,STATION_NM,dec_lat_va,dec_long_v,DTdeparsed,WLA_DEM,Date
0,JL-49-13-509,31.815556,-106.434167,7/27/1913,3686.72,1913-07-27
1,JL-49-13-521,31.826944,-106.425,10/20/1915,3688.98,1915-10-20
2,JL-49-13-816,31.788611,-106.453334,5/19/1919,3673.88,1919-05-19
3,JL-49-13-523,31.826944,-106.422778,1/6/1920,3660.38,1920-01-06
4,20N.08E.15.134,35.96611111,-106.0866667,5/3/1921,5571.08,1921-05-03
5,JL-49-13-518,31.7975,-106.434722,8/30/1921,3645.5,1921-08-30
6,JL-49-13-719,31.757778,-106.473889,5/17/1925,3697.59,1925-05-17
7,JL-49-13-906,31.768055,-106.403056,3/20/1929,3679.22,1929-03-20
8,JL-49-13-924,31.770278,-106.398334,1/6/1930,3705.52,1930-01-06
9,JL-49-13-911,31.767778,-106.398334,1/2/1931,3678.84,1931-01-02
10,JL-49-13-512,31.827222,-106.425,2/25/1931,3694.5,1931-02-25
11,JL-49-13-502,31.826667,-106.421944,10/1/1931,3687.32,1931-10-01
12,JL-49-13-809,31.783055,-106.437222,3/22/1933,3646.53,1933-03-22
13,JL-49-13-708,31.753889,-106.486389,4/23/1933,3703.87,1933-04-23
14,NA03500823BBB,37.53000309,-106.0683599,9/24/1934,7554.63,1934-09-24
15,JL-49-13-805,31.781389,-106.425833,10/19/1934,3680.51,1934-10-19
16,JL-49-13-804,31.780555,-106.436945,11/19/1934,3666.15,1934-11-19
17,JL-49-13-709,31.752501,-106.481111,12/22/1934,3693.54,1934-12-22
18,JL-49-13-801,31.771944,-106.453889,12/22/1934,3678.67,1934-12-22
19,JL-49-13-716,31.766112,-106.470833,1/5/1935,3705.94,1935-01-05
20,JL-49-13-717,31.755556,-106.480555,1/7/1935,3676.55,1935-01-07
21,JL-49-13-723,31.753334,-106.490834,8/2/1935,3701.3,1935-08-02
22,JL-49-13-501,31.826667,-106.426111,8/6/1935,3683.94,1935-08-06
23,JL-49-13-310,31.866112,-106.403334,8/7/1935,3692.56,1935-08-07
24,JL-49-05-313,31.960278,-106.400278,8/9/1935,3711.54,1935-08-09
25,JL-49-13-720,31.753334,-106.490834,8/20/1935,3703.6,1935-08-20
26,JL-49-13-722,31.753334,-106.490834,8/20/1935,3698.6,1935-08-20
27,JL-49-21-103,31.749167,-106.482222,8/23/1935,3701.76,1935-08-23
28,JL-49-13-923,31.770278,-106.398334,8/28/1935,3690.62,1935-08-28
29,JL-49-13-904,31.768333,-106.398334,8/28/1935,3688.83,1935-08-28
30,JL-49-13-817,31.783055,-106.437222,9/27/1935,3661.56,1935-09-27
31,JL-49-04-134,31.981389,-106.589722,9/28/1935,3789.91,1935-09-28
32,JL-49-13-807,31.78705261,-106.4344304,11/11/1935,3671.41,1935-11-11
33,JL-49-13-401,31.803056,-106.461667,11/20/1935,3686.67,1935-11-20
34,JL-49-13-515,31.799167,-106.434722,11/20/1935,3675.3,1935-11-20
35,JL-49-13-508,31.815556,-106.434167,11/20/1935,3670.82,1935-11-20
36,JL-49-07-802,31.893611,-106.200556,3/30/1936,3702.35,1936-03-30
37,JL-49-32-301,31.609167,-106.011945,4/2/1936,3629.57,1936-04-02
38,JL-49-06-502,31.943889,-106.323333,4/3/1936,3717.29,1936-04-03
39,JL-49-15-901,31.758889,-106.151389,4/10/1936,3673.8,1936-04-10
40,JL-49-13-201,31.866944,-106.439722,4/14/1936,3703.87,1936-04-14
41,JL-49-14-502,31.804167,-106.292778,6/13/1936,3691.14,1936-06-13
42,JL-49-32-702,31.539167,-106.094722,7/11/1936,3637.21,1936-07-11
43,JL-49-13-611,31.826389,-106.384445,7/16/1936,3677.15,1936-07-16
44,JL-49-13-613,31.792222,-106.380555,7/17/1936,3681.97,1936-07-17
45,JL-49-13-704,31.769167,-106.462778,3/15/1937,3648.75,1937-03-15
46,31N.11E.35. MAESTAS WELL,36.88279762,-105.7441778,4/1/1937,7337.19,1937-04-01
47,18N.07E.35.442,35.74391662,-106.1611361,8/25/1937,5660.9,1937-08-25
48,JL-49-13-505,31.815001,-106.422778,10/15/1937,3674.93,1937-10-15
49,JL-49-13-210,31.862501,-106.431667,4/26/1938,3695.75,1938-04-26
50,JL-49-13-618,31.798611,-106.404445,4/27/1938,3678.67,1938-04-27
51,JL-49-13-605,31.826111,-106.405278,5/4/1938,3681.46,1938-05-04
52,17N.07E.34.242,35.66308579,-106.1794688,5/9/1938,5685.49,1938-05-09
53,JL-49-13-517,31.799167,-106.434722,8/12/1938,3666.8,1938-08-12
54,JL-49-13-205,31.840556,-106.423055,8/24/1938,3693.39,1938-08-24
55,JL-49-13-612,31.819167,-106.413889,8/24/1938,3677.79,1938-08-24
56,JL-49-13-604,31.826111,-106.395556,10/14/1938,3679.75,1938-10-14
57,16N.08E.12.31231,35.63030946,-106.0511337,1/1/1939,6163.35,1939-01-01
58,JL-49-13-516,31.799167,-106.434722,1/25/1939,3673.5,1939-01-25
59,JL-49-13-702,31.761667,-106.474722,2/2/1939,3676.71,1939-02-02
60,13S.04W.33.434,33.13118255,-107.2555848,2/28/1939,4305.26,1939-02-28
61,13S.04W.33.433+DUP,33.12923808,-107.2528069,3/22/1939,4250.26,1939-03-22
62,14S.04W.33.211,33.05451526,-107.2550262,3/28/1939,4504.82,1939-03-28
63,13S.04W.33.434   A,33.12979364,-107.2519736,3/28/1939,4258.83,1939-03-28
64,13S.04W.33.433,33.12979365,-107.2558625,3/29/1939,4257.5,1939-03-29
65,14S.04W.04.212   A,33.1275714,-107.2525291,3/29/1939,4240.72,1939-03-29
66,13S.04W.34.313,33.13312704,-107.2466958,3/30/1939,4275.99,1939-03-30
67,JL-49-13-211,31.848611,-106.421944,4/8/1939,3684.3,1939-04-08
68,JL-49-13-206,31.862501,-106.4225,6/20/1939,3698.42,1939-06-20
69,03N.01E.16.144,34.48638889,-106.8452778,11/1/1939,4742.4,1939-11-01
70,18S.04W.35.221,32.70646593,-107.2164096,1/1/1940,4071.89,1940-01-01
71,JL-49-13-806,31.769722,-106.436389,2/28/1940,3669.49,1940-02-28
72,JL-49-13-522,31.826944,-106.423889,3/15/1940,3678.59,1940-03-15
73,14S.04W.04.211,33.12805556,-107.2558611,4/6/1940,4251.04,1940-04-06
74,JL-49-05-502,31.956945,-106.424444,4/23/1940,3707.15,1940-04-23
75,13S.04W.33.344,33.12979365,-107.2561403,6/15/1940,4259.07,1940-06-15
76,13S.04W.33.344   A,33.12963889,-107.256,6/15/1940,4258.81,1940-06-15
77,JL-49-05-508,31.958056,-106.425,6/21/1940,3704.96,1940-06-21
78,JL-49-13-808,31.75566466,-106.4319301,9/20/1940,3669.73,1940-09-20
79,JL-49-06-704,31.914445,-106.342778,9/27/1940,3698.61,1940-09-27
80,JL-49-06-801,31.905278,-106.320833,10/15/1940,3732.28,1940-10-15
81,JL-49-06-705,31.911667,-106.358612,11/4/1940,3694.59,1940-11-04
82,JL-49-05-908,31.908334,-106.397222,12/12/1940,3708.96,1940-12-12
83,JL-49-14-106,31.854723,-106.371944,12/13/1940,3695.93,1940-12-13
84,13S.05W.30.331,33.14647222,-107.4023611,1/1/1941,4679.04,1941-01-01
85,14S.04W.04.211   A,33.12701585,-107.2583624,5/26/1941,4251.39,1941-05-26
86,14S.04W.04.211A,33.12701585,-107.2583624,5/26/1941,4251.39,1941-05-26
87,JL-49-13-203,31.855834,-106.422222,6/25/1941,3837.74,1941-06-25
88,10N.03E.01.114,35.12865653,-106.5836356,6/27/1941,4969.69,1941-06-27
89,09N.03E.36.211,34.97005038,-106.5753009,7/1/1941,4945.12,1941-07-01
90,10S.08W.17.220,33.4453462,-107.6772611,10/23/1941,6554.1,1941-10-23
91,10S.08W.29.000,33.40840224,-107.6864272,10/23/1941,6416.86,1941-10-23
92,26S.02E.17.244,32.04732164,-106.7511083,1/1/1942,3802.15,1942-01-01
93,29S.04E.18.233,31.78621859,-106.5733222,1/1/1942,3758.13,1942-01-01
94,JL-49-06-403,31.942222,-106.364723,1/23/1942,3707.07,1942-01-23
95,JL-49-13-803,31.773889,-106.447222,2/7/1944,3659.74,1944-02-07
96,JL-49-07-801,31.893611,-106.200278,2/12/1944,3699.9,1944-02-12
97,JL-49-13-815,31.773889,-106.447222,1/22/1945,3662.04,1945-01-22
98,17N.09E.31.44332,35.65364221,-106.0219669,4/1/1945,6295.15,1945-04-01
99,14S.04W.06.233A+DUP,33.1197936,-107.2930848,4/14/1945,4272.13,1945-04-14
100,14S.04W.06.233A,33.12229361,-107.2883626,4/14/1945,4237.81,1945-04-14
101,14S.04W.07.311A,33.1050713,-107.3016954,10/3/1945,4332.59,1945-10-03
102,14S.04W.07.311+DUP,33.1050713,-107.3016954,10/3/1945,4268.85,1945-10-03
103,14S.04W.07.311,33.10562684,-107.290862,10/3/1945,4197.34,1945-10-03
104,14S.04W.06.312A,33.11951583,-107.297807,10/4/1945,4326.26,1945-10-04
105,14S.04W.06.312,33.10729351,-107.2841953,10/4/1945,4201.82,1945-10-04
106,14S.04W.06.233,33.12229361,-107.2883626,10/10/1945,4293.88,1945-10-10
107,14S.04W.06.322,33.12007138,-107.2914181,10/17/1945,4301.35,1945-10-17
108,14S.04W.06.442A,33.11590468,-107.2847512,10/17/1945,4272.7,1945-10-17
109,14S.04W.06.442,33.11673802,-107.2828067,10/17/1945,4197.19,1945-10-17
110,MBOWN-218 - JL-49-04-121 (USBR-29),31.99537875,-106.6144368,12/15/1945,3789.01,1945-12-15
111,MBOWN-255 - JL-49-12-501 (USBR-34),31.81538439,-106.5677669,12/15/1945,3732.77,1945-12-15
112,16S.05W.35.243,32.87396223,-107.3191909,12/21/1945,4156.51,1945-12-21
113,30N.11E.15.333,36.83001994,-105.7650101,1/1/1946,7347.67,1946-01-01
114,18S.04W.05.211,32.77924127,-107.271967,1/1/1946,4114.62,1946-01-01
115,MBOWN-92 - 24S.02E.28.334 (USBR-8),32.18509669,-106.7480561,1/1/1946,3841.35,1946-01-01
116,MBOWN-111 - 25S.03E.28.343A (USBR-27),32.09704301,-106.6452729,1/1/1946,3808.11,1946-01-01
117,MBOWN-112    USBR MES4    25S.03E.31.143,32.09148753,-106.6786071,1/1/1946,3807.93,1946-01-01
118,MBOWN-122    USBR MES3    26S.02E.01.211,32.08259884,-106.6747179,1/1/1946,3806.64,1946-01-01
119,MBOWN-130 - 26S.03E.08.221 (USBR-23),32.06787698,-106.6519392,1/1/1946,3802.41,1946-01-01
120,MBOWN-131 - 26S.03E.09.221A (USBR-22),32.06787701,-106.6386054,1/1/1946,3801.06,1946-01-01
121,MBOWN-132 - 26S.03E.15.112 (USBR-28),32.05343291,-106.6286049,1/1/1946,3794.63,1946-01-01
122,MBOWN-138 - 26S.03E.27.212 (USBR-31),32.02482247,-106.6197152,1/1/1946,3791.25,1946-01-01
123,MBOWN-140 - 26S.03E.32.441 (USBR-39),31.99815631,-106.6524934,1/1/1946,3788.51,1946-01-01
124,MBOWN-174   USBR MES2   27S.03E.32.124A,31.91926978,-106.658048,1/1/1946,3770.6,1946-01-01
125,MBOWN-8 - 22S.01E.16.433 (USBR-19),32.38842428,-106.8438959,1/15/1946,3934.09,1946-01-15
126,MBOWN-7 - 22S.01E.09.333 (USBR-20),32.40342381,-106.8522297,1/15/1946,3930.3,1946-01-15
127,MBOWN-5 - 22S.01E.09.241 (OLD USBR-26),32.41286809,-106.8405628,1/15/1946,3927.58,1946-01-15
128,MBOWN-12 - 22S.01E.35.434B (USBR-17),32.3450924,-106.8075054,1/15/1946,3903.68,1946-01-15
129,MBOWN-9 - 22S.01E.33.341 (USBR-15),32.3467587,-106.84834,1/15/1946,3902.42,1946-01-15
130,MBOWN-10 - 22S.01E.35.334 (OLD USBR 18),32.3445368,-106.8152834,1/15/1946,3901.97,1946-01-15
131,MBOWN-21 - 23S.01E.09.433 (USBR-16),32.31509291,-106.8450062,1/15/1946,3888.76,1946-01-15
132,MBOWN-25 - 23S.01E.16.424 (USBR-12),32.30369444,-106.8371111,1/15/1946,3884.56,1946-01-15
133,MBOWN-37 - 23S.01E.27.334 (USBR-11),32.27231637,-106.8336164,1/15/1946,3875.11,1946-01-15
134,MBOWN-67 - 24S.02E.08.434 (OLD USBR-13),32.22842912,-106.7566687,1/15/1946,3858.43,1946-01-15
135,MBOWN-69 - 24S.02E.09.433 (USBR-14),32.22870693,-106.743057,1/15/1946,3851.91,1946-01-15
136,MBOWN-88 - 24S.02E.22.242 (OLD USBR-10),32.20842952,-106.7183333,1/15/1946,3844.6,1946-01-15
137,MBOWN-90 - 24S.02E.23.342 (OLD USBR-9),32.20176298,-106.7105551,1/15/1946,3841.72,1946-01-15
138,MBOWN-102 - 25S.02E.01.411 (USBR-25),32.16231935,-106.6905535,1/15/1946,3829.77,1946-01-15
139,MBOWN-110 - 25S.03E.20.421 (USBR-24),32.11870919,-106.6538847,1/15/1946,3815.27,1946-01-15
140,MBOWN-105 - 25S.02E.25.322 (OLD USBR-5),32.10426502,-106.6930523,1/15/1946,3810.46,1946-01-15
141,MBOWN-129 - 26S.03E.04.122 (USBR-21),32.08259889,-106.6422169,1/15/1946,3802.93,1946-01-15
142,MBOWN-135 - 26S.03E.22.211 (USBR-30),32.03898881,-106.62166,1/15/1946,3795.27,1946-01-15
143,MBOWN-137 - 26S.03E.27.211 (USBR-32),32.02482246,-106.623882,1/15/1946,3791.33,1946-01-15
144,MBOWN-173  USBR MES1   27S.03E.28.314,31.92676959,-106.6469367,1/15/1946,3766.78,1946-01-15
145,MBOWN-252 - JL-49-12-117 (OLD USBR-33),31.85427199,-106.5933234,1/15/1946,3746.08,1946-01-15
146,MBOWN-249 - JL-49-12-101 (OLD USBR-35),31.84510558,-106.5997123,1/15/1946,3744.6,1946-01-15
147,NA04101036DDD,37.75083301,-105.8191864,4/2/1946,7533.28,1946-04-02
148,NA04001002CC,37.73722212,-105.8522427,4/11/1946,7540.87,1946-04-11
149,NA04001106CCC,37.7366666,-105.8177976,5/6/1946,7534.12,1946-05-06
150,NA04001109BB,37.73416668,-105.7797412,5/23/1946,7528.94,1946-05-23
151,NA04001110AA,37.73416672,-105.7483516,5/27/1946,7533.02,1946-05-27
152,14S.04W.06.321,33.1211825,-107.2919737,5/29/1946,4306.27,1946-05-29
153,NA04001136DDD,37.66666826,-105.7172398,6/1/1946,7522.37,1946-06-01
154,29N.12E.03.422,36.77780231,-105.6072286,6/5/1946,7440.76,1946-06-05
155,16S.05W.11.433,32.924239,-107.3203024,6/12/1946,4295.35,1946-06-12
156,15S.05W.29.244,32.97812714,-107.3694705,6/13/1946,4469.61,1946-06-13
157,15S.05W.29.243,32.97618275,-107.3705816,6/13/1946,4400.67,1946-06-13
158,15S.05W.27.311,32.97396041,-107.3483589,6/13/1946,4352.35,1946-06-13
159,16S.05W.21.144,32.90340647,-107.3594697,6/14/1946,4369.21,1946-06-14
160,16S.05W.26.143,32.88840647,-107.3278023,6/15/1946,4316.56,1946-06-15
161,16S.05W.35.311,32.87285119,-107.3239132,6/15/1946,4234.86,1946-06-15
162,14S.05W.01.223,33.12590476,-107.3022517,6/18/1946,4323.92,1946-06-18
163,14S.05W.08.222,33.11284921,-107.3689187,6/19/1946,4508.3,1946-06-19
164,14S.05W.36.121,33.05479326,-107.3111382,6/19/1946,4303.61,1946-06-19
165,14S.05W.25.233,33.06395996,-107.3075273,6/19/1946,4263.46,1946-06-19
166,14S.04W.05.310,33.1181269,-107.2705844,6/19/1946,4245.89,1946-06-19
167,15S.05W.01.214,33.03979315,-107.3053042,6/19/1946,4223.93,1946-06-19
168,15S.05W.01.214A,33.03979315,-107.3053042,6/19/1946,4223.76,1946-06-19
169,15S.05W.01.214+DUP,33.03673758,-107.3061374,6/19/1946,4223.22,1946-06-19
170,14S.04W.05.310+DUP,33.11618245,-107.2803067,6/19/1946,4223.18,1946-06-19
171,15S.05W.18.400+DUP,32.99673796,-107.3878043,6/20/1946,4568.07,1946-06-20
172,15S.05W.18.400,33.00618235,-107.3891934,6/20/1946,4553.52,1946-06-20
173,15S.05W.22.122,32.99645991,-107.3447479,6/20/1946,4385.08,1946-06-20
174,15S.05W.22.122+DUP2,32.99645989,-107.3425256,6/20/1946,4367.64,1946-06-20
175,15S.05W.26.334+DUP,32.96784931,-107.3319697,6/20/1946,4256.9,1946-06-20
176,15S.05W.26.334,32.96951592,-107.3297474,6/20/1946,4248.99,1946-06-20
177,16S.05W.01.131+DUP,32.94812736,-107.3147469,6/20/1946,4220.0,1946-06-20
178,15S.05W.24.441,32.98562654,-107.3058582,6/20/1946,4213.78,1946-06-20
179,16S.05W.01.131,32.94923847,-107.3175248,6/20/1946,4206.46,1946-06-20
180,15S.05W.24.441+DUP,32.98534875,-107.3028026,6/20/1946,4203.73,1946-06-20
181,16S.05W.25.343+DUP,32.88007315,-107.3130797,6/21/1946,4156.92,1946-06-21
182,17S.05W.11.211,32.85201829,-107.3244686,6/21/1946,4149.7,1946-06-21
183,16S.05W.25.343,32.88118422,-107.3108574,6/21/1946,4147.55,1946-06-21
184,NA04001115DC,37.70972276,-105.7522407,6/24/1946,7526.97,1946-06-24
185,NA04001135DD,37.66500155,-105.7316846,6/29/1946,7529.17,1946-06-29
186,NA03901135DD,37.57778109,-105.7333515,7/19/1946,7514.28,1946-07-19
187,NA03900813BA,37.63055723,-106.0505812,8/6/1946,7616.19,1946-08-06
188,NA03801135DD,37.49056069,-105.7325183,8/6/1946,7525.79,1946-08-06
189,NA03901103BB,37.66111261,-105.7614076,8/11/1946,7523.76,1946-08-11
190,NA03901207CD,37.63555785,-105.7044617,8/12/1946,7522.61,1946-08-12
191,NA04001132CC,37.6652791,-105.7977973,8/14/1946,7532.99,1946-08-14
192,15S.06W.31.430,32.95507308,-107.4944727,8/20/1946,5089.06,1946-08-20
193,17N.09E.24.324,35.6869752,-105.9389101,8/28/1946,6946.04,1946-08-28
194,17N.09E.26.222,35.68114192,-105.9511326,8/28/1946,6904.91,1946-08-28
195,NA04001121CC,37.664724,-105.6902946,8/30/1946,7531.77,1946-08-30
196,NA03901012AAA,37.65000156,-105.8172422,9/1/1946,7532.23,1946-09-01
197,NA03901133DDD,37.65000171,-105.7672411,9/1/1946,7521.54,1946-09-01
198,17N.09E.23.332,35.6841973,-105.9627995,9/2/1946,6799.69,1946-09-02
199,NA03901203BB,37.66111315,-105.6541825,9/7/1946,7583.62,1946-09-07
200,29N.11E.23.444,36.72668814,-105.7302853,9/16/1946,7287.94,1946-09-16
201,NA03901116AD,37.62861324,-105.7672412,9/19/1946,7522.9,1946-09-19
202,NA04100925AAA,37.77499959,-105.9339105,10/1/1946,7563.43,1946-10-01
203,NA04101013AAA,37.80249956,-105.8280742,10/1/1946,7529.76,1946-10-01
204,NA04001119BC,37.70138949,-105.8164087,10/4/1946,7535.35,1946-10-04
205,NA04001005CC,37.73666652,-105.9072439,10/8/1946,7560.45,1946-10-08
206,NA04001021AD,37.70111161,-105.8755767,10/12/1946,7552.42,1946-10-12
207,NA04001020BC,37.70027824,-105.9075218,10/14/1946,7560.74,1946-10-14
208,NA03801134CCC,37.50000481,-105.7505744,10/14/1946,7518.82,1946-10-14
209,NA04100704ABB,37.83333467,-106.2172513,11/1/1946,7683.49,1946-11-01
210,NA04000725ABB,37.68916849,-106.1564174,11/1/1946,7683.29,1946-11-01
211,NA03900817BBB,37.6316689,-106.1289168,11/1/1946,7660.15,1946-11-01
212,NA04000901AAA,37.74999963,-105.9172441,11/1/1946,7558.84,1946-11-01
213,19S.04W.11.221,32.67702258,-107.2166872,11/14/1946,4061.52,1946-11-14
214,16S.05W.25.120,32.89285064,-107.3097464,11/22/1946,4181.88,1946-11-22
215,16S.05W.25.212,32.89201729,-107.3058574,11/22/1946,4180.09,1946-11-22
216,17S.05W.14.231,32.8339631,-107.3239129,11/22/1946,4139.56,1946-11-22
217,19S.03W.04.331,32.68118989,-107.1625192,11/22/1946,4050.69,1946-11-22
218,NA04200812AAA1,37.9166664,-106.0339098,11/23/1946,7555.56,1946-11-23
219,JL-49-13-902,31.775833,-106.412778,12/18/1946,3674.82,1946-12-18
220,16N.09E.03.1213 B,35.65197586,-105.9775217,1/1/1947,6730.06,1947-01-01
221,20S.01E.35.221,32.53092071,-106.8041742,1/1/1947,4056.59,1947-01-01
222,20S.02W.24.110,32.56036257,-107.0055697,1/1/1947,3984.82,1947-01-01
223,20S.01W.30.330,32.53453017,-106.9889022,1/1/1947,3984.55,1947-01-01
224,20S.01W.11.310,32.58119603,-106.9186228,1/1/1947,3984.21,1947-01-01
225,20S.01W.25.230,32.5417521,-106.9972359,1/1/1947,3976.83,1947-01-01
226,20S.02W.13.330,32.56341803,-107.0052919,1/1/1947,3974.46,1947-01-01
227,20S.01W.31.320,32.5236972,-106.9839019,1/1/1947,3956.33,1947-01-01
228,31N.11E.16.333,36.91779665,-105.7816798,1/2/1947,7337.87,1947-01-02
229,29N.11E.14.410,36.74724352,-105.7361182,1/2/1947,7329.63,1947-01-02
230,JL-49-13-519,31.799167,-106.434722,1/15/1947,3672.07,1947-01-15
231,14S.04W.06.441A+DUP3,33.11590468,-107.2886401,1/22/1947,4293.62,1947-01-22
232,14S.04W.06.110A,33.12368252,-107.2978072,1/22/1947,4281.08,1947-01-22
233,13S.04W.06.110,33.12701587,-107.2972517,1/22/1947,4261.47,1947-01-22
234,16S.05W.26.143+DUP,32.88757318,-107.3305801,1/22/1947,4260.19,1947-01-22
235,14S.04W.06.441,33.11673802,-107.285029,1/22/1947,4178.19,1947-01-22
236,14S.04W.06.441+DUP,33.11590468,-107.2886401,1/22/1947,4177.02,1947-01-22
237,16S.05W.11.433A,32.92396128,-107.3261359,1/23/1947,4347.41,1947-01-23
238,15S.05W.27.413A,32.97146044,-107.3444699,1/23/1947,4345.76,1947-01-23
239,15S.05W.27.324A,32.97146044,-107.3447477,1/23/1947,4327.1,1947-01-23
240,16S.05W.11.433+DUP,32.92396128,-107.3261359,1/23/1947,4324.39,1947-01-23
241,15S.05W.27.324,32.97257151,-107.3425255,1/23/1947,4313.04,1947-01-23
242,15S.05W.27.324+DUP,32.97146044,-107.3447477,1/23/1947,4303.56,1947-01-23
243,15S.05W.27.413+DUP,32.97146044,-107.3444699,1/23/1947,4284.9,1947-01-23
244,16S.05W.21.144A,32.90201763,-107.3611364,1/28/1947,4370.44,1947-01-28
245,16S.05W.21.144+DUP,32.90201763,-107.3611364,1/28/1947,4345.54,1947-01-28
246,16S.05W.21.233A,32.90201762,-107.3608586,1/28/1947,4333.79,1947-01-28
247,17N.09E.22.444,35.68308619,-105.9658551,2/10/1947,6785.49,1947-02-10
248,17S.04W.31.111,32.79368581,-107.2986343,2/20/1947,4114.32,1947-02-20
249,17S.04W.32.112,32.79368554,-107.2791895,2/20/1947,4111.75,1947-02-20
250,19S.03W.15.443,32.65008036,-107.1283514,2/20/1947,4050.66,1947-02-20
251,20S.03E.18.211,32.57453126,-106.6744479,3/18/1947,4052.3,1947-03-18
252,17N.10E.17.333,35.69725291,-105.9116875,4/1/1947,7298.11,1947-04-01
253,18S.01E.27.432,32.70897087,-106.8244546,4/1/1947,4126.85,1947-04-01
254,17S.05W.10.442,32.8411853,-107.3347465,4/17/1947,4235.2,1947-04-17
255,17S.04W.30.133,32.80340784,-107.2986344,4/17/1947,4125.87,1947-04-17
256,17S.05W.26.212,32.80896359,-107.322246,4/17/1947,4124.22,1947-04-17
257,17S.05W.26.242,32.80507472,-107.3178014,4/17/1947,4110.12,1947-04-17
258,28S.02E.31.344,31.82260533,-106.7794387,5/6/1947,3811.6,1947-05-06
259,NA04300804CC,37.98583331,-106.1039112,5/20/1947,7597.1,1947-05-20
260,NA04200913AAA,37.89249935,-105.8247386,5/20/1947,7535.39,1947-05-20
261,21S.01W.09.320,32.49786495,-106.9458449,5/26/1947,3966.43,1947-05-26
262,JL-49-22-201,31.721389,-106.319722,6/5/1947,3672.65,1947-06-05
263,19S.04W.03.234,32.68618861,-107.2361322,6/12/1947,4072.03,1947-06-12
264,19S.05W.16.144+DUP,32.65785754,-107.3603011,6/25/1947,4460.62,1947-06-25
265,19S.05W.01.000,32.6853559,-107.3108559,6/25/1947,4316.32,1947-06-25
266,16S.05W.25.341,32.88285082,-107.3080796,7/3/1947,4149.79,1947-07-03
267,JL-49-13-912,31.756112,-106.381944,7/12/1947,3672.46,1947-07-12
268,18S.04W.09.130,32.75757488,-107.2630777,7/15/1947,4107.43,1947-07-15
269,17S.05W.14.441,32.82701875,-107.3203016,8/1/1947,4146.65,1947-08-01
270,17S.05W.24.331,32.81313008,-107.3153014,8/1/1947,4117.24,1947-08-01
271,19S.03W.09.121,32.67702346,-107.1569635,8/1/1947,4048.53,1947-08-01
272,18S.04W.17.312,32.74229774,-107.2769668,8/11/1947,4090.2,1947-08-11
273,19S.03W.10.333,32.66452409,-107.1439075,8/11/1947,4049.43,1947-08-11
274,26S.03E.09.221,32.06732144,-106.6497169,8/12/1947,3806.92,1947-08-12
275,18S.04W.35.231,32.70257711,-107.2208542,8/15/1947,4067.83,1947-08-15
276,19S.03W.10.432,32.66646862,-107.1333517,8/27/1947,4043.44,1947-08-27
277,JL-49-13-909,31.7620536,-106.3899847,10/1/1947,3645.68,1947-10-01
278,NA04100703BB,37.8336123,-106.2000285,10/10/1947,7670.83,1947-10-10
279,NA04000801CB,37.73944472,-106.0544697,10/29/1947,7614.38,1947-10-29
280,NA04000701CC,37.73527919,-106.1647508,10/30/1947,7682.9,1947-10-30
281,NA04000803CC,37.73527847,-106.0911375,10/30/1947,7633.02,1947-10-30
282,NA04000732CCC,37.66666937,-106.2339198,11/1/1947,7745.77,1947-11-01
283,NA04200736DDD,37.84166742,-106.1505822,11/1/1947,7629.13,1947-11-01
284,NA03900930BC,37.58333552,-106.0339142,11/1/1947,7596.26,1947-11-01
285,23S.02E.31.213,32.26842805,-106.7752811,12/3/1947,3863.53,1947-12-03
286,NA04100919CCC,37.77805547,-106.0364129,1/1/1948,7594.17,1948-01-01
287,NA04100932DDD,37.74944405,-106.0022459,1/1/1948,7585.92,1948-01-01
288,NA03900910DDD,37.63305694,-105.9661345,1/1/1948,7579.42,1948-01-01
289,NA04100906BBB,37.99833301,-106.0422417,1/8/1948,7584.49,1948-01-08
290,JL-49-13-309,31.861945,-106.413056,1/10/1948,3685.44,1948-01-10
291,NA03900901AAA,37.66083439,-105.9294669,1/22/1948,7570.93,1948-01-22
292,15S.05W.27.331A,32.97118273,-107.3530812,1/24/1948,4316.63,1948-01-24
293,14S.04W.05.241,33.12312694,-107.271418,1/24/1948,4271.66,1948-01-24
294,16S.05W.21.233   B,32.90201762,-107.3608586,1/25/1948,4335.36,1948-01-25
295,16S.05W.21.233B,32.90201762,-107.3608586,1/25/1948,4335.36,1948-01-25
296,21S.01W.13.323,32.47897695,-106.9000099,2/12/1948,3948.42,1948-02-12
297,17S.05W.25.123,32.80757459,-107.3111346,2/14/1948,4127.47,1948-02-14
298,18S.04W.05.214,32.77701906,-107.2700225,2/14/1948,4104.52,1948-02-14
299,NA04100821DDD,37.77500102,-106.1505833,3/1/1948,7656.57,1948-03-01
300,19S.02E.33.213,32.61702981,-106.740562,3/26/1948,4077.06,1948-03-26
301,20S.01E.14.144,32.56758624,-106.8116748,3/26/1948,4042.64,1948-03-26
302,21S.01W.11.431,32.49147651,-106.9125104,3/26/1948,3948.64,1948-03-26
303,NA04000614ABB,37.72500239,-106.2755877,4/1/1948,7785.31,1948-04-01
304,NA04000826DDD,37.67500115,-106.0589146,4/1/1948,7621.17,1948-04-01
305,NA04200936DDD,37.85833284,-105.9339085,4/1/1948,7543.72,1948-04-01
306,NA03900931CCC,37.57694675,-106.0389977,4/19/1948,7601.66,1948-04-19
307,NA03900936DDD,37.57555798,-105.929745,4/19/1948,7564.56,1948-04-19
308,NA04000932DDD,37.65750095,-106.0047463,4/22/1948,7599.6,1948-04-22
309,NA04100613ACC,37.81666831,-106.2672532,6/1/1948,7802.3,1948-06-01
310,03N.01E.34.430A,34.44145301,-106.8280822,6/1/1948,4777.91,1948-06-01
311,NA04100810CC,37.80833369,-106.0908585,8/7/1948,7613.24,1948-08-07
312,NA03900904CC,37.64861216,-106.000024,8/8/1948,7593.32,1948-08-08
313,NA04100923CA,37.78333291,-105.9580774,10/5/1948,7567.7,1948-10-05
314,21N.08E.28.424,36.02141181,-106.0919681,1/1/1949,5661.32,1949-01-01
315,13S.06W.24.244,33.16507155,-107.4036429,1/1/1949,4700.71,1949-01-01
316,NA03800831CCC,37.50000368,-106.1172504,4/1/1949,7621.06,1949-04-01
317,NA03800917AA,37.51666971,-105.9839131,4/1/1949,7579.32,1949-04-01
318,NA03700901AA,37.48333732,-105.933912,4/1/1949,7553.31,1949-04-01
319,NA03701020DD,37.43333881,-105.8839107,4/1/1949,7537.24,1949-04-01
320,NA03701025AA,37.41667303,-105.8172424,4/1/1949,7519.74,1949-04-01
321,NA03600913AAA,37.37000656,-105.9316895,4/21/1949,7563.25,1949-04-21
322,NA03801028DDB,37.51167044,-105.8783551,4/26/1949,7546.99,1949-04-26
323,NA03800825DDD,37.49805895,-106.0422482,4/29/1949,7593.44,1949-04-29
324,NA04001101CA,37.74194449,-105.7202953,6/2/1949,7549.4,1949-06-02
325,02N.01W.13.223,34.40369444,-106.8901667,7/15/1949,4732.84,1949-07-15
326,01N.03E.03.120,34.34589957,-106.6191855,7/26/1949,5384.11,1949-07-26
327,10N.04E.31.411,35.05052778,-106.5588889,8/1/1949,4960.74,1949-08-01
328,01N.01W.03.420,34.34228747,-106.9216961,8/17/1949,4958.48,1949-08-17
329,02N.03E.10.410,34.45089789,-106.6211322,9/2/1949,4836.31,1949-09-02
330,NA04100901AA,37.83416619,-105.9289089,9/29/1949,7550.83,1949-09-29
331,NA04101026BC,37.77361073,-105.8527977,10/4/1949,7538.67,1949-10-04
332,NA04000925DD,37.67722302,-105.9283557,10/12/1949,7572.32,1949-10-12
333,NA03901007BB,37.64694573,-105.9283558,10/20/1949,7570.98,1949-10-20
334,10N.04E.30.321,35.06515833,-106.5629861,10/22/1949,4949.79,1949-10-22
335,NA03900924AAA,37.61777953,-105.9289115,10/31/1949,7568.33,1949-10-31
336,09N.03E.01.112,35.04227036,-106.5830793,11/1/1949,4968.74,1949-11-01
337,NA03801006BB,37.57389136,-105.9264116,11/3/1949,7570.1,1949-11-03
338,04N.01W.36.140,34.52922871,-106.893918,11/21/1949,4802.03,1949-11-21
339,03N.01W.25.444,34.45183333,-106.8901667,11/21/1949,4759.81,1949-11-21
340,03N.01W.35.430,34.43700823,-106.9108625,11/21/1949,4752.52,1949-11-21
341,01N.02W.01.330,34.33339807,-107.0116997,11/30/1949,4975.57,1949-11-30
342,09N.04E.06.411,35.03532625,-106.5597454,12/1/1949,4954.72,1949-12-01
343,02N.03E.18.232,34.40200975,-106.6650212,12/7/1949,4810.01,1949-12-07
344,03N.02E.26.330,34.4511755,-106.7100235,12/7/1949,4770.74,1949-12-07
345,02N.02E.09.330,34.40728736,-106.7458568,12/7/1949,4737.45,1949-12-07
346,03N.01W.31.440,34.4358968,-106.9769757,12/21/1949,5341.2,1949-12-21
347,04S.12W.12.410,33.97144598,-108.0436664,1/1/1950,6756.97,1950-01-01
348,16N.08E.15.143,35.6180875,-106.0841895,1/1/1950,6122.06,1950-01-01
349,14S.04W.06.200,33.12479363,-107.2858626,1/1/1950,4245.64,1950-01-01
350,18S.02W.35.112,32.70646898,-107.0219605,1/1/1950,4019.57,1950-01-01
351,03N.02W.14.332,34.47895135,-107.0205875,1/6/1950,5375.01,1950-01-06
352,01N.01W.17.210,34.31506539,-106.9636424,1/14/1950,4888.14,1950-01-14
353,01N.01W.34.334,34.26091667,-106.9406111,1/15/1950,4704.26,1950-01-15
354,16N.08E.24.4112,35.60197697,-106.0433556,2/1/1950,6119.42,1950-02-01
355,01S.01E.09.410,34.23617837,-106.8433583,2/22/1950,4694.45,1950-02-22
356,04N.02E.35.214,34.53380556,-106.6995833,2/24/1950,4779.76,1950-02-24
357,JL-49-16-701,31.781944,-106.108334,4/30/1950,3741.22,1950-04-30
358,04N.03W.24.132,34.55950384,-107.1130896,5/25/1950,5249.95,1950-05-25
359,19N.07E.04.444,35.90196886,-106.1969699,7/1/1950,5792.94,1950-07-01
360,03S.08W.02.433,34.07061655,-107.637544,8/10/1950,6803.93,1950-08-10
361,03S.09W.21.221,34.0383932,-107.7728261,8/10/1950,6801.12,1950-08-10
362,03S.11W.27.444,34.01089118,-107.961165,8/11/1950,6743.35,1950-08-11
363,05S.09W.01.112,33.90700558,-107.7319897,8/12/1950,6809.36,1950-08-12
364,03S.09W.28.240,34.01755999,-107.7719926,8/12/1950,6799.58,1950-08-12
365,04S.09W.17.311,33.95756004,-107.8019926,8/12/1950,6796.2,1950-08-12
366,05S.09W.02.111,33.91006097,-107.7503236,8/12/1950,6791.07,1950-08-12
367,04S.09W.06.000,33.99450411,-107.8111602,8/13/1950,6774.26,1950-08-13
368,04S.11W.21.122,33.95228022,-107.9858871,8/13/1950,6770.65,1950-08-13
369,04S.10W.05.333,33.98422531,-107.9067185,8/13/1950,6759.5,1950-08-13
370,20N.08E.10.312,35.97936111,-106.0865833,9/11/1950,5569.53,1950-09-11
371,20N.08E.03.3221,35.99418994,-106.0822457,9/12/1950,5576.25,1950-09-12
372,21N.11E.18.422,36.04502523,-105.8066847,9/15/1950,7939.49,1950-09-15
373,21N.09E.36.441,36.00502429,-105.9327986,9/15/1950,6119.56,1950-09-15
374,20N.09E.01.224,35.99724663,-105.929743,9/15/1950,6108.48,1950-09-15
375,18N.10E.05.330,35.81363917,-105.9091876,9/26/1950,6980.39,1950-09-26
376,20N.08E.11.140,35.98196805,-106.0650233,9/26/1950,5595.9,1950-09-26
377,20N.09E.05.433,35.98696827,-106.0086335,9/28/1950,5783.03,1950-09-28
378,19N.08E.06.4224,35.90308033,-106.1283577,9/29/1950,5531.55,1950-09-29
379,JL-49-14-103,31.844722,-106.357223,10/4/1950,3698.81,1950-10-04
380,18N.08E.35.420,35.74586161,-106.0564124,10/13/1950,5568.34,1950-10-13
381,18N.08E.28.310,35.76002767,-106.1055798,10/13/1950,4683.56,1950-10-13
382,21N.08E.28.441,36.0191896,-106.0936348,10/25/1950,5712.36,1950-10-25
383,21N.08E.21.144,36.03946715,-106.1005793,10/25/1950,5630.31,1950-10-25
384,21N.08E.25.344,36.01780101,-106.0472451,10/26/1950,5632.38,1950-10-26
385,17N.09E.23.322,35.68864167,-105.956966,11/16/1950,6816.6,1950-11-16
386,17N.09E.22.441,35.68475279,-105.9683551,11/29/1950,6774.89,1950-11-29
387,16N.09E.06.4424,35.64086481,-106.0189112,11/30/1950,6338.48,1950-11-30
388,17N.09E.23.231,35.69253047,-105.9547438,12/8/1950,6858.79,1950-12-08
389,20N.09E.18.4421,35.96002428,-106.0203004,12/28/1950,5758.36,1950-12-28
390,31N.11E.19.140,36.91224061,-105.813625,1/1/1951,7332.73,1951-01-01
391,03S.04W.02.211,34.08339745,-107.2253137,1/1/1951,6903.12,1951-01-01
392,02S.04W.35.110,34.09867512,-107.232536,1/1/1951,6713.59,1951-01-01
393,01S.01W.23.431,34.20617776,-106.9103063,1/1/1951,4635.49,1951-01-01
394,02S.01W.12.322,34.14978873,-106.8975276,1/1/1951,4604.48,1951-01-01
395,02S.01E.30.132,34.11089974,-106.8844712,1/1/1951,4595.22,1951-01-01
396,03S.01E.18.144,34.0495106,-106.8805819,1/1/1951,4583.19,1951-01-01
397,03S.01W.13.213,34.05478835,-106.8964162,1/1/1951,4583.15,1951-01-01
398,03S.01W.12.324,34.06117726,-106.8969718,1/1/1951,4582.1,1951-01-01
399,03S.01W.26.311,34.01978816,-106.9214174,1/1/1951,4560.47,1951-01-01
400,03S.01W.11.214,34.06839947,-106.9094725,1/1/1951,4557.35,1951-01-01
401,04S.01W.22.212,33.95483333,-106.9283611,1/1/1951,4544.75,1951-01-01
402,29S.03E.12.212,31.80594014,-106.5897117,1/1/1951,3754.07,1951-01-01
403,19N.07E.20.221,35.87030268,-106.217248,1/4/1951,5777.11,1951-01-04
404,17N.09E.30.43333,35.66808623,-106.026967,2/28/1951,6164.61,1951-02-28
405,17N.09E.25.232,35.67753105,-105.9347433,4/1/1951,7022.02,1951-04-01
406,17N.09E.24.124,35.69308614,-105.9386324,4/1/1951,6932.65,1951-04-01
407,17N.09E.26.133,35.67614197,-105.9625216,4/20/1951,6781.28,1951-04-20
408,JL-49-04-137,31.970555,-106.595834,4/28/1951,3768.3,1951-04-28
409,JL-49-04-722,31.885834,-106.594445,4/28/1951,3754.92,1951-04-28
410,JL-49-12-107,31.87454911,-106.6049906,4/28/1951,3751.23,1951-04-28
411,28S.03E.26.134,31.84482776,-106.6124904,4/28/1951,3742.94,1951-04-28
412,19N.07E.05.112,35.91419067,-106.2275259,5/1/1951,5920.53,1951-05-01
413,19N.07E.05.231,35.91002412,-106.2214147,5/1/1951,5891.67,1951-05-01
414,16N.09E.02.32221,35.64558731,-105.956688,6/1/1951,6687.28,1951-06-01
415,19N.07E.04.133,35.90891308,-106.2128034,7/1/1951,5859.91,1951-07-01
416,29S.04E.07.131,31.80316248,-106.5822115,7/5/1951,3735.34,1951-07-05
417,16N.09E.15.22321,35.62197677,-105.9677992,7/6/1951,6637.5,1951-07-06
418,JL-49-13-616,31.830555,-106.393611,7/6/1951,3655.84,1951-07-06
419,17N.09E.27.211,35.68114175,-105.9730774,7/17/1951,6746.11,1951-07-17
420,17N.09E.25.312,35.67391997,-105.9433546,7/18/1951,6982.11,1951-07-18
421,17N.09E.36.234,35.66169815,-105.935021,7/19/1951,7006.17,1951-07-19
422,17N.09E.25.324,35.67225338,-105.9394656,7/19/1951,6992.05,1951-07-19
423,17N.09E.36.243,35.6614204,-105.9327988,7/19/1951,6983.56,1951-07-19
424,16N.09E.05.23423,35.64725356,-106.0055778,7/23/1951,6540.84,1951-07-23
425,16N.08E.12.324,35.62836508,-106.0464114,7/23/1951,6144.05,1951-07-23
426,17N.09E.28.423 B,35.67197523,-105.9861331,7/24/1951,6715.53,1951-07-24
427,17N.09E.28.423,35.67197523,-105.9861331,7/24/1951,6715.53,1951-07-24
428,16N.08E.01.321,35.64530903,-106.0478004,7/24/1951,6271.49,1951-07-24
429,17N.08E.34.342,35.65614192,-106.0819676,7/24/1951,6166.68,1951-07-24
430,16N.08E.04.13214,35.64864207,-106.1047455,7/24/1951,6146.81,1951-07-24
431,17N.09E.24.114,35.69419718,-105.9436325,7/27/1951,6926.17,1951-07-27
432,17N.09E.24.123,35.69308612,-105.9405769,7/28/1951,6900.64,1951-07-28
433,17N.09E.27.133,35.67614181,-105.9816886,7/28/1951,6728.85,1951-07-28
434,16N.08E.24.333,35.59558824,-106.0528001,8/1/1951,6152.0,1951-08-01
435,19N.07E.04.411,35.90613541,-106.2030811,8/1/1951,5806.2,1951-08-01
436,17N.09E.22.424,35.68697497,-105.9664106,8/3/1951,6823.2,1951-08-03
437,15N.08E.10.224,35.54920069,-106.0730777,8/7/1951,6147.39,1951-08-07
438,15N.08E.22.24221 PEACH TREE,35.51892381,-106.0727996,8/7/1951,6128.59,1951-08-07
439,15N.08E.08.3414,35.53892317,-106.1191891,8/7/1951,6004.96,1951-08-07
440,15N.08E.07.24122,35.53836763,-106.1261335,8/7/1951,5948.25,1951-08-07
441,16N.08E.14.444,35.61031003,-106.0553002,8/8/1951,6149.71,1951-08-08
442,15N.08E.34.1233,35.49003575,-106.0850218,8/9/1951,5916.83,1951-08-09
443,16N.09E.08.11222,35.6383649,-106.0141889,8/11/1951,6361.66,1951-08-11
444,16N.08E.12.13114,35.63419822,-106.053356,8/13/1951,6163.92,1951-08-13
445,16N.08E.10.424,35.63058716,-106.0733561,8/13/1951,6133.4,1951-08-13
446,29S.03E.12.222,31.80594016,-106.5844338,8/13/1951,3733.19,1951-08-13
447,16N.08E.13.323,35.61419882,-106.0489113,8/14/1951,6154.85,1951-08-14
448,16N.08E.13.243,35.61753208,-106.0397446,8/14/1951,6153.33,1951-08-14
449,JL-49-22-805,31.64539062,-106.2997033,8/14/1951,3655.07,1951-08-14
450,JL-49-22-902,31.65900151,-106.2733139,8/14/1951,3651.53,1951-08-14
451,15N.09E.31.2112,35.493369,-106.0266881,8/15/1951,6196.94,1951-08-15
452,29S.03E.01.431,31.81010668,-106.5902673,8/16/1951,3733.65,1951-08-16
453,17N.09E.27.232,35.67808629,-105.9708551,8/22/1951,6763.48,1951-08-22
454,16N.09E.01.433,35.64142092,-105.9372432,8/23/1951,6966.88,1951-08-23
455,17N.09E.25.421,35.67364229,-105.9325211,8/24/1951,7056.06,1951-08-24
456,17N.09E.27.241,35.67725301,-105.9680773,8/24/1951,6745.49,1951-08-24
457,16N.09E.02.42141,35.64447629,-105.9494656,8/24/1951,6731.3,1951-08-24
458,29S.03E.12.223,31.803718,-106.5861005,9/4/1951,3736.79,1951-09-04
459,29S.03E.12.224,31.80427355,-106.5827671,9/4/1951,3729.48,1951-09-04
460,17N.09E.24.124A,35.69308614,-105.9386324,9/11/1951,6927.8,1951-09-11
461,17N.09E.27.143,35.67586408,-105.9775219,9/11/1951,6750.8,1951-09-11
462,04S.01E.20.430,33.94312154,-106.8603027,9/12/1951,4544.85,1951-09-12
463,29S.04E.17.111,31.79177402,-106.5616554,10/2/1951,3739.13,1951-10-02
464,JL-49-05-311,31.969722,-106.3975,10/2/1951,3693.6,1951-10-02
465,18N.10E.31.414,35.74502932,-105.9172434,10/3/1951,7017.25,1951-10-03
466,21N.11E.19.221,36.04502521,-105.808907,10/12/1951,7895.98,1951-10-12
467,JL-49-13-212,31.857778,-106.422222,10/23/1951,3677.02,1951-10-23
468,15N.08E.29.2323,35.50197987,-106.1136331,10/27/1951,6214.21,1951-10-27
469,09N.02E.14.123,35.00949301,-106.7044704,12/1/1951,4920.63,1951-12-01
470,17N.09E.27.441,35.67022222,-105.9679167,12/27/1951,6748.95,1951-12-27
471,17N.09E.28.434,35.66891974,-105.9886332,12/27/1951,6704.29,1951-12-27
472,17N.09E.33.241,35.66308659,-105.9861331,12/27/1951,6702.82,1951-12-27
473,13N.06E.36.332  (RG 81301),35.30698483,-106.2633573,12/31/1951,6176.87,1951-12-31
474,01S.01W.35.123,34.18397222,-106.9170278,1/1/1952,4630.27,1952-01-01
475,29S.04E.08.311,31.79982932,-106.5652667,1/1/1952,3731.04,1952-01-01
476,17N.09E.35.432,35.65614261,-105.9527991,1/2/1952,6751.93,1952-01-02
477,16N.09E.03.421,35.64447614,-105.9683549,1/2/1952,6680.87,1952-01-02
478,16N.09E.03.134,35.64725375,-105.9791884,1/2/1952,6559.72,1952-01-02
479,15N.08E.17.2232,35.53447887,-106.1083556,1/2/1952,6053.25,1952-01-02
480,15N.09E.14.11413 A,35.53475702,-105.9630763,1/6/1952,6472.89,1952-01-06
481,15N.09E.16.4143,35.52697926,-105.9886323,1/6/1952,6363.81,1952-01-06
482,15N.09E.19.211,35.52170152,-106.0258549,1/6/1952,6200.19,1952-01-06
483,JL-49-14-405,31.826944,-106.365556,1/9/1952,3683.74,1952-01-09
484,JL-49-04-436,31.94371372,-106.5958246,1/10/1952,3771.88,1952-01-10
485,JL-49-04-138,31.96843519,-106.5963805,1/10/1952,3769.42,1952-01-10
486,JL-49-04-415,31.92704752,-106.6047135,1/10/1952,3765.43,1952-01-10
487,27S.03E.34.212,31.92204762,-106.6199916,1/10/1952,3760.78,1952-01-10
488,15N.09E.17.1333,35.53003462,-106.0175215,1/11/1952,6188.92,1952-01-11
489,JL-49-04-713,31.913889,-106.593334,1/11/1952,3766.6,1952-01-11
490,15N.09E.09.2223,35.55058974,-105.9847435,1/12/1952,6375.57,1952-01-12
491,15N.09E.06.1134,35.56308922,-106.0341886,1/12/1952,6190.86,1952-01-12
492,15N.08E.01.321,35.55781157,-106.0486331,1/12/1952,6154.93,1952-01-12
493,16N.08E.12.332,35.62669845,-106.0514114,1/14/1952,6155.85,1952-01-14
494,USBR RIN1    18S.04W.05.313,32.77063044,-107.2805782,1/15/1952,4096.31,1952-01-15
495,USBR RIN2     18S.04W.35.111,32.70646571,-107.2302989,1/15/1952,4069.67,1952-01-15
496,USBR RIN3     19S.03W.09.413,32.66896826,-107.1516855,1/15/1952,4047.72,1952-01-15
497,USBR RIN4     19S.02W.08.333,32.66424729,-107.0764058,1/15/1952,4029.78,1952-01-15
498,USBR RIN5     18S.02W.22.143,32.64285951,-107.0458493,1/15/1952,4014.46,1952-01-15
499,16N.09E.08.21432,35.63586499,-106.006411,1/16/1952,6521.83,1952-01-16
500,16N.09E.16.2433,35.61725453,-105.9861328,1/16/1952,6496.99,1952-01-16
501,JL-49-04-133,31.981667,-106.587778,1/16/1952,3787.46,1952-01-16
502,27S.03E.04.241,31.99121213,-106.6366596,1/17/1952,3779.8,1952-01-17
503,27S.03E.09.243,31.97537928,-106.6366594,1/17/1952,3776.69,1952-01-17
504,27S.03E.09.243+DUP,31.97510151,-106.6361038,1/17/1952,3776.36,1952-01-17
505,27S.03E.16.224,31.96343521,-106.6333258,1/17/1952,3776.2,1952-01-17
506,26S.03E.25.313,32.01398945,-106.5994367,1/18/1952,3787.52,1952-01-18
507,26S.03E.34.113,32.00843392,-106.6308264,1/18/1952,3784.6,1952-01-18
508,26S.03E.31.244,32.00398945,-106.6680495,1/18/1952,3784.4,1952-01-18
509,JL-49-14-404,31.826944,-106.365278,1/18/1952,3685.51,1952-01-18
510,04S.12W.24.122,33.95200168,-108.0453328,1/28/1952,6756.94,1952-01-28
511,29S.03E.01.111,31.81843974,-106.595823,1/31/1952,3739.91,1952-01-31
512,JL-49-06-702,31.91333333,-106.34,2/4/1952,3703.16,1952-02-04
513,JL-49-06-701,31.88399468,-106.3694294,2/4/1952,3672.24,1952-02-04
514,18N.10E.18.132,35.79336163,-105.9250213,2/7/1952,6734.07,1952-02-07
515,18N.10E.07.342,35.8000282,-105.9216879,2/7/1952,6679.42,1952-02-07
516,15N.08E.13.2424,35.53225677,-106.0366884,2/13/1952,6160.13,1952-02-13
517,27S.03E.04.231,31.99204543,-106.6394374,2/13/1952,3781.64,1952-02-13
518,JL-49-14-201,31.8559404,-106.3041498,2/21/1952,3691.26,1952-02-21
519,JL-49-14-102,31.85594009,-106.3466509,2/27/1952,3699.14,1952-02-27
520,05S.13W.14.122,33.87975,-108.1666944,4/1/1952,6760.72,1952-04-01
521,JL-49-04-412,31.93260291,-106.6055469,4/18/1952,3766.69,1952-04-18
522,JL-49-04-420,31.93260287,-106.6166583,4/18/1952,3766.2,1952-04-18
523,JL-49-14-302,31.872222,-106.256389,4/25/1952,3702.1,1952-04-25
524,JL-49-23-201,31.726667,-106.198334,4/29/1952,3672.04,1952-04-29
525,JL-49-15-801,31.755278,-106.199167,4/29/1952,3662.31,1952-04-29
526,JL-49-23-801,31.658056,-106.201945,4/29/1952,3641.98,1952-04-29
527,02S.01E.05.341,34.16117784,-106.8658593,5/1/1952,4752.42,1952-05-01
528,01S.01W.26.442,34.19006661,-106.9058616,5/1/1952,4627.51,1952-05-01
529,01S.01W.34.414,34.17784421,-106.9283627,5/1/1952,4622.71,1952-05-01
530,02S.01W.13.113,34.14105556,-106.90475,5/1/1952,4616.49,1952-05-01
531,02S.01E.19.321,34.12034423,-106.8833601,5/1/1952,4613.84,1952-05-01
532,02S.01E.30.241,34.11089978,-106.8744707,5/1/1952,4605.69,1952-05-01
533,03S.01E.06.121,34.08451075,-106.881971,5/1/1952,4595.5,1952-05-01
534,02S.01E.31.344,34.08673298,-106.8800265,5/1/1952,4593.88,1952-05-01
535,04S.01E.08.422,33.97617709,-106.8544692,5/1/1952,4559.56,1952-05-01
536,04S.01E.27.110,33.93895494,-106.8328012,5/1/1952,4553.18,1952-05-01
537,04S.01E.05.444,33.98451042,-106.8550248,5/1/1952,4550.1,1952-05-01
538,JL-49-13-925,31.770278,-106.398334,5/7/1952,3663.12,1952-05-07
539,JL-49-32-901,31.514723,-106.002223,5/7/1952,3659.39,1952-05-07
540,04S.01E.16.322,33.9614549,-106.8464131,5/23/1952,4548.0,1952-05-23
541,01S.01W.25.332,34.19006664,-106.9019725,6/1/1952,4629.47,1952-06-01
542,MBOWN-188 - 28S.03E.09.1324,31.88843742,-106.6462417,6/11/1952,3763.67,1952-06-11
543,MBOWN-187 - 28S.03E.04.1113,31.9076035,-106.6494365,6/11/1952,3759.85,1952-06-11
544,28S.03E.04.322,31.89649273,-106.647214,6/11/1952,3758.16,1952-06-11
545,MBOWN-191 - 28S.03E.16.4311,31.87010467,-106.6388802,6/11/1952,3752.93,1952-06-11
546,28S.03E.16.124,31.87621558,-106.6416581,6/11/1952,3751.3,1952-06-11
547,27S.03E.05.212,31.99565638,-106.6544379,6/12/1952,3778.82,1952-06-12
548,27S.03E.16.343,31.9526021,-106.6602707,6/13/1952,3771.78,1952-06-13
549,27S.03E.20.242,31.94788006,-106.6497148,6/13/1952,3767.12,1952-06-13
550,27S.03E.29.441,31.92510296,-106.6522146,6/13/1952,3765.4,1952-06-13
551,27S.03E.28.112,31.93649153,-106.6444368,6/13/1952,3765.07,1952-06-13
552,27S.03E.28.341,31.92510299,-106.6430477,6/13/1952,3763.4,1952-06-13
553,27S.03E.32.244,31.91593657,-106.6519367,6/13/1952,3762.93,1952-06-13
554,27S.03E.32.321,31.91482545,-106.6616591,6/13/1952,3762.72,1952-06-13
555,27S.03E.36.422,31.91454772,-106.6511033,6/13/1952,3762.67,1952-06-13
556,27S.03E.20.333,31.93954692,-106.6649929,6/13/1952,3756.78,1952-06-13
557,27S.03E.32.224,31.92010308,-106.6588813,6/13/1952,3749.17,1952-06-13
558,26S.03E.30.3431,32.01232257,-106.6786055,6/16/1952,3783.25,1952-06-16
559,26S.03E.31.141,32.00648936,-106.6783276,6/16/1952,3783.22,1952-06-16
560,26S.03E.31.444,31.99760074,-106.6613825,6/16/1952,3781.62,1952-06-16
561,27S.03E.05.423,31.99676745,-106.6569379,6/16/1952,3780.12,1952-06-16
562,27S.03E.18.244,31.95982408,-106.6683266,6/16/1952,3771.08,1952-06-16
563,26S.03E.34.144,32.00704509,-106.6219372,6/18/1952,3786.02,1952-06-18
564,10N.04E.32.433,35.04615933,-106.5416896,7/1/1952,4965.81,1952-07-01
565,29S.04E.08.221,31.80649584,-106.5519332,7/2/1952,3726.39,1952-07-02
566,17N.09E.26.142,35.6772531,-105.9564104,7/18/1952,6758.09,1952-07-18
567,05S.13W.27.42222,33.84338973,-108.1753336,7/19/1952,6749.04,1952-07-19
568,13N.04E.01.442,35.38114867,-106.4614145,7/26/1952,5125.57,1952-07-26
569,13N.04E.29.421,35.3255947,-106.5344703,7/26/1952,5064.76,1952-07-26
570,10N.04E.29.413 KAFB NO.5,35.06282547,-106.5414119,7/29/1952,4969.71,1952-07-29
571,05S.13W.14.32214,33.87227847,-108.1683894,8/19/1952,6756.82,1952-08-19
572,JL-49-04-443,31.936945,-106.598334,8/29/1952,3775.13,1952-08-29
573,10N.03E.35.111,35.05782532,-106.604191,10/1/1952,4967.69,1952-10-01
574,07S.01W.18.200,33.70534409,-106.9769752,10/2/1952,4454.33,1952-10-02
575,06S.13W.20.12223,33.78061205,-108.205611,10/30/1952,6758.24,1952-10-30
576,05S.13W.22.100,33.86116717,-108.189223,10/30/1952,6758.02,1952-10-30
577,05S.13W.09.420,33.88561133,-108.1958902,10/30/1952,6756.42,1952-10-30
578,06S.13W.20.12223 B,33.78061205,-108.205611,10/30/1952,6744.74,1952-10-30
579,05S.13W.32.33143,33.82422253,-108.2264454,10/30/1952,6722.27,1952-10-30
580,05S.14W.13.100+DUP,33.87644393,-108.2575578,10/31/1952,6850.93,1952-10-31
581,06S.14W.08.333,33.79616638,-108.3139463,10/31/1952,6741.9,1952-10-31
582,06S.14W.21.433,33.76727797,-108.2875566,10/31/1952,6740.25,1952-10-31
583,27S.03E.03.121,31.9945454,-106.6280483,11/1/1952,3784.44,1952-11-01
584,JL-49-05-804,31.884722,-106.422778,11/8/1952,3682.97,1952-11-08
585,17N.09E.26.214,35.6794753,-105.9522437,11/11/1952,6827.83,1952-11-11
586,16N.09E.05.44234,35.64030932,-106.0022443,11/13/1952,6526.91,1952-11-13
587,06S.14W.28.332A,33.75450026,-108.2947788,11/17/1952,6756.89,1952-11-17
588,06S.14W.28.332B,33.75450026,-108.2947788,11/17/1952,6756.49,1952-11-17
589,17N.08E.01.2124,35.73863969,-106.0411344,11/20/1952,6156.73,1952-11-20
590,05S.12W.04.310,33.89977911,-108.104222,12/4/1952,6761.46,1952-12-04
591,03S.11W.31.300,33.99866818,-108.0283888,12/11/1952,6967.12,1952-12-11
592,04S.13W.35.200,33.92088926,-108.1631123,12/11/1952,6776.96,1952-12-11
593,04S.12W.30.421,33.929223,-108.1270007,12/11/1952,6762.84,1952-12-11
594,04S.12W.31.421,33.91505645,-108.127556,12/11/1952,6762.34,1952-12-11
595,04S.12W.31.31132,33.91533405,-108.1406118,12/11/1952,6761.2,1952-12-11
596,04S.12W.22.31111,33.94561227,-108.0883891,12/11/1952,6758.56,1952-12-11
597,04S.12W.15.42314,33.9575568,-108.0747779,12/17/1952,6770.99,1952-12-17
598,04S.11W.17.33333,33.95255767,-108.0122767,12/17/1952,6766.76,1952-12-17
599,04S.11W.08.122,33.98061309,-108.0044992,12/17/1952,6763.99,1952-12-17
600,04S.12W.12.420,33.97227937,-108.0394997,12/17/1952,6761.94,1952-12-17
601,05S.12W.01.434+DUP,33.89561331,-108.0422763,12/19/1952,6764.96,1952-12-19
602,05S.11W.19.111+DUP,33.86450257,-108.0344979,12/19/1952,6763.08,1952-12-19
603,05S.12W.05.440+DUP,33.89616797,-108.1086665,12/19/1952,6757.49,1952-12-19
604,05S.13W.27.42222A,33.84338973,-108.1753336,12/19/1952,6750.04,1952-12-19
605,29N.13E.20.434,36.72808159,-105.5736169,1/1/1953,7718.34,1953-01-01
606,30N.10E.08.444,36.84390663,-105.8936257,1/1/1953,7342.57,1953-01-01
607,10N.02E.12.222 DUR 6,35.11476762,-106.6755818,1/1/1953,4950.65,1953-01-01
608,10N.02E.12.334 DUR 5,35.10143464,-106.6889153,1/1/1953,4946.63,1953-01-01
609,10N.02E.12.312 DUR 4,35.10782334,-106.688082,1/1/1953,4935.66,1953-01-01
610,29S.03E.01.434,31.80788452,-106.5899895,1/15/1953,3761.76,1953-01-15
611,28S.03E.35.212,31.8356614,-106.6049901,1/15/1953,3747.21,1953-01-15
612,29S.04E.17.112,31.79177402,-106.5624888,1/15/1953,3736.73,1953-01-15
613,29S.04E.06.334,31.80871788,-106.5797115,1/15/1953,3732.13,1953-01-15
614,JL-49-05-803,31.898889,-106.423333,1/15/1953,3698.27,1953-01-15
615,JL-49-05-806,31.897778,-106.423611,1/15/1953,3694.65,1953-01-15
616,JL-49-12-202,31.836945,-106.566112,1/16/1953,3728.26,1953-01-16
617,06S.14W.31.122,33.75113889,-108.3222222,1/27/1953,6747.77,1953-01-27
618,03S.11W.35.311+DUP,34.00228012,-107.9594982,1/28/1953,6767.83,1953-01-28
619,10N.02E.12.121 DUR 7,35.11560088,-106.6866932,2/1/1953,4958.65,1953-02-01
620,26S.03E.26.442,32.01343391,-106.5991589,2/10/1953,3789.69,1953-02-10
621,26S.03E.26.444,32.01037842,-106.6011034,2/10/1953,3779.14,1953-02-10
622,27S.03E.20.213,31.94982442,-106.6574928,2/11/1953,3771.53,1953-02-11
623,26S.03E.29.334,32.0114893,-106.6630495,2/13/1953,3784.72,1953-02-13
624,27S.03E.06.231,31.991212,-106.673605,2/13/1953,3780.96,1953-02-13
625,27S.03E.05.414,31.98621222,-106.6541599,2/13/1953,3777.62,1953-02-13
626,27S.03E.16.224A,31.96732394,-106.6427705,2/13/1953,3774.96,1953-02-13
627,27S.03E.08.244,31.97426815,-106.649993,2/13/1953,3773.8,1953-02-13
628,MBOWN-139 - 26S.03E.31.341,31.99815622,-106.6780496,2/15/1953,3782.04,1953-02-15
629,MBOWN-164 - 27S.03E.17.1414,31.96065741,-106.661382,2/16/1953,3774.62,1953-02-16
630,27S.03E.17.321,31.95843525,-106.6622153,2/16/1953,3773.65,1953-02-16
631,27S.03E.15.334,31.95315775,-106.6291589,2/16/1953,3773.43,1953-02-16
632,MBOWN-167 - 27S.03E.21.4221,31.94426911,-106.6349922,2/18/1953,3767.0,1953-02-18
633,MBOWN-175 - 27S.03E.33.4222,31.91704772,-106.6333251,2/18/1953,3763.56,1953-02-18
634,27S.03E.28.233,31.93176947,-106.6394366,2/18/1953,3760.82,1953-02-18
635,28S.03E.05.422,31.90065926,-106.6505475,2/18/1953,3759.51,1953-02-18
636,JL-48-42-701,31.2736111,-105.8533333,3/9/1953,3509.6,1953-03-09
637,JL-49-04-440,31.948334,-106.595,3/13/1953,3774.21,1953-03-13
638,JL-49-05-802,31.913334,-106.423611,3/23/1953,3687.4,1953-03-23
639,JL-49-13-506,31.80871863,-106.4349861,4/14/1953,3659.68,1953-04-14
640,10N.03E.32.411,35.05004762,-106.6380805,4/16/1953,5025.91,1953-04-16
641,JL-49-14-501,31.8275,-106.303612,4/17/1953,3658.32,1953-04-17
642,NA03801230CCC,37.5041716,-105.7105732,5/4/1953,7532.71,1953-05-04
643,NA04100803BBB,37.83527808,-106.0921358,5/5/1953,7605.7,1953-05-05
644,NA04301008BBB,37.99166597,-105.9075158,5/6/1953,7561.07,1953-05-06
645,JL-49-04-205,31.9617689,-106.5477681,5/7/1953,3797.69,1953-05-07
646,JL-49-13-308,31.861945,-106.413056,5/9/1953,3682.44,1953-05-09
647,JL-49-05-611,31.946111,-106.398611,5/25/1953,3701.29,1953-05-25
648,30N.12E.16.231,36.83918882,-105.6613975,6/1/1953,7428.08,1953-06-01
649,JL-49-06-601,31.923611,-106.274444,6/1/1953,3694.98,1953-06-01
650,JL-49-15-702,31.784445,-106.219444,6/4/1953,3686.13,1953-06-04
651,JL-49-05-312,31.969722,-106.3975,6/12/1953,3690.4,1953-06-12
652,JL-49-15-701,31.78566506,-106.2216474,6/19/1953,3683.14,1953-06-19
653,JL-49-15-401,31.804445,-106.239167,7/7/1953,3676.44,1953-07-07
654,JL-49-15-601,31.822778,-106.150834,7/19/1953,3682.82,1953-07-19
655,JL-49-23-601,31.705556,-106.129444,8/1/1953,3644.32,1953-08-01
656,JL-49-04-716,31.899722,-106.586111,8/9/1953,3780.0,1953-08-09
657,JL-49-14-710,31.755834,-106.353056,8/9/1953,3672.24,1953-08-09
658,MBOWN-159 - 27S.03E.09.1334,31.97454593,-106.6477707,8/13/1953,3777.19,1953-08-13
659,14S.05W.13.410,33.08979344,-107.305306,9/21/1953,4304.04,1953-09-21
660,MBOWN-157 - 27S.03E.07.2313,31.97676799,-106.6741603,11/13/1953,3782.44,1953-11-13
661,JL-49-03-322,31.979444,-106.638334,11/13/1953,3775.62,1953-11-13
662,27S.03E.15.441,31.95426887,-106.6180475,12/14/1953,3778.31,1953-12-14
663,JL-49-06-501,31.94343784,-106.322484,12/16/1953,3717.65,1953-12-16
664,03S.08W.31.111,34.00894951,-107.7147684,1/1/1954,6785.84,1954-01-01
665,10N.02E.12.412 DUR 3,35.10810114,-106.6814152,1/1/1954,4951.03,1954-01-01
666,10N.01E.26.343,35.06032412,-106.8094735,1/1/1954,4900.5,1954-01-01
667,02S.01W.11.242,34.15395536,-106.9061392,1/1/1954,4615.83,1954-01-01
668,JL-49-13-721,31.753334,-106.490834,1/5/1954,3690.0,1954-01-05
669,JL-49-05-507,31.928333,-106.442778,1/7/1954,3699.35,1954-01-07
670,JL-49-32-101,31.613056,-106.111112,2/3/1954,3630.74,1954-02-03
671,JL-49-31-203,31.598889,-106.198889,2/3/1954,3626.63,1954-02-03
672,JL-49-31-301,31.595556,-106.167222,2/3/1954,3597.14,1954-02-03
673,JL-49-23-301,31.731944,-106.126389,2/6/1954,3691.07,1954-02-06
674,JL-49-23-501,31.686945,-106.172222,2/6/1954,3650.6,1954-02-06
675,JL-49-13-208,31.869444,-106.422778,2/8/1954,3679.87,1954-02-08
676,JL-49-24-801,31.635,-106.081389,2/8/1954,3595.86,1954-02-08
677,JL-49-32-501,31.581389,-106.056112,2/8/1954,3564.24,1954-02-08
678,JL-49-13-614,31.798334,-106.397222,3/6/1954,3653.7,1954-03-06
679,JL-49-16-501,31.791945,-106.053334,3/10/1954,3658.99,1954-03-10
680,JL-49-05-809,31.911945,-106.422778,3/17/1954,3685.38,1954-03-17
681,JL-49-05-911,31.886111,-106.407223,3/17/1954,3683.98,1954-03-17
682,JL-49-05-910,31.884722,-106.407501,3/17/1954,3596.42,1954-03-17
683,JL-49-05-810,31.911945,-106.422778,3/18/1954,3682.59,1954-03-18
684,JL-49-13-304,31.858889,-106.406112,3/22/1954,3678.3,1954-03-22
685,JL-49-13-302,31.869722,-106.405834,3/22/1954,3677.57,1954-03-22
686,JL-49-13-602,31.830278,-106.385278,3/23/1954,3666.83,1954-03-23
687,15N.02E.06.222A,35.5653074,-106.7630905,3/26/1954,5452.94,1954-03-26
688,JL-49-06-602,31.958056,-106.261667,4/14/1954,3710.26,1954-04-14
689,JL-49-07-201,31.963334,-106.205834,4/14/1954,3709.66,1954-04-14
690,09N.04E.06.111,35.0425482,-106.5697457,5/17/1954,4953.74,1954-05-17
691,29S.03E.01.434A,31.8081623,-106.5883228,11/12/1954,3711.53,1954-11-12
692,19N.07E.04.441,35.9033577,-106.1997477,12/1/1954,5754.41,1954-12-01
693,11N.03E.32.143 GRI 4,35.13921142,-106.6508593,1/1/1955,4961.78,1955-01-01
694,11N.03E.31.231 GRI 1,35.14087797,-106.6644707,1/1/1955,4960.78,1955-01-01
695,10N.03E.06.121,35.13004495,-106.6689152,1/1/1955,4957.78,1955-01-01
696,11N.02E.36.442 GRI 3,35.13393369,-106.6753042,1/1/1955,4956.78,1955-01-01
697,10N.03E.27.244 A,35.06643615,-106.6058577,1/1/1955,4949.05,1955-01-01
698,30N.11E.23.120,36.82779819,-105.7413983,1/11/1955,7318.97,1955-01-11
699,09N.04E.05.332,35.03171531,-106.5489118,2/1/1955,4973.72,1955-02-01
700,06S.03E.11.141,33.80479013,-106.605847,2/3/1955,4702.16,1955-02-03
701,06S.03E.25.122,33.76534604,-106.5864019,2/3/1955,4682.16,1955-02-03
702,05S.01E.36.442,33.82658333,-106.7849167,2/8/1955,4524.74,1955-02-08
703,07S.01E.27.214,33.67491667,-106.8235,2/9/1955,4590.47,1955-02-09
704,07S.01E.02.334,33.72228915,-106.8164104,2/9/1955,4588.58,1955-02-09
705,07S.01E.14.341,33.69525,-106.8121667,2/9/1955,4574.19,1955-02-09
706,08S.01E.25.421,33.58284817,-106.7872409,2/9/1955,4569.18,1955-02-09
707,05S.03E.25.121,33.85229013,-106.5861242,2/11/1955,4857.05,1955-02-11
708,05S.03E.17.1113,33.88080556,-106.6608889,2/11/1955,4739.03,1955-02-11
709,05S.04E.17.442,33.87006822,-106.5408451,2/15/1955,4924.22,1955-02-15
710,05S.04E.18.243,33.87645693,-106.559179,2/15/1955,4919.47,1955-02-15
711,05S.04E.20.444,33.85312387,-106.5397339,2/15/1955,4890.21,1955-02-15
712,07S.02E.26.322,33.66979113,-106.7086272,2/18/1955,4580.17,1955-02-18
713,08S.02E.23.313,33.59701497,-106.7166826,2/18/1955,4565.43,1955-02-18
714,06S.04E.10.131,33.80423536,-106.5241778,2/23/1955,4823.09,1955-02-23
715,07S.03E.22.314,33.68312481,-106.6269583,2/23/1955,4605.17,1955-02-23
716,24N.13E.06.141,36.34585929,-105.5972342,3/9/1955,6950.63,1955-03-09
717,14S.05W.25.112,33.06868223,-107.3139165,4/4/1955,4306.98,1955-04-04
718,USBR RIN10    17S.05W.24.124,32.82035207,-107.3078013,4/15/1955,4117.93,1955-04-15
719,USBR RIN8    19S.03W.07.131,32.67341191,-107.1955755,4/15/1955,4052.7,1955-04-15
720,USBR RIN7     19S.03W.13.132,32.65924701,-107.1075177,4/15/1955,4031.51,1955-04-15
721,USBR RIN6     20S.02W.01.124,32.60313905,-107.0050145,4/15/1955,3993.28,1955-04-15
722,JL-49-13-907,31.766944,-106.399722,5/6/1955,3637.17,1955-05-06
723,JL-49-05-303,31.975555,-106.395556,5/16/1955,3708.19,1955-05-16
724,07S.04E.23.312,33.68423685,-106.5061215,5/20/1955,4761.07,1955-05-20
725,07S.04E.28.334,33.66645911,-106.5397335,5/23/1955,4648.52,1955-05-23
726,08S.04E.21.123,33.6028491,-106.5372332,5/23/1955,4638.51,1955-05-23
727,09S.04E.18.344,33.51979488,-106.5700116,6/2/1955,4676.3,1955-06-02
728,JL-49-04-409,31.93538056,-106.6169361,6/3/1955,3762.11,1955-06-03
729,01S.74W.24.244,36.946,-105.6099444,6/4/1955,7436.1,1955-06-04
730,04S.01W.23.100,33.95117696,-106.9172504,6/24/1955,4542.94,1955-06-24
731,09S.03E.28.324,33.49479521,-106.6386244,6/29/1955,4656.27,1955-06-29
732,29N.12E.03.244,36.77875,-105.6401667,7/7/1955,7461.22,1955-07-07
733,MBOWN-206 - 29S.01E.08.124,31.80427163,-106.8616647,7/7/1955,3804.29,1955-07-07
734,10S.02E.03.222,33.47257313,-106.7169598,7/8/1955,4636.42,1955-07-08
735,01S.73W.32.422,36.91613368,-105.5736201,7/10/1955,7497.1,1955-07-10
736,01S.73W.32.322,36.91613352,-105.5825092,7/10/1955,7495.57,1955-07-10
737,01S.73W.32.122,36.92335559,-105.5827871,7/10/1955,7475.51,1955-07-10
738,01S.73W.29.322,36.93085545,-105.5822317,7/10/1955,7472.59,1955-07-10
739,01S.73W.32.222,36.92335575,-105.5736203,7/10/1955,7471.19,1955-07-10
740,01S.73W.29.422,36.93085559,-105.5736204,7/10/1955,7466.96,1955-07-10
741,01S.74W.26.442,36.92641031,-105.6283436,7/10/1955,7355.82,1955-07-10
742,01S.73W.19.422,36.94502168,-105.5916766,7/11/1955,7460.99,1955-07-11
743,01S.73W.19.222,36.95224376,-105.5916768,7/12/1955,7465.24,1955-07-12
744,01S.74W.24.244   A,36.94557693,-105.6102881,7/12/1955,7431.44,1955-07-12
745,01N.74W.33.322,37.00113069,-105.6733464,7/15/1955,7397.41,1955-07-15
746,JL-49-05-304,31.975278,-106.387222,7/15/1955,3717.38,1955-07-15
747,30N.12E.01.144,36.86641164,-105.6138974,7/17/1955,7496.57,1955-07-17
748,30N.12E.01.342,36.8616895,-105.6138973,7/17/1955,7495.59,1955-07-17
749,30N.12E.02.440,36.85863383,-105.6219529,7/17/1955,7467.42,1955-07-17
750,31N.12E.35.123,36.88413889,-105.6339722,7/17/1955,7366.05,1955-07-17
751,01S.73W.14.334,36.95280018,-105.5338979,7/18/1955,7714.69,1955-07-18
752,02S.73W.04.234,36.90224529,-105.5622307,7/18/1955,7512.69,1955-07-18
753,02S.73W.04.141,36.90422222,-105.5683056,7/18/1955,7510.9,1955-07-18
754,31N.12E.34.444,36.87363317,-105.6408425,7/18/1955,7431.79,1955-07-18
755,30N.12E.09.422,36.8502998,-105.6594533,7/25/1955,7436.71,1955-07-25
756,30N.12E.16.223,36.841411,-105.6613975,7/25/1955,7413.17,1955-07-25
757,30N.12E.21.111,36.82863313,-105.6733418,7/25/1955,7327.71,1955-07-25
758,30N.12E.11.1112,36.85807792,-105.6386198,7/26/1955,7451.73,1955-07-26
759,30N.12E.11.144,36.85141152,-105.6313973,7/26/1955,7451.36,1955-07-26
760,30N.12E.11.142,36.85446702,-105.6316752,7/26/1955,7415.36,1955-07-26
761,29N.13E.05.132,36.78141406,-105.5813951,7/27/1955,7807.3,1955-07-27
762,29N.13E.05.131,36.78141403,-105.5825062,7/27/1955,7787.9,1955-07-27
763,30N.12E.23.122,36.82835634,-105.6322301,7/27/1955,7345.86,1955-07-27
764,29N.13E.05.121,36.78474736,-105.5800062,7/28/1955,7849.91,1955-07-28
765,30N.13E.19.444,36.81585766,-105.5869514,7/28/1955,7687.72,1955-07-28
766,29N.12E.02.222,36.78502399,-105.6227845,7/28/1955,7497.56,1955-07-28
767,29N.12E.13.211,36.75558057,-105.6050058,7/30/1955,7521.88,1955-07-30
768,29N.12E.12.344,36.75752472,-105.6138949,7/30/1955,7501.24,1955-07-30
769,29N.12E.02.411,36.77752393,-105.6297288,7/30/1955,7480.78,1955-07-30
770,30N.12E.35.221,36.80027778,-105.625,8/1/1955,7492.33,1955-08-01
771,29N.09E.15.300,36.74529539,-105.9700154,8/2/1955,8455.21,1955-08-02
772,28N.09E.22.220,36.65224033,-105.9689051,8/2/1955,8086.37,1955-08-02
773,28N.09E.22.420,36.64501815,-105.9683496,8/5/1955,8094.17,1955-08-05
774,30N.11E.28.4421,36.80335348,-105.7675093,8/16/1955,7333.57,1955-08-16
775,29N.13E.07.443,36.7575251,-105.6005614,8/23/1955,7550.07,1955-08-23
776,29N.13E.19.122,36.74085871,-105.5961169,8/23/1955,7506.06,1955-08-23
777,29N.13E.19.320,36.73280313,-105.5969504,8/23/1955,7503.81,1955-08-23
778,29N.13E.19.322,36.73425,-105.5990833,8/23/1955,7498.89,1955-08-23
779,29N.13E.18.414,36.7464144,-105.5913945,8/23/1955,7483.69,1955-08-23
780,30N.12E.24.144,36.82307912,-105.6127853,8/24/1955,7539.94,1955-08-24
781,29N.13E.18.211,36.75530312,-105.5936168,8/25/1955,7508.24,1955-08-25
782,30N.12E.24.422,36.82169046,-105.604174,8/30/1955,7543.22,1955-08-30
783,02S.74W.11.222,36.89418865,-105.6277872,8/31/1955,7383.77,1955-08-31
784,04S.01E.06.133,33.99238889,-106.88575,9/1/1955,4566.56,1955-09-01
785,29N.13E.19.320A,36.73280313,-105.5969504,9/2/1955,7504.09,1955-09-02
786,09N.04E.15.311,35.00699404,-106.5139109,9/16/1955,4966.46,1955-09-16
787,JL-49-14-702,31.768055,-106.360834,9/27/1955,3657.14,1955-09-27
788,14S.05W.23.130,33.07951567,-107.3311393,10/21/1955,4356.65,1955-10-21
789,19N.08E.08.42121,35.89363617,-106.1108575,10/26/1955,5545.74,1955-10-26
790,09N.01E.25.241,34.98194444,-106.7830556,10/26/1955,4873.29,1955-10-26
791,02S.73W.08.344,36.88057865,-105.5838973,11/7/1955,7508.74,1955-11-07
792,01S.73W.33.212,36.92224488,-105.56112,11/7/1955,7504.64,1955-11-07
793,02S.74W.12.222,36.89446677,-105.6097314,11/8/1955,7502.87,1955-11-08
794,JL-49-05-902,31.899167,-106.409445,11/14/1955,3688.19,1955-11-14
795,JL-49-12-607,31.794167,-106.524167,11/21/1955,3753.89,1955-11-21
796,JL-49-04-408,31.93121401,-106.6199917,11/23/1955,3757.22,1955-11-23
797,JL-49-04-405,31.93815827,-106.6122138,12/15/1955,3760.13,1955-12-15
798,JL-49-04-407,31.93093623,-106.6230473,12/19/1955,3754.92,1955-12-19
799,12N.07E.18 Ortiz Mine Grant  (RG  32942),35.27254132,-106.2344684,1/1/1956,6250.89,1956-01-01
800,10N.04E.35.231,35.05282591,-106.4878001,1/7/1956,5766.84,1956-01-07
801,29N.10E.10.311,36.76251904,-105.8647339,1/9/1956,7698.7,1956-01-09
802,32N.11E.28.3433,36.97529618,-105.7789036,1/12/1956,7334.18,1956-01-12
803,08S.03W.02.331,33.63563889,-107.01625,1/13/1956,4297.37,1956-01-13
804,JL-49-04-414,31.92315874,-106.6066579,1/13/1956,3760.51,1956-01-13
805,05S.05W.14.113,33.8781189,-107.3378137,1/17/1956,6194.08,1956-01-17
806,04S.05W.11.443,33.96839701,-107.3250365,1/18/1956,6691.97,1956-01-18
807,05S.05W.24.243,33.8603411,-107.308091,1/18/1956,6032.5,1956-01-18
808,06S.05W.02.233,33.81927778,-107.3278333,1/18/1956,5950.32,1956-01-18
809,06S.04W.30.140,33.76145178,-107.2967012,1/18/1956,5678.5,1956-01-18
810,06S.04W.36.113,33.75244444,-107.2085,1/18/1956,4939.13,1956-01-18
811,10S.05W.22.312,33.42562485,-107.3467022,1/21/1956,5555.91,1956-01-21
812,10S.06W.33.322,33.39784714,-107.4642028,1/21/1956,5488.85,1956-01-21
813,13S.04W.22.300,33.1617384,-107.2444747,1/21/1956,4266.15,1956-01-21
814,02S.03W.25.133,34.10839829,-107.1136457,1/23/1956,5712.35,1956-01-23
815,29S.03E.01.341,31.81010666,-106.5941562,1/23/1956,3739.74,1956-01-23
816,10N.03E.10.324,35.10671262,-106.6139138,1/24/1956,4960.31,1956-01-24
817,10N.03E.03.412,35.12282325,-106.6094694,1/25/1956,4976.74,1956-01-25
818,10N.03E.03.144,35.12448984,-106.6141918,1/25/1956,4965.46,1956-01-25
819,10N.04E.03.242,35.1250459,-106.5089118,1/26/1956,5489.33,1956-01-26
820,11N.04E.30.422,35.15198928,-106.5522463,1/26/1956,4968.03,1956-01-26
821,10N.03E.10.422,35.10893482,-106.604747,1/26/1956,4965.99,1956-01-26
822,JL-49-13-305,31.85927302,-106.3894298,1/26/1956,3669.27,1956-01-26
823,JL-49-13-610,31.79788586,-106.396374,1/27/1956,3659.24,1956-01-27
824,01S.74W.23.222,36.95140988,-105.6283442,2/2/1956,7330.6,1956-02-02
825,10N.03E.14.441,35.0900466,-106.5900243,2/6/1956,4964.11,1956-02-06
826,10N.03E.14.233,35.09560196,-106.5941911,2/6/1956,4960.84,1956-02-06
827,07N.01W.31.124,34.79544444,-106.9852778,2/10/1956,4980.53,1956-02-10
828,10N.04E.26.233,35.06615883,-106.4872447,2/14/1956,5682.7,1956-02-14
829,08N.03E.32.412,34.87655556,-106.6457778,2/14/1956,4866.89,1956-02-14
830,08N.03E.14.231,34.92282946,-106.5941901,2/15/1956,4938.35,1956-02-15
831,29N.12E.13.121,36.75558026,-105.6158393,2/20/1956,7513.27,1956-02-20
832,10N.03E.34.144,35.05143659,-106.6136355,2/20/1956,4956.14,1956-02-20
833,CB00107433DAA,37.00126967,-105.6649851,2/21/1956,7419.18,1956-02-21
834,02S.73W.17.142,36.87502321,-105.5838972,2/22/1956,7502.74,1956-02-22
835,29N.13E.19.231,36.73335866,-105.5977837,2/22/1956,7500.28,1956-02-22
836,07S.03E.04.231,33.73062375,-106.6383477,2/23/1956,4613.96,1956-02-23
837,07S.03E.36.333,33.65007014,-106.5933461,2/23/1956,4606.11,1956-02-23
838,14S.04W.05.210,33.1264603,-107.2708625,2/29/1956,4255.99,1956-02-29
839,06N.02E.01.131,34.77783362,-106.6914144,3/13/1956,4833.58,1956-03-13
840,06N.02E.16.423,34.74533458,-106.7319709,3/14/1956,4824.68,1956-03-14
841,06N.02E.27.133,34.71666667,-106.7285833,3/15/1956,4814.96,1956-03-15
842,05N.02E.04.211,34.69228046,-106.7397486,3/15/1956,4811.13,1956-03-15
843,JL-49-05-905,31.908056,-106.412223,3/19/1956,3689.21,1956-03-19
844,05N.01E.24.344,34.629,-106.78525,3/20/1956,4744.7,1956-03-20
845,07N.02E.21.332,34.81497222,-106.7412222,3/26/1956,4848.94,1956-03-26
846,06N.02E.05.244,34.77644472,-106.7422489,3/26/1956,4832.59,1956-03-26
847,06N.02E.30.313,34.71541667,-106.7785278,3/27/1956,4816.77,1956-03-27
848,06N.02E.19.413,34.72780556,-106.7710278,3/27/1956,4814.79,1956-03-27
849,04N.01E.25.222,34.55061111,-106.78175,3/29/1956,4767.26,1956-03-29
850,12N.03E.08.233,35.28527778,-106.6478056,4/4/1956,5025.59,1956-04-04
851,12N.02E.04.242,35.30080556,-106.7295278,4/6/1956,4962.5,1956-04-06
852,12N.01E.22.222,35.26059564,-106.8180867,4/6/1956,4955.31,1956-04-06
853,04N.02E.06.124,34.60978257,-106.7755824,4/11/1956,4783.81,1956-04-11
854,04N.02W.08.243,34.5861722,-106.7491927,4/11/1956,4781.38,1956-04-11
855,06N.02E.03.344,34.75005671,-106.6853031,4/12/1956,5004.72,1956-04-12
856,04N.02E.32.141,34.53534021,-106.7561371,4/12/1956,4777.31,1956-04-12
857,07N.02E.11.343,34.8417205,-106.7025258,4/13/1956,4855.52,1956-04-13
858,06S.02E.01.444,33.80978939,-106.682516,4/17/1956,4745.6,1956-04-17
859,09N.03E.11.241 OLD IRRIGATION WELL,35.02438889,-106.5865556,4/24/1956,4961.58,1956-04-24
860,06N.02E.10.142,34.7642229,-106.7211373,4/24/1956,4828.3,1956-04-24
861,25N.07E.33.414,36.35390727,-106.1930801,4/25/1956,6913.97,1956-04-25
862,06N.01E.05.412,34.77505537,-106.8566963,4/25/1956,4831.14,1956-04-25
863,06N.02W.13.234,34.74700013,-106.997533,4/26/1956,5046.16,1956-04-26
864,07N.01W.23.334,34.81194444,-106.9186667,4/26/1956,4844.49,1956-04-26
865,03N.01E.36.111,34.44811969,-106.800026,4/27/1956,4730.92,1956-04-27
866,13N.03E.25.244+DUP,35.33061111,-106.5676667,5/8/1956,5049.1,1956-05-08
867,04N.01W.28.323,34.54172813,-106.9514194,5/8/1956,4809.34,1956-05-08
868,04N.01E.18.311,34.57144981,-106.8866959,5/9/1956,4824.69,1956-05-09
869,04N.01W.15.211,34.57978275,-106.9289191,5/9/1956,4814.35,1956-05-09
870,JL-49-05-606,31.928055,-106.406667,5/10/1956,3688.23,1956-05-10
871,05N.03E.08.2242,34.67977778,-106.6406944,5/15/1956,4822.72,1956-05-15
872,05N.03E.19.212,34.65175,-106.6634722,5/15/1956,4801.68,1956-05-15
873,JL-49-14-703,31.765834,-106.368889,5/15/1956,3659.86,1956-05-15
874,07N.02E.24.134,34.8203323,-106.6894699,5/16/1956,4847.49,1956-05-16
875,02N.01E.22.233,34.38111111,-106.8233056,5/17/1956,4717.56,1956-05-17
876,01S.01W.36.311,34.17978881,-106.9036392,5/17/1956,4630.14,1956-05-17
877,10N.03E.36.132,35.05290556,-106.5824083,5/19/1956,4943.56,1956-05-19
878,01S.01W.01.231,34.25395573,-106.8972502,5/22/1956,4670.6,1956-05-22
879,05N.02W.21.422,34.64422462,-107.0461444,5/24/1956,4850.21,1956-05-24
880,06N.01E.33.433,34.69644661,-106.8419733,5/24/1956,4815.1,1956-05-24
881,06S.02E.10.141,33.80506676,-106.7272395,5/31/1956,4647.73,1956-05-31
882,08N.02E.29.213A,34.89602778,-106.7537778,6/4/1956,4876.71,1956-06-04
883,06S.01E.16.231,33.78923279,-106.8428013,6/10/1956,4519.19,1956-06-10
884,06S.01W.36.412,33.74423267,-106.8911374,6/10/1956,4483.72,1956-06-10
885,JL-49-13-928,31.758889,-106.411389,6/20/1956,3677.12,1956-06-20
886,09N.03E.08.221,35.02838161,-106.6425248,6/26/1956,4934.6,1956-06-26
887,JL-49-13-910,31.766112,-106.391667,6/29/1956,3645.91,1956-06-29
888,28S.02E.13.333,31.86538234,-106.6999925,7/1/1956,3782.41,1956-07-01
889,08S.03E.09.434,33.62201487,-106.6352916,7/4/1956,4599.95,1956-07-04
890,JL-49-22-901,31.665001,-106.285,7/5/1956,3642.65,1956-07-05
891,08N.02E.01.312+DUP,34.94866165,-106.6894699,7/9/1956,4897.73,1956-07-09
892,09N.02E.36.334,34.9742164,-106.6905811,7/10/1956,4902.53,1956-07-10
893,09N.02E.35.113,34.96838317,-106.7089148,7/10/1956,4871.16,1956-07-10
894,10S.03E.03.2211,33.47507339,-106.6152903,7/10/1956,4700.3,1956-07-10
895,14S.04W.18.310,33.09034898,-107.2966948,7/10/1956,4205.31,1956-07-10
896,09N.02E.10.142,35.02699236,-106.7244709,7/11/1956,4978.92,1956-07-11
897,09N.02E.34.322,34.95838344,-106.7200262,7/11/1956,4931.62,1956-07-11
898,09N.02E.35.143,34.95616133,-106.7089148,7/11/1956,4893.94,1956-07-11
899,09N.02E.15.221,35.01421504,-106.713915,7/11/1956,4890.05,1956-07-11
900,JL-49-22-539,31.6720564,-106.3285932,7/11/1956,3644.41,1956-07-11
901,09N.02E.12.322,35.02143718,-106.6844701,7/12/1956,4920.13,1956-07-12
902,09N.02E.12.413,35.0167151,-106.6853034,7/12/1956,4900.28,1956-07-12
903,09N.02E.15.124,34.9644944,-106.7089148,7/12/1956,4884.15,1956-07-12
904,09S.02E.34.211,33.48868401,-106.7230711,7/13/1956,4633.43,1956-07-13
905,10S.02E.04.313,33.46535091,-106.7483495,7/13/1956,4629.46,1956-07-13
906,08S.02E.17.224,33.61979201,-106.7530727,7/13/1956,4578.99,1956-07-13
907,09N.02E.35.224,34.95616135,-106.7033591,7/18/1956,4897.78,1956-07-18
908,09N.02E.23.333,34.98643816,-106.7089148,7/19/1956,4901.47,1956-07-19
909,09N.02E.22.441,34.98838252,-106.7136371,7/19/1956,4883.09,1956-07-19
910,14S.04W.04.123,33.12562695,-107.2591957,7/23/1956,4248.86,1956-07-23
911,14S.04W.06.314,33.11812693,-107.2955847,7/23/1956,4180.01,1956-07-23
912,JL-49-22-114,31.728611,-106.365001,7/26/1956,3666.14,1956-07-26
913,JL-49-22-110,31.741945,-106.344722,7/26/1956,3634.64,1956-07-26
914,JL-49-05-901,31.91343798,-106.4072084,7/30/1956,3686.24,1956-07-30
915,09N.02E.11.241,35.02504812,-106.6955814,8/1/1956,4923.59,1956-08-01
916,09N.03E.19.322,34.99199374,-106.6672473,8/2/1956,4914.52,1956-08-02
917,09N.02E.25.211,34.98532721,-106.6825254,8/2/1956,4911.58,1956-08-02
918,09N.03E.18.414,34.9708837,-106.5733564,8/3/1956,5241.96,1956-08-03
919,09S.01E.18.324,33.52297222,-106.8814444,8/14/1956,4525.96,1956-08-14
920,09S.01W.23.311,33.5111819,-106.9211354,8/14/1956,4523.98,1956-08-14
921,09S.01E.18.341,33.52368201,-106.8811337,8/14/1956,4523.85,1956-08-14
922,08S.01W.23.224,33.60208333,-106.9053889,8/14/1956,4510.79,1956-08-14
923,08S.01W.33.341,33.56522222,-106.9490833,8/14/1956,4492.97,1956-08-14
924,JL-49-40-102,31.466667,-106.113612,8/17/1956,3562.03,1956-08-17
925,11N.03E.16.231,35.21254255,-106.6311374,8/21/1956,4996.74,1956-08-21
926,11N.03E.09.331,35.1919876,-106.6383596,8/21/1956,4990.48,1956-08-21
927,11N.03E.30.233,35.15837766,-106.6158588,8/22/1956,5015.86,1956-08-22
928,11N.03E.04.134,35.21254255,-106.6297484,9/5/1956,4995.16,1956-09-05
929,11N.03E.05.412,35.20976479,-106.6447487,9/5/1956,4990.57,1956-09-05
930,10N.03E.07.242,35.11004562,-106.6611371,9/5/1956,4944.39,1956-09-05
931,06S.02E.04.144,33.81673325,-106.7427956,9/7/1956,4621.08,1956-09-07
932,12N.03E.14.332,35.2639299,-106.6005818,9/12/1956,5019.5,1956-09-12
933,11N.03E.16.312,35.18115462,-106.6358594,9/13/1956,4987.74,1956-09-13
934,13N.04E.32.211,35.31837274,-106.5350258,9/14/1956,5077.23,1956-09-14
935,13N.03E.36.224,35.31670595,-106.5683598,9/14/1956,5053.26,1956-09-14
936,13N.04E.31.131,35.31476159,-106.5655819,9/14/1956,5050.81,1956-09-14
937,09N.02E.03.342,35.03199223,-106.7200264,10/2/1956,4912.91,1956-10-02
938,10N.03E.09.124,35.11393453,-106.631692,10/3/1956,4947.66,1956-10-03
939,10N.03E.20.214,35.08754642,-106.6422476,10/3/1956,4944.49,1956-10-03
940,17S.04W.31.342,32.7828526,-107.2922452,10/4/1956,4095.33,1956-10-04
941,17S.04W.31.341,32.78285263,-107.2944674,10/4/1956,4094.56,1956-10-04
942,09N.02E.03.411,35.03615874,-106.7241932,10/9/1956,4940.49,1956-10-09
943,09N.02E.11.241   A,35.02504812,-106.6955814,10/9/1956,4923.95,1956-10-09
944,09N.02E.23.321   A,34.99227132,-106.7055814,10/9/1956,4912.72,1956-10-09
945,10N.03E.17.343,35.08837968,-106.6522478,10/10/1956,4932.62,1956-10-10
946,13N.04E.01.412,35.38241667,-106.4653611,10/15/1956,5095.68,1956-10-15
947,13N.04E.01.243,35.38531518,-106.4636368,10/15/1956,5085.1,1956-10-15
948,13N.04E.28.421,35.32615035,-106.515581,10/16/1956,5062.2,1956-10-16
949,12N.03E.14.332A,35.2639299,-106.6005818,10/16/1956,5020.67,1956-10-16
950,12N.03E.22.232,35.25726345,-106.6061373,10/16/1956,5014.1,1956-10-16
951,12N.03E.14.332B,35.23920848,-106.6097483,10/16/1956,5012.94,1956-10-16
952,09N.03E.05.234,35.03752778,-106.6444444,10/16/1956,4914.48,1956-10-16
953,10N.03E.29.314,35.07088029,-106.6400252,10/17/1956,4993.06,1956-10-17
954,09N.03E.05.314,35.03449248,-106.6530806,10/18/1956,4930.8,1956-10-18
955,09N.03E.18.213,35.01219444,-106.6648889,10/24/1956,4928.68,1956-10-24
956,10N.02E.26.133,35.06449126,-106.7100265,10/25/1956,4939.17,1956-10-25
957,11N.02E.35.311,35.13726675,-106.7089161,10/26/1956,4964.67,1956-10-26
958,13N.04E.12.431,35.36503807,-106.4683588,10/30/1956,5096.72,1956-10-30
959,11N.03E.21.132,35.17004386,-106.6358593,11/1/1956,4980.78,1956-11-01
960,10N.02E.36.413,35.04838079,-106.6825258,11/1/1956,4927.65,1956-11-01
961,10N.02E.26.432,35.09032385,-106.695582,11/13/1956,4949.26,1956-11-13
962,10N.02E.36.243,35.05838046,-106.6853037,11/13/1956,4933.61,1956-11-13
963,10N.02E.24.413,35.07088011,-106.6755814,11/13/1956,4925.96,1956-11-13
964,JL-49-40-101,31.4725,-106.113612,11/13/1956,3565.94,1956-11-13
965,JL-49-22-909,31.65400177,-106.2530356,11/14/1956,3641.58,1956-11-14
966,JL-49-23-704,31.63594676,-106.2447018,11/14/1956,3639.7,1956-11-14
967,JL-49-22-834,31.63011327,-106.2974808,11/15/1956,3639.16,1956-11-15
968,JL-49-22-922,31.64483519,-106.2813695,11/15/1956,3636.1,1956-11-15
969,JL-49-04-402,31.95093566,-106.6124918,11/16/1956,3780.39,1956-11-16
970,JL-49-22-602,31.69594485,-106.2922038,11/16/1956,3653.65,1956-11-16
971,JL-49-22-515,31.69955582,-106.2991485,11/16/1956,3653.56,1956-11-16
972,JL-49-22-536,31.67427857,-106.3272043,11/16/1956,3652.04,1956-11-16
973,JL-49-22-809,31.66094564,-106.3210929,11/16/1956,3651.57,1956-11-16
974,JL-49-22-113,31.731389,-106.367778,11/19/1956,3668.39,1956-11-19
975,JL-49-22-826,31.64705713,-106.319426,11/19/1956,3645.69,1956-11-19
976,JL-49-22-825,31.6473349,-106.3191482,11/19/1956,3644.91,1956-11-19
977,JL-49-14-705,31.776111,-106.360834,11/23/1956,3642.15,1956-11-23
978,JL-49-05-610,31.920278,-106.416389,11/25/1956,3685.35,1956-11-25
979,09N.01W.14.134,35.00893601,-106.9178096,11/26/1956,5126.86,1956-11-26
980,11N.02E.36.131,35.14087784,-106.691138,11/27/1956,4960.98,1956-11-27
981,10N.02E.14.321,35.10004579,-106.6900264,11/27/1956,4804.88,1956-11-27
982,03N.02E.03.312,34.51188889,-106.7155833,11/27/1956,4785.03,1956-11-27
983,03N.02E.04.121,34.52080556,-106.7471667,11/27/1956,4753.15,1956-11-27
984,07N.02E.28.234,34.80616601,-106.7311376,11/28/1956,4844.49,1956-11-28
985,11N.03E.18.414,35.17921011,-106.6625266,12/6/1956,4983.78,1956-12-06
986,10N.02E.14.211,35.10143459,-106.6997489,12/6/1956,4952.3,1956-12-06
987,10N.03E.19.111+DUP,35.08615742,-106.6744704,12/7/1956,4945.97,1956-12-07
988,11N.03E.33.322,35.13754491,-106.6305811,12/11/1956,4972.78,1956-12-11
989,11N.03E.34.141,35.14115597,-106.6164142,12/11/1956,4972.31,1956-12-11
990,12N.07E.15 Ortiz Mine Grant  (RG  32946),35.26920821,-106.1886346,1/1/1957,6661.81,1957-01-01
991,05N.04E.03.114,34.69233333,-106.5140556,1/1/1957,5609.65,1957-01-01
992,JL-49-22-102,31.748889,-106.340278,1/2/1957,3675.97,1957-01-02
993,MBOWN-136 - 26S.03E.26.4244,32.01371168,-106.5994367,1/9/1957,3784.3,1957-01-09
994,29S.04E.07.310,31.79899594,-106.5813781,1/15/1957,3743.73,1957-01-15
995,08N.01E.01.342,34.947,-106.7871111,1/16/1957,4879.85,1957-01-16
996,11N.04E.15.442,35.17754428,-106.4994677,1/25/1957,5637.47,1957-01-25
997,12N.04E.32.242,35.227,-106.5336667,1/25/1957,4998.76,1957-01-25
998,14S.05W.23.440,33.07146004,-107.3186389,1/28/1957,4317.79,1957-01-28
999,08N.02E.35.334,34.87094444,-106.7075556,1/30/1957,4865.57,1957-01-30
1000,10N.03E.11.143,35.12087894,-106.5950247,1/31/1957,4949.22,1957-01-31
1001,10N.02E.12.241 CITY 4,35.11282323,-106.6772485,1/31/1957,4946.11,1957-01-31
1002,10N.02E.14.123,35.10143466,-106.6858597,1/31/1957,4809.43,1957-01-31
1003,09S.02E.25.311,33.49618396,-106.6964038,2/11/1957,4643.14,1957-02-11
1004,02S.74W.02.312,36.89974387,-105.6402876,2/15/1957,7333.46,1957-02-15
1005,11N.04E.16.341,35.17587753,-106.5289127,2/19/1957,4991.79,1957-02-19
1006,21N.10E.35.321,36.00863621,-105.8522414,2/21/1957,7004.14,1957-02-21
1007,12N.04E.17.424,35.26563889,-106.5335833,3/25/1957,5063.52,1957-03-25
1008,17S.04W.06.313,32.85516667,-107.2964722,4/1/1957,4123.68,1957-04-01
1009,01S.01W.25.114,34.19867778,-106.9022503,4/16/1957,4633.49,1957-04-16
1010,10N.03E.15.334,35.08837984,-106.618636,4/18/1957,4940.08,1957-04-18
1011,09N.01W.04.424,35.03449065,-106.9403105,4/19/1957,5187.23,1957-04-19
1012,17N.09E.31.131,35.66336411,-106.0344671,4/23/1957,6516.6,1957-04-23
1013,11N.01W.28.224,35.15754261,-106.9392003,4/23/1957,5313.7,1957-04-23
1014,11N.02E.22.441,35.16282148,-106.7133608,4/25/1957,5002.36,1957-04-25
1015,11N.02E.24.324,35.16486111,-106.6839167,4/25/1957,4970.26,1957-04-25
1016,10N.03E.21.223,35.08504658,-106.6253028,4/25/1957,4943.01,1957-04-25
1017,22S.01E.27.411,32.36759163,-106.8288952,4/25/1957,3884.83,1957-04-25
1018,MBOWN-345 23S.01E.03.422,32.33620364,-106.8211168,4/25/1957,3883.52,1957-04-25
1019,22S.01E.27.233,32.3662028,-106.8263951,4/25/1957,3882.41,1957-04-25
1020,23S.01E.11.443,32.31648206,-106.807505,4/25/1957,3867.56,1957-04-25
1021,23S.01E.14.313,32.30537114,-106.8202831,4/25/1957,3867.55,1957-04-25
1022,23S.02E.19.133,32.29426063,-106.7836151,4/25/1957,3864.43,1957-04-25
1023,23S.02E.29.143,32.28259445,-106.7611142,4/25/1957,3860.87,1957-04-25
1024,24S.01E.01.424,32.24537297,-106.7897257,4/25/1957,3844.61,1957-04-25
1025,23S.01E.36.333,32.25759478,-106.8033375,4/25/1957,3844.07,1957-04-25
1026,24S.02E.04.313,32.24648437,-106.7505578,4/25/1957,3840.11,1957-04-25
1027,18S.04W.36.134,32.70035514,-107.2100205,4/26/1957,4054.77,1957-04-26
1028,19S.02W.35.322,32.61227778,-107.0165556,4/26/1957,3985.01,1957-04-26
1029,MBOWN-321 21S.01W.24.324,32.46313889,-106.8976389,4/26/1957,3936.33,1957-04-26
1030,22S.01E.06.222,32.43286731,-106.8713973,4/26/1957,3923.13,1957-04-26
1031,24S.02E.36.411,32.17731903,-106.691665,4/26/1957,3831.15,1957-04-26
1032,25S.02E.03.214,32.16565262,-106.721388,4/26/1957,3823.19,1957-04-26
1033,MBOWN-356 25S.02E.11.144,32.15176402,-106.710554,4/26/1957,3811.77,1957-04-26
1034,17S.05W.01.321,32.86002778,-107.3094722,4/27/1957,4129.52,1957-04-27
1035,17S.04W.30.344,32.79713889,-107.29075,4/27/1957,4109.92,1957-04-27
1036,18S.04W.17.211,32.75008333,-107.27225,4/27/1957,4084.38,1957-04-27
1037,18S.04W.36.322,32.70016667,-107.2091944,4/27/1957,4051.68,1957-04-27
1038,19S.03W.11.413,32.66761111,-107.1174444,4/27/1957,4036.98,1957-04-27
1039,17N.09E.35.343,35.65447593,-105.9594659,5/1/1957,6702.11,1957-05-01
1040,12N.03E.26.112,35.24670828,-106.6011371,5/1/1957,5014.77,1957-05-01
1041,02N.02E.06.112,34.43395338,-106.7789139,5/1/1957,4724.39,1957-05-01
1042,04S.01E.32.240,33.91867712,-106.8555802,5/8/1957,4545.15,1957-05-08
1043,11N.03E.31.214 CITY 3,35.14337791,-106.6611374,5/9/1957,4964.81,1957-05-09
1044,JL-49-13-802,31.774167,-106.448611,5/25/1957,3637.74,1957-05-25
1045,17N.09E.03.1241,35.73836235,-105.9761334,6/12/1957,6677.92,1957-06-12
1046,22N.08E.36.130,36.09807817,-106.0525228,6/15/1957,5627.68,1957-06-15
1047,24N.08E.24.341,36.29557649,-106.0502997,6/26/1957,6187.54,1957-06-26
1048,07N.03E.35.313,34.78672234,-106.6047456,7/11/1957,4846.56,1957-07-11
1049,29S.04E.07.123,31.80455135,-106.5772114,7/28/1957,3730.94,1957-07-28
1050,11N.03E.33.143 CITY 2,35.14004482,-106.6319701,8/1/1957,4971.74,1957-08-01
1051,10N.03E.17.232+DUP CITY 1,35.09671279,-106.6447477,8/1/1957,4933.25,1957-08-01
1052,JL-49-21-301,31.746667,-106.403056,8/1/1957,3647.01,1957-08-01
1053,JL-49-04-104,31.96621296,-106.6163809,8/5/1957,3754.53,1957-08-05
1054,24N.08E.24.142,36.3022431,-106.0477995,8/6/1957,6217.63,1957-08-06
1055,16N.09E.02.33241,35.64086518,-105.9616881,8/12/1957,6681.64,1957-08-12
1056,16N.09E.02.31212,35.64586504,-105.9619659,8/13/1957,6695.72,1957-08-13
1057,16N.09E.02.121,35.65225377,-105.9594659,8/14/1957,6714.87,1957-08-14
1058,17N.09E.34.311,35.65919785,-105.9814108,8/16/1957,6722.59,1957-08-16
1059,16N.09E.10.42114,35.63142095,-105.9686326,8/16/1957,6636.26,1957-08-16
1060,16N.09E.01.2413,35.64586527,-105.933632,8/17/1957,6995.71,1957-08-17
1061,17N.09E.33.43212,35.65642009,-105.9880775,8/17/1957,6536.75,1957-08-17
1062,15N.08E.02.21132,35.5647558,-106.0625222,8/29/1957,6113.91,1957-08-29
1063,10N.04E.34.214+DUP,35.05477036,-106.5030778,9/30/1957,5006.43,1957-09-30
1064,14S.05W.25.111,33.06923779,-107.3141943,10/25/1957,4287.03,1957-10-25
1065,11S.04W.31.440B,33.30701579,-107.2858677,11/18/1957,4660.46,1957-11-18
1066,11S.04W.31.440,33.30701579,-107.2858677,11/18/1957,4625.36,1957-11-18
1067,11S.04W.32.330,33.30534917,-107.279201,11/18/1957,4623.02,1957-11-18
1068,13N.04E.01.233,35.3858707,-106.4680813,11/22/1957,5085.74,1957-11-22
1069,10S.04W.36.444,33.39118157,-107.1950327,12/1/1957,4376.65,1957-12-01
1070,17N.09E.34.422,35.65919797,-105.9661327,12/11/1957,6724.77,1957-12-11
1071,17N.09E.31.44321,35.65475329,-106.0214113,12/26/1957,6294.33,1957-12-26
1072,11N.04E.32.321,35.13698979,-106.5450238,1/1/1958,4964.29,1958-01-01
1073,10S.06W.19.222,33.43229105,-107.489759,1/9/1958,5396.6,1958-01-09
1074,10S.06W.29.422,33.41145805,-107.4719808,1/9/1958,5270.75,1958-01-09
1075,10S.06W.34.310B,33.39645831,-107.4528138,1/9/1958,5154.18,1958-01-09
1076,JL-49-05-202,31.985834,-106.426667,1/19/1958,3715.16,1958-01-19
1077,01S.01W.22.243,34.21312205,-106.9353077,1/20/1958,4758.41,1958-01-20
1078,20N.08E.02.334,35.98807902,-106.0686344,1/21/1958,5585.89,1958-01-21
1079,05S.01E.12.400,33.88617736,-106.7877984,1/22/1958,4763.32,1958-01-22
1080,JL-49-04-106,31.95926874,-106.6130474,2/3/1958,3746.07,1958-02-03
1081,05S.01E.18.300,33.87228815,-106.8825261,2/5/1958,4631.81,1958-02-05
1082,05S.01W.26.213,33.85201026,-106.9116944,2/5/1958,4577.86,1958-02-05
1083,05S.01E.18.431,33.87117705,-106.8783592,2/5/1958,4533.21,1958-02-05
1084,05S.01E.17.344,33.87228821,-106.8658584,2/5/1958,4512.14,1958-02-05
1085,06S.01W.12.233,33.80645478,-106.8916931,2/5/1958,4458.12,1958-02-05
1086,06S.01W.15.100,33.79339899,-106.939196,2/6/1958,4806.92,1958-02-06
1087,06S.01E.17.133,33.78812155,-106.8691917,2/13/1958,4509.86,1958-02-13
1088,JL-49-05-604,31.94371501,-106.3913748,2/13/1958,3693.13,1958-02-13
1089,JL-49-14-704,31.760556,-106.360278,2/15/1958,3666.44,1958-02-15
1090,14S.04W.30.324B,33.06007099,-107.2914158,3/3/1958,4219.17,1958-03-03
1091,14S.04W.30.324A,33.06007099,-107.2914158,3/6/1958,4213.3,1958-03-06
1092,14S.05W.05.443,33.1145,-107.3700278,3/7/1958,4519.46,1958-03-07
1093,14S.05W.15.133,33.09257133,-107.3497511,3/7/1958,4412.48,1958-03-07
1094,14S.05W.15.322,33.09118242,-107.3430843,3/7/1958,4406.07,1958-03-07
1095,14S.05W.23.111,33.08423792,-107.333084,3/7/1958,4373.03,1958-03-07
1096,14S.05W.23.233,33.07784898,-107.3236392,3/7/1958,4340.17,1958-03-07
1097,14S.05W.23.422,33.07646006,-107.3175279,3/7/1958,4312.85,1958-03-07
1098,14S.04W.30.333,33.05645989,-107.2989158,3/7/1958,4230.83,1958-03-07
1099,14S.04W.06.441A+DUP2,33.11673802,-107.285029,3/7/1958,4226.82,1958-03-07
1100,22N.09E.30.120,36.11585605,-106.0300224,3/15/1958,5704.52,1958-03-15
1101,13S.04W.26.300,33.14673845,-107.2269736,3/26/1958,4233.05,1958-03-26
1102,JL-49-13-609,31.794445,-106.401667,3/27/1958,3659.53,1958-03-27
1103,23N.10E.20.233,36.21363422,-105.9000192,4/2/1958,5840.64,1958-04-02
1104,JL-49-05-801,31.914167,-106.440556,4/7/1958,3677.86,1958-04-07
1105,23N.08E.01.330,36.25057707,-106.0528003,4/12/1958,6047.78,1958-04-12
1106,16N.08E.34.21234,35.57919979,-106.0775224,5/1/1958,6133.86,1958-05-01
1107,01S.01W.27.422,34.19395539,-106.9250293,5/1/1958,4632.67,1958-05-01
1108,01S.01W.26.131,34.19756655,-106.920029,5/1/1958,4611.48,1958-05-01
1109,07N.02E.18.422,34.83358333,-106.7658333,6/12/1958,4853.81,1958-06-12
1110,07N.02E.18.421,34.83422054,-106.7669718,6/16/1958,4858.31,1958-06-16
1111,15S.05W.26.344,32.96896035,-107.3253029,6/25/1958,4234.28,1958-06-25
1112,05N.02E.32.143,34.6139493,-106.7075251,6/26/1958,4935.89,1958-06-26
1113,10N.02E.25.211,35.07199116,-106.6822483,6/26/1958,4921.44,1958-06-26
1114,15S.05W.29.313,32.97284958,-107.3839152,6/26/1958,4691.99,1958-06-26
1115,15S.05W.30.111,32.98201617,-107.4014156,6/26/1958,4495.58,1958-06-26
1116,15S.05W.29.410,32.97312728,-107.373915,6/27/1958,4627.99,1958-06-27
1117,15S.05W.29.220,32.98062709,-107.3694705,6/27/1958,4507.68,1958-06-27
1118,15S.06W.15.344,32.99812719,-107.4464166,7/1/1958,4654.44,1958-07-01
1119,15S.05W.30.111A,32.98201617,-107.4014156,7/1/1958,4487.98,1958-07-01
1120,15S.05W.29.411,32.97534946,-107.3750261,7/1/1958,4403.52,1958-07-01
1121,15S.05W.30.440,32.97034966,-107.3869707,7/2/1958,4695.98,1958-07-02
1122,15S.06W.23.132,32.99257169,-107.4330829,7/2/1958,4618.79,1958-07-02
1123,05S.01E.32.234,33.83451046,-106.862247,7/17/1958,4501.34,1958-07-17
1124,05S.01E.32.214,33.83478825,-106.8583579,7/17/1958,4500.66,1958-07-17
1125,14S.04W.06.234B,33.12201583,-107.2866959,7/18/1958,4245.36,1958-07-18
1126,05S.01E.28.331,33.84173273,-106.8491907,7/23/1958,4511.61,1958-07-23
1127,16N.09E.05.234224,35.64753133,-106.0050222,7/25/1958,6531.08,1958-07-25
1128,05S.01E.28.111,33.85173272,-106.8505797,7/26/1958,4515.27,1958-07-26
1129,05S.01E.29.222,33.85256604,-106.8528021,7/26/1958,4513.48,1958-07-26
1130,JL-49-04-401,31.95482445,-106.6066583,8/18/1958,3735.35,1958-08-18
1131,16N.09E.01.31121,35.64392078,-105.9458544,8/26/1958,6786.41,1958-08-26
1132,17N.09E.15.2432,35.70558555,-105.9680775,8/26/1958,6757.54,1958-08-26
1133,JL-49-04-105,31.96871291,-106.608603,8/28/1958,3760.47,1958-08-28
1134,13S.04W.21.234,33.16590505,-107.2528084,9/1/1958,4271.39,1958-09-01
1135,09S.02E.08.440,33.53534961,-106.7522389,9/6/1958,4664.65,1958-09-06
1136,10N.02E.01.431 DUR 2,35.11893412,-106.6833598,10/1/1958,4941.88,1958-10-01
1137,10N.02E.21.343,35.07663889,-106.7418611,10/10/1958,4963.77,1958-10-10
1138,11N.03E.31.442,35.13393378,-106.6575261,10/14/1958,4955.13,1958-10-14
1139,25N.13E.30.323,36.36891463,-105.6025119,10/24/1958,6874.15,1958-10-24
1140,10N.04E.05.122,35.1297678,-106.5430792,10/24/1958,4983.39,1958-10-24
1141,JL-49-05-207,31.985834,-106.442778,10/27/1958,3720.5,1958-10-27
1142,14S.05W.14.333,33.08479348,-107.333084,11/4/1958,4386.98,1958-11-04
1143,26N.13E.04.113,36.53527778,-105.5691667,11/10/1958,7490.2,1958-11-10
1144,23N.09E.24.313,36.20918954,-105.9439091,11/12/1958,5818.75,1958-11-12
1145,10N.02E.24.112 ATR 3,35.08726842,-106.6889152,11/17/1958,4943.37,1958-11-17
1146,17N.09E.03.2331,35.73447358,-105.9739111,1/1/1959,6711.91,1959-01-01
1147,11N.03E.36.443 LDR 1,35.1311565,-106.5730799,1/1/1959,4966.82,1959-01-01
1148,03S.01E.07.313,34.0611773,-106.8864156,1/1/1959,4584.38,1959-01-01
1149,JL-49-05-601,31.95704782,-106.4072087,1/6/1959,3697.74,1959-01-06
1150,JL-49-05-602,31.95704796,-106.3916527,1/6/1959,3697.09,1959-01-06
1151,JL-49-05-603,31.9426038,-106.4069308,1/6/1959,3690.93,1959-01-06
1152,14S.04W.18.111,33.09784903,-107.3016952,1/7/1959,4283.8,1959-01-07
1153,14S.04W.06.234   B,33.12007138,-107.2889181,1/7/1959,4240.3,1959-01-07
1154,14S.04W.06.234B+DUP,33.1197936,-107.288918,1/7/1959,4238.47,1959-01-07
1155,14S.04W.06.411,33.1211825,-107.2889181,1/7/1959,4236.15,1959-01-07
1156,14S.04W.06.411   A,33.12090472,-107.2891959,1/7/1959,4235.55,1959-01-07
1157,14S.04W.06.322   A,33.11951582,-107.2933625,1/7/1959,4231.43,1959-01-07
1158,14S.04W.06.322A+DUP,33.11951582,-107.2933625,1/7/1959,4231.43,1959-01-07
1159,10N.02E.21.343+DUP,35.07226863,-106.7419717,1/13/1959,4948.35,1959-01-13
1160,17N.09E.02.4332,35.72725173,-105.9541884,1/14/1959,6749.61,1959-01-14
1161,JL-49-04-143,31.972222,-106.585,1/15/1959,3741.76,1959-01-15
1162,JL-49-22-103,31.735556,-106.342222,1/19/1959,3658.78,1959-01-19
1163,JL-49-13-823,31.75455364,-106.4210965,1/22/1959,3667.44,1959-01-22
1164,JL-49-14-711,31.750278,-106.356667,1/22/1959,3662.05,1959-01-22
1165,11N.04E.31.412,35.13698973,-106.5564129,1/28/1959,4952.8,1959-01-28
1166,03S.01E.19.144,34.03616667,-106.8796111,3/1/1959,4572.82,1959-03-01
1167,03S.01E.19.124,34.03923277,-106.8808597,3/1/1959,4563.52,1959-03-01
1168,17N.09E.31.44221,35.65669769,-106.0194669,3/3/1959,6309.2,1959-03-03
1169,22N.09E.16.320,36.13696741,-105.9922439,3/3/1959,5733.84,1959-03-03
1170,11N.04E.32.333,35.13171212,-106.5564129,3/4/1959,4913.79,1959-03-04
1171,22N.08E.26.430,36.10557803,-106.0616896,3/12/1959,5645.29,1959-03-12
1172,17N.09E.25.144,35.67558662,-105.9394656,3/23/1959,7035.3,1959-03-23
1173,16N.09E.03.312,35.64503159,-105.9791884,3/24/1959,6506.46,1959-03-24
1174,16N.09E.03.441,35.64142067,-105.9683548,3/26/1959,6665.79,1959-03-26
1175,16N.09E.09.321,35.63114297,-105.993633,3/26/1959,6513.34,1959-03-26
1176,16N.08E.01.34223,35.64142026,-106.0455782,3/27/1959,6163.66,1959-03-27
1177,26S.03E.36.144,32.00371193,-106.5933253,4/1/1959,3726.13,1959-04-01
1178,JL-49-13-608,31.804445,-106.403612,4/2/1959,3654.76,1959-04-02
1179,10N.03E.29.312,35.06504707,-106.6539143,4/16/1959,4938.15,1959-04-16
1180,10N.03E.29.311,35.06504706,-106.6566921,4/16/1959,4937.65,1959-04-16
1181,10N.03E.31.232,35.05393627,-106.6628032,4/16/1959,4934.17,1959-04-16
1182,10N.02E.25.433A,35.05893601,-106.6828037,4/16/1959,4930.65,1959-04-16
1183,09N.02E.11.221,35.02838135,-106.6958592,4/16/1959,4929.64,1959-04-16
1184,09N.02E.11.212,35.02838134,-106.6980815,4/16/1959,4929.15,1959-04-16
1185,23N.10E.28.240,36.19974558,-105.8766854,4/29/1959,6024.24,1959-04-29
1186,JL-49-14-701,31.783611,-106.361112,5/14/1959,3663.68,1959-05-14
1187,14S.05W.25.441,33.0578488,-107.3028048,5/15/1959,4219.85,1959-05-15
1188,10N.02E.25.433,35.05893601,-106.6828037,5/16/1959,4932.65,1959-05-16
1189,09N.04E.20.221,34.99810531,-106.5364113,6/12/1959,4972.13,1959-06-12
1190,MBOWN-48 - 23S.02E.28.123 (NMSU-3),32.28315007,-106.7461137,7/6/1959,3844.76,1959-07-06
1191,29S.04E.07.123+DUP,31.8039958,-106.577767,7/28/1959,3731.13,1959-07-28
1192,23N.10E.20.132,36.21530083,-105.9064082,8/3/1959,5852.11,1959-08-03
1193,16N.08E.17.2122,35.62364281,-106.1128009,8/4/1959,6149.57,1959-08-04
1194,JL-49-14-101,31.8706617,-106.3730406,8/21/1959,3665.02,1959-08-21
1195,15N.08E.06.23322,35.56031139,-106.1311338,10/24/1959,5872.61,1959-10-24
1196,JL-49-05-203,31.981111,-106.4325,10/26/1959,3723.48,1959-10-26
1197,JL-49-04-144,31.989167,-106.585278,11/12/1959,3759.73,1959-11-12
1198,02S.01E.07.430,34.14506659,-106.8772487,11/19/1959,4563.46,1959-11-19
1199,10N.03E.07.141 DUR 1,35.11115666,-106.6686372,12/8/1959,4941.65,1959-12-08
1200,17N.09E.28.32243,35.67308626,-105.9925222,12/24/1959,6508.38,1959-12-24
1201,12N.07E.09 Ortiz Mine Grant  (RG  32948),35.2822634,-106.1964124,1/1/1960,6570.27,1960-01-01
1202,12N.07E.5 Ortiz Mine Grant  (RG  32947),35.29726296,-106.2150236,1/1/1960,6486.97,1960-01-01
1203,12N.07E.05 Ortiz Mine Grant  (RG  32943),35.29642963,-106.2222459,1/1/1960,6382.54,1960-01-01
1204,11N.03E.35.442 VLA 4,35.13421189,-106.5869691,1/1/1960,4964.29,1960-01-01
1205,11N.03E.36.422 LDR 4,35.13754521,-106.5689132,1/1/1960,4962.97,1960-01-01
1206,10N.03E.01.133 VLA 2,35.12560107,-106.5841912,1/1/1960,4959.87,1960-01-01
1207,11N.03E.35.324 VLA 1,35.13476738,-106.5975249,1/1/1960,4959.25,1960-01-01
1208,JL-49-05-204,31.971389,-106.424722,1/5/1960,3710.87,1960-01-05
1209,29S.04E.07.134,31.80094033,-106.5794336,1/12/1960,3707.67,1960-01-12
1210,MBOWN-165 - 27S.03E.19.4222,31.94343568,-106.6686041,1/13/1960,3771.68,1960-01-13
1211,JL-49-04-439,31.95315789,-106.5930469,1/13/1960,3752.36,1960-01-13
1212,10N.03E.01.244 LDR 2,35.12421229,-106.5694686,1/15/1960,4961.0,1960-01-15
1213,13S.04W.22.330,33.15923837,-107.2458635,1/22/1960,4212.29,1960-01-22
1214,22N.09E.30.334,36.10474498,-106.0333558,1/27/1960,5693.35,1960-01-27
1215,JL-49-04-112,31.98787901,-106.6066588,2/2/1960,3780.94,1960-02-02
1216,11N.03E.36.322 LDR 3,35.13865624,-106.5783578,2/8/1960,4961.15,1960-02-08
1217,22N.09E.10.144,36.155023,-105.9733545,2/19/1960,5741.55,1960-02-19
1218,10N.03E.29.443,35.06004728,-106.6428029,2/19/1960,4919.61,1960-02-19
1219,14S.04W.07.421,33.10534905,-107.2847508,2/22/1960,4228.03,1960-02-22
1220,14S.05W.23.413,33.07479341,-107.3236391,3/18/1960,4340.9,1960-03-18
1221,22N.08E.36.121,36.10252262,-106.0489116,3/31/1960,5694.73,1960-03-31
1222,23S.02E.16.413,32.306205,-106.7425027,4/1/1960,3852.09,1960-04-01
1223,14S.04W.06.431A,33.11673802,-107.2886401,4/10/1960,4230.44,1960-04-10
1224,14S.04W.06.431,33.11673802,-107.2886401,4/10/1960,4230.44,1960-04-10
1225,14S.04W.06.430B,33.11534912,-107.2880845,4/10/1960,4226.56,1960-04-10
1226,14S.04W.06.430,33.11534912,-107.2880845,4/10/1960,4226.56,1960-04-10
1227,14S.04W.30.324,33.06007099,-107.2914158,4/15/1960,4218.9,1960-04-15
1228,14S.05W.25.240,33.0645155,-107.3011384,4/29/1960,4216.43,1960-04-29
1229,02S.04W.26.333,34.10061954,-107.233925,6/1/1960,6683.2,1960-06-01
1230,03S.03W.23.212,34.04145387,-107.1203122,6/1/1960,6565.82,1960-06-01
1231,02S.04W.27.111,34.11283333,-107.2519722,6/1/1960,6449.22,1960-06-01
1232,02S.04W.27.221,34.11284168,-107.2389251,6/1/1960,6426.86,1960-06-01
1233,02S.04W.23.321,34.12089727,-107.2311472,6/1/1960,6409.45,1960-06-01
1234,02S.04W.13.434,34.13006413,-107.2061469,6/1/1960,6268.27,1960-06-01
1235,03S.02W.20.111,34.04145415,-107.0797561,6/1/1960,5793.75,1960-06-01
1236,03S.02W.17.423,34.04673202,-107.0667004,6/1/1960,5735.95,1960-06-01
1237,02S.03W.24.411,34.12089836,-107.1047567,6/1/1960,5718.25,1960-06-01
1238,03S.02W.08.424,34.06117648,-107.0644782,6/1/1960,5711.56,1960-06-01
1239,02S.02W.18.112,34.14312066,-107.0936455,6/1/1960,5706.69,1960-06-01
1240,02S.03W.27.223,34.11200922,-107.1355904,6/1/1960,5706.56,1960-06-01
1241,02S.02W.07.324,34.14836111,-107.0893889,6/1/1960,5704.58,1960-06-01
1242,02S.02W.34.432,34.08908333,-107.0336944,6/1/1960,5695.97,1960-06-01
1243,02S.02W.35.323,34.0900657,-107.0222556,6/1/1960,5682.39,1960-06-01
1244,01S.02W.30.121,34.20133333,-107.0913611,6/1/1960,5657.77,1960-06-01
1245,01S.03W.12.131,34.2406204,-107.112535,6/1/1960,5466.37,1960-06-01
1246,05S.01E.29.310,33.84006601,-106.863636,6/1/1960,4508.65,1960-06-01
1247,13S.04W.22.100,33.16868291,-107.2436416,6/1/1960,4348.59,1960-06-01
1248,02S.01W.26.330,34.10201066,-106.9205843,6/4/1960,4593.39,1960-06-04
1249,23N.09E.34.431,36.17863399,-105.972521,6/9/1960,5776.08,1960-06-09
1250,JL-49-05-301,31.971667,-106.409167,6/13/1960,3700.39,1960-06-13
1251,23N.10E.29.111,36.20474534,-105.9094639,6/20/1960,5908.31,1960-06-20
1252,05S.01E.20.342,33.85701045,-106.863636,6/23/1960,4512.23,1960-06-23
1253,13S.04W.22.330A,33.15923837,-107.2458635,6/28/1960,4305.29,1960-06-28
1254,04N.01E.31.330,34.52339557,-106.8853067,7/1/1960,4667.54,1960-07-01
1255,05S.01E.29.342,33.84228823,-106.8619692,7/4/1960,4508.64,1960-07-04
1256,05S.01E.30.241,33.84951041,-106.8736366,7/8/1960,4509.89,1960-07-08
1257,05S.01E.30.223,33.85117708,-106.873081,7/10/1960,4510.58,1960-07-10
1258,10N.02E.21.314,35.07782401,-106.7428051,7/12/1960,4943.4,1960-07-12
1259,05S.01E.17.333,33.86951042,-106.8694697,7/14/1960,4514.15,1960-07-14
1260,02N.03E.21.330,34.37895459,-106.6408534,7/15/1960,5233.48,1960-07-15
1261,JL-49-13-503,31.814723,-106.433055,7/22/1960,3643.77,1960-07-22
1262,22N.09E.19.413,36.1225227,-106.0269668,7/29/1960,5704.78,1960-07-29
1263,14S.04W.06.400A,33.1170158,-107.2853068,8/11/1960,4219.12,1960-08-11
1264,JL-49-05-605,31.9423263,-106.3760966,8/12/1960,3689.96,1960-08-12
1265,23N.08E.01.310,36.25391036,-106.0528002,8/24/1960,6069.41,1960-08-24
1266,11N.03E.35.313 VLA 5,35.13587843,-106.6030805,9/1/1960,4955.98,1960-09-01
1267,JL-49-23-702,31.66177943,-106.2377575,9/2/1960,3664.54,1960-09-02
1268,13S.04W.35.100A,33.14118285,-107.2266956,9/19/1960,4236.41,1960-09-19
1269,14S.05W.09.343,33.0997936,-107.3622515,10/1/1960,4466.55,1960-10-01
1270,16N.08E.13.42113,35.61614323,-106.0405779,10/6/1960,6155.62,1960-10-06
1271,11N.03E.35.241 VLA 6,35.1411561,-106.589747,10/26/1960,4967.01,1960-10-26
1272,23N.10E.19.410,36.21030081,-105.9166863,11/1/1960,5852.25,1960-11-01
1273,JL-49-14-403,31.798611,-106.334445,11/15/1960,3676.49,1960-11-15
1274,JL-49-14-402,31.79705283,-106.3527618,11/18/1960,3665.94,1960-11-18
1275,22N.09E.02.421,36.1675231,-105.9489094,11/23/1960,6179.27,1960-11-23
1276,23N.07E.34.332,36.17752038,-106.1866917,11/23/1960,5813.69,1960-11-23
1277,JL-49-14-401,31.79771667,-106.3682,11/28/1960,3653.33,1960-11-28
1278,JL-49-22-613,31.70455576,-106.2855371,12/20/1960,3664.45,1960-12-20
1279,JL-49-04-113,31.97149057,-106.6188811,12/27/1960,3739.31,1960-12-27
1280,20N.08E.03.413,35.99196778,-106.0794679,1/1/1961,5572.64,1961-01-01
1281,23S.02E.08.433+DUP,32.31564914,-106.7583367,1/1/1961,3844.29,1961-01-01
1282,JL-49-13-510,31.815556,-106.434167,1/5/1961,3660.18,1961-01-05
1283,JL-49-13-905,31.769167,-106.401945,1/6/1961,3631.03,1961-01-06
1284,JL-49-14-706,31.783889,-106.347778,1/23/1961,3674.89,1961-01-23
1285,16N.08E.24.112,35.60892119,-106.0511335,2/8/1961,6130.19,1961-02-08
1286,15N.09E.33.433,35.47975836,-105.9902989,2/16/1961,6252.81,1961-02-16
1287,15N.09E.33.3443,35.47948056,-105.9930767,2/16/1961,6242.94,1961-02-16
1288,15N.08E.25.1141,35.50614641,-106.0511327,2/16/1961,6117.03,1961-02-16
1289,18N.09E.25.13113,35.76447311,-105.9464106,2/17/1961,6658.12,1961-02-17
1290,18N.09E.25.13111,35.76530642,-105.9464106,2/17/1961,6647.97,1961-02-17
1291,JL-49-04-410,31.93232511,-106.6124915,3/8/1961,3759.2,1961-03-08
1292,19S.05W.05.141,32.6884123,-107.382524,3/10/1961,4368.12,1961-03-10
1293,03S.01W.23.000,34.03451045,-106.9144726,3/15/1961,4594.35,1961-03-15
1294,04S.01E.06.200,33.99451039,-106.8747481,3/31/1961,4562.09,1961-03-31
1295,20N.09E.06.3424,35.98807925,-106.0275227,4/12/1961,5729.86,1961-04-12
1296,05S.01W.01.330,33.89895475,-106.9028051,4/15/1961,4816.39,1961-04-15
1297,23N.10E.27.323,36.19530122,-105.8683519,5/1/1961,6050.83,1961-05-01
1298,16N.09E.07.21221,35.63836487,-106.0233557,5/30/1961,6248.91,1961-05-30
1299,05S.01E.05.233,33.90589933,-106.8605804,6/2/1961,4532.98,1961-06-02
1300,05S.01E.08.123,33.89451043,-106.8650251,6/12/1961,4535.96,1961-06-12
1301,JL-49-13-958,31.774444,-106.375833,6/19/1961,3635.21,1961-06-19
1302,JL-49-14-707,31.774444,-106.375833,6/19/1961,3632.21,1961-06-19
1303,JL-49-13-914,31.78010867,-106.3838736,6/23/1961,3644.25,1961-06-23
1304,JL-49-04-147,31.960278,-106.589722,7/8/1961,3737.15,1961-07-08
1305,04S.01E.30.400,33.92923262,-106.8750258,7/11/1961,4590.17,1961-07-11
1306,23N.05E.24.300,36.20974079,-106.373086,7/21/1961,6378.63,1961-07-21
1307,23N.08E.23.442,36.20752178,-106.055856,7/23/1961,5969.1,1961-07-23
1308,09N.02E.11.442,35.01782614,-106.6933591,8/1/1961,4924.05,1961-08-01
1309,06S.03E.05.232 SRC-1,33.81895631,-106.6527929,8/1/1961,4742.36,1961-08-01
1310,16N.08E.10.3121,35.63114265,-106.0872452,8/18/1961,6134.59,1961-08-18
1311,17N.08E.11.33231,35.71364027,-106.0689123,9/5/1961,6103.36,1961-09-05
1312,JL-49-04-421,31.93093622,-106.6233251,9/26/1961,3758.91,1961-09-26
1313,12S.04W.29.440,33.23201665,-107.2669778,9/27/1961,4381.85,1961-09-27
1314,21N.08E.05.144,36.08279993,-106.1180795,11/29/1961,5659.3,1961-11-29
1315,12N.03E.31.243,35.22527778,-106.6708333,11/29/1961,4986.84,1961-11-29
1316,29S.03E.12.242,31.80344024,-106.5844338,12/14/1961,3732.42,1961-12-14
1317,10N.03E.26.111 BUR 2,35.07254708,-106.6036355,1/1/1962,4943.32,1962-01-01
1318,10N.03E.23.314 BUR 3,35.07782471,-106.6000244,1/1/1962,4942.02,1962-01-01
1319,MBOWN-177 - 28S.01W.06.323,31.8984346,-106.9852836,1/5/1962,3812.83,1962-01-05
1320,MBOWN-146 - 27S.02W.25.111,31.93676681,-107.0077852,1/5/1962,3811.4,1962-01-05
1321,MBOWN-178 - 28S.01W.06.333,31.89482353,-106.9908393,1/5/1962,3807.23,1962-01-05
1322,28S.01W.07.113,31.8898238,-106.9750051,1/5/1962,3800.75,1962-01-05
1323,28S.02E.01.233,31.9006591,-106.6913818,1/5/1962,3603.36,1962-01-05
1324,11S.04W.18.410,33.35229284,-107.2875346,2/14/1962,4881.14,1962-02-14
1325,JL-48-33-716,31.381944,-105.97,2/27/1962,3542.34,1962-02-27
1326,JL-48-41-619,31.2919444,-105.8797222,3/6/1962,3518.77,1962-03-06
1327,02S.01W.14.200,34.14034419,-106.9094727,3/26/1962,4636.93,1962-03-26
1328,JL-48-42-404,31.315278,-105.858056,4/10/1962,3517.45,1962-04-10
1329,03S.01E.18.344,34.04339946,-106.8803041,6/1/1962,4577.25,1962-06-01
1330,18N.08E.17.21314,35.79558249,-106.1150243,6/30/1962,5837.19,1962-06-30
1331,03S.03W.03.312,34.07784252,-107.1455904,7/1/1962,6707.86,1962-07-01
1332,01S.03W.31.433,34.17423081,-107.1911469,7/1/1962,5799.36,1962-07-01
1333,02S.03W.27.232,34.10978698,-107.1378127,7/1/1962,5735.65,1962-07-01
1334,02S.02W.19.422,34.12228745,-107.0808675,7/1/1962,5716.51,1962-07-01
1335,02S.02W.21.333,34.11563889,-107.0619722,7/1/1962,5708.94,1962-07-01
1336,02S.03W.22.111,34.128,-107.1479722,7/1/1962,5708.26,1962-07-01
1337,02S.03W.23.243,34.12256491,-107.118368,7/1/1962,5707.48,1962-07-01
1338,02S.02W.20.311,34.12062079,-107.0800342,7/1/1962,5706.61,1962-07-01
1339,02S.02W.35.321,34.09228792,-107.0230889,7/1/1962,5693.92,1962-07-01
1340,01S.03W.12.331,34.23339818,-107.1136461,7/1/1962,5490.1,1962-07-01
1341,22N.08E.34.443,36.09002247,-106.0758566,7/19/1962,5713.69,1962-07-19
1342,JL-49-05-208,31.985556,-106.435556,8/6/1962,3712.67,1962-08-06
1343,22N.09E.10.214,36.15835635,-105.9691877,8/7/1962,5761.24,1962-08-07
1344,13N.04E.36.323b,35.30892886,-106.4725247,8/8/1962,5666.91,1962-08-08
1345,02S.04W.26.313,34.10423064,-107.2342027,8/10/1962,6635.97,1962-08-10
1346,21N.08E.04.330,36.07613344,-106.1058571,8/24/1962,5654.44,1962-08-24
1347,23N.08E.35.213,36.18724408,-106.0619672,8/28/1962,5931.52,1962-08-28
1348,02S.01W.26.310,34.10534401,-106.9208621,8/30/1962,4736.53,1962-08-30
1349,10N.04E.22.342 LOM 1,35.07504748,-106.5072447,9/15/1962,4955.66,1962-09-15
1350,13S.04W.35.100C,33.14118285,-107.2266956,10/3/1962,4216.41,1962-10-03
1351,10N.02E.21.214,35.08532381,-106.7344717,10/4/1962,4936.66,1962-10-04
1352,05S.01E.04.122,33.9106216,-106.845024,10/5/1962,4538.56,1962-10-05
1353,21N.08E.04.111,36.08835553,-106.1075238,10/8/1962,5746.77,1962-10-08
1354,15N.08E.05.214,35.56308911,-106.1125226,10/30/1962,6069.09,1962-10-30
1355,03S.01W.25.233,34.02183333,-106.8963611,11/1/1962,4575.12,1962-11-01
1356,27N.12E.33.123,36.53613435,-105.6711224,1/1/1963,6774.44,1963-01-01
1357,13N.05E.22.320,35.33892804,-106.4016914,1/1/1963,5898.89,1963-01-01
1358,10N.03E.10.223 SBA 1,35.11337911,-106.6075249,1/1/1963,4953.7,1963-01-01
1359,10N.03E.21.443 YAL 1,35.07393583,-106.6244693,1/1/1963,4936.03,1963-01-01
1360,14S.04W.04.214A+DUP3,33.12368248,-107.2544734,1/2/1963,4241.0,1963-01-02
1361,14S.04W.04.214+DUP,33.12368248,-107.2544734,1/2/1963,4235.92,1963-01-02
1362,JL-49-05-607,31.92788214,-106.391097,1/3/1963,3679.13,1963-01-03
1363,14S.04W.06.344,33.11451579,-107.2908623,1/5/1963,4220.37,1963-01-05
1364,14S.04W.06.332A,33.11673803,-107.2961402,1/8/1963,4227.35,1963-01-08
1365,JL-49-32-701,31.506667,-106.115278,1/15/1963,3629.6,1963-01-15
1366,16N.08E.31.444,35.56614455,-106.1269672,1/20/1963,5938.76,1963-01-20
1367,04S.01W.13.421,33.96089925,-106.8878043,1/28/1963,4516.03,1963-01-28
1368,03S.01E.31.124,34.01089931,-106.880304,2/1/1963,4632.44,1963-02-01
1369,02S.01W.25.324,34.10488889,-106.8975278,2/1/1963,4607.92,1963-02-01
1370,14S.04W.06.332,33.11673803,-107.2961402,2/1/1963,4228.23,1963-02-01
1371,13S.04W.35.100B,33.14118285,-107.2266956,2/16/1963,4250.41,1963-02-16
1372,14S.04W.06.342,33.11673802,-107.2903068,2/18/1963,4223.94,1963-02-18
1373,02N.02E.31.333,34.36297222,-106.7784444,3/1/1963,4973.61,1963-03-01
1374,03S.01E.04.314,34.07701082,-106.8505804,3/1/1963,4556.58,1963-03-01
1375,05N.01W.20.222,34.652,-106.958,3/24/1963,4849.41,1963-03-24
1376,16N.08E.12.21444,35.63530934,-106.0405781,3/30/1963,6163.4,1963-03-30
1377,02S.04W.22.434,34.11867499,-107.2394806,5/1/1963,6385.93,1963-05-01
1378,JL-49-04-422,31.95565776,-106.6066584,5/13/1963,3757.0,1963-05-13
1379,15N.08E.34.220,35.49170238,-106.0741884,5/18/1963,6096.38,1963-05-18
1380,16N.09E.06.22314,35.65086451,-106.0219669,5/30/1963,6301.97,1963-05-30
1381,JL-49-05-903,31.914723,-106.395556,6/27/1963,3664.87,1963-06-27
1382,12N.03E.31.132,35.22781965,-106.6711383,7/1/1963,4974.75,1963-07-01
1383,13S.04W.13.143,33.18007216,-107.2080854,7/1/1963,4483.44,1963-07-01
1384,JL-49-05-505,31.942778,-106.450278,8/27/1963,3691.67,1963-08-27
1385,JL-49-05-506,31.956667,-106.443056,8/29/1963,3696.99,1963-08-29
1386,22N.08E.35.110,36.10141131,-106.0703009,9/5/1963,5641.16,1963-09-05
1387,JL-49-05-209,31.971389,-106.443334,9/13/1963,3693.71,1963-09-13
1388,12S.04W.03.220,33.30146056,-107.2322558,10/1/1963,4398.33,1963-10-01
1389,11N.02E.02.343,35.20420911,-106.7050277,10/5/1963,5021.54,1963-10-05
1390,15S.06W.16.120,33.01034947,-107.4653061,10/22/1963,4743.97,1963-10-22
1391,JL-49-06-402,31.95677034,-106.3741522,10/30/1963,3695.3,1963-10-30
1392,14S.05W.25.121,33.06868222,-107.3108609,11/6/1963,4286.43,1963-11-06
1393,06S.01E.09.111,33.80725,-106.8512222,11/15/1963,4502.72,1963-11-15
1394,24N.09E.06.334,36.33613171,-106.0339099,11/27/1963,6306.59,1963-11-27
1395,22N.09E.08.444,36.14613396,-106.0014107,11/30/1963,5718.79,1963-11-30
1396,MBOWN-53 - 23S.02E.29.243A (NMSU-2),32.28037235,-106.7536139,12/1/1963,3854.83,1963-12-01
1397,JL-49-05-503,31.94232588,-106.4238757,12/6/1963,3674.76,1963-12-06
1398,22N.09E.17.210,36.14335613,-106.0072441,12/12/1963,5724.19,1963-12-12
1399,10N.02E.29.141,35.07136111,-106.7563889,1/17/1964,4888.57,1964-01-17
1400,12N.03E.31.134,35.22615303,-106.6719717,1/22/1964,4995.71,1964-01-22
1401,22N.08E.35.133,36.09668912,-106.071412,1/24/1964,5663.59,1964-01-24
1402,07N.04E.28.133,34.80616633,-106.5339106,2/5/1964,5431.67,1964-02-05
1403,25N.08E.24.222,36.39168644,-106.038076,2/18/1964,6499.58,1964-02-18
1404,16N.08E.13.444,35.61,-106.0361111,2/19/1964,6161.68,1964-02-19
1405,21N.08E.14.134,36.05363392,-106.0691899,3/13/1964,5598.56,1964-03-13
1406,JL-49-13-810,31.781389,-106.425833,3/30/1964,3657.23,1964-03-30
1407,16S.05W.25.442,32.88257297,-107.3005795,4/3/1964,4150.07,1964-04-03
1408,23S.02E.29.243,32.28065012,-106.7541695,4/14/1964,3853.39,1964-04-14
1409,04S.01E.12.440,33.97117723,-106.786132,5/20/1964,4871.52,1964-05-20
1410,14S.05W.16.212,33.09868248,-107.3555847,5/28/1964,4450.83,1964-05-28
1411,14S.05W.15.434,33.08534905,-107.3386396,5/28/1964,4369.03,1964-05-28
1412,JL-49-04-427,31.950834,-106.612501,6/17/1964,3740.15,1964-06-17
1413,23N.10E.28.420,36.19613449,-105.8766854,6/18/1964,6033.34,1964-06-18
1414,23N.09E.23.240,36.21335616,-105.9477981,6/29/1964,5884.0,1964-06-29
1415,09N.03E.22.311,34.99310504,-106.6216908,7/3/1964,4910.84,1964-07-03
1416,JL-49-04-116,31.96593519,-106.6177699,7/13/1964,3756.45,1964-07-13
1417,14S.05W.16.110,33.0972936,-107.3655848,8/6/1964,4516.1,1964-08-06
1418,04S.01E.20.313,33.94441667,-106.8689444,8/15/1964,4542.85,1964-08-15
1419,JL-49-04-404,31.938611,-106.618611,8/24/1964,3747.55,1964-08-24
1420,14S.05W.15.430,33.08673795,-107.3400286,9/2/1964,4373.95,1964-09-02
1421,14S.05W.23.110,33.08257124,-107.3314172,9/2/1964,4358.02,1964-09-02
1422,04S.01E.07.111,33.9828437,-106.8864154,9/4/1964,4518.04,1964-09-04
1423,JL-49-04-110,31.97204611,-106.6191589,9/17/1964,3754.28,1964-09-17
1424,JL-49-13-301,31.87010585,-106.4155417,10/16/1964,3658.29,1964-10-16
1425,JL-49-04-426,31.9478802,-106.6124917,10/21/1964,3767.2,1964-10-21
1426,JL-49-04-423,31.95232453,-106.6069361,10/21/1964,3766.52,1964-10-21
1427,JL-49-04-424,31.94788022,-106.606936,10/21/1964,3764.36,1964-10-21
1428,JL-49-04-428,31.92149214,-106.6044356,10/21/1964,3760.73,1964-10-21
1429,JL-49-04-425,31.94788022,-106.606936,10/21/1964,3743.15,1964-10-21
1430,09N.02E.35.333,34.95788889,-106.70875,11/4/1964,4891.58,1964-11-04
1431,JL-48-51-601,31.172222,-105.660556,11/13/1964,3579.87,1964-11-13
1432,26S.03E.25.411,32.01648942,-106.5905476,12/8/1964,3793.56,1964-12-08
1433,20N.09E.30.4241,35.93280259,-106.0197449,12/18/1964,5797.75,1964-12-18
1434,04S.01W.13.244,33.96312147,-106.8878043,12/25/1964,4518.95,1964-12-25
1435,JL-49-13-701,31.752501,-106.489167,12/30/1964,3667.49,1964-12-30
1436,16N.06E.31.444,35.56753249,-106.338359,1/1/1965,5201.74,1965-01-01
1437,MBOWN-40 - 23S.02E.07.122 (LC-11),32.33009306,-106.7761153,1/1/1965,3871.06,1965-01-01
1438,MBOWN-13 - 22S.02E.31.444 (LC-23),32.34592602,-106.7700041,1/1/1965,3850.52,1965-01-01
1439,MBOWN-43 - 23S.02E.16.314 (LC-24),32.3053717,-106.7483363,1/1/1965,3838.26,1965-01-01
1440,23N.10E.19.312,36.21141187,-105.9236309,1/22/1965,5854.15,1965-01-22
1441,MBOWN-348 23S.02E.21.444 (NMSU-4),32.28870546,-106.73528,1/22/1965,3833.04,1965-01-22
1442,03S.01W.01.221,34.08506627,-106.8911382,3/1/1965,4590.52,1965-03-01
1443,JL-49-06-104,31.971667,-106.374444,3/9/1965,3697.39,1965-03-09
1444,JL-49-06-101,31.971389,-106.358334,3/16/1965,3703.9,1965-03-16
1445,24N.07E.11.433,36.32168577,-106.1622463,4/1/1965,6664.63,1965-04-01
1446,13S.04W.26.340,33.14507179,-107.225029,4/7/1965,4247.22,1965-04-07
1447,10N.04E.04.221,35.12976792,-106.5191899,4/13/1965,4970.38,1965-04-13
1448,23N.07E.30.322,36.19557507,-106.2358593,4/22/1965,5842.61,1965-04-22
1449,22S.02E.29.424,32.3634257,-106.7511149,4/23/1965,3862.95,1965-04-23
1450,JL-49-05-308,31.985834,-106.392222,4/28/1965,3698.01,1965-04-28
1451,22S.01E.23.112,32.38592456,-106.8172284,5/13/1965,3919.92,1965-05-13
1452,25S.02E.01.132,32.16537484,-106.6969427,5/13/1965,3822.78,1965-05-13
1453,19S.03W.08.414+DUP,32.66785697,-107.1669637,5/25/1965,4048.31,1965-05-25
1454,22S.03E.02.214,32.42870184,-106.6116656,5/26/1965,4764.95,1965-05-26
1455,18S.04W.08.422,32.75785268,-107.2653,5/26/1965,4097.32,1965-05-26
1456,14S.05W.09.341,33.10173806,-107.3619738,6/2/1965,4465.87,1965-06-02
1457,09N.01E.10.422,35.02002778,-106.8177222,6/4/1965,4906.45,1965-06-04
1458,25S.02E.22.242,32.12232018,-106.7186091,6/4/1965,3812.24,1965-06-04
1459,23S.02E.32.212,32.2703726,-106.7563917,6/9/1965,3815.35,1965-06-09
1460,05S.01E.01.220,33.90978844,-106.7852984,6/20/1965,4632.03,1965-06-20
1461,12N.02E.25.421+DUP,35.23944444,-106.6783333,6/28/1965,4997.02,1965-06-28
1462,04S.01E.01.440,33.98478832,-106.7855765,7/17/1965,4930.29,1965-07-17
1463,24N.07E.04.210,36.3475184,-106.1969691,7/19/1965,6921.69,1965-07-19
1464,22N.08E.25.410,36.10835597,-106.043356,7/21/1965,5689.31,1965-07-21
1465,JL-49-05-306,31.983055,-106.400278,7/23/1965,3685.29,1965-07-23
1466,17N.09E.08.440,35.71308506,-106.0030781,8/1/1965,6319.66,1965-08-01
1467,22N.08E.35.420,36.09446705,-106.0569673,9/8/1965,5659.08,1965-09-08
1468,JL-49-05-305,31.985834,-106.411945,9/23/1965,3705.44,1965-09-23
1469,JL-49-13-703,31.761667,-106.47,10/18/1965,3658.01,1965-10-18
1470,JL-49-13-706,31.759723,-106.467778,10/19/1965,3647.49,1965-10-19
1471,JL-49-13-705,31.761667,-106.467778,10/25/1965,3652.79,1965-10-25
1472,03S.01W.11.212,34.07034392,-106.9103059,11/1/1965,4584.64,1965-11-01
1473,19S.06W.03.113,32.6898021,-107.4536365,11/5/1965,4525.08,1965-11-05
1474,18S.05W.26.344,32.70841081,-107.3258564,11/5/1965,4202.23,1965-11-05
1475,15S.05W.29.420,32.97423834,-107.3694704,11/15/1965,4389.01,1965-11-15
1476,22N.09E.09.444,36.14724521,-105.981688,11/25/1965,5739.74,1965-11-25
1477,22N.09E.19.433,36.11863385,-106.0264112,12/2/1965,5711.31,1965-12-02
1478,21N.08E.02.221,36.08696709,-106.0583563,12/6/1965,5674.43,1965-12-06
1479,15N.08E.26.444,35.49448008,-106.0547438,12/14/1965,6098.4,1965-12-14
1480,JL-49-06-401,31.95704822,-106.3616519,12/29/1965,3694.3,1965-12-29
1481,12S.04W.32.310,33.22118319,-107.2794774,1/1/1966,4418.6,1966-01-01
1482,USBR RIN9    18S.04W.17.422,32.74118651,-107.266411,1/1/1966,4082.47,1966-01-01
1483,16N.09E.07.21114,35.63808709,-106.0261335,1/11/1966,6152.63,1966-01-11
1484,NA03501127BB,37.25278857,-105.7627963,2/1/1966,7495.46,1966-02-01
1485,19S.06W.03.343,32.67758021,-107.447803,2/2/1966,4490.32,1966-02-02
1486,21N.08E.05.344,36.07557778,-106.1183573,2/9/1966,5659.29,1966-02-09
1487,03S.09W.29.331,34.01228188,-107.8031046,3/1/1966,6786.1,1966-03-01
1488,03S.01W.03.344,34.07201052,-106.9341961,3/1/1966,4731.69,1966-03-01
1489,03S.01W.10.243,34.0633994,-106.9266956,3/1/1966,4647.94,1966-03-01
1490,03S.01E.20.422,34.03451059,-106.8539138,3/1/1966,4637.57,1966-03-01
1491,02S.01E.19.233,34.12338889,-106.8783611,3/1/1966,4610.48,1966-03-01
1492,03S.01E.06.421,34.07701074,-106.8736372,3/1/1966,4584.32,1966-03-01
1493,03S.01E.18.133,34.05006614,-106.8864156,3/1/1966,4577.37,1966-03-01
1494,03S.01W.13.311,34.04867719,-106.9041943,3/1/1966,4576.53,1966-03-01
1495,02S.01E.32.332,34.08895526,-106.8678036,3/1/1966,4576.09,1966-03-01
1496,03S.01E.17.313,34.04645506,-106.8694702,3/1/1966,4569.47,1966-03-01
1497,03S.01E.29.114,34.02478829,-106.8672478,3/1/1966,4568.93,1966-03-01
1498,JL-49-05-906,31.91260489,-106.380541,3/16/1966,3669.58,1966-03-16
1499,06S.01E.04.414,33.81339945,-106.8416902,3/20/1966,4508.78,1966-03-20
1500,17N.09E.17.210,35.7097518,-106.0075226,3/30/1966,6745.03,1966-03-30
1501,03S.03W.23.342,34.03062052,-107.1244789,4/1/1966,6684.4,1966-04-01
1502,03S.03W.13.321,34.04895393,-107.1100343,4/1/1966,6404.98,1966-04-01
1503,23N.10E.29.144,36.19891209,-105.9025193,4/6/1966,6031.75,1966-04-06
1504,15N.08E.06.14221,35.56170023,-106.1333561,4/6/1966,5871.65,1966-04-06
1505,17N.09E.17.420,35.70225203,-106.0030781,4/14/1966,6678.15,1966-04-14
1506,21N.08E.26.440,36.0183565,-106.0561342,4/14/1966,5621.53,1966-04-14
1507,13S.04W.15.340,33.17368297,-107.2414195,4/16/1966,4279.44,1966-04-16
1508,13S.04W.22.331,33.16034948,-107.2466969,5/24/1966,4278.04,1966-05-24
1509,26S.03E.35.141+DUP,32.00482296,-106.6102702,5/26/1966,3763.43,1966-05-26
1510,22N.09E.10.123,36.15863408,-105.9758545,5/31/1966,5702.9,1966-05-31
1511,JL-49-05-608,31.956945,-106.399445,6/2/1966,3666.35,1966-06-02
1512,JL-49-32-703,31.504723,-106.116389,6/7/1966,3591.33,1966-06-07
1513,06S.01E.09.333,33.79589941,-106.8505795,6/13/1966,4510.77,1966-06-13
1514,06S.01E.09.212,33.80951057,-106.8389122,6/28/1966,4498.41,1966-06-28
1515,JL-49-05-807,31.875833,-106.432778,7/1/1966,3656.0,1966-07-01
1516,NA04000724CBB,37.69861284,-106.1566952,8/1/1966,7682.6,1966-08-01
1517,03S.01W.11.211,34.07006614,-106.9119726,8/1/1966,4571.52,1966-08-01
1518,15S.05W.29.422,32.97423833,-107.3678037,8/12/1966,4366.04,1966-08-12
1519,15S.05W.34.222,32.96784932,-107.3333586,8/15/1966,4270.38,1966-08-15
1520,NA04200821AAA,37.8775002,-106.0922461,8/19/1966,7587.31,1966-08-19
1521,16N.09E.07.21111,35.63836485,-106.026689,8/22/1966,6175.9,1966-08-22
1522,15S.05W.30.121,32.98146059,-107.396971,8/30/1966,4468.7,1966-08-30
1523,04S.01E.02.440,33.98534385,-106.8027997,9/2/1966,4913.28,1966-09-02
1524,NA04100705BBB RG20,37.83611261,-106.2391964,9/13/1966,7652.71,1966-09-13
1525,28S.03E.34.331+DUP,31.82399497,-106.6324905,9/13/1966,3755.88,1966-09-13
1526,JL-49-07-401,31.955001,-106.248611,9/28/1966,3702.64,1966-09-28
1527,15S.05W.23.231,32.99257097,-107.3244697,11/1/1966,4199.32,1966-11-01
1528,15S.05W.30.140,32.97729401,-107.3958599,11/15/1966,4582.62,1966-11-15
1529,15S.06W.24.410,32.98812719,-107.4091935,11/15/1966,4525.51,1966-11-15
1530,15S.05W.30.123,32.98034951,-107.3975266,11/15/1966,4466.31,1966-11-15
1531,15S.05W.22.210,32.99534879,-107.3400256,11/16/1966,4333.56,1966-11-16
1532,15S.05W.12.330,33.01479305,-107.3139145,11/16/1966,4235.54,1966-11-16
1533,16S.05W.01.112,32.95229392,-107.3130803,11/16/1966,4210.78,1966-11-16
1534,15S.05W.23.230,32.99229318,-107.3225252,11/17/1966,4277.9,1966-11-17
1535,16S.05W.12.110,32.93618314,-107.3139135,11/17/1966,4174.94,1966-11-17
1536,10S.03W.05.410,33.46895834,-107.1661434,12/1/1966,4446.94,1966-12-01
1537,JL-49-14-406,31.797778,-106.360834,12/13/1966,3649.04,1966-12-13
1538,17N.09E.06.223,35.73780649,-106.0214119,12/23/1966,6216.43,1966-12-23
1539,JL-49-40-404,31.452501,-106.088611,12/28/1966,3572.16,1966-12-28
1540,17N.09E.21.4344,35.68253041,-105.9958556,1/1/1967,6478.97,1967-01-01
1541,NA03401028DDD,37.13667939,-105.8814086,1/3/1967,7734.62,1967-01-03
1542,NA03700701AAA,37.48167076,-106.1533625,1/3/1967,7658.81,1967-01-03
1543,NA03800822BAA,37.52500324,-106.0872494,1/3/1967,7614.3,1967-01-03
1544,NA03800928AAD,37.50583651,-105.9872466,1/3/1967,7580.1,1967-01-03
1545,NA03801106BCC,37.56000319,-105.8289094,1/3/1967,7537.02,1967-01-03
1546,NA03701119CCC,37.43056157,-105.8194647,1/3/1967,7522.57,1967-01-03
1547,NA03501121AAD,37.26612155,-105.7664075,1/3/1967,7505.34,1967-01-03
1548,NA04500920CAB,38.13527721,-106.0077941,1/4/1967,7846.63,1967-01-04
1549,NA04401006BBB1,38.10083255,-105.9239034,1/4/1967,7623.82,1967-01-04
1550,NA04300816DDD,37.96722218,-106.0908555,1/4/1967,7583.12,1967-01-04
1551,NA04101013ABD (SLV),37.80633288,-105.8243796,1/4/1967,7529.8,1967-01-04
1552,NA04000818CBB,37.70750156,-106.1489171,1/5/1967,7676.86,1967-01-05
1553,NA04100831CCC3,37.74583447,-106.1480836,1/5/1967,7663.58,1967-01-05
1554,NA04000904CCC,37.7299999,-106.0039127,1/5/1967,7591.64,1967-01-05
1555,NA03900903DDD,37.64777893,-105.9664122,1/5/1967,7582.08,1967-01-05
1556,NA04001108AAA,37.72666682,-105.7905748,1/5/1967,7532.37,1967-01-05
1557,05S.01E.16.400,33.87201053,-106.8389124,1/10/1967,4516.4,1967-01-10
1558,21N.08E.08.320,36.0653001,-106.1191907,2/23/1967,5658.27,1967-02-23
1559,04S.01E.07.224,33.98117706,-106.870859,3/3/1967,4528.86,1967-03-03
1560,23N.08E.25.130,36.19918856,-106.0522448,3/18/1967,5955.17,1967-03-18
1561,14S.05W.01.220,33.12729366,-107.3011407,3/21/1967,4310.56,1967-03-21
1562,14S.04W.06.110,33.12646031,-107.295585,3/21/1967,4261.41,1967-03-21
1563,JL-49-13-824,31.754723,-106.421111,3/30/1967,3679.44,1967-03-30
1564,CB00207212ADC,37.1544613,-105.3925111,3/31/1967,8100.11,1967-03-31
1565,CC03007324DDD,37.41745285,-105.4885677,3/31/1967,7765.54,1967-03-31
1566,CB00307323CDB DUP1,37.20473638,-105.5344576,3/31/1967,7749.07,1967-03-31
1567,NA03801124CCC,37.51889342,-105.7294626,3/31/1967,7517.49,1967-03-31
1568,NA04301036DDD,37.91999929,-105.8244602,4/6/1967,7538.74,1967-04-06
1569,17N.09E.32.24134,35.65419782,-106.0044667,4/17/1967,6526.56,1967-04-17
1570,MBOWN-49 - 23S.02E.28.314 (NMSU-8),32.27648358,-106.7461136,5/6/1967,3850.68,1967-05-06
1571,22N.08E.35.444,36.0894671,-106.0555784,5/12/1967,5667.78,1967-05-12
1572,06S.01E.08.223,33.80756606,-106.8547465,5/26/1967,4501.69,1967-05-26
1573,JL-49-32-704,31.505278,-106.1225,5/31/1967,3575.63,1967-05-31
1574,20N.09E.07.1414,35.98113493,-106.0300227,6/2/1967,5718.07,1967-06-02
1575,04S.01E.07.340,33.9717326,-106.8825263,6/15/1967,4533.08,1967-06-15
1576,JL-49-32-705,31.504167,-106.116112,6/22/1967,3588.83,1967-06-22
1577,NA03700833AAC,37.40778295,-106.1000275,6/23/1967,7686.86,1967-06-23
1578,NA03700830CCC USGS 372450106085001,37.41389396,-106.1478067,6/23/1967,7673.52,1967-06-23
1579,NA03700830CCC USGS 372512106082201,37.42000498,-106.1400287,6/23/1967,7639.01,1967-06-23
1580,20N.08E.02.330,35.98863456,-106.0694678,6/28/1967,5582.7,1967-06-28
1581,02S.04W.26.230,34.10867515,-107.2242026,7/1/1967,6582.22,1967-07-01
1582,03S.03W.10.422,34.06395375,-107.1328124,7/1/1967,6561.63,1967-07-01
1583,03S.03W.23.221,34.04145388,-107.1186455,7/1/1967,6529.43,1967-07-01
1584,03S.03W.13.331,34.04478724,-107.1136454,7/1/1967,6441.39,1967-07-01
1585,03S.03W.11.313,34.06117599,-107.1308679,7/1/1967,6215.58,1967-07-01
1586,NA03300904BBA,37.13737228,-105.9973001,7/3/1967,7803.52,1967-07-03
1587,NA03800818BBB,37.54472554,-106.1480844,7/3/1967,7654.19,1967-07-03
1588,NA03500934DCC,37.22612055,-105.9728009,7/3/1967,7642.9,1967-07-03
1589,NA03701216DDA,37.43084037,-105.6605719,7/3/1967,7594.54,1967-07-03
1590,NA03801227BBA,37.50417187,-105.6572384,7/3/1967,7566.47,1967-07-03
1591,NA03801018BBC,37.5358364,-105.9297451,7/3/1967,7565.24,1967-07-03
1592,NA03900816AAA,37.62666872,-106.0955825,7/5/1967,7639.95,1967-07-05
1593,NA04000834CCD,37.6622238,-106.0905822,7/5/1967,7637.6,1967-07-05
1594,JL-49-32-706,31.506112,-106.122222,7/11/1967,3585.7,1967-07-11
1595,NA03700713DCC USGS 372630106093001,37.44167135,-106.1589182,7/12/1967,7637.19,1967-07-12
1596,NA03700817ABC,37.45547663,-106.1209448,7/12/1967,7625.11,1967-07-12
1597,NA03700713DCC USGS 372656106085601,37.44889345,-106.1494735,7/12/1967,7608.62,1967-07-12
1598,15S.06W.24.321B,32.98896053,-107.4139159,7/12/1967,4522.96,1967-07-12
1599,15S.05W.23.414,32.98812659,-107.3205807,7/12/1967,4328.88,1967-07-12
1600,NA04100726BCC1,37.77002916,-106.1854733,7/14/1967,7675.74,1967-07-14
1601,NA04100716CBB,37.79444601,-106.2186407,7/14/1967,7675.45,1967-07-14
1602,NA04100720CCD,37.77500182,-106.2339192,7/14/1967,7675.15,1967-07-14
1603,JL-49-21-306,31.74510957,-106.4027627,7/17/1967,3681.52,1967-07-17
1604,JL-49-13-715,31.772222,-106.473055,7/19/1967,3680.52,1967-07-19
1605,17N.09E.21.4114,35.68808586,-105.9900222,7/20/1967,6517.01,1967-07-20
1606,02S.04W.24.211,34.12784189,-107.208647,8/1/1967,6278.42,1967-08-01
1607,21N.09E.14.331,36.04807927,-105.9636324,8/1/1967,6259.34,1967-08-01
1608,21N.09E.12.314,36.06419047,-105.9427986,8/1/1967,6228.49,1967-08-01
1609,03S.03W.01.212,34.08552778,-107.1035,8/1/1967,5719.12,1967-08-01
1610,02S.02W.18.321,34.13562068,-107.0925344,8/1/1967,5714.73,1967-08-01
1611,02S.03W.17.142,34.13895325,-107.1772577,8/1/1967,5709.84,1967-08-01
1612,02S.03W.01.312,34.16367604,-107.1114236,8/1/1967,5708.3,1967-08-01
1613,02S.03W.11.333,34.14450922,-107.1305905,8/1/1967,5699.07,1967-08-01
1614,16N.08E.01.24142,35.64808676,-106.0386337,8/15/1967,6177.63,1967-08-15
1615,16N.09E.15.223,35.62169882,-105.9902996,8/29/1967,6426.25,1967-08-29
1616,JL-49-14-504,31.81066389,-106.3005384,9/3/1967,3673.39,1967-09-03
1617,JL-49-14-714,31.759723,-106.338056,9/11/1967,3675.21,1967-09-11
1618,06S.01E.08.211,33.81062159,-106.859469,9/22/1967,4503.85,1967-09-22
1619,02S.01E.29.330,34.10117754,-106.8680814,9/23/1967,4575.88,1967-09-23
1620,NA03801215DCC,37.52083823,-105.6519605,10/3/1967,7572.17,1967-10-03
1621,NA03801233CCC,37.48972768,-105.6741834,10/3/1967,7565.09,1967-10-03
1622,NA03701101AAA RG59,37.48778309,-105.7127955,10/3/1967,7542.23,1967-10-03
1623,NA03801220CCC,37.51889361,-105.6919616,10/3/1967,7531.29,1967-10-03
1624,NA03801132CCD,37.48889365,-105.7994644,10/3/1967,7529.23,1967-10-03
1625,NA03801120CCC,37.51805968,-105.8016866,10/3/1967,7528.62,1967-10-03
1626,NA03801121BBB,37.52167082,-105.7858529,10/3/1967,7525.92,1967-10-03
1627,NA03801129DDD,37.50333785,-105.7855752,10/3/1967,7523.55,1967-10-03
1628,NA03801128AAA,37.50694898,-105.7714082,10/3/1967,7521.26,1967-10-03
1629,NA03901102ABB,37.6602794,-105.7352959,10/3/1967,7515.76,1967-10-03
1630,NA04001135DDC,37.66389046,-105.732518,10/3/1967,7511.68,1967-10-03
1631,NA03901210BCD,37.64189132,-105.6532381,10/4/1967,7575.83,1967-10-04
1632,NA03901227ADD,37.58667027,-105.6436268,10/4/1967,7549.91,1967-10-04
1633,NA03801108CCC,37.53833706,-105.8047422,10/4/1967,7531.26,1967-10-04
1634,NA03901132CCC,37.57583635,-105.8022421,10/4/1967,7528.86,1967-10-04
1635,NA03801103CCC,37.55278142,-105.7677969,10/4/1967,7528.57,1967-10-04
1636,NA03801209BAB,37.56055956,-105.6689053,10/4/1967,7525.79,1967-10-04
1637,NA03801116AAA,37.5450038,-105.7680747,10/4/1967,7525.03,1967-10-04
1638,NA03901228BCC,37.59028113,-105.67835,10/4/1967,7524.72,1967-10-04
1639,NA03901120AAA,37.61805783,-105.7858527,10/4/1967,7521.41,1967-10-04
1640,NA03901207CDC,37.63761336,-105.7056006,10/4/1967,7520.79,1967-10-04
1641,NA03901129DDD,37.58055855,-105.7880751,10/4/1967,7519.89,1967-10-04
1642,NA03801110DDD,37.53750403,-105.7533521,10/4/1967,7516.22,1967-10-04
1643,NA03901134ABB,37.58889186,-105.7577966,10/4/1967,7514.38,1967-10-04
1644,NA03801101CCB,37.55555932,-105.7339071,10/4/1967,7513.82,1967-10-04
1645,NA03801113DDD,37.53361543,-105.7127955,10/4/1967,7513.24,1967-10-04
1646,NA03901135ADC1,37.58389207,-105.7341849,10/4/1967,7507.3,1967-10-04
1647,NA03801218BBB,37.53667091,-105.7144622,10/4/1967,7505.52,1967-10-04
1648,NA03801206AAA,37.57500358,-105.693906,10/4/1967,7503.38,1967-10-04
1649,02S.01E.19.120,34.12728871,-106.8814156,10/5/1967,4610.97,1967-10-05
1650,NA044008190BB,38.05000001,-106.1339116,10/10/1967,7630.26,1967-10-10
1651,NA04200703CCC,37.90833415,-106.200583,10/10/1967,7627.73,1967-10-10
1652,NA04101031CCC,37.74911075,-105.927911,10/10/1967,7567.93,1967-10-10
1653,NA04301126DCC,37.93611035,-105.7311243,10/12/1967,7638.66,1967-10-12
1654,JL-49-14-709,31.7875,-106.371944,10/17/1967,3625.15,1967-10-17
1655,NA03901117BBB,37.63397413,-105.8013808,10/31/1967,7528.77,1967-10-31
1656,18N.09E.25.11332,35.7655842,-105.9458551,10/31/1967,6660.61,1967-10-31
1657,18N.10E.19.2321,35.77947307,-105.9172434,11/1/1967,6938.2,1967-11-01
1658,18N.10E.18.13112,35.79388889,-105.9275,11/1/1967,6726.62,1967-11-01
1659,19N.09E.29.2113,35.8539153,-106.0091893,11/3/1967,5962.15,1967-11-03
1660,20N.09E.32.31233,35.91919177,-106.015856,11/3/1967,5835.01,1967-11-03
1661,19N.09E.29.3413,35.84308215,-106.0130783,11/6/1967,6068.61,1967-11-06
1662,19N.09E.28.1413,35.85058213,-105.9947447,11/7/1967,6051.23,1967-11-07
1663,21N.08E.34.14423,36.00835643,-106.0819679,11/7/1967,5452.17,1967-11-07
1664,19N.08E.11.1441,35.89419198,-106.0647456,11/8/1967,5701.34,1967-11-08
1665,19N.08E.14.1424,35.88030336,-106.0636345,11/8/1967,5669.7,1967-11-08
1666,18N.10E.06.1142,35.82447215,-105.925299,11/9/1967,6688.18,1967-11-09
1667,18N.10E.06.12113,35.82586103,-105.9241878,11/10/1967,6705.57,1967-11-10
1668,18N.10E.06.24312,35.82141675,-105.9144654,11/13/1967,6860.45,1967-11-13
1669,18N.10E.06.2444,35.81947237,-105.9116876,11/13/1967,6834.88,1967-11-13
1670,18N.09E.27.431,35.75752857,-105.9730778,11/14/1967,6626.53,1967-11-14
1671,19N.09E.25.432,35.84391614,-105.9350213,11/20/1967,6344.6,1967-11-20
1672,18N.08E.07.213,35.81030432,-106.1325246,11/20/1967,5720.96,1967-11-20
1673,18N.08E.24.3144 WINDMILL,35.7730833,-106.0497457,11/21/1967,6109.33,1967-11-21
1674,JL-49-13-617,31.794167,-106.381667,11/21/1967,3627.16,1967-11-21
1675,CC03207317DDD,37.25001233,-105.5672367,12/1/1967,7642.43,1967-12-01
1676,05N.01E.13.33,34.65478126,-106.796972,12/1/1967,4772.37,1967-12-01
1677,JL-49-04-901,31.914167,-106.516389,12/1/1967,4053.87,1967-12-01
1678,20S.02E.28.334,32.53397663,-106.7472279,12/8/1967,4063.98,1967-12-08
1679,17N.09E.28.32441,35.67225294,-105.9927999,12/12/1967,6519.46,1967-12-12
1680,22S.03E.07.444,32.40286912,-106.6666675,12/22/1967,4104.62,1967-12-22
1681,19S.02E.33.123,32.61536318,-106.744451,12/26/1967,4061.66,1967-12-26
1682,19S.01E.16.244,32.65869444,-106.8388989,12/28/1967,4063.43,1967-12-28
1683,20S.01E.04.121,32.60480706,-106.8477875,12/28/1967,4047.83,1967-12-28
1684,27S.03E.07.2311,31.97704576,-106.6741603,12/28/1967,3782.56,1967-12-28
1685,19S.03E.19.120,32.64702927,-106.6744489,12/29/1967,4282.18,1967-12-29
1686,19S.02E.02.210,32.69063901,-106.7050062,12/29/1967,4146.86,1967-12-29
1687,20S.01W.23.300,32.55119693,-106.9177891,12/30/1967,4017.98,1967-12-30
1688,10N.03E.13.222 CHW 2,35.101713,-106.5703018,1/1/1968,4945.69,1968-01-01
1689,10N.03E.12.232,35.11115712,-106.5744686,1/1/1968,4945.07,1968-01-01
1690,10N.04E.18.211 CHW 4,35.10060197,-106.5594682,1/1/1968,4940.0,1968-01-01
1691,CB00107335BAB,37.00835432,-105.5352878,1/12/1968,7662.87,1968-01-12
1692,CB00107425AAA DUP2,37.02085291,-105.6186232,1/12/1968,7489.28,1968-01-12
1693,CB00207524AAC,37.12501505,-105.7277938,1/12/1968,7319.3,1968-01-12
1694,NA04000623DCC,37.69041938,-106.2866437,1/15/1968,7802.34,1968-01-15
1695,NA04000730BCC,37.68055829,-106.2547538,1/15/1968,7763.23,1968-01-15
1696,NA03900705ABB,37.65555832,-106.2297531,1/15/1968,7732.74,1968-01-15
1697,NA04000728BCC1,37.68055801,-106.2186415,1/15/1968,7728.07,1968-01-15
1698,NA04000716CCC,37.7041689,-106.2186414,1/15/1968,7725.11,1968-01-15
1699,NA04000705DCC,37.73194653,-106.2297528,1/15/1968,7720.95,1968-01-15
1700,NA04000726BCB,37.68333546,-106.1839183,1/15/1968,7698.35,1968-01-15
1701,NA04000714CCB,37.70694633,-106.1839182,1/15/1968,7695.32,1968-01-15
1702,NA04000703CCC,37.73333512,-106.2005852,1/15/1968,7694.8,1968-01-15
1703,NA04000712ACC1,37.72361258,-106.1575284,1/15/1968,7674.1,1968-01-15
1704,NA03800711CBD,37.54583683,-106.1825299,1/15/1968,7666.67,1968-01-15
1705,NA04000807DCC1,37.71666804,-106.1394724,1/15/1968,7661.56,1968-01-15
1706,NA03600918CCC1,37.3533396,-106.0380811,1/15/1968,7644.54,1968-01-15
1707,NA03800805BAB,37.56722517,-106.1261392,1/15/1968,7640.86,1968-01-15
1708,NA03800802CBB2,37.56555823,-106.0762211,1/15/1968,7617.6,1968-01-15
1709,NA03900812CBB2,37.633335,-106.0547479,1/15/1968,7616.73,1968-01-15
1710,NA03800811CCC,37.54166964,-106.0755823,1/15/1968,7615.59,1968-01-15
1711,NA03800813BBB2,37.5388918,-106.0561373,1/15/1968,7605.51,1968-01-15
1712,NA03700812BCC1,37.46111528,-106.0589152,1/15/1968,7603.43,1968-01-15
1713,NA04001031CBB,37.66111216,-105.930578,1/15/1968,7567.52,1968-01-15
1714,NA04001008BCB,37.72222232,-105.9089106,1/15/1968,7556.53,1968-01-15
1715,NA04001035DCC,37.66361234,-105.8447428,1/15/1968,7542.47,1968-01-15
1716,NA04001024BBB,37.69722285,-105.8408537,1/15/1968,7541.51,1968-01-15
1717,NA03701004DDC,37.4755601,-105.8783551,1/15/1968,7538.82,1968-01-15
1718,NA04001133DDD,37.66341811,-105.7635743,1/15/1968,7523.46,1968-01-15
1719,CC03107208ABC,37.35501021,-105.4672346,1/16/1968,7803.44,1968-01-16
1720,NA03500816ABB,37.28195174,-106.1025273,1/16/1968,7778.81,1968-01-16
1721,CC03007311ADD1,37.45503506,-105.5058734,1/16/1968,7764.64,1968-01-16
1722,NA03400923CCC,37.16251098,-105.9672443,1/16/1968,7725.36,1968-01-16
1723,NA04301111DBA,37.98333245,-105.7255675,1/16/1968,7683.88,1968-01-16
1724,CC03107306ACC,37.36667577,-105.592237,1/16/1968,7671.75,1968-01-16
1725,NA03600803DAC,37.38750554,-106.079749,1/16/1968,7668.54,1968-01-16
1726,NA04301114DDA,37.96666585,-105.72279,1/16/1968,7668.01,1968-01-16
1727,NA04100711DCC,37.80555666,-106.1741947,1/16/1968,7655.91,1968-01-16
1728,CB00207303BAA,37.16612642,-105.5561241,1/16/1968,7645.87,1968-01-16
1729,CC03207304CAD,37.291678,-105.5530696,1/16/1968,7644.04,1968-01-16
1730,NA04100818CCC1,37.79111203,-106.1464162,1/16/1968,7643.54,1968-01-16
1731,NA04301109BCC,37.98611015,-105.7741797,1/16/1968,7627.69,1968-01-16
1732,NA04100805CCC1,37.81888957,-106.131693,1/16/1968,7626.16,1968-01-16
1733,NA04400905AAA,38.09999942,-105.9961275,1/16/1968,7621.1,1968-01-16
1734,CB00207305DDA,37.16251524,-105.5769578,1/16/1968,7618.42,1968-01-16
1735,NA04100826BCC2,37.76666697,-106.0741921,1/16/1968,7614.02,1968-01-16
1736,CC03107422DDA,37.32362099,-105.6433493,1/16/1968,7583.98,1968-01-16
1737,NA04100908CCC,37.80416639,-106.0178006,1/16/1968,7578.45,1968-01-16
1738,CB00207316BAA,37.13751614,-105.5722351,1/16/1968,7574.51,1968-01-16
1739,NA04200813CCC,37.87638882,-106.0547448,1/16/1968,7573.21,1968-01-16
1740,NA04200801AAD,37.91944419,-106.036132,1/16/1968,7558.26,1968-01-16
1741,CC03207404AAA,37.29945486,-105.6561274,1/16/1968,7552.21,1968-01-16
1742,NA04300920DDD,37.95194396,-105.9991854,1/16/1968,7551.25,1968-01-16
1743,CC03107512DAA,37.35278649,-105.7089064,1/16/1968,7550.0,1968-01-16
1744,CC03107431DAA,37.29723244,-105.6927948,1/16/1968,7548.17,1968-01-16
1745,NA04200925DDD,37.84583285,-105.9311309,1/16/1968,7547.1,1968-01-16
1746,NA04201001BAB,37.91666597,-105.8297381,1/16/1968,7540.14,1968-01-16
1747,18S.02W.36.322,32.6992473,-107.0016821,1/30/1968,4016.12,1968-01-30
1748,24S.01W.22.123+DUP2,32.21092808,-106.9341745,2/3/1968,3889.8,1968-02-03
1749,MBOWN-57 - 24S.01W.22.121,32.21092808,-106.9336189,2/3/1968,3888.1,1968-02-03
1750,13S.04W.22.424,33.16201629,-107.2319743,2/4/1968,4230.93,1968-02-04
1751,JL-49-13-710,31.751667,-106.492222,2/8/1968,3664.6,1968-02-08
1752,16N.09E.08.24324,35.63253176,-106.0033554,2/10/1968,6500.68,1968-02-10
1753,JL-49-13-711,31.752501,-106.481111,2/15/1968,3664.63,1968-02-15
1754,JL-49-21-304,31.73816544,-106.3797065,3/21/1968,3674.63,1968-03-21
1755,JL-49-21-101,31.74955341,-106.4897092,3/26/1968,3681.74,1968-03-26
1756,JL-49-22-501,31.69983344,-106.3263713,4/10/1968,3663.94,1968-04-10
1757,29S.01E.08.210,31.80343835,-106.8583311,4/11/1968,3794.1,1968-04-11
1758,24S.01W.25.422,32.19120662,-106.8883392,4/12/1968,3847.55,1968-04-12
1759,NA03601006BBB,37.40000537,-105.9991911,4/25/1968,7578.67,1968-04-25
1760,JL-49-22-108,31.7164994,-106.3724838,5/2/1968,3668.9,1968-05-02
1761,JL-49-22-601,31.68288976,-106.2727587,5/2/1968,3661.2,1968-05-02
1762,24N.07E.03.331,36.33779637,-106.1889134,5/4/1968,6840.66,1968-05-04
1763,16N.08E.12.23422,35.63253164,-106.0408558,5/11/1968,6164.42,1968-05-11
1764,MBOWN-93 - 25S.02W.05.133,32.16398348,-107.0747339,5/11/1968,4309.81,1968-05-11
1765,25S.02W.16.210,32.13926201,-107.0477885,5/11/1968,3847.04,1968-05-11
1766,25S.01W.16.331,32.12704077,-106.9550076,5/11/1968,3829.81,1968-05-11
1767,16N.09E.07.43131,35.62642075,-106.0269667,5/18/1968,6151.68,1968-05-18
1768,18S.02W.11.440,32.75230109,-107.0122385,5/18/1968,4043.11,1968-05-18
1769,20S.01W.10.424,32.58064044,-106.9241785,5/18/1968,4026.77,1968-05-18
1770,21S.01W.13.230,32.48397686,-106.8944542,5/18/1968,3958.87,1968-05-18
1771,22N.09E.03.144,36.16946736,-105.9736322,5/31/1968,5736.06,1968-05-31
1772,CC03207222CBA,37.25001314,-105.4269578,6/7/1968,7991.29,1968-06-07
1773,JL-49-30-303,31.5865034,-106.2869243,6/7/1968,3634.8,1968-06-07
1774,27S.01E.33.330,31.91260209,-106.8502771,6/8/1968,3844.63,1968-06-08
1775,20S.03W.04.320,32.59647074,-107.1575184,6/20/1968,4701.24,1968-06-20
1776,19S.03W.32.200,32.61619215,-107.1666855,6/20/1968,4492.29,1968-06-20
1777,18N.10E.07.2412+DUP,35.80836145,-105.9136321,6/21/1968,6781.26,1968-06-21
1778,MBOWN-121 - 26S.01E.35.332,31.99787773,-106.8188882,6/25/1968,3805.19,1968-06-25
1779,22N.09E.30.111,36.11724487,-106.0361336,8/1/1968,5691.53,1968-08-01
1780,20N.09E.09.111,35.98530168,-106.0000222,8/27/1968,5862.23,1968-08-27
1781,20N.09E.19.4244,35.94696899,-106.0191893,8/27/1968,5744.22,1968-08-27
1782,20N.09E.18.143,35.9653019,-106.0303005,8/27/1968,5711.52,1968-08-27
1783,21N.09E.35.212,36.01585736,-105.9516878,8/28/1968,6015.44,1968-08-28
1784,21N.09E.34.433,36.00280167,-105.9727994,8/28/1968,5910.3,1968-08-28
1785,17N.09E.03.1111,35.74002891,-105.9825224,9/1/1968,6440.49,1968-09-01
1786,21N.09E.35.123,36.01363508,-105.9589102,9/3/1968,6014.68,1968-09-03
1787,20N.09E.04.213,35.99780155,-105.9894664,9/3/1968,5839.97,1968-09-03
1788,20N.08E.11.221,35.98613468,-106.0575231,9/3/1968,5615.5,1968-09-03
1789,21N.08E.35.234,36.01002321,-106.0597453,9/3/1968,5607.85,1968-09-03
1790,20N.09E.05.312,35.99169036,-106.0150225,9/4/1968,5749.31,1968-09-04
1791,20N.09E.06.334,35.9872459,-106.0328005,9/4/1968,5685.55,1968-09-04
1792,21N.08E.23.244,36.03818333,-106.0555194,9/4/1968,5626.06,1968-09-04
1793,20N.09E.18.422,35.96280201,-106.0197448,9/11/1968,5730.2,1968-09-11
1794,21N.08E.14.434,36.04641182,-106.0605786,9/11/1968,5636.15,1968-09-11
1795,11N.02E.28.222 VCL 1,35.16393249,-106.7283612,9/24/1968,4966.73,1968-09-24
1796,17N.09E.33.31112,35.66003101,-105.9994666,9/25/1968,6522.73,1968-09-25
1797,JL-49-15-803,31.780555,-106.169722,9/30/1968,3677.0,1968-09-30
1798,11N.02E.28.422,35.1539328,-106.7283611,10/7/1968,4965.68,1968-10-07
1799,22N.09E.16.221,36.14530076,-105.9844659,10/28/1968,5757.61,1968-10-28
1800,22N.09E.10.130,36.15557852,-105.9786324,10/31/1968,5708.01,1968-10-31
1801,18N.10E.07.2441,35.80641705,-105.9127988,11/1/1968,6788.43,1968-11-01
1802,NA03901135ADC2,37.56694796,-105.7369627,11/21/1968,7513.8,1968-11-21
1803,JL-49-04-465,31.927222,-106.599722,11/30/1968,3762.53,1968-11-30
1804,25S.02E.01.312,32.1628749,-106.6980538,12/31/1968,3825.01,1968-12-31
1805,12N.03E.30.112,35.2465,-106.66925,1/1/1969,4996.37,1969-01-01
1806,10N.03E.35.322+DUP,35.05060337,-106.5958574,1/1/1969,4963.7,1969-01-01
1807,12N.02E.14.344,35.2630961,-106.7011394,1/1/1969,4956.13,1969-01-01
1808,26S.01W.25.414,32.01509906,-106.8947256,1/1/1969,3820.88,1969-01-01
1809,NA04100832DDA,37.75138962,-106.1130825,1/4/1969,7651.71,1969-01-04
1810,NA03900704ACB2,37.65694707,-106.2130859,1/8/1969,7704.0,1969-01-08
1811,NA03700802CDD,37.47361507,-106.0672488,1/17/1969,7629.13,1969-01-17
1812,NA03700801DCC,37.47361501,-106.0478038,1/17/1969,7626.82,1969-01-17
1813,NA03700932ACC2,37.40833851,-106.0103026,1/17/1969,7626.63,1969-01-17
1814,NA03700917CCC2,37.43667125,-106.018914,1/17/1969,7622.91,1969-01-17
1815,NA03700928CCB2,37.41667166,-106.0005801,1/17/1969,7617.9,1969-01-17
1816,NA03700920CCC1,37.42917141,-106.0200251,1/17/1969,7614.79,1969-01-17
1817,NA03700923BCB,37.42500509,-105.9630792,1/17/1969,7612.51,1969-01-17
1818,NA03800922CBC,37.51944745,-105.9825242,1/17/1969,7607.06,1969-01-17
1819,NA03701032CDC2,37.40139496,-105.9033555,1/17/1969,7574.44,1969-01-17
1820,NA03301019CCD USGS 370440105553001,37.07779137,-105.9255754,1/20/1969,7702.1,1969-01-20
1821,NA03200901BBB,37.04945841,-105.9461309,1/20/1969,7699.94,1969-01-20
1822,NA03500803DCB,37.30139596,-106.0825267,1/20/1969,7691.57,1969-01-20
1823,NA03401005CCC,37.19584419,-105.9089101,1/20/1969,7668.09,1969-01-20
1824,NA03400910ACC,37.2041766,-105.9741895,1/20/1969,7665.0,1969-01-20
1825,NA03401004BCC,37.2194549,-105.8908544,1/20/1969,7642.66,1969-01-20
1826,NA04200736CBB,37.84194531,-106.1644715,1/20/1969,7639.25,1969-01-20
1827,NA04300726DCC,37.93750052,-106.1755816,1/20/1969,7630.46,1969-01-20
1828,NA04300736CCD,37.92361162,-106.1630813,1/20/1969,7627.31,1969-01-20
1829,NA04200827BCC,37.85694469,-106.0922465,1/20/1969,7623.67,1969-01-20
1830,NA04200919CCC1   SAG 4,37.8652776,-106.0380777,1/20/1969,7618.26,1969-01-20
1831,NA04300724DAB,37.95694475,-106.1505803,1/20/1969,7616.4,1969-01-20
1832,NA04300818BCC,37.97416686,-106.1422463,1/20/1969,7615.29,1969-01-20
1833,NA04300833DCC,37.92222236,-106.1005789,1/20/1969,7613.49,1969-01-20
1834,NA04200907CCC   SAG 2,37.88611091,-106.0380773,1/20/1969,7610.98,1969-01-20
1835,NA04300803ABB   SAG 3,38.01305537,-106.077243,1/20/1969,7609.42,1969-01-20
1836,NA04401019BBB,38.05555482,-105.9227929,1/20/1969,7608.99,1969-01-20
1837,NA04300815CBB   SAG 13,37.97222217,-106.0894664,1/20/1969,7608.02,1969-01-20
1838,NA04100922BCC,37.78611069,-105.9825223,1/20/1969,7598.92,1969-01-20
1839,NA04300910BAB,37.993055,-105.972795,1/20/1969,7587.06,1969-01-20
1840,NA04001022BBB,37.70416712,-105.8714099,1/20/1969,7584.53,1969-01-20
1841,NA03601034DCC,37.31250845,-105.8644655,1/20/1969,7576.39,1969-01-20
1842,NA03501013CCB,37.2727874,-105.8372425,1/20/1969,7576.07,1969-01-20
1843,NA03501012BBC   CON 2,37.29584242,-105.836687,1/20/1969,7572.95,1969-01-20
1844,NA03601026CCC USGS 371945105511501,37.32917481,-105.8547431,1/20/1969,7571.81,1969-01-20
1845,NA03801027ABA,37.51528159,-105.8616881,1/20/1969,7571.5,1969-01-20
1846,NA03601026CCC USGS 371941105511901,37.32806371,-105.8558542,1/20/1969,7571.18,1969-01-20
1847,NA03701122CCC1   ALA 4,37.43056197,-105.7644634,1/20/1969,7567.32,1969-01-20
1848,NA03801034DDD1,37.48889325,-105.8589102,1/20/1969,7563.96,1969-01-20
1849,NA03701002CCC,37.47361586,-105.8547434,1/20/1969,7562.74,1969-01-20
1850,NA03601134CCC USGS 371845105455001,37.31389817,-105.7644631,1/20/1969,7560.25,1969-01-20
1851,CC03107514ADD,37.34861984,-105.7227956,1/20/1969,7558.01,1969-01-20
1852,NA03701105DCB,37.476394,-105.792242,1/20/1969,7556.95,1969-01-20
1853,NA04200735BCC   SAG 1 (RGWCD CONFINED),37.84305656,-106.1825277,1/21/1969,7642.2,1969-01-21
1854,NA03700811CCC,37.45972645,-106.0755824,1/21/1969,7631.18,1969-01-21
1855,NA04200815ACC   SAG 10,37.88638899,-106.0819678,1/21/1969,7628.03,1969-01-21
1856,NA04200818BCC,37.88611166,-106.1464146,1/21/1969,7627.0,1969-01-21
1857,NA04200807BCC USGS 375405106084501,37.90138937,-106.1441921,1/21/1969,7624.59,1969-01-21
1858,NA04300712ABD1,37.99166684,-106.1533576,1/21/1969,7622.94,1969-01-21
1859,NA03901004DCC2,37.64861218,-105.9922461,1/21/1969,7615.71,1969-01-21
1860,NA04400919BBB,38.05694403,-106.0325183,1/21/1969,7612.15,1969-01-21
1861,NA04100906DCD   SAG 17,37.82111088,-106.0255783,1/21/1969,7604.07,1969-01-21
1862,NA04001033BCB2,37.67083433,-105.889466,1/21/1969,7586.65,1969-01-21
1863,NA03901012BCC,37.64166833,-105.8339093,1/21/1969,7578.8,1969-01-21
1864,NA03801011ACC USGS 373315105504501,37.55416987,-105.8464098,1/21/1969,7573.94,1969-01-21
1865,NA04301020BBB,37.96249934,-105.9047387,1/21/1969,7571.3,1969-01-21
1866,NA03801113BCA,37.5416701,-105.8461321,1/21/1969,7532.9,1969-01-21
1867,NA03801101DAD USGS 373401105500601,37.56694747,-105.8355762,1/21/1969,7514.15,1969-01-21
1868,NA03801205ACD,37.568892,-105.8119645,1/21/1969,7512.13,1969-01-21
1869,NA03700806BBB1,37.48750399,-106.1478068,1/22/1969,7638.24,1969-01-22
1870,NA03800815BBB6,37.54583634,-106.0922494,1/22/1969,7638.2,1969-01-22
1871,NA03700807BCC   RIO 1,37.46805983,-106.1478068,1/22/1969,7635.57,1969-01-22
1872,NA03800828CBB,37.50833689,-106.1116946,1/22/1969,7635.12,1969-01-22
1873,NA03701005BCD,37.48055979,-105.9075225,1/22/1969,7615.08,1969-01-22
1874,NA03700901CCA,37.4750041,-105.9450233,1/22/1969,7608.82,1969-01-22
1875,NA03700901CCB,37.47500408,-105.9478012,1/22/1969,7591.52,1969-01-22
1876,NA03701030CCC3,37.41528335,-105.9269672,1/24/1969,7581.73,1969-01-24
1877,NA04000830BCB,37.6816685,-106.1480839,1/27/1969,7675.38,1969-01-27
1878,NA03900713DDD,37.61944697,-106.1505842,1/27/1969,7669.39,1969-01-27
1879,NA03900819CBB,37.61028039,-106.1478064,1/27/1969,7661.4,1969-01-27
1880,NA04100736AAA,37.76250107,-106.1505835,1/27/1969,7660.42,1969-01-27
1881,CC03107321DDA,37.33112147,-105.5436248,1/27/1969,7657.14,1969-01-27
1882,NA03700829AAA,37.44583788,-106.1130835,1/27/1969,7650.99,1969-01-27
1883,NA04000825CCC,37.67638999,-106.0547478,1/27/1969,7618.61,1969-01-27
1884,NA03900813DDD,37.61944619,-106.0408587,1/27/1969,7610.97,1969-01-27
1885,NA03900931BAB,37.58750213,-106.0339142,1/27/1969,7602.71,1969-01-27
1886,NA04100926BCC,37.77105514,-105.9647445,1/27/1969,7570.45,1969-01-27
1887,NA03801018CCC,37.52972541,-105.926134,1/27/1969,7557.74,1969-01-27
1888,NA03400935DDD,37.13890068,-105.9472434,1/28/1969,7740.07,1969-01-28
1889,NA04000728DDD,37.67639126,-106.2047523,1/28/1969,7723.71,1969-01-28
1890,NA04100715CCC3,37.79305697,-106.2019735,1/28/1969,7664.47,1969-01-28
1891,NA04100703BBB,37.83527897,-106.200584,1/28/1969,7660.04,1969-01-28
1892,NA04100702CCC1,37.82222333,-106.182528,1/28/1969,7651.27,1969-01-28
1893,NA03500920CCC,37.25431394,-106.0196081,1/28/1969,7639.35,1969-01-28
1894,NA03400901DDD,37.21112136,-105.9297441,1/28/1969,7638.19,1969-01-28
1895,13S.04W.22.000,33.16423847,-107.2394746,1/28/1969,4280.38,1969-01-28
1896,NA03400917DCC,37.1819545,-106.0103012,1/29/1969,7703.8,1969-01-29
1897,21N.08E.17.423,36.04974475,-106.1108572,1/30/1969,5637.37,1969-01-30
1898,NA03500936CCC USGS 371330105564601,37.22500973,-105.9466892,2/19/1969,7650.28,1969-02-19
1899,NA03401016AAA,37.2100105,-105.9089103,2/19/1969,7629.61,1969-02-19
1900,NA04000714ACB,37.7152795,-106.1755846,2/24/1969,7687.09,1969-02-24
1901,NA04000831BCC3,37.66944641,-106.1478061,2/24/1969,7674.92,1969-02-24
1902,JL-49-14-715,31.765278,-106.346945,3/7/1969,3634.65,1969-03-07
1903,18N.10E.31.141,35.7503069,-105.9236325,3/12/1969,6872.34,1969-03-12
1904,CB00207401ADB,37.16945909,-105.6177921,4/1/1969,7569.15,1969-04-01
1905,JL-49-14-718,31.758612,-106.346667,4/3/1969,3657.73,1969-04-03
1906,CC03207209CAB,37.27695682,-105.4436241,4/6/1969,7919.92,1969-04-06
1907,23N.10E.29.424,36.19474551,-105.8930747,4/12/1969,6051.88,1969-04-12
1908,22N.08E.25.321,36.10974479,-106.0491894,5/1/1969,5593.98,1969-05-01
1909,JL-49-24-415,31.697222,-106.105001,5/5/1969,3642.76,1969-05-05
1910,17N.09E.15.2421,35.70752995,-105.9672441,5/6/1969,6759.44,1969-05-06
1911,17N.09E.29.23423,35.67641941,-106.0061335,5/10/1969,6498.35,1969-05-10
1912,CB00207306AAA,37.17223696,-105.5964028,5/13/1969,7598.62,1969-05-13
1913,13S.04W.10.222,33.20090547,-107.2322536,5/17/1969,4350.78,1969-05-17
1914,NA03300814CCC,37.09445587,-106.0741907,6/24/1969,7866.41,1969-06-24
1915,13S.04W.35.100,33.14118285,-107.2266956,6/27/1969,4250.41,1969-06-27
1916,CC03007310CDC,37.44639623,-105.5366798,7/1/1969,7715.24,1969-07-01
1917,CC03007323CCC,37.41750819,-105.5219573,7/2/1969,7729.52,1969-07-02
1918,06S.03E.05.234,33.81673408,-106.653904,7/14/1969,4730.66,1969-07-14
1919,23N.10E.28.424,36.19474562,-105.875852,7/22/1969,6018.88,1969-07-22
1920,22N.09E.16.124,36.14363405,-105.9908549,8/20/1969,5714.7,1969-08-20
1921,12N.02E.24.442,35.25055556,-106.6761111,9/1/1969,5028.48,1969-09-01
1922,JL-49-14-716,31.771111,-106.339167,10/16/1969,3585.08,1969-10-16
1923,21N.08E.08.343,36.06113346,-106.1203018,11/7/1969,5657.53,1969-11-07
1924,16N.08E.29.440,35.58225521,-106.1014115,11/18/1969,6024.74,1969-11-18
1925,13S.04S.15.340,33.17368297,-107.2414195,11/19/1969,4293.44,1969-11-19
1926,CC03007401AAB,37.47361738,-105.6005703,12/1/1969,7600.07,1969-12-01
1927,19S.04W.34.132,32.61535785,-107.244743,1/26/1970,4341.36,1970-01-26
1928,NA03400934BDC,37.14445573,-105.9758553,2/1/1970,7743.89,1970-02-01
1929,NA03400931BCC,37.1466773,-106.0339125,2/1/1970,7688.15,1970-02-01
1930,NA03701208CBC,37.46250605,-105.6922394,2/9/1970,7576.46,1970-02-09
1931,NA04000829CBD,37.67916835,-106.1269721,2/17/1970,7667.27,1970-02-17
1932,NA04200825BCC,37.85694441,-106.0547452,2/17/1970,7635.63,1970-02-17
1933,NA04000931BAB   ALA 2,37.67500094,-106.0339138,2/17/1970,7630.79,1970-02-17
1934,NA04301005ADC,37.99999925,-105.8894596,2/17/1970,7602.89,1970-02-17
1935,NA04001132CCC,37.66389024,-105.7977973,2/17/1970,7556.01,1970-02-17
1936,21N.10E.06.141,36.08474606,-105.9239092,2/18/1970,6639.99,1970-02-18
1937,20N.09E.24.24343,35.95002528,-105.9319654,2/18/1970,6377.24,1970-02-18
1938,NA03400922BCC,37.17501052,-105.9811337,2/19/1970,7683.47,1970-02-19
1939,NA03600815DCC,37.35833939,-106.0839158,2/19/1970,7656.84,1970-02-19
1940,NA03500933CCC,37.22778689,-106.0005794,2/19/1970,7653.35,1970-02-19
1941,NA03500907CCC   CON 1,37.28472986,-106.0380809,2/19/1970,7643.23,1970-02-19
1942,NA03700820CCC,37.43056037,-106.1297506,2/19/1970,7640.01,1970-02-19
1943,NA03700835BCC2,37.4083385,-106.0755823,2/19/1970,7637.87,1970-02-19
1944,NA03700823CCD,37.4305603,-106.0547484,2/19/1970,7615.28,1970-02-19
1945,18S.06W.15.133+DUP,32.74396698,-107.4544702,2/19/1970,4605.31,1970-02-19
1946,18S.06W.23.433,32.72344444,-107.4266111,2/19/1970,4559.78,1970-02-19
1947,NA03300922ACC,37.08890148,-105.9741877,2/21/1970,7704.97,1970-02-21
1948,NA03901006CDD,37.6486124,-105.9186333,2/21/1970,7592.56,1970-02-21
1949,21N.09E.05.4234,36.07863429,-106.0033554,2/24/1970,6048.76,1970-02-24
1950,21N.10E.32.344,36.00335795,-105.9030758,2/26/1970,6452.31,1970-02-26
1951,21N.09E.26.441,36.01946847,-105.9500211,2/26/1970,6137.02,1970-02-26
1952,20N.09E.17.400,35.96057991,-106.0055779,2/27/1970,5915.3,1970-02-27
1953,20N.09E.29.31314,35.93335815,-106.0172448,2/27/1970,5814.0,1970-02-27
1954,03N.01E.06.433,34.5065,-106.8724167,3/30/1970,4782.99,1970-03-30
1955,JL-49-04-163,31.988611,-106.586389,4/3/1970,3750.76,1970-04-03
1956,15N.09E.11.11311,35.54947881,-105.9650209,4/6/1970,6466.84,1970-04-06
1957,17N.08E.02.42312,35.73113981,-106.0578012,4/6/1970,6122.57,1970-04-06
1958,21N.09E.30.134,36.02288889,-106.0315556,4/9/1970,5651.5,1970-04-09
1959,JL-49-05-316,31.9725,-106.400278,4/23/1970,3692.64,1970-04-23
1960,22N.09E.10.310,36.15196743,-105.9789102,4/24/1970,5741.61,1970-04-24
1961,15N.09E.02.4224,35.55753428,-105.9472428,5/5/1970,6535.06,1970-05-05
1962,15N.09E.09.221,35.5508675,-105.9861324,5/5/1970,6375.41,1970-05-05
1963,15N.09E.06.414,35.55642276,-106.0239107,5/5/1970,6294.96,1970-05-05
1964,16N.09E.06.12234,35.65142003,-106.0283558,5/7/1970,6192.5,1970-05-07
1965,23N.07E.19.000,36.21446361,-106.2408594,5/7/1970,5874.82,1970-05-07
1966,16N.08E.15.232,35.61947637,-106.0769672,5/13/1970,6145.42,1970-05-13
1967,21N.10E.34.413,36.00696942,-105.8652972,5/21/1970,6942.33,1970-05-21
1968,21N.11E.30.232,36.02669204,-105.8094627,5/25/1970,7949.75,1970-05-25
1969,21N.10E.24.131,36.04002498,-105.8380743,5/25/1970,7430.76,1970-05-25
1970,21N.11E.19.211,36.04502517,-105.8127959,5/26/1970,7855.89,1970-05-26
1971,20N.09E.08.000,35.97891286,-106.0100224,5/26/1970,5759.73,1970-05-26
1972,21N.08E.03.200,36.08530027,-106.0769677,5/26/1970,5621.89,1970-05-26
1973,21N.10E.31.441,36.00474671,-105.9144649,5/27/1970,6333.86,1970-05-27
1974,21N.10E.31.342,36.00474663,-105.9216873,5/27/1970,6241.01,1970-05-27
1975,21N.10E.31.330,36.00391325,-105.9269652,5/27/1970,6228.41,1970-05-27
1976,21N.09E.36.422,36.00863541,-105.9300208,5/27/1970,6193.88,1970-05-27
1977,21N.09E.34.342,36.00502385,-105.9747439,5/27/1970,5914.46,1970-05-27
1978,20N.09E.09.41312,35.97641307,-105.9897443,5/28/1970,5865.32,1970-05-28
1979,21N.08E.26.2214,36.02946753,-106.0572453,5/28/1970,5622.14,1970-05-28
1980,20N.08E.11.241,35.98280141,-106.0578009,5/28/1970,5588.99,1970-05-28
1981,22N.09E.16.311,36.13807847,-105.9977995,6/9/1970,5748.86,1970-06-09
1982,15S.05W.28.323,32.97284955,-107.3794706,6/16/1970,4678.53,1970-06-16
1983,17N.09E.21.4343,35.68280824,-105.988911,6/17/1970,6502.44,1970-06-17
1984,13S.04W.16.120,33.18479408,-107.258087,7/1/1970,4417.67,1970-07-01
1985,22N.09E.30.323,36.10807831,-106.0311335,8/20/1970,5696.6,1970-08-20
1986,JL-49-04-150,31.962778,-106.585556,10/3/1970,3740.99,1970-10-03
1987,18N.09E.35.310,35.74558454,-105.9550219,10/21/1970,6648.07,1970-10-21
1988,JL-49-14-414,31.797778,-106.345278,10/23/1970,3651.69,1970-10-23
1989,JL-49-05-612,31.930555,-106.380833,10/30/1970,3596.15,1970-10-30
1990,JL-49-14-413,31.798611,-106.342222,12/22/1970,3641.95,1970-12-22
1991,17N.09E.28.444,35.66836424,-105.9833553,12/29/1970,6721.89,1970-12-29
1992,17N.09E.33.2112,35.66725311,-105.9897443,12/29/1970,6519.96,1970-12-29
1993,16N.09E.05.22331,35.65003126,-106.0047444,12/29/1970,6518.97,1970-12-29
1994,15N.09E.02.4423,35.55420103,-105.9486317,1/1/1971,6420.75,1971-01-01
1995,17N.09E.04.1443,35.73336234,-105.9930781,1/1/1971,6366.71,1971-01-01
1996,17N.09E.28.34232,35.67030855,-105.9927999,1/2/1971,6542.3,1971-01-02
1997,17N.09E.27.31344,35.6716975,-105.9805775,1/6/1971,6710.56,1971-01-06
1998,17N.09E.27.31413,35.67280859,-105.9802997,1/11/1971,6688.1,1971-01-11
1999,17N.09E.28.441,35.67030861,-105.9861331,1/12/1971,6705.76,1971-01-12
2000,10N.03E.07.434,35.10560134,-106.657248,1/13/1971,4940.33,1971-01-13
2001,JL-49-15-403,31.810556,-106.245,1/15/1971,3691.14,1971-01-15
2002,21N.07E.16.312,36.05029961,-106.2036365,1/30/1971,6174.78,1971-01-30
2003,21N.11E.20.143,36.03974758,-105.7991846,2/1/1971,7945.68,1971-02-01
2004,16N.09E.15.24333,35.61725467,-105.9689103,2/9/1971,6630.9,1971-02-09
2005,16N.08E.21.134,35.60364344,-106.1041896,2/15/1971,6254.17,1971-02-15
2006,JL-49-15-502,31.814723,-106.193611,3/11/1971,3708.69,1971-03-11
2007,22N.08E.24.340,36.11974473,-106.0480782,3/25/1971,5669.37,1971-03-25
2008,14N.08E.12.420,35.45531451,-106.0386327,3/31/1971,6041.07,1971-03-31
2009,22N.09E.09.330,36.14807843,-105.9964106,4/7/1971,5722.14,1971-04-07
2010,22N.09E.17.233,36.1389117,-106.0080775,4/15/1971,5719.75,1971-04-15
2011,16N.08E.30.224,35.59225485,-106.1258563,4/21/1971,6068.44,1971-04-21
2012,16N.09E.06.43443,35.6389204,-106.0236335,4/27/1971,6296.59,1971-04-27
2013,22N.08E.36.311,36.09502263,-106.053634,4/27/1971,5660.15,1971-04-27
2014,17N.09E.16.342,35.70002994,-105.9930779,4/30/1971,6436.67,1971-04-30
2015,16N.09E.12.423,35.62697692,-105.9325208,5/17/1971,6921.66,1971-05-17
2016,22N.08E.25.342,36.1064115,-106.0469671,5/19/1971,5691.65,1971-05-19
2017,16N.09E.08.31343,35.62780963,-106.0169666,7/7/1971,6333.42,1971-07-07
2018,17N.09E.18.423,35.70086309,-106.0219672,7/12/1971,6222.09,1971-07-12
2019,23N.07E.31.220,36.18751973,-106.2275258,7/23/1971,5865.43,1971-07-23
2020,14N.08E.02.444,35.46670307,-106.0561328,7/26/1971,6069.3,1971-07-26
2021,23N.07E.29.313,36.1936308,-106.2244702,8/9/1971,5813.17,1971-08-09
2022,16N.09E.07.32121,35.63114283,-106.0303001,8/12/1971,6165.13,1971-08-12
2023,17N.09E.27.144,35.6758641,-105.9752996,8/18/1971,6758.6,1971-08-18
2024,22N.08E.25.411,36.11002261,-106.0450227,9/1/1971,5697.51,1971-09-01
2025,17N.09E.28.434A,35.66891974,-105.9886332,9/20/1971,6502.41,1971-09-20
2026,10S.03W.20.332,33.42173678,-107.1741989,9/23/1971,4434.35,1971-09-23
2027,10S.03W.20.141,33.43062554,-107.17281,9/23/1971,4421.25,1971-09-23
2028,10S.03W.20.312,33.42590338,-107.1747545,9/23/1971,4414.21,1971-09-23
2029,10S.03W.20.312A,33.42590338,-107.1747545,9/23/1971,4411.5,1971-09-23
2030,10S.03W.20.211,33.43423663,-107.1678099,9/24/1971,4429.6,1971-09-24
2031,23N.09E.23.433,36.20641172,-105.9536316,10/7/1971,5928.67,1971-10-07
2032,23N.10E.35.120,36.18863473,-105.8491848,10/11/1971,6147.19,1971-10-11
2033,13S.04W.21.120,33.17034952,-107.2578086,10/15/1971,4285.5,1971-10-15
2034,28S.03E.28.241,31.84566097,-106.636102,10/31/1971,3741.76,1971-10-31
2035,23N.07E.33.431,36.17724248,-106.1969697,11/1/1971,5803.84,1971-11-01
2036,16N.09E.07.2134,35.63530939,-106.0258557,11/13/1971,6128.49,1971-11-13
2037,JL-49-22-122,31.721667,-106.351112,11/15/1971,3673.17,1971-11-15
2038,JL-49-32-505,31.561667,-106.069444,11/15/1971,3608.14,1971-11-15
2039,JL-49-32-504,31.562223,-106.070278,11/15/1971,3596.29,1971-11-15
2040,22N.08E.36.222,36.1028005,-106.0375225,12/1/1971,5706.53,1971-12-01
2041,22N.09E.17.423,36.13530065,-106.0039108,12/7/1971,5730.42,1971-12-07
2042,22N.11E.21.314,36.1225244,-105.8202956,12/30/1971,7166.54,1971-12-30
2043,22N.09E.10.230,36.15585635,-105.9705766,1/19/1972,5766.33,1972-01-19
2044,13S.04W.21.232,33.16757173,-107.2522529,1/19/1972,4275.49,1972-01-19
2045,17S.04W.30.342,32.79701898,-107.2914119,1/22/1972,4114.61,1972-01-22
2046,19N.09E.21.34343,35.855582,-105.9983558,1/26/1972,6006.78,1972-01-26
2047,22N.09E.16.110,36.14446733,-105.9969662,1/26/1972,5736.33,1972-01-26
2048,18N.09E.35.2214,35.75336218,-105.9500218,1/27/1972,6700.68,1972-01-27
2049,21N.11E.30.220,36.02974759,-105.8069626,2/1/1972,8032.35,1972-02-01
2050,19S.05W.08.333,32.66396873,-107.3833572,2/7/1972,4368.89,1972-02-07
2051,14N.08E.02.3243,35.46809192,-106.0650217,2/9/1972,6034.16,1972-02-09
2052,19S.02W.35.121,32.61924946,-107.0219596,2/12/1972,4006.67,1972-02-12
2053,23S.01E.33.214,32.26870529,-106.8411166,2/14/1972,3874.87,1972-02-14
2054,24S.03E.31.413,32.17370799,-106.6733309,2/15/1972,3823.03,1972-02-15
2055,26S.03E.07.144,32.06148818,-106.676662,2/15/1972,3801.02,1972-02-15
2056,26S.03E.08.211,32.06676588,-106.6580504,2/15/1972,3799.59,1972-02-15
2057,26S.03E.10.111,32.06787702,-106.6302719,2/16/1972,3801.29,1972-02-16
2058,MBOWN-360 26S.03E.04.433,32.06815477,-106.6411055,2/16/1972,3801.14,1972-02-16
2059,26S.03E.03.242,32.07787682,-106.6155494,2/16/1972,3798.72,1972-02-16
2060,26S.03E.28.343,32.01176714,-106.6441601,2/16/1972,3784.83,1972-02-16
2061,MBOWN-362 28S.02E.36.142,31.83122222,-106.6935556,2/17/1972,3778.07,1972-02-17
2062,22S.01E.20.244,32.38064661,-106.8561185,2/19/1972,3914.32,1972-02-19
2063,22S.01E.28.333,32.35925833,-106.8513958,2/19/1972,3904.43,1972-02-19
2064,23S.01E.16.213,32.31175966,-106.845284,2/19/1972,3881.86,1972-02-19
2065,19S.02W.36.322,32.61202775,-106.9983478,2/21/1972,4008.62,1972-02-21
2066,19S.02W.35.412,32.6125831,-107.0139038,2/21/1972,3997.56,1972-02-21
2067,20S.02W.03.242,32.60063888,-107.0252928,2/21/1972,3995.42,1972-02-21
2068,21S.01W.14.113,32.48647659,-106.9194551,2/21/1972,3963.54,1972-02-21
2069,21S.01W.24.133,32.46814387,-106.9047322,2/21/1972,3943.58,1972-02-21
2070,21S.01W.36.221+DUP,32.4364782,-106.8863979,2/21/1972,3934.81,1972-02-21
2071,18S.04W.34.211,32.70757667,-107.2369657,2/22/1972,4070.44,1972-02-22
2072,19S.04W.02.233,32.68535553,-107.2211318,2/22/1972,4063.46,1972-02-22
2073,19S.03W.06.123,32.69063356,-107.1914089,2/22/1972,4058.6,1972-02-22
2074,19S.04W.12.241,32.67591667,-107.1991944,2/22/1972,4052.99,1972-02-22
2075,19S.04W.12.222,32.67730064,-107.1969645,2/22/1972,4050.62,1972-02-22
2076,19S.03W.09.241,32.67396816,-107.1469632,2/22/1972,4042.5,1972-02-22
2077,19S.03W.15.212,32.66369095,-107.1322406,2/22/1972,4040.42,1972-02-22
2078,19S.02W.18.242,32.65813635,-107.0777947,2/22/1972,4023.82,1972-02-22
2079,19S.02W.22.323,32.63855556,-107.0357778,2/22/1972,4001.52,1972-02-22
2080,17S.05W.14.223,32.83590746,-107.3200239,2/23/1972,4134.7,1972-02-23
2081,17S.05W.24.314,32.81590778,-107.313357,2/23/1972,4124.03,1972-02-23
2082,17S.05W.24.343,32.80979675,-107.3103013,2/23/1972,4117.45,1972-02-23
2083,17S.05W.13.312,32.83118524,-107.312246,2/23/1972,4116.76,1972-02-23
2084,17S.04W.31.211,32.79313019,-107.2936342,2/23/1972,4112.47,1972-02-23
2085,18S.04W.05.133,32.77383333,-107.2806389,2/23/1972,4098.4,1972-02-23
2086,18S.04W.21.111,32.73563113,-107.2636331,2/23/1972,4085.6,1972-02-23
2087,24S.02E.23.341,32.20148521,-106.7124996,2/24/1972,3836.2,1972-02-24
2088,26S.03E.16.423,32.04343312,-106.6358271,2/24/1972,3791.88,1972-02-24
2089,14S.05W.25.123,33.06562666,-107.3144719,2/25/1972,4369.9,1972-02-25
2090,13S.04W.08.433,33.18647222,-107.2722778,2/25/1972,4355.73,1972-02-25
2091,14S.05W.23.444+DUP,33.07072222,-107.3158611,2/25/1972,4311.02,1972-02-25
2092,15S.05W.26.341,32.97086111,-107.3284444,2/25/1972,4267.7,1972-02-25
2093,09N.04E.04.213,35.04032628,-106.5228003,2/27/1972,4920.04,1972-02-27
2094,16N.08E.12.22432,35.63614266,-106.0375225,2/29/1972,6175.05,1972-02-29
2095,21N.08E.03.000,36.08168915,-106.0811344,3/1/1972,5630.21,1972-03-01
2096,23S.03E.20.222,32.29953838,-106.649721,3/1/1972,4407.34,1972-03-01
2097,19S.01E.01.222,32.69147173,-106.7861199,3/1/1972,4085.49,1972-03-01
2098,MBOWN-185 - 28S.02E.23.324 (ST-14),31.85482706,-106.7108259,3/5/1972,3784.38,1972-03-05
2099,20S.03E.31.123,32.52897697,-106.6686136,3/6/1972,4119.86,1972-03-06
2100,25S.01E.21.331+DUP,32.114264,-106.8536143,3/7/1972,3834.47,1972-03-07
2101,24S.02E.14.122,32.22731801,-106.7097223,3/8/1972,3822.68,1972-03-08
2102,MBOWN-41 - 23S.02E.07.411 (LC-10),32.32064888,-106.7744484,3/10/1972,3858.79,1972-03-10
2103,MBOWN-39 - 23S.02E.05.342 (LC-28),32.33259312,-106.7600037,3/10/1972,3843.88,1972-03-10
2104,23S.02E.08.443,32.31537141,-106.7541699,3/10/1972,3835.51,1972-03-10
2105,MBOWN-42 - 23S.02E.08.443 (LC-27),32.3153714,-106.7555589,3/10/1972,3833.14,1972-03-10
2106,23S.02E.21.221,32.29926074,-106.7386136,3/10/1972,3824.49,1972-03-10
2107,23S.02E.17.212,32.31370475,-106.7580589,3/10/1972,3821.19,1972-03-10
2108,22N.09E.17.412,36.13724506,-106.0064108,3/14/1972,5657.7,1972-03-14
2109,17N.09E.04.2124,35.73836225,-105.988078,3/30/1972,6333.02,1972-03-30
2110,19N.03E.18.333,35.87141118,-106.6680914,4/13/1972,8288.94,1972-04-13
2111,17N.09E.28.33313,35.66864187,-106.0003,4/20/1972,6554.72,1972-04-20
2112,02S.01W.11.111,34.15728862,-106.9222512,4/28/1972,4600.51,1972-04-28
2113,22S.02E.26.214,32.37064772,-106.7052797,5/1/1972,4398.11,1972-05-01
2114,19S.04W.34.131,32.61508005,-107.2477986,5/12/1972,4341.98,1972-05-12
2115,18S.04W.25.333,32.72313231,-107.1958537,5/12/1972,4141.26,1972-05-12
2116,19S.03W.08.412,32.67007909,-107.1689082,5/12/1972,4045.27,1972-05-12
2117,17N.09E.25.434,35.6686424,-105.9350211,5/14/1972,7009.77,1972-05-14
2118,17S.05W.12.121,32.86285112,-107.2986348,5/15/1972,4119.01,1972-05-15
2119,17N.09E.36.2211,35.66725357,-105.9333544,5/16/1972,7049.39,1972-05-16
2120,JL-48-41-618,31.2919444,-105.88,5/20/1972,3512.11,1972-05-20
2121,JL-48-41-603,31.2922222,-105.8808333,6/10/1972,3512.38,1972-06-10
2122,25S.01E.16.114,32.14065235,-106.8538926,7/1/1972,3812.17,1972-07-01
2123,05S.01E.04.000,33.90395494,-106.8439128,7/11/1972,4515.97,1972-07-11
2124,18S.03E.10.423,32.75508232,-106.6169486,7/18/1972,5048.84,1972-07-18
2125,18N.08E.10.1433,35.80613802,-106.0844683,7/25/1972,5852.59,1972-07-25
2126,28S.03E.28.114,31.84732754,-106.6474911,7/27/1972,3756.17,1972-07-27
2127,18S.04W.36.133,32.70118843,-107.2111317,8/14/1972,4034.29,1972-08-14
2128,19S.02W.17.424,32.652859,-107.0597387,8/14/1972,3990.27,1972-08-14
2129,23S.01E.04.114,32.34175881,-106.8511178,8/14/1972,3858.52,1972-08-14
2130,JL-49-15-802,31.784167,-106.169722,8/14/1972,3663.03,1972-08-14
2131,24N.09E.07.310,36.32640961,-106.0350212,8/17/1972,6292.65,1972-08-17
2132,15N.09E.14.11413 B,35.53430556,-105.9623611,8/28/1972,6474.74,1972-08-28
2133,24S.02E.35.114,32.18120786,-106.7147215,9/6/1972,3833.13,1972-09-06
2134,25S.02E.09.413,32.14537526,-106.7419438,9/6/1972,3824.19,1972-09-06
2135,26S.03E.23.232,32.03482229,-106.6033261,9/12/1972,3774.38,1972-09-12
2136,28N.12E.09.BLM VISITOR CENTER WELL NEAR CERRO,36.68252318,-105.6719524,9/29/1972,7110.2,1972-09-29
2137,24S.02E.21.112,32.2120406,-106.7486124,10/3/1972,3820.87,1972-10-03
2138,26S.03E.06.442,32.07065467,-106.6666619,10/4/1972,3730.88,1972-10-04
2139,25S.02E.22.314,32.11620918,-106.7308316,10/11/1972,3810.54,1972-10-11
2140,18N.08E.13.243,35.79224966,-106.0391899,10/17/1972,6131.85,1972-10-17
2141,MBOWN-44 - 23S.02E.17.243 (LC-26),32.30926045,-106.7555588,10/18/1972,3746.82,1972-10-18
2142,02S.01W.11.330,34.14562192,-106.9208622,10/25/1972,4619.06,1972-10-25
2143,23S.01E.35.424,32.26231688,-106.802782,10/30/1972,3854.51,1972-10-30
2144,22S.01E.32.443,32.34453646,-106.8577848,11/6/1972,3890.79,1972-11-06
2145,23S.01E.20.134,32.29342678,-106.8502839,11/6/1972,3711.71,1972-11-06
2146,23S.01E.04.411,32.33537016,-106.8419508,11/7/1972,3891.62,1972-11-07
2147,23S.01E.02.114,32.34120367,-106.8005606,11/8/1972,3888.8,1972-11-08
2148,23S.01E.02.413,32.33425934,-106.8100053,11/9/1972,3890.78,1972-11-09
2149,15N.09E.01.3314,35.55364552,-105.9447428,11/14/1972,6548.78,1972-11-14
2150,23S.02E.19.313,32.29092737,-106.7855595,11/15/1972,3864.69,1972-11-15
2151,MBOWN-99 - 25S.01E.16.111,32.14065235,-106.8538926,11/20/1972,3839.89,1972-11-20
2152,JL-49-13-622,31.819722,-106.378611,11/23/1972,3625.62,1972-11-23
2153,23S.02E.32.144,32.26648378,-106.7605584,11/28/1972,3853.51,1972-11-28
2154,24S.02E.03.434,32.24176218,-106.721112,11/29/1972,3823.78,1972-11-29
2155,23S.02E.34.412,32.26537272,-106.7233347,12/1/1972,3863.83,1972-12-01
2156,23S.02E.34.123,32.27065037,-106.7300017,12/4/1972,3836.85,1972-12-04
2157,JL-49-13-623,31.819722,-106.387222,12/12/1972,3615.03,1972-12-12
2158,16N.09E.15.200,35.62058791,-105.9691881,12/13/1972,6760.77,1972-12-13
2159,13S.04W.21.424,33.16284949,-107.2486415,12/31/1972,4279.08,1972-12-31
2160,10N.04E.29.231 RID 1,35.0681031,-106.5394675,1/1/1973,4932.71,1973-01-01
2161,10N.03E.21.331 YAL 3,35.0764357,-106.6341918,1/1/1973,4920.62,1973-01-01
2162,10N.04E.16.123 EUB 6,35.09810221,-106.5278009,1/1/1973,4915.7,1973-01-01
2163,10N.03E.28.243 YAL 2,35.0661,-106.6251028,1/1/1973,4913.06,1973-01-01
2164,11N.04E.33.331A PON 2,35.13337886,-106.5311346,1/1/1973,4890.74,1973-01-01
2165,25S.02W.30.323,32.10120696,-107.0872337,1/22/1973,4070.65,1973-01-22
2166,12S.05W.29.240,33.23840514,-107.3694783,1/27/1973,4766.01,1973-01-27
2167,MBOWN-357 25S.02E.26.221,32.11148708,-106.7055529,2/26/1973,3811.34,1973-02-26
2168,25S.03E.30.122,32.11120934,-106.6755519,2/26/1973,3809.46,1973-02-26
2169,17S.04W.06.113+DUP,32.86201778,-107.2972459,2/27/1973,4132.6,1973-02-27
2170,23N.08E.13.122,36.23252173,-106.0472446,2/28/1973,6035.26,1973-02-28
2171,21N.07E.24.310,36.03530016,-106.1522468,3/1/1973,6227.8,1973-03-01
2172,12N.07E.29.213b San Pedro Grant,35.24033109,-106.2164129,3/6/1973,6697.79,1973-03-06
2173,12N.07E.30.132 San Pedro Grant,35.2400588,-106.2411353,3/6/1973,6546.26,1973-03-06
2174,20S.03E.30.333,32.5331435,-106.6805586,3/6/1973,4053.55,1973-03-06
2175,16N.09E.13.330,35.61197723,-105.9450209,3/7/1973,6754.97,1973-03-07
2176,15N.08E.35.200,35.49114684,-106.0586327,3/8/1973,6087.84,1973-03-08
2177,23N.10E.21.223,36.21668989,-105.8772408,3/12/1973,5823.71,1973-03-12
2178,23S.03E.03.232+DUP,32.33870404,-106.6224982,3/19/1973,5009.96,1973-03-19
2179,23S.03E.21.312,32.29231633,-106.6449985,3/19/1973,4421.73,1973-03-19
2180,19S.04W.33.244,32.6145245,-107.248632,3/19/1973,4344.07,1973-03-19
2181,21S.03E.19.444,32.46120098,-106.6663904,3/21/1973,4082.31,1973-03-21
2182,25S.02E.31.133,32.09120942,-106.7844442,3/21/1973,3816.19,1973-03-21
2183,22S.03E.02.412,32.42203534,-106.6033318,3/22/1973,4962.76,1973-03-22
2184,21S.02E.11.324,32.49481115,-106.7102815,3/22/1973,4065.6,1973-03-22
2185,23N.10E.21.223A,36.21668989,-105.8772408,3/23/1973,5893.71,1973-03-23
2186,25S.03E.33.112,32.09676524,-106.6441617,3/26/1973,3747.92,1973-03-26
2187,23S.03E.27.400,32.27509449,-106.6194416,3/27/1973,4586.95,1973-03-27
2188,26S.03E.02.342,32.07065478,-106.6083268,3/27/1973,3809.4,1973-03-27
2189,25S.03E.21.244,32.11954252,-106.6333284,3/27/1973,3806.51,1973-03-27
2190,22S.03E.23.143,32.38064746,-106.6086092,3/28/1973,4830.73,1973-03-28
2191,23S.02E.18.313D,32.30509366,-106.7847263,4/4/1973,3879.46,1973-04-04
2192,23S.02E.18.313A,32.30509366,-106.7850041,4/4/1973,3864.5,1973-04-04
2193,23S.02E.18.313C+DUP,32.30509366,-106.7847263,4/4/1973,3864.44,1973-04-04
2194,26S.02E.12.421,32.0600993,-106.6869401,4/4/1973,3803.26,1973-04-04
2195,MBOWN-126 - 26S.03E.03.344B,32.06819444,-106.6268889,4/4/1973,3801.93,1973-04-04
2196,MBOWN-125 - 26S.03E.03.344A,32.06819444,-106.6268889,4/4/1973,3801.91,1973-04-04
2197,MBOWN-124 - 26S.03E.03.344,32.06819444,-106.6268889,4/4/1973,3801.91,1973-04-04
2198,MBOWN-127 - 26S.03E.03.344C,32.06819444,-106.6268889,4/4/1973,3800.18,1973-04-04
2199,MBOWN-128 - 26S.03E.03.344D,32.06819444,-106.6268889,4/4/1973,3800.02,1973-04-04
2200,22S.03E.08.144,32.41120225,-106.6580561,4/10/1973,4073.89,1973-04-10
2201,16N.08E.30.412,35.58642169,-106.1297452,4/11/1973,6116.57,1973-04-11
2202,18N.10E.06.24314,35.82113898,-105.9141877,4/16/1973,6842.8,1973-04-16
2203,24N.07E.14.422,36.31251929,-106.1555795,4/20/1973,6539.23,1973-04-20
2204,28S.01W.19.111,31.84676916,-106.9908385,4/23/1973,3974.02,1973-04-23
2205,17N.09E.04.2234,35.73697341,-105.9858558,4/25/1973,6328.69,1973-04-25
2206,21N.08E.12.23412,36.06696737,-106.0422449,4/26/1973,5832.99,1973-04-26
2207,20N.08E.12.23412,35.9816904,-106.0422451,4/26/1973,5662.94,1973-04-26
2208,25S.03E.18.224,32.13731989,-106.6674966,5/2/1973,3819.12,1973-05-02
2209,15N.09E.33.3444+DUP,35.47948058,-105.99141,5/4/1973,6287.93,1973-05-04
2210,26S.03E.09.111,32.06732144,-106.6491613,5/8/1973,3799.66,1973-05-08
2211,19S.02W.08.433,32.66396965,-107.0672389,5/9/1973,4019.35,1973-05-09
2212,19S.02W.17.233,32.65758095,-107.0680722,5/9/1973,4013.65,1973-05-09
2213,19S.02W.17.322,32.65480326,-107.0686278,5/9/1973,3993.0,1973-05-09
2214,19S.02W.35.211,32.61952731,-107.0155705,5/9/1973,3973.05,1973-05-09
2215,21S.01W.25.324,32.44814453,-106.8886203,5/17/1973,3918.4,1973-05-17
2216,16N.08E.29.2144,35.59142157,-106.1133562,5/29/1973,6119.94,1973-05-29
2217,16N.08E.28.31323,35.58558843,-106.1064116,5/30/1973,6119.54,1973-05-30
2218,16N.08E.20.3234+DUP,35.59892133,-106.1191897,5/30/1973,6107.28,1973-05-30
2219,16N.08E.28.3133,35.58419958,-106.107245,5/30/1973,6107.21,1973-05-30
2220,16N.08E.28.13313,35.58892166,-106.1075228,5/30/1973,6105.79,1973-05-30
2221,16N.08E.20.43224,35.5983658,-106.1125229,5/30/1973,6105.69,1973-05-30
2222,16N.08E.28.2333,35.5878106,-106.098356,5/31/1973,6111.45,1973-05-31
2223,16N.08E.28.2324,35.58975499,-106.0950227,5/31/1973,6109.27,1973-05-31
2224,16N.08E.28.14242,35.59003275,-106.0991894,5/31/1973,6102.35,1973-05-31
2225,16N.08E.32.4211,35.57281103,-106.1111338,5/31/1973,6056.44,1973-05-31
2226,16N.08E.31.121,35.57975522,-106.137523,5/31/1973,5991.76,1973-05-31
2227,12S.05W.29.1412,33.23979399,-107.3794784,6/1/1973,4787.54,1973-06-01
2228,JL-49-23-706,31.661667,-106.233611,6/1/1973,3665.65,1973-06-01
2229,16N.08E.27.2324,35.59031057,-106.0766892,6/4/1973,6166.03,1973-06-04
2230,16N.08E.33.3122,35.57281105,-106.1030781,6/4/1973,6096.03,1973-06-04
2231,25S.02E.14.312,32.13343106,-106.7158315,6/4/1973,3787.12,1973-06-04
2232,JL-49-05-314,31.990278,-106.408334,6/4/1973,3678.03,1973-06-04
2233,16N.08E.22.311,35.60086578,-106.0891894,6/5/1973,6155.98,1973-06-05
2234,16N.08E.33.1232,35.57836644,-106.1014115,6/5/1973,6089.41,1973-06-05
2235,16N.08E.24.12411,35.60781014,-106.0389112,6/6/1973,6185.8,1973-06-06
2236,16N.08E.24.32234,35.60086588,-106.0469668,6/6/1973,6153.82,1973-06-06
2237,16N.08E.24.13111,35.60614349,-106.0539113,6/6/1973,6149.32,1973-06-06
2238,16N.08E.24.13311,35.60447687,-106.0539113,6/6/1973,6146.89,1973-06-06
2239,16N.08E.24.31122,35.60197695,-106.0525224,6/6/1973,6141.53,1973-06-06
2240,16N.08E.13.43314,35.61031006,-106.044189,6/7/1973,6145.02,1973-06-07
2241,16N.08E.33.4312,35.56892229,-106.0969669,6/7/1973,6103.13,1973-06-07
2242,05N.02E.04.413,34.64844444,-106.71565,6/8/1973,4797.66,1973-06-08
2243,16N.08E.26.32112,35.58777778,-106.0661111,6/11/1973,6169.64,1973-06-11
2244,16N.08E.10.22421,35.63669809,-106.0728006,6/11/1973,6154.12,1973-06-11
2245,13N.08E.36.122,35.31809613,-106.0464109,6/12/1973,6192.96,1973-06-12
2246,16N.08E.33.44312,35.56781121,-106.0933558,6/12/1973,6122.76,1973-06-12
2247,16N.08E.34.14144,35.57558877,-106.0828002,6/12/1973,6114.47,1973-06-12
2248,16N.08E.33.4343,35.56614459,-106.0958558,6/12/1973,6110.61,1973-06-12
2249,20N.09E.30.2444,35.93558032,-106.0189115,6/12/1973,5815.47,1973-06-12
2250,16N.08E.34.21241,35.5800331,-106.0766891,6/13/1973,6139.2,1973-06-13
2251,16N.08E.34.14441,35.57364439,-106.080578,6/13/1973,6138.22,1973-06-13
2252,16N.08E.34.21414,35.57836648,-106.0778002,6/18/1973,6136.88,1973-06-18
2253,16N.08E.34.22234,35.57892203,-106.0730779,6/18/1973,6136.74,1973-06-18
2254,16N.08E.34.23441,35.57336663,-106.0764112,6/18/1973,6134.53,1973-06-18
2255,16N.08E.34.21442,35.5772554,-106.0766891,6/18/1973,6125.09,1973-06-18
2256,16N.08E.34.14222,35.57669986,-106.080578,6/18/1973,6124.2,1973-06-18
2257,16N.08E.34.23332,35.5744777,-106.0794668,6/18/1973,6107.48,1973-06-18
2258,16N.08E.34.14432,35.57392216,-106.0819669,6/19/1973,6127.57,1973-06-19
2259,22S.01E.36.114,32.35536997,-106.7994497,6/19/1973,3890.51,1973-06-19
2260,16N.08E.01.24232,35.64808676,-106.0372448,6/20/1973,6182.02,1973-06-20
2261,16N.08E.01.22222,35.65308662,-106.0361337,6/20/1973,6160.05,1973-06-20
2262,16N.08E.01.41324,35.64364243,-106.0428004,6/21/1973,6181.81,1973-06-21
2263,21S.01W.12.343+DUP,32.48925446,-106.8986211,6/21/1973,3966.81,1973-06-21
2264,18S.03W.36.114,32.70419444,-107.1074722,6/25/1973,4241.22,1973-06-25
2265,16N.08E.12.24312,35.63253165,-106.0394669,6/26/1973,6162.02,1973-06-26
2266,17S.05W.27.223,32.80729715,-107.3369685,6/26/1973,4148.76,1973-06-26
2267,17S.04W.32.321,32.78674121,-107.2775227,6/26/1973,4082.51,1973-06-26
2268,18S.04W.05.231,32.77590801,-107.2730781,6/27/1973,4081.2,1973-06-27
2269,18S.04W.05.233,32.77396361,-107.2730781,6/27/1973,4079.21,1973-06-27
2270,16N.09E.06.34311,35.63975369,-106.0314113,6/28/1973,6154.86,1973-06-28
2271,23S.02E.08.224,32.32981548,-106.7527812,7/1/1973,3846.11,1973-07-01
2272,27S.01W.32.124,31.91898981,-106.9663941,7/2/1973,3826.71,1973-07-02
2273,16N.09E.06.44414,35.63947596,-106.0194667,7/5/1973,6320.69,1973-07-05
2274,MBOWN-183 - 28S.02E.14.421 (ST-26),31.87121549,-106.7041593,7/10/1973,3782.05,1973-07-10
2275,20N.09E.19.44331,35.94308015,-106.0225227,7/11/1973,5801.48,1973-07-11
2276,20N.09E.19.44341,35.94335793,-106.0211338,7/11/1973,5796.5,1973-07-11
2277,23S.01E.03.213,32.34092568,-106.8280615,7/12/1973,3851.55,1973-07-12
2278,16N.09E.07.22222,35.63808711,-106.0186334,7/13/1973,6316.12,1973-07-13
2279,20N.09E.08.22243,35.98446835,-106.0016889,7/13/1973,5817.78,1973-07-13
2280,20N.09E.08.41112,35.9786351,-106.0083557,7/13/1973,5776.82,1973-07-13
2281,20N.09E.08.31221,35.97863506,-106.0150225,7/13/1973,5764.41,1973-07-13
2282,16N.09E.17.4414,35.61197678,-106.0039108,7/14/1973,6312.63,1973-07-14
2283,16N.09E.06.24141,35.64808682,-106.0214113,7/16/1973,6296.37,1973-07-16
2284,16N.09E.07.43133,35.62586521,-106.0269667,7/16/1973,6174.38,1973-07-16
2285,16N.09E.18.12133,35.62280973,-106.0308556,7/16/1973,6159.83,1973-07-16
2286,16N.08E.13.21213,35.62392078,-106.0428002,7/16/1973,6131.89,1973-07-16
2287,16N.09E.08.1332,35.63280949,-106.0166889,7/17/1973,6326.36,1973-07-17
2288,16N.09E.18.2132,35.62169867,-106.0253,7/17/1973,6132.46,1973-07-17
2289,21N.08E.05.130,36.08363321,-106.1236352,7/18/1973,5642.31,1973-07-18
2290,16N.09E.08.21132,35.63780937,-106.0086333,7/19/1973,6518.04,1973-07-19
2291,16N.09E.08.33224,35.62697633,-106.013911,7/19/1973,6333.18,1973-07-19
2292,16N.9E.15.240,35.61892131,-105.9672436,7/20/1973,6531.58,1973-07-20
2293,MBOWN-76 - 24S.02E.17.423A (EBID-1),32.21787379,-106.7544461,7/21/1973,3844.83,1973-07-21
2294,MBOWN-193 - 28S.03E.19.133 (ST-27),31.85843818,-106.6827698,7/21/1973,3768.13,1973-07-21
2295,16N.09E.08.21314,35.63642052,-106.0086333,7/23/1973,6518.1,1973-07-23
2296,16N.09E.08.22122,35.63836493,-106.0030777,7/23/1973,6516.86,1973-07-23
2297,16N.09E.08.21123,35.63614276,-106.0080777,7/23/1973,6514.98,1973-07-23
2298,16N.09E.08.22212,35.63836493,-106.0019665,7/23/1973,6511.24,1973-07-23
2299,15N.09E.35.3424,35.48114747,-105.9564093,7/23/1973,6418.28,1973-07-23
2300,14N.09E.18.222,35.44892581,-106.0191881,7/24/1973,6143.51,1973-07-24
2301,17N.08E.21.4123,35.68808535,-106.0958569,7/24/1973,6130.26,1973-07-24
2302,17N.08E.16.3441,35.69808503,-106.1005793,7/24/1973,5937.44,1973-07-24
2303,JL-49-30-340,31.590556,-106.251112,7/24/1973,3632.12,1973-07-24
2304,16N.09E.08.22321,35.63669831,-106.0036332,7/25/1973,6528.34,1973-07-25
2305,16N.09E.08.24121,35.63475392,-106.0036332,7/25/1973,6523.27,1973-07-25
2306,16N.09E.08.24132,35.63392061,-106.0044665,7/25/1973,6509.25,1973-07-25
2307,14N.08E.01.331,35.46670307,-106.0525217,7/25/1973,6024.74,1973-07-25
2308,14N.08E.11.424,35.45503673,-106.0547439,7/25/1973,6016.99,1973-07-25
2309,16N.09E.05.44332,35.63919824,-106.0047444,7/26/1973,6501.5,1973-07-26
2310,16N.09E.08.12113,35.63808713,-106.0136333,7/26/1973,6339.64,1973-07-26
2311,16N.09E.18.21142,35.62308752,-106.0255778,7/26/1973,6152.09,1973-07-26
2312,14N.08E.11.112,35.46336983,-106.0683551,7/30/1973,5980.87,1973-07-30
2313,16N.09E.05.14231,35.64808685,-106.0114112,7/31/1973,6559.39,1973-07-31
2314,16N.09E.05.41132,35.64419808,-106.0083555,7/31/1973,6533.62,1973-07-31
2315,16N.09E.05.31423,35.64392029,-106.0150223,7/31/1973,6312.39,1973-07-31
2316,14N.08E.11.144,35.4580922,-106.0644662,7/31/1973,6010.49,1973-07-31
2317,13S.04W.15.100+DUP3,33.18284969,-107.24392,7/31/1973,4309.11,1973-07-31
2318,16N.09E.05.23343,35.6458647,-106.0083556,8/1/1973,6533.27,1973-08-01
2319,16N.08E.08.122,35.63780902,-106.1178011,8/1/1973,6249.34,1973-08-01
2320,14N.08E.13.422,35.44142601,-106.0377994,8/1/1973,6038.25,1973-08-01
2321,14N.08E.13.1241,35.44698141,-106.0469661,8/2/1973,6037.03,1973-08-02
2322,16N.09E.05.24332A,35.64642026,-106.0044666,8/6/1973,6521.69,1973-08-06
2323,16N.09E.05.24332,35.64642026,-106.0044666,8/6/1973,6517.98,1973-08-06
2324,16N.09E.05.34211,35.64197591,-106.0114111,8/6/1973,6511.05,1973-08-06
2325,16N.09E.04.11222,35.65308679,-105.9958554,8/7/1973,6519.29,1973-08-07
2326,16N.09E.04.3124,35.64419814,-105.9961332,8/8/1973,6523.38,1973-08-08
2327,16N.09E.04.3122,35.64530922,-105.9961332,8/8/1973,6516.62,1973-08-08
2328,16N.09E.04.3431,35.6400316,-105.995022,8/8/1973,6514.92,1973-08-08
2329,16N.09E.04.3213,35.64419815,-105.9952998,8/8/1973,6514.28,1973-08-08
2330,16N.09E.04.3442,35.6403094,-105.9922442,8/8/1973,6497.8,1973-08-08
2331,13S.04W.15.100+DUP2,33.18118301,-107.2439199,8/8/1973,4338.37,1973-08-08
2332,JL-49-31-908,31.509445,-106.150556,8/8/1973,3586.51,1973-08-08
2333,16N.08E.25.2424,35.58975511,-106.0361332,8/9/1973,6171.14,1973-08-09
2334,16N.09E.30.1314,35.59031066,-106.0341888,8/9/1973,6168.63,1973-08-09
2335,16N.08E.25.32122,35.5878107,-106.0480778,8/9/1973,6166.49,1973-08-09
2336,16N.08E.25.4211,35.58725518,-106.0400221,8/9/1973,6165.41,1973-08-09
2337,16N.08E.25.2441,35.58947734,-106.0377999,8/9/1973,6163.06,1973-08-09
2338,16N.08E.25.4323,35.58281086,-106.0425221,8/9/1973,6141.58,1973-08-09
2339,MBOWN-186 - 28S.02E.24.444 (ST-29),31.85121616,-106.6858253,8/10/1973,3771.86,1973-08-10
2340,16N.08E.25.34411,35.57925,-106.0451944,8/13/1973,6183.62,1973-08-13
2341,16N.08E.25.3244,35.58475524,-106.0461333,8/13/1973,6164.12,1973-08-13
2342,16N.08E.25.4134,35.58475524,-106.0430777,8/13/1973,6119.93,1973-08-13
2343,16N.08E.25.31144,35.58669961,-106.0525222,8/14/1973,6167.99,1973-08-14
2344,16N.08E.25.32121,35.58753293,-106.0486333,8/14/1973,6165.3,1973-08-14
2345,16N.08E.25.33234,35.58253307,-106.0516889,8/14/1973,6146.78,1973-08-14
2346,16N.09E.04.11242,35.65225348,-105.9958554,8/16/1973,6524.38,1973-08-16
2347,16N.09E.10.34243,35.6258655,-105.9747438,8/17/1973,6657.31,1973-08-17
2348,16N.09E.10.34231,35.62642103,-105.9755771,8/17/1973,6642.62,1973-08-17
2349,16N.09E.10.43423,35.62530999,-105.9700214,8/17/1973,6637.39,1973-08-17
2350,16N.09E.10.14443,35.6314209,-105.9747438,8/17/1973,6628.21,1973-08-17
2351,16N.09E.10.43412,35.62586553,-105.970577,8/17/1973,6625.05,1973-08-17
2352,16N.09E.15.2442,35.618088,-105.9664102,8/21/1973,6652.89,1973-08-21
2353,16N.09E.15.2224,35.6228101,-105.9652991,8/21/1973,6651.47,1973-08-21
2354,16N.09E.15.21443,35.6205879,-105.970577,8/21/1973,6629.04,1973-08-21
2355,16N.09E.15.1444,35.61697686,-105.9739104,8/21/1973,6616.32,1973-08-21
2356,16N.09E.15.31234,35.61503243,-105.9791882,8/21/1973,6455.7,1973-08-21
2357,16N.09E.15.12444,35.62058787,-105.9736326,8/22/1973,6624.32,1973-08-22
2358,16N.09E.10.4424,35.62642111,-105.9658547,8/22/1973,6613.32,1973-08-22
2359,JL-49-13-624,31.819444,-106.395556,8/27/1973,3610.48,1973-08-27
2360,22S.02E.24.422,32.37953638,-106.6833345,8/31/1973,4084.56,1973-08-31
2361,30N.13E.18.1121,36.84330556,-105.5989722,9/6/1973,7530.76,1973-09-06
2362,16N.09E.09.42122,35.63142081,-105.9852995,9/6/1973,6511.36,1973-09-06
2363,JL-49-06-106,31.964445,-106.355556,9/6/1973,3695.9,1973-09-06
2364,10N.02E.33.442,35.04365839,-106.7483605,9/13/1973,5084.94,1973-09-13
2365,20N.09E.04.1234,35.99669041,-105.993911,9/18/1973,5794.96,1973-09-18
2366,15N.08E.27.2142,35.50503533,-106.0761329,9/24/1973,6128.27,1973-09-24
2367,15N.09E.19.332,35.51059073,-106.0330771,9/25/1973,6139.71,1973-09-25
2368,15N.09E.27.4434,35.49364702,-105.9677984,9/27/1973,6416.76,1973-09-27
2369,15N.08E.25.3134,35.49809109,-106.0527994,10/1/1973,6102.61,1973-10-01
2370,15N.08E.26.4313,35.49559116,-106.0622439,10/1/1973,6078.87,1973-10-01
2371,15N.08E.35.1421,35.48920245,-106.0650217,10/1/1973,6076.48,1973-10-01
2372,15N.08E.36.3332,35.47975827,-106.0527994,10/1/1973,6048.76,1973-10-01
2373,15N.10E.16.141,35.53392428,-105.8891861,10/3/1973,6924.48,1973-10-03
2374,23N.10E.15.343,36.22113435,-105.8686295,10/3/1973,5887.2,1973-10-03
2375,JL-49-22-541,31.66983438,-106.3041482,10/5/1973,3654.74,1973-10-05
2376,JL-49-14-602,31.805834,-106.253334,10/9/1973,3683.93,1973-10-09
2377,JL-49-14-608,31.805556,-106.253889,10/9/1973,3683.73,1973-10-09
2378,JL-49-14-508,31.800278,-106.303889,10/9/1973,3664.75,1973-10-09
2379,JL-49-14-416,31.829167,-106.365278,10/11/1973,3632.07,1973-10-11
2380,16N.09E.02.44344,35.63919866,-105.9491878,10/12/1973,6766.67,1973-10-12
2381,MBOWN-143 - 27S.01W.26.433,31.92649009,-106.9105581,10/17/1973,3816.24,1973-10-17
2382,21S.03E.16.411,32.48175606,-106.6391674,10/19/1973,4087.32,1973-10-19
2383,16N.08E.32.3413,35.5675334,-106.1200227,10/20/1973,5938.48,1973-10-20
2384,10N.02E.33.421,35.04560277,-106.7486383,10/20/1973,5073.22,1973-10-20
2385,JL-49-40-504,31.443334,-106.077222,10/24/1973,3574.24,1973-10-24
2386,JL-49-40-107,31.460001,-106.109167,10/25/1973,3581.05,1973-10-25
2387,16N.09E.02.42141A,35.64447629,-105.9494656,10/26/1973,6704.36,1973-10-26
2388,16N.09E.02.42132,35.64447628,-105.9505768,10/26/1973,6686.6,1973-10-26
2389,16N.09E.02.4133,35.6430874,-105.9547435,10/26/1973,6682.62,1973-10-26
2390,JL-49-40-602,31.435278,-106.031944,10/26/1973,3561.73,1973-10-26
2391,16N.09E.02.2211,35.65308715,-105.9508546,10/27/1973,6710.32,1973-10-27
2392,16N.09E.02.43432,35.6394764,-105.952799,10/27/1973,6694.39,1973-10-27
2393,16N.09E.02.32434,35.64253184,-105.9572435,10/27/1973,6673.56,1973-10-27
2394,16N.08E.23.400,35.59892146,-106.0589113,10/30/1973,6074.25,1973-10-30
2395,JL-49-04-149,31.99648986,-106.6069367,11/1/1973,3760.14,1973-11-01
2396,JL-49-40-507,31.4308333,-106.0591667,11/1/1973,3570.06,1973-11-01
2397,JL-49-40-509,31.4291667,-106.0647222,11/1/1973,3502.52,1973-11-01
2398,JL-49-40-809,31.398056,-106.063889,11/2/1973,3565.81,1973-11-02
2399,JL-49-40-905,31.414167,-106.016389,11/5/1973,3557.74,1973-11-05
2400,17N.09E.18.322,35.70336348,-105.9566883,11/6/1973,7139.01,1973-11-06
2401,JL-48-33-706,31.393889,-105.996945,11/6/1973,3555.24,1973-11-06
2402,19S.03W.16.411,32.65507984,-107.1530743,11/9/1973,4092.34,1973-11-09
2403,19S.02W.21.143,32.64202609,-107.0547384,11/9/1973,4002.49,1973-11-09
2404,16N.09E.02.42223,35.64530962,-105.9472434,11/10/1973,6763.89,1973-11-10
2405,16N.09E.02.41214,35.64530958,-105.9525212,11/10/1973,6695.83,1973-11-10
2406,23N.07E.30.120,36.20196385,-106.2364149,11/13/1973,5857.91,1973-11-13
2407,17N.09E.29.42344,35.67141956,-106.0036334,11/14/1973,6580.32,1973-11-14
2408,13S.04W.21.211,33.17118287,-107.2550308,11/14/1973,4279.55,1973-11-14
2409,JL-49-14-104,31.833889,-106.358612,11/14/1973,3642.45,1973-11-14
2410,16N.09E.02.24241,35.64836509,-105.9475212,11/15/1973,6771.84,1973-11-15
2411,16N.09E.02.24222,35.6491984,-105.9469656,11/15/1973,6770.2,1973-11-15
2412,16N.09E.02.22243,35.65142056,-105.9472434,11/15/1973,6769.05,1973-11-15
2413,16N.08E.24.13314,35.60392133,-106.0536335,11/16/1973,6149.34,1973-11-16
2414,16N.08E.24.31143,35.60086587,-106.0525224,11/16/1973,6121.68,1973-11-16
2415,19S.04W.11.213,32.67507814,-107.2211317,11/20/1973,4057.0,1973-11-20
2416,JL-49-04-151,31.970555,-106.603889,11/25/1973,3763.5,1973-11-25
2417,17N.09E.35.44321,35.65475378,-105.9497435,11/29/1973,6737.51,1973-11-29
2418,21S.01E.30.143,32.45342222,-106.8819535,12/3/1973,3947.84,1973-12-03
2419,JL-48-42-716,31.2725,-105.851667,12/10/1973,3503.01,1973-12-10
2420,JL-48-42-710,31.280833,-105.861389,12/10/1973,3502.69,1973-12-10
2421,17N.08E.25.31121,35.67447483,-106.0528007,12/11/1973,6168.52,1973-12-11
2422,17N.08E.25.32121,35.67447484,-106.048634,12/11/1973,6164.27,1973-12-11
2423,17N.08E.25.12434,35.67836363,-106.0472451,12/11/1973,6157.04,1973-12-11
2424,21S.01W.11.443,32.49258763,-106.9069547,12/11/1973,3957.65,1973-12-11
2425,17N.09E.31.22434,35.66447525,-106.0197447,12/13/1973,6292.91,1973-12-13
2426,17N.08E.25.22443,35.67864144,-106.037245,12/13/1973,6215.08,1973-12-13
2427,17N.08E.25.144,35.67558596,-106.0386339,12/13/1973,6209.82,1973-12-13
2428,17N.08E.25.13233,35.67669699,-106.0516896,12/13/1973,6167.12,1973-12-13
2429,17N.09E.30.43424,35.66919732,-106.0230781,12/14/1973,6282.7,1973-12-14
2430,17N.09E.30.14323,35.67614154,-106.0303005,12/14/1973,6223.92,1973-12-14
2431,17N.09E.30.14324,35.67614154,-106.0297449,12/14/1973,6221.72,1973-12-14
2432,17N.09E.30.43221,35.67086394,-106.0239115,12/15/1973,6279.33,1973-12-15
2433,17N.09E.30.23322,35.67641933,-106.0253004,12/15/1973,6250.02,1973-12-15
2434,17N.09E.30.24423,35.67614158,-106.0197448,12/18/1973,6308.27,1973-12-18
2435,17N.09E.30.23141,35.67725263,-106.0261338,12/19/1973,6225.32,1973-12-19
2436,17N.08E.25.41332,35.67197493,-106.044745,12/19/1973,6193.25,1973-12-19
2437,12S.05W.36.110,33.22840533,-107.3136445,12/19/1973,4837.22,1973-12-19
2438,17N.09E.07.43131,35.71364048,-106.0269673,12/20/1973,6224.85,1973-12-20
2439,MBOWN-50 - 23S.02E.28.333 (NMSU-9),32.27370588,-106.749447,12/22/1973,3833.91,1973-12-22
2440,17N.09E.02.3442,35.72725171,-105.9564107,1/1/1974,6695.43,1974-01-01
2441,10N.04E.19.322 RID 4,35.07921375,-106.5616903,1/1/1974,4912.02,1974-01-01
2442,10N.02E.22.321 WSM 4,35.07837965,-106.7222491,1/1/1974,4905.91,1974-01-01
2443,18S.05W.30.343+DUP,32.70725,-107.3965278,1/1/1974,4353.93,1974-01-01
2444,JL-49-14-105,31.838334,-106.352501,1/7/1974,3666.57,1974-01-07
2445,17S.04W.30.131,32.80340783,-107.2983566,1/14/1974,4121.88,1974-01-14
2446,JL-49-31-905,31.518889,-106.132778,1/17/1974,3591.14,1974-01-17
2447,JL-49-31-906,31.521111,-106.152778,1/18/1974,3611.63,1974-01-18
2448,16N.08E.20.211,35.60836549,-106.1158564,1/19/1974,6153.55,1974-01-19
2449,16N.08E.26.43123,35.5839219,-106.0608556,1/21/1974,6157.49,1974-01-21
2450,16N.08E.26.44113,35.58392191,-106.0583556,1/22/1974,6160.58,1974-01-22
2451,18S.06W.15.133,32.74507807,-107.4550258,1/22/1974,4606.97,1974-01-22
2452,19S.06W.03.113+DUP,32.68952435,-107.4544699,1/22/1974,4538.95,1974-01-22
2453,19S.06W.03.344,32.67869127,-107.4464141,1/22/1974,4488.48,1974-01-22
2454,18S.05W.30.343,32.70786111,-107.3966389,1/22/1974,4358.95,1974-01-22
2455,18S.05W.18.434,32.73677778,-107.3908056,1/22/1974,4323.25,1974-01-22
2456,19S.05W.16.144,32.65813529,-107.3589122,1/23/1974,4461.94,1974-01-23
2457,19S.05W.07.442,32.66669444,-107.3863056,1/23/1974,4380.45,1974-01-23
2458,19S.05W.25.131A,32.63230236,-107.3161334,1/23/1974,4374.61,1974-01-23
2459,19S.05W.05.144,32.68757891,-107.3758572,1/23/1974,4312.88,1974-01-23
2460,16N.08E.26.43111,35.58419967,-106.0625223,1/24/1974,6142.62,1974-01-24
2461,30N.13E.31.1112,36.79974647,-105.6025068,2/8/1974,7552.44,1974-02-08
2462,26N.12E.25.4122,36.45863636,-105.6066778,2/8/1974,7106.7,1974-02-08
2463,18N.09E.10.24211,35.80780543,-105.9669665,2/16/1974,6335.23,1974-02-16
2464,17N.09E.31.43331,35.65419773,-106.0269669,2/16/1974,6306.23,1974-02-16
2465,17N.09E.31.32222,35.6600309,-106.0275225,2/16/1974,6167.49,1974-02-16
2466,17N.09E.31.324,35.65503104,-106.0275225,2/16/1974,6114.57,1974-02-16
2467,17N.09E.31.44421,35.6547533,-106.0194669,2/19/1974,6295.25,1974-02-19
2468,30N.12E.01.3244,36.86335616,-105.6127862,2/20/1974,7504.69,1974-02-20
2469,30N.13E.30.4422,36.80363571,-105.5861178,2/21/1974,7736.52,1974-02-21
2470,02S.73W.05.244,36.90280045,-105.5827866,2/21/1974,7509.93,1974-02-21
2471,02S.73W.17.322,36.87918954,-105.5963975,2/21/1974,7508.31,1974-02-21
2472,JL-49-31-909,31.527222,-106.159167,2/22/1974,3605.08,1974-02-22
2473,13S.04W.15.230,33.18118306,-107.2369752,2/23/1974,4354.1,1974-02-23
2474,10S.06W.28.330,33.40701367,-107.4692029,3/1/1974,5302.4,1974-03-01
2475,17N.09E.32.12222,35.66753075,-106.0100224,3/7/1974,6587.75,1974-03-07
2476,17N.09E.29.34444,35.66808629,-106.0100224,3/7/1974,6583.34,1974-03-07
2477,17N.09E.32.21132,35.66669745,-106.0089113,3/7/1974,6577.53,1974-03-07
2478,17N.09E.29.34433,35.66780852,-106.0116891,3/7/1974,6574.43,1974-03-07
2479,17N.09E.29.34431,35.66836406,-106.0119669,3/7/1974,6508.93,1974-03-07
2480,17N.09E.29.23433,35.67503055,-106.0069668,3/8/1974,6519.88,1974-03-08
2481,16N.09E.06.24111,35.64919789,-106.0222446,3/8/1974,6291.5,1974-03-08
2482,17N.09E.32.21411,35.66586415,-106.0069668,3/9/1974,6565.53,1974-03-09
2483,17N.09E.32.22131,35.66669746,-106.0050223,3/9/1974,6536.88,1974-03-09
2484,17N.09E.32.13143,35.66253087,-106.0169669,3/9/1974,6292.13,1974-03-09
2485,17N.09E.32.41141,35.65947543,-106.0080779,3/12/1974,6585.48,1974-03-12
2486,17N.09E.32.312442,35.65919764,-106.014189,3/12/1974,6575.39,1974-03-12
2487,17N.09E.32.21334,35.66475306,-106.0089112,3/14/1974,6592.25,1974-03-14
2488,17N.09E.32.23434,35.66086429,-106.006689,3/14/1974,6576.84,1974-03-14
2489,17N.09E.33.13231,35.66280872,-105.9980778,3/14/1974,6513.08,1974-03-14
2490,17N.09E.33.13123,35.66336426,-105.9986333,3/14/1974,6506.25,1974-03-14
2491,18N.10E.05.121,35.82558342,-105.9052986,4/1/1974,7050.4,1974-04-01
2492,10N.02E.21.412+DUP,35.07865737,-106.7322493,4/1/1974,4904.38,1974-04-01
2493,13S.04W.21.233,33.16590505,-107.2550306,4/4/1974,4274.9,1974-04-04
2494,15S.05W.24.312,32.98923764,-107.3147473,5/1/1974,4255.32,1974-05-01
2495,25S.03E.01.211,32.17037469,-106.5891611,5/2/1974,3826.01,1974-05-02
2496,16S.05W.20.243,32.90257326,-107.3703032,5/3/1974,4355.23,1974-05-03
2497,16S.05W.22.313,32.89923978,-107.3480805,5/3/1974,4200.04,1974-05-03
2498,15S.05W.28.313,32.97229392,-107.3666926,5/7/1974,4431.64,1974-05-07
2499,15S.05W.29.424,32.97330556,-107.3700278,5/8/1974,4432.44,1974-05-08
2500,22S.01E.14.341,32.39009114,-106.8150061,5/17/1974,3911.63,1974-05-17
2501,JL-49-04-462,31.947222,-106.591389,6/5/1974,3784.94,1974-06-05
2502,17N.09E.32.32422,35.65836434,-106.0103001,6/11/1974,6579.44,1974-06-11
2503,17N.09E.32.32321,35.65836434,-106.0125224,6/11/1974,6578.39,1974-06-11
2504,17N.09E.32.41444,35.65725328,-106.0058556,6/13/1974,6572.36,1974-06-13
2505,17N.09E.29.44114,35.67030848,-106.004189,6/13/1974,6571.24,1974-06-13
2506,MBOWN-182 - 28S.02E.13.332 (ST-25),31.86788228,-106.6972147,6/13/1974,3777.7,1974-06-13
2507,28S.02E.25.233,31.84482743,-106.6927698,6/13/1974,3777.25,1974-06-13
2508,28S.02E.24.213,31.86232692,-106.6905478,6/13/1974,3771.54,1974-06-13
2509,MBOWN-203 - 28S.03E.30.141,31.84538303,-106.6794362,6/13/1974,3770.69,1974-06-13
2510,MBOWN-192 - 28S.03E.17.214 (ST-12),31.87871545,-106.657214,6/13/1974,3761.74,1974-06-13
2511,28S.03E.29.132,31.84621639,-106.6649915,6/13/1974,3759.8,1974-06-13
2512,28S.03E.28.444,31.83621681,-106.6355463,6/13/1974,3759.79,1974-06-13
2513,MBOWN-194 - 28S.03E.20.123 (ST-28),31.86288257,-106.6627695,6/13/1974,3757.51,1974-06-13
2514,MBOWN-201 - 28S.03E.27.434 (ST-21),31.83658333,-106.6210278,6/13/1974,3747.96,1974-06-13
2515,MBOWN-195 - 28S.03E.21.144 (ST-7),31.85899387,-106.642769,6/13/1974,3746.59,1974-06-13
2516,MBOWN-365 28S.03E.20.422,31.85455556,-106.6562222,6/13/1974,3746.5,1974-06-13
2517,28S.03E.29.442,31.83899445,-106.6505466,6/13/1974,3732.13,1974-06-13
2518,MBOWN-204 - 28S.03E.32.143 (ST-11),31.83010578,-106.6619356,6/14/1974,3766.49,1974-06-14
2519,MBOWN-200 - 28S.03E.27.124 (ST-18),31.84747222,-106.6274722,6/14/1974,3748.38,1974-06-14
2520,MBOWN-202 - 28S.03E.29.344 (ST-31),31.83705,-106.6652691,6/14/1974,3745.03,1974-06-14
2521,17N.09E.32.42232,35.65919768,-106.0019667,6/18/1974,6532.02,1974-06-18
2522,17N.09E.32.44321,35.65475336,-106.0036333,6/18/1974,6526.01,1974-06-18
2523,17N.09E.32.42124,35.66003099,-106.0033556,6/18/1974,6525.75,1974-06-18
2524,17N.09E.32.44433,35.65336451,-106.0030778,6/18/1974,6515.61,1974-06-18
2525,16N.09E.05.32142,35.64419807,-106.0130778,6/18/1974,6514.68,1974-06-18
2526,22N.09E.09.333,36.14752287,-105.9977995,6/18/1974,5662.68,1974-06-18
2527,17N.09E.33.13331,35.66114208,-106.0000222,6/19/1974,6516.11,1974-06-19
2528,17N.09E.33.32142,35.65947552,-105.9936332,6/19/1974,6514.84,1974-06-19
2529,MBOWN-117 - 26S.02W.15.434,32.04148647,-107.028065,6/25/1974,3848.34,1974-06-25
2530,27S.01W.15.233,31.95815575,-106.9325042,6/25/1974,3811.28,1974-06-25
2531,17N.09E.28.41223,35.67419737,-105.9886332,6/27/1974,6743.73,1974-06-27
2532,17N.09E.28.41412,35.67280852,-105.9880776,6/27/1974,6717.76,1974-06-27
2533,19S.04W.12.421,32.67063417,-107.1997423,6/27/1974,4058.32,1974-06-27
2534,19S.04W.12.421D,32.67063417,-107.1997423,6/27/1974,4058.24,1974-06-27
2535,19S.04W.12.421B,32.67063417,-107.1997423,6/27/1974,4057.88,1974-06-27
2536,19S.04W.12.421A,32.67063417,-107.1997423,6/27/1974,4056.96,1974-06-27
2537,19S.04W.12.421C,32.67063417,-107.1997423,6/27/1974,4056.96,1974-06-27
2538,23S.01E.10.134,32.32259279,-106.8341726,6/27/1974,3891.84,1974-06-27
2539,23S.01E.34.423D,32.26092787,-106.8233382,6/27/1974,3874.43,1974-06-27
2540,15S.05W.32.444,32.95507209,-107.3689147,7/2/1974,4491.37,1974-07-02
2541,16N.09E.06.121,35.65197556,-106.0303003,7/3/1974,6147.4,1974-07-03
2542,15S.06W.24.413,32.98673834,-107.4097491,7/9/1974,4522.79,1974-07-09
2543,15S.06W.24.413+DUP,32.98763889,-107.4141944,7/9/1974,4516.72,1974-07-09
2544,15S.05W.30.213,32.97979395,-107.3953043,7/9/1974,4460.22,1974-07-09
2545,16S.06W.22.223,32.90658333,-107.4389444,7/10/1974,4593.74,1974-07-10
2546,16S.06W.24.231,32.90455556,-107.4074722,7/10/1974,4431.14,1974-07-10
2547,16S.05W.21.141,32.90396203,-107.3614142,7/10/1974,4338.39,1974-07-10
2548,11N.03E.24.221 COR 1,35.17365517,-106.5719691,7/13/1974,4953.85,1974-07-13
2549,17S.05W.03.432,32.85479618,-107.3389133,7/13/1974,4231.69,1974-07-13
2550,16S.05W.36.144,32.87368433,-107.307524,7/13/1974,4159.4,1974-07-13
2551,17N.09E.18.324,35.70169637,-106.028634,7/22/1974,6203.3,1974-07-22
2552,17N.09E.08.33424,35.71225169,-106.0144672,7/24/1974,6337.06,1974-07-24
2553,16S.01W.09.313,32.93007624,-106.9552955,7/25/1974,4492.97,1974-07-25
2554,15S.01W.36.111,32.96618725,-106.9052946,7/25/1974,4466.03,1974-07-25
2555,16S.01W.10.324,32.92979872,-106.9319614,7/25/1974,4444.05,1974-07-25
2556,16S.01W.09.424,32.92924308,-106.9411284,7/25/1974,4430.28,1974-07-25
2557,16S.02W.25.233,32.89063206,-106.999185,7/26/1974,4431.56,1974-07-26
2558,17S.02W.11.213,32.85035476,-107.0161291,7/26/1974,4399.37,1974-07-26
2559,17S.02W.29.311+DUP,32.79924358,-107.0761296,7/30/1974,4396.92,1974-07-30
2560,15S.05W.23.411,32.99034879,-107.3236363,7/31/1974,4300.93,1974-07-31
2561,15S.05W.23.412,32.98923768,-107.3211363,7/31/1974,4285.78,1974-07-31
2562,18S.02W.11.441,32.7523011,-107.0116829,7/31/1974,4045.95,1974-07-31
2563,01S.74W.11.424,36.97085399,-105.6283447,8/2/1974,7338.84,1974-08-02
2564,18S.01E.02.231,32.77508049,-106.8097329,8/2/1974,4149.25,1974-08-02
2565,18S.02W.36.321,32.69896968,-106.9855705,8/2/1974,4037.6,1974-08-02
2566,23N.10E.36.310,36.18113488,-105.8358512,8/13/1974,6183.15,1974-08-13
2567,23N.10E.29.230,36.19946766,-105.8991859,8/16/1974,5942.47,1974-08-16
2568,22N.09E.03.310,36.16696734,-105.9794657,8/21/1974,5844.87,1974-08-21
2569,15N.08E.07.34123,35.5394787,-106.1358559,8/22/1974,5968.69,1974-08-22
2570,23N.10E.27.314,36.19502343,-105.8711297,8/28/1974,6060.08,1974-08-28
2571,NA04100636DCC,37.74916883,-106.2683651,9/5/1974,7725.81,1974-09-05
2572,NA03400906BAB,37.22473116,-106.032247,9/5/1974,7654.87,1974-09-05
2573,NA04100806BCC,37.82861189,-106.1472489,9/5/1974,7631.14,1974-09-05
2574,NA04400906DAA RG05,38.0936106,-106.013906,9/5/1974,7622.72,1974-09-05
2575,NA04401006BBB2 RG04,38.10055477,-105.9214033,9/5/1974,7622.52,1974-09-05
2576,NA03801202DAD RG45,37.56667079,-105.621404,9/5/1974,7589.44,1974-09-05
2577,NA04100936DDD RG28,37.74972185,-105.928911,9/5/1974,7563.55,1974-09-05
2578,NA04301006BCC RG09,38.00638821,-105.9219603,9/5/1974,7562.45,1974-09-05
2579,NA03700930CCC,37.41556112,-105.9280784,9/5/1974,7553.19,1974-09-05
2580,NA04200936DDD1 RG23,37.83583286,-105.9291867,9/5/1974,7548.61,1974-09-05
2581,NA04201001AAA RG15,37.91805485,-105.8272381,9/5/1974,7542.91,1974-09-05
2582,NA04001106BBB RG27,37.75027746,-105.8180753,9/5/1974,7536.78,1974-09-05
2583,NA04001232BAA  RG42,37.6700017,-105.6850167,9/5/1974,7535.62,1974-09-05
2584,NA04201034CDD2 RG24,37.83777728,-105.8725188,9/5/1974,7534.97,1974-09-05
2585,15N.08E.07.32334,35.540312,-106.1364114,9/5/1974,5960.96,1974-09-05
2586,JL-49-15-504,31.818889,-106.185278,9/16/1974,3683.71,1974-09-16
2587,21S.01E.32.344,32.43120074,-106.8644527,9/18/1974,3909.78,1974-09-18
2588,23S.01E.13.411A+DUP,32.30759352,-106.7936156,10/2/1974,3867.5,1974-10-02
2589,21S.01W.25.232,32.45481099,-106.8925094,10/4/1974,3941.8,1974-10-04
2590,NA03701201DDD,37.47583952,-105.6041815,10/5/1974,7596.16,1974-10-05
2591,23S.01E.26.133,32.27981628,-106.8188938,10/15/1974,3872.94,1974-10-15
2592,12N.02E.14.321,35.26948474,-106.7036396,10/29/1974,4940.94,1974-10-29
2593,13N.07E.10.231,35.37226106,-106.185023,11/1/1974,6483.78,1974-11-01
2594,16N.08E.06.233,35.64669759,-106.1314125,11/8/1974,6419.53,1974-11-08
2595,16N.08E.11.222C,35.63808699,-106.0553005,11/9/1974,6174.63,1974-11-09
2596,18S.05W.10.212,32.76368698,-107.3389126,11/12/1974,4232.18,1974-11-12
2597,10N.04E.30.243 RID 3,35.06998611,-106.553375,11/15/1974,4917.72,1974-11-15
2598,JL-49-14-606,31.809445,-106.253612,11/20/1974,3703.18,1974-11-20
2599,15N.08E.25.3323,35.4961467,-106.0514105,11/26/1974,6110.58,1974-11-26
2600,15N.08E.25.3341,35.49448008,-106.0508549,11/26/1974,6067.17,1974-11-26
2601,NA03301031DDD RG96,37.05001451,-105.9116857,12/1/1974,7757.62,1974-12-01
2602,NA03300901CCC,37.12306774,-105.9464098,12/1/1974,7738.25,1974-12-01
2603,NA03301017BBB,37.10779085,-105.9105755,12/1/1974,7704.26,1974-12-01
2604,29S.04E.17.121,31.79177403,-106.5597109,12/4/1974,3733.24,1974-12-04
2605,29S.04E.18.222,31.791774,-106.5658222,12/4/1974,3729.37,1974-12-04
2606,15N.09E.25.3124B,35.49948038,-105.9430757,12/10/1974,6512.68,1974-12-10
2607,15N.09E.25.3124A,35.49948038,-105.9430757,12/10/1974,6512.64,1974-12-10
2608,15N.09E.25.3124,35.49948038,-105.9430757,12/10/1974,6512.5,1974-12-10
2609,15N.09E.11.113,35.54947881,-105.9650209,12/10/1974,6476.06,1974-12-10
2610,15N.09E.14.33222,35.52614616,-105.960854,12/10/1974,6472.82,1974-12-10
2611,15N.09E.14.33222A,35.52614616,-105.960854,12/10/1974,6471.44,1974-12-10
2612,15N.09E.03.431,35.55392307,-105.9730766,12/10/1974,6431.83,1974-12-10
2613,15N.09E.25.42432,35.49781385,-105.9314089,12/12/1974,6561.4,1974-12-12
2614,15N.09E.25.2442,35.50225818,-105.9302977,12/12/1974,6549.88,1974-12-12
2615,15N.09E.25.12442,35.50503581,-105.938909,12/12/1974,6497.8,1974-12-12
2616,NA03300923BCC,37.08667947,-105.9636319,1/1/1975,7793.9,1975-01-01
2617,NA03300913CBB,37.10084605,-105.9466873,1/1/1975,7763.06,1975-01-01
2618,17N.09E.02.3311,35.72864049,-105.965022,1/1/1975,6570.22,1975-01-01
2619,17N.09E.21.12213,35.69641893,-105.9933556,1/1/1975,6208.79,1975-01-01
2620,NA03801106CBB,37.56750308,-105.8222425,1/6/1975,7537.6,1975-01-06
2621,16N.08E.06.233A,35.64669759,-106.1314125,1/8/1975,6417.53,1975-01-08
2622,21N.08E.26.211,36.03030082,-106.0622453,1/12/1975,5611.34,1975-01-12
2623,JL-49-13-511,31.8270515,-106.4230415,1/20/1975,3644.6,1975-01-20
2624,MBOWN-371 29S.04E.07.1112,31.80760679,-106.581656,1/21/1975,3733.16,1975-01-21
2625,18S.04W.16.112,32.75007499,-107.2616888,1/27/1975,4086.79,1975-01-27
2626,10N.02E.29.242,35.07060199,-106.7472496,2/4/1975,4949.88,1975-02-04
2627,15N.08E.01.440,35.55336727,-106.0383552,2/20/1975,6153.82,1975-02-20
2628,22N.09E.03.330,36.16307847,-105.9794657,2/26/1975,5779.55,1975-02-26
2629,JL-49-13-828,31.76594199,-106.4563752,2/28/1975,3613.05,1975-02-28
2630,JL-49-15-406,31.811112,-106.244722,3/1/1975,3686.33,1975-03-01
2631,23N.10E.26.430,36.19252362,-105.8447402,3/13/1975,6248.2,1975-03-13
2632,JL-49-04-120,31.99,-106.619444,3/13/1975,3781.03,1975-03-13
2633,EB-121,35.73787543,-106.042924,3/14/1975,6138.65,1975-03-14
2634,23N.08E.23.430,36.20613283,-106.0611338,3/14/1975,5994.43,1975-03-14
2635,24N.09E.06.310,36.34057607,-106.0352988,4/1/1975,6338.76,1975-04-01
2636,10S.06W.20.110,33.43145774,-107.4869811,4/1/1975,5373.56,1975-04-01
2637,JL-49-06-105,31.985278,-106.375,4/10/1975,3686.87,1975-04-10
2638,25S.03E.12.441,32.1450975,-106.5858272,4/14/1975,3821.11,1975-04-14
2639,15N.08E.06.22133,35.56447793,-106.1283561,4/16/1975,5915.42,1975-04-16
2640,15N.08E.06.14233,35.56031138,-106.134745,4/16/1975,5862.06,1975-04-16
2641,15N.08E.06.32321,35.55614484,-106.1361338,4/17/1975,5824.41,1975-04-17
2642,15N.08E.06.32221,35.55864477,-106.1336338,4/19/1975,5867.75,1975-04-19
2643,JL-49-14-803,31.760834,-106.320278,4/20/1975,3665.34,1975-04-20
2644,JL-49-21-104,31.7495534,-106.4905425,4/23/1975,3639.81,1975-04-23
2645,15N.08E.06.22124,35.56503347,-106.1261338,4/25/1975,5909.66,1975-04-25
2646,15N.07E.12.421,35.54420076,-106.1450226,4/29/1975,5914.03,1975-04-29
2647,21S.01E.31.111,32.44453354,-106.8858424,5/6/1975,3900.3,1975-05-06
2648,13N.07E.05.432,35.37948305,-106.2191899,5/8/1975,6312.1,1975-05-08
2649,16N.08E.28.134,35.58892166,-106.1055783,5/8/1975,6123.96,1975-05-08
2650,14N.07E.33.422,35.39781594,-106.1961341,5/9/1975,6203.43,1975-05-09
2651,20S.02E.35.244,32.52397699,-106.7172266,5/14/1975,4035.99,1975-05-14
2652,16S.06W.09.112,32.93766667,-107.4669722,5/19/1975,4874.11,1975-05-19
2653,15S.07W.01.241,33.03701625,-107.5094742,5/21/1975,4919.95,1975-05-21
2654,15S.06W.07.142,33.02084444,-107.4993333,5/21/1975,4851.63,1975-05-21
2655,15N.08E.05.340,35.55336717,-106.1183559,5/22/1975,6047.93,1975-05-22
2656,22S.01E.09.111,32.41592348,-106.8516743,5/22/1975,3897.28,1975-05-22
2657,21S.01W.15.242,32.48342108,-106.9227885,5/23/1975,3929.44,1975-05-23
2658,23S.01E.04.434,32.32953699,-106.8416729,5/26/1975,3886.77,1975-05-26
2659,22S.01E.05.142,32.42703418,-106.8650082,6/2/1975,3735.28,1975-06-02
2660,19S.02W.26.312,32.62536038,-107.0216819,6/12/1975,3975.24,1975-06-12
2661,26S.03E.36.123,32.0078785,-106.5938809,6/12/1975,3766.77,1975-06-12
2662,19S.02W.26.223,32.63202699,-107.0102928,6/13/1975,4021.43,1975-06-13
2663,13N.04E.12.112,35.37613489,-106.4742035,6/24/1975,5100.4,1975-06-24
2664,02N.01E.31.313 SEVILLETA HQ,34.35200976,-106.8850279,7/8/1975,4725.55,1975-07-08
2665,MBOWN-63 - 24S.02E.07.231 (EBID-2-NEST),32.23676215,-106.774725,7/31/1975,3854.05,1975-07-31
2666,MBOWN-62 - 24S.01E.13.221A (EBID-5),32.22648446,-106.7894475,7/31/1975,3851.74,1975-07-31
2667,MBOWN-73 - 24S.02E.17.322 (EBID-3),32.21981814,-106.7623353,7/31/1975,3848.54,1975-07-31
2668,29S.03E.13.223,31.7901073,-106.5858225,7/31/1975,3740.5,1975-07-31
2669,17S.05W.01.122,32.86396232,-107.3089128,8/8/1975,4123.56,1975-08-08
2670,11N.04E.22.243,35.1675446,-106.5014121,8/10/1975,5611.58,1975-08-10
2671,15N.08E.04.240,35.56058921,-106.0919668,8/22/1975,6122.68,1975-08-22
2672,NA04200812AAA2,37.90777754,-106.0364101,9/1/1975,7559.27,1975-09-01
2673,NA04101006BBB,37.75027746,-105.8191864,9/1/1975,7537.24,1975-09-01
2674,14N.08E.01.241,35.47475841,-106.0408549,9/4/1975,6156.98,1975-09-04
2675,13S.04W.21.420,33.16340504,-107.2491971,10/1/1975,4271.46,1975-10-01
2676,22N.12E.02.410,36.16669298,-105.6286255,10/5/1975,8119.94,1975-10-05
2677,22N.12E.02.240,36.17030412,-105.6255699,10/10/1975,7869.84,1975-10-10
2678,20N.08E.01.113,35.99946777,-106.0541897,10/16/1975,5615.49,1975-10-16
2679,20N.08E.03.323,36.07641139,-106.0850234,10/17/1975,5877.44,1975-10-17
2680,20N.08E.03.113,36.08363351,-106.0894679,10/17/1975,5825.62,1975-10-17
2681,21N.08E.21.412,36.03585611,-106.0941903,10/17/1975,5601.04,1975-10-17
2682,21N.08E.34.432,36.0033565,-106.0766901,10/17/1975,5555.91,1975-10-17
2683,NA03600905BBB,37.31306262,-106.0391921,11/1/1975,7666.21,1975-11-01
2684,NA04501031CCC,38.11583252,-105.9183475,11/1/1975,7641.23,1975-11-01
2685,NA03900918AAD,37.62944592,-106.0214136,11/1/1975,7604.19,1975-11-01
2686,NA04200902DDD,37.90666613,-105.9472409,11/1/1975,7544.94,1975-11-01
2687,CC03007310CCC RG63,37.44667399,-105.5380687,11/5/1975,7714.33,1975-11-05
2688,11S.05W.26.340,33.31951542,-107.3269791,11/8/1975,4774.37,1975-11-08
2689,NA04501016BBC1,38.15527682,-105.8822348,11/15/1975,7722.79,1975-11-15
2690,02S.08W.06.431,34.15811541,-107.7069917,11/15/1975,6801.98,1975-11-15
2691,13N.08E.26.113,35.32948465,-106.0711333,11/18/1975,6265.69,1975-11-18
2692,13N.08E.32.341,35.30781847,-106.1197449,11/26/1975,6659.93,1975-11-26
2693,13N.08E.34.324,35.30948518,-106.0805779,11/26/1975,6405.86,1975-11-26
2694,23S.02E.30.243,32.27787228,-106.7705589,12/3/1975,3853.03,1975-12-03
2695,JL-49-13-831,31.761667,-106.427778,12/8/1975,3613.42,1975-12-08
2696,25S.03E.28.434,32.09732079,-106.6380504,12/14/1975,3806.05,1975-12-14
2697,NA04501028ACC1,38.1219435,-105.8741796,12/15/1975,7681.89,1975-12-15
2698,26S.03E.15.322,32.04509977,-106.6247157,12/18/1975,3791.65,1975-12-18
2699,25S.03E.13.111,32.14009762,-106.597772,12/20/1975,3813.67,1975-12-20
2700,JL-49-22-124,31.715278,-106.366389,12/29/1975,3653.74,1975-12-29
2701,NA03300936BCC,37.05723599,-105.9464088,1/7/1976,7756.33,1976-01-07
2702,21S.01W.13.341,32.47592147,-106.8997321,1/7/1976,3951.17,1976-01-07
2703,22S.01E.17.244,32.39425737,-106.8547297,1/9/1976,3931.84,1976-01-09
2704,19S.02W.08.341,32.66563618,-107.0727947,1/12/1976,4032.5,1976-01-12
2705,19S.02W.20.222,32.64813692,-107.0602942,1/12/1976,4014.76,1976-01-12
2706,19S.02W.22.122,32.64758174,-107.034738,1/12/1976,4011.54,1976-01-12
2707,19S.02W.27.432,32.62174928,-107.0300154,1/12/1976,4004.87,1976-01-12
2708,20S.02W.02.441,32.59508364,-107.013348,1/12/1976,3996.42,1976-01-12
2709,MBOWN-87 - 24S.02E.21.123 (EBID-4),32.21120728,-106.7452789,1/12/1976,3845.3,1976-01-12
2710,19S.04W.03.212,32.69174396,-107.2355767,1/13/1976,4068.16,1976-01-13
2711,19S.04W.01.333,32.678967,-107.213076,1/13/1976,4061.26,1976-01-13
2712,19S.03W.07.323,32.66757885,-107.1911309,1/13/1976,4059.84,1976-01-13
2713,19S.03W.11.341,32.66591324,-107.1222403,1/13/1976,4043.98,1976-01-13
2714,19S.03W.14.441,32.65174715,-107.1152956,1/13/1976,4042.97,1976-01-13
2715,19S.03W.13.424,32.65480291,-107.0936284,1/13/1976,4030.97,1976-01-13
2716,19S.02W.28.112,32.63397076,-107.0566828,1/13/1976,4024.68,1976-01-13
2717,JL-49-04-102,31.998334,-106.591667,1/13/1976,3780.89,1976-01-13
2718,18S.04W.31.131,32.70341062,-107.2989114,1/14/1976,4190.44,1976-01-14
2719,17S.05W.36.131,32.79146385,-107.3150235,1/14/1976,4109.7,1976-01-14
2720,18S.04W.05.122,32.78007463,-107.2750226,1/14/1976,4107.77,1976-01-14
2721,17S.04W.31.344,32.78063042,-107.2928007,1/14/1976,4097.38,1976-01-14
2722,18S.04W.22.324,32.72618704,-107.2394659,1/14/1976,4082.1,1976-01-14
2723,18S.04W.20.211,32.73590902,-107.2719666,1/14/1976,4080.78,1976-01-14
2724,18S.04W.25.341,32.71091033,-107.2083539,1/14/1976,4075.61,1976-01-14
2725,18S.04W.27.312,32.71424297,-107.2441881,1/14/1976,4071.91,1976-01-14
2726,18S.04W.35.332,32.69618836,-107.2275209,1/14/1976,4063.2,1976-01-14
2727,JL-49-04-801,31.90788153,-106.580546,1/14/1976,3761.98,1976-01-14
2728,17S.05W.01.243,32.86007343,-107.3019682,1/15/1976,4127.77,1976-01-15
2729,17S.05W.26.233,32.80396369,-107.3216904,1/15/1976,4126.51,1976-01-15
2730,17S.05W.12.422,32.84146267,-107.3003014,1/15/1976,4124.17,1976-01-15
2731,17S.05W.25.113,32.80729688,-107.3164125,1/15/1976,4121.56,1976-01-15
2732,18S.04W.07.313,32.7553532,-107.2972451,1/15/1976,4100.62,1976-01-15
2733,18S.05W.12.444,32.75146446,-107.3016896,1/15/1976,4088.31,1976-01-15
2734,MBOWN-156 - 27S.03E.05.4211,31.98760107,-106.6547155,1/15/1976,3779.0,1976-01-15
2735,JL-49-14-415,31.82510747,-106.3705402,1/15/1976,3624.91,1976-01-15
2736,04S.01E.19.420,33.94589929,-106.8728034,1/16/1976,4578.16,1976-01-16
2737,25S.03E.07.312,32.14620858,-106.6805528,1/16/1976,3822.52,1976-01-16
2738,26S.03E.21.111,32.03898874,-106.6499941,1/16/1976,3793.32,1976-01-16
2739,15S.06W.25.414,32.97319444,-107.4062222,1/24/1976,4381.31,1976-01-24
2740,15S.05W.30.343,32.96868311,-107.3966931,1/24/1976,4376.04,1976-01-24
2741,15S.05W.30.432+DUP,32.97034968,-107.3894708,1/24/1976,4373.78,1976-01-24
2742,13S.04W.17.120,33.18479405,-107.2750315,2/1/1976,4349.31,1976-02-01
2743,23S.01E.35.444,32.25787254,-106.8044486,2/1/1976,3859.1,1976-02-01
2744,10N.03E.07.434 BIA WINDMILL,35.10549024,-106.6552202,2/17/1976,4938.21,1976-02-17
2745,JL-49-21-309,31.742222,-106.376667,2/25/1976,3637.51,1976-02-25
2746,01S.01W.27.423,34.19173316,-106.9264182,3/9/1976,4589.17,1976-03-09
2747,22S.01E.25.222,32.37231406,-106.7866717,3/15/1976,3895.24,1976-03-15
2748,22S.02E.30.123,32.36953643,-106.778338,3/15/1976,3892.66,1976-03-15
2749,15N.08E.25.123A,35.5053131,-106.0486327,3/16/1976,6146.08,1976-03-16
2750,16N.08E.32.343,35.56614456,-106.1194671,3/19/1976,5837.54,1976-03-19
2751,15N.08E.25.123,35.5053131,-106.0486327,3/22/1976,6151.08,1976-03-22
2752,15N.08E.22.311A,35.51420172,-106.0880775,3/26/1976,6164.96,1976-03-26
2753,15N.08E.22.311,35.51420172,-106.0880775,3/28/1976,6166.96,1976-03-28
2754,22N.09E.03.440,36.16335634,-105.9658543,4/13/1976,5821.41,1976-04-13
2755,22N.09E.03.414,36.16613408,-105.9694655,4/16/1976,5751.4,1976-04-16
2756,23S.01E.23.433,32.28703839,-106.8094492,4/19/1976,3855.47,1976-04-19
2757,MBOWN-54 - 23S.02E.29.331 (LC-30),32.27398352,-106.7669476,4/28/1976,3850.8,1976-04-28
2758,17N.09E.21.310,35.68780802,-105.9983557,5/6/1976,6230.89,1976-05-06
2759,MBOWN-119 - 26S.01E.18.222A,32.05287623,-106.8719473,5/6/1976,3821.24,1976-05-06
2760,NA03801215CDA,37.65666883,-105.6486268,5/10/1976,7600.5,1976-05-10
2761,NA03701113AAA,37.45972823,-105.7125177,5/11/1976,7563.85,1976-05-11
2762,NA03801235CCC,37.4894501,-105.6386268,5/12/1976,7587.05,1976-05-12
2763,NA03801228DDC,37.50417185,-105.6602941,5/12/1976,7575.37,1976-05-12
2764,14N.08E.03.422,35.47059185,-106.0733551,5/12/1976,6034.55,1976-05-12
2765,NA04001108CCC,37.72194468,-105.8000194,5/13/1976,7543.96,1976-05-13
2766,MBOWN-22 - 23S.01E.11.214A (LC-31),32.32648179,-106.8077829,5/13/1976,3882.05,1976-05-13
2767,15N.08E.24.430B,35.51003519,-106.0427994,5/17/1976,6126.59,1976-05-17
2768,JL-49-14-605,31.803334,-106.256112,5/17/1976,3675.17,1976-05-17
2769,NA04201018BCC,37.88472169,-105.9266855,5/19/1976,7559.73,1976-05-19
2770,NA04301035DCC2,37.92083265,-105.8444606,5/19/1976,7549.58,1976-05-19
2771,15S.05W.30.223+DUP,32.97868284,-107.3919709,5/20/1976,4462.05,1976-05-20
2772,15S.05W.30.223,32.98008333,-107.3889167,5/20/1976,4448.9,1976-05-20
2773,24N.08E.25.142,36.28752109,-106.0472441,6/2/1976,6343.55,1976-06-02
2774,JL-49-13-938,31.77566418,-106.4133187,6/2/1976,3659.67,1976-06-02
2775,JL-49-13-725,31.76760845,-106.4844314,6/7/1976,3626.41,1976-06-07
2776,JL-49-14-720,31.75010969,-106.3566505,6/8/1976,3642.96,1976-06-08
2777,22S.02E.18.331,32.39036916,-106.783894,6/11/1976,3893.55,1976-06-11
2778,18N.09E.31.14223,35.75030609,-106.0283565,6/15/1976,6203.95,1976-06-15
2779,24N.09E.11.124,36.33335471,-105.9547416,6/16/1976,6203.14,1976-06-16
2780,JL-49-13-832,31.77538621,-106.4469306,6/21/1976,3654.76,1976-06-21
2781,21N.07E.25.343,36.01668928,-106.1486356,6/28/1976,6452.3,1976-06-28
2782,18N.08E.05.22114,35.82697079,-106.1108576,6/28/1976,5716.52,1976-06-28
2783,17N.09E.18.22141,35.70975173,-106.0211339,7/1/1976,6242.15,1976-07-01
2784,17N.09E.07.12314,35.72308463,-106.0308564,7/1/1976,6201.11,1976-07-01
2785,22N.09E.03.230,36.17030072,-105.9702988,7/3/1976,5769.55,1976-07-03
2786,JL-49-15-404,31.798334,-106.234167,7/5/1976,3677.36,1976-07-05
2787,JL-49-15-405,31.816944,-106.226667,7/5/1976,3673.05,1976-07-05
2788,JL-49-15-407,31.809445,-106.234445,7/6/1976,3716.44,1976-07-06
2789,15N.08E.25.110B,35.50642418,-106.0519661,7/7/1976,6105.31,1976-07-07
2790,15N.08E.25.110,35.50642418,-106.0519661,7/9/1976,6088.31,1976-07-09
2791,JL-49-22-554,31.68900038,-106.3302602,7/9/1976,3666.41,1976-07-09
2792,21N.08E.05.244,36.08252223,-106.1094683,7/15/1976,5737.38,1976-07-15
2793,23S.02E.29.331,32.27481683,-106.7675032,7/30/1976,3862.45,1976-07-30
2794,23S.02E.29.331A,32.27481683,-106.7675032,7/30/1976,3862.32,1976-07-30
2795,12S.05W.27.340,33.23229411,-107.3442002,8/1/1976,4711.47,1976-08-01
2796,01S.01W.22.340,34.20312203,-106.9339187,8/4/1976,4684.98,1976-08-04
2797,15N.08E.25.110A,35.50642418,-106.0519661,8/19/1976,6107.31,1976-08-19
2798,17N.09E.04.1213,35.73863995,-105.9955782,8/20/1976,6359.54,1976-08-20
2799,15N.08E.25.212,35.51586835,-106.0419661,8/20/1976,6191.84,1976-08-20
2800,15N.08E.25.212A,35.51586835,-106.0419661,8/20/1976,6190.84,1976-08-20
2801,15N.08E.24.344,35.50892411,-106.0458549,8/22/1976,6151.99,1976-08-22
2802,15N.08E.25.110C,35.50642418,-106.0519661,8/22/1976,6109.31,1976-08-22
2803,14S.04W.06.3221A,33.11951582,-107.295307,8/23/1976,4221.14,1976-08-23
2804,14S.04W.06.3221D,33.11951582,-107.295307,8/23/1976,4221.14,1976-08-23
2805,NA03801234DDC2,37.49000562,-105.6433492,8/31/1976,7580.27,1976-08-31
2806,14N.08E.02.241,35.47503617,-106.0580772,8/31/1976,6070.83,1976-08-31
2807,01S.01E.07.123,34.24173365,-106.8833605,8/31/1976,4801.71,1976-08-31
2808,MBOWN-74 - 24S.02E.17.414A (EBID-1-FAR NEST),32.21842932,-106.7566684,9/10/1976,3845.75,1976-09-10
2809,MBOWN-75 - 24S.02E.17.414B (EBID-1-FAR NEST),32.21842932,-106.7569462,9/10/1976,3839.82,1976-09-10
2810,16N.08E.24.2113,35.60864344,-106.0453001,9/13/1976,6146.75,1976-09-13
2811,04S.01E.07.413,33.97312149,-106.8780816,9/17/1976,4533.73,1976-09-17
2812,NA03801125DDD9,37.50444935,-105.7130733,9/20/1976,7526.86,1976-09-20
2813,15N.08E.14.423,35.52697913,-106.0577996,9/23/1976,6210.2,1976-09-23
2814,15N.08E.14.424,35.52697913,-106.0552996,9/25/1976,6200.21,1976-09-25
2815,13S.04W.17.414,33.17618289,-107.2705867,9/27/1976,4385.8,1976-09-27
2816,MBOWN-23 - 23S.01E.13.411B (LC-29),32.30787129,-106.7938933,9/27/1976,3789.6,1976-09-27
2817,15N.08E.04.132,35.56170027,-106.1039114,9/29/1976,6076.41,1976-09-29
2818,MBOWN-66 - 24S.02E.07.234B (EBID-2-NEST),32.23676215,-106.774725,9/30/1976,3850.21,1976-09-30
2819,MBOWN-65 - 24S.02E.07.234A (EBID-2-NEST),32.23676215,-106.774725,9/30/1976,3849.72,1976-09-30
2820,MBOWN-64 - 24S.02E.07.234 (EBID-2-NEST),32.23676215,-106.774725,9/30/1976,3848.68,1976-09-30
2821,04S.01E.07.413+DUP,33.97284372,-106.8783594,10/1/1976,4516.15,1976-10-01
2822,16N.08E.11.222,35.63808699,-106.0553005,10/4/1976,6133.63,1976-10-04
2823,15N.08E.24.342B,35.5108685,-106.0461327,10/12/1976,6127.2,1976-10-12
2824,MBOWN-80 - 24S.02E.17.423E (M-3E),32.21731824,-106.7550017,10/13/1976,3846.24,1976-10-13
2825,MBOWN-79 - 24S.02E.17.423D (M-3D),32.21731824,-106.7550017,10/13/1976,3844.46,1976-10-13
2826,MBOWN-78 - 24S.02E.17.423C (M-3C),32.21731824,-106.7550017,10/13/1976,3840.52,1976-10-13
2827,MBOWN-77 - 24S.02E.17.423B (M-3B),32.21815156,-106.7547239,10/13/1976,3840.34,1976-10-13
2828,15N.08E.24.342,35.5108685,-106.0461327,10/14/1976,6111.2,1976-10-14
2829,17N.09E.25.121,35.681142,-105.9414102,10/15/1976,6919.49,1976-10-15
2830,15N.08E.24.344A,35.50892411,-106.0458549,10/15/1976,6149.99,1976-10-15
2831,15N.08E.24.342A,35.5108685,-106.0461327,10/15/1976,6128.2,1976-10-15
2832,11N.03E.13.242,35.18337709,-106.5705803,10/15/1976,4993.74,1976-10-15
2833,23N.10E.21.211,36.21918983,-105.8827965,11/5/1976,5853.95,1976-11-05
2834,JL-49-13-830,31.76899757,-106.4366525,12/9/1976,3609.29,1976-12-09
2835,14N.09E.18.110,35.44781472,-106.0333549,12/20/1976,6077.39,1976-12-20
2836,15N.08E.02.21223,35.56531134,-106.0591888,1/1/1977,6168.12,1977-01-01
2837,11N.04E.18.124,35.18615482,-106.5622468,1/1/1977,4916.97,1977-01-01
2838,JL-49-23-708,31.66177943,-106.2377575,1/6/1977,3659.81,1977-01-06
2839,NA04300907BBB,37.99416631,-106.0341859,1/11/1977,7579.38,1977-01-11
2840,15N.08E.24.333,35.50920188,-106.0527994,1/24/1977,6123.89,1977-01-24
2841,JL-49-14-603,31.805834,-106.256389,2/2/1977,3674.71,1977-02-02
2842,15N.08E.24.131,35.51809051,-106.0527995,2/9/1977,6137.21,1977-02-09
2843,15N.08E.02.222,35.56586688,-106.0555777,2/14/1977,6147.95,1977-02-14
2844,10S.06W.34.310,33.39645831,-107.4528138,2/15/1977,5191.05,1977-02-15
2845,13N.05E.22.334  (RG 28178),35.3347615,-106.4050247,2/19/1977,5924.95,1977-02-19
2846,05S.09W.24.441,33.85339493,-107.7189329,2/21/1977,6793.34,1977-02-21
2847,05S.09W.23.233,33.85922807,-107.7411558,2/22/1977,6801.84,1977-02-22
2848,05S.09W.23.231,33.86117249,-107.7417114,2/22/1977,6797.72,1977-02-22
2849,04S.10W.32.333,33.91089258,-107.9050506,2/23/1977,6767.29,1977-02-23
2850,05S.11W.01.311,33.90005893,-107.9414404,2/23/1977,6763.48,1977-02-23
2851,05S.11W.22.212,33.86422554,-107.9742186,2/23/1977,6762.38,1977-02-23
2852,15S.05W.30.432,32.97118302,-107.3922486,2/23/1977,4392.34,1977-02-23
2853,04S.08W.04.331,33.98450553,-107.680878,2/24/1977,6799.13,1977-02-24
2854,03S.08W.30.100,34.02172724,-107.7122684,2/24/1977,6793.31,1977-02-24
2855,04S.09W.08.132,33.97617107,-107.7978261,2/24/1977,6793.28,1977-02-24
2856,04S.09W.32.333,33.9086715,-107.8039363,2/24/1977,6791.58,1977-02-24
2857,15N.08E.24.331A,35.51059072,-106.0530772,2/26/1977,6135.33,1977-02-26
2858,15N.08E.24.333A,35.50920188,-106.0527994,2/26/1977,6113.89,1977-02-26
2859,15N.08E.24.331B,35.51059072,-106.0530772,2/28/1977,6163.33,1977-02-28
2860,15N.08E.24.331,35.51059072,-106.0530772,2/28/1977,6125.33,1977-02-28
2861,21N.07E.25.314,36.02002256,-106.1511357,3/2/1977,6242.13,1977-03-02
2862,23N.07E.34.340,36.17585378,-106.1828028,3/4/1977,5808.63,1977-03-04
2863,JL-49-13-625,31.82594061,-106.3952631,3/5/1977,3604.72,1977-03-05
2864,20N.09E.01.4444,35.98641351,-105.9291875,3/9/1977,6124.93,1977-03-09
2865,20N.09E.01.2223,35.99919103,-105.9305764,3/14/1977,6130.55,1977-03-14
2866,15N.08E.25.113,35.50586864,-106.0514105,3/14/1977,6121.07,1977-03-14
2867,18N.09E.24.2424,35.77836187,-105.9297436,3/16/1977,6732.38,1977-03-16
2868,18N.09E.24.4341,35.77002865,-105.9350215,3/16/1977,6678.64,1977-03-16
2869,JL-49-13-901,31.788611,-106.400278,3/21/1977,3872.77,1977-03-21
2870,20N.09E.06.4422,35.98946816,-106.0189114,3/25/1977,5746.35,1977-03-25
2871,20N.09E.05.2443,35.99391261,-106.0019667,3/30/1977,5795.97,1977-03-30
2872,20N.09E.05.3224,35.99196816,-106.0103002,3/30/1977,5752.69,1977-03-30
2873,20N.09E.09.1124,35.98502395,-105.9964111,3/31/1977,5826.37,1977-03-31
2874,20N.09E.04.2234,35.9966905,-105.9852997,4/1/1977,5834.22,1977-04-01
2875,20N.09E.18.11114,35.97085732,-106.0350228,4/1/1977,5693.93,1977-04-01
2876,23N.10E.34.240,36.18474582,-105.8577961,4/4/1977,6222.13,1977-04-04
2877,20N.09E.18.4212,35.96030204,-106.0222449,4/6/1977,5730.59,1977-04-06
2878,20N.09E.18.32221,35.96391305,-106.0283561,4/6/1977,5715.32,1977-04-06
2879,20N.09E.19.22311,35.95474659,-106.0225227,4/8/1977,5781.96,1977-04-08
2880,JL-49-22-125,31.743056,-106.362223,4/19/1977,3638.93,1977-04-19
2881,01S.01W.27.343,34.18812198,-106.9350298,4/20/1977,4613.44,1977-04-20
2882,19N.09E.28.4241,35.84641564,-105.9844667,4/28/1977,6142.15,1977-04-28
2883,15N.09E.33.4444,35.47948064,-105.9830765,5/1/1977,6246.22,1977-05-01
2884,MBOWN-19 - 23S.01E.01.411 (LC-33),32.33620388,-106.7919492,5/1/1977,3850.43,1977-05-01
2885,19N.08E.10.12322,35.89808069,-106.0825237,5/3/1977,5640.7,1977-05-03
2886,14N.08E.01.141,35.47559172,-106.0483549,5/27/1977,6048.24,1977-05-27
2887,18N.10E.20.1443,35.77669546,-105.9041876,6/17/1977,7213.45,1977-06-17
2888,15N.08E.26.222,35.50725749,-106.0552994,6/18/1977,6166.36,1977-06-18
2889,16N.08E.11.222A,35.63808699,-106.0553005,6/30/1977,6167.63,1977-06-30
2890,16N.09E.35.234,35.57420045,-105.9525208,7/18/1977,6513.3,1977-07-18
2891,13S.04W.21.240,33.1667384,-107.249475,7/18/1977,4276.52,1977-07-18
2892,03S.11W.31.342,33.99839038,-108.0297777,7/20/1977,6966.62,1977-07-20
2893,04S.12W.12.413,33.97172374,-108.0453331,7/20/1977,6868.98,1977-07-20
2894,04S.12W.12.414,33.97200156,-108.041722,7/20/1977,6859.1,1977-07-20
2895,04S.11W.02.333,33.9820025,-107.9594979,7/21/1977,6762.1,1977-07-21
2896,04S.11W.10.433,33.96755806,-107.9689424,7/21/1977,6760.36,1977-07-21
2897,14N.08E.01.000,35.47225848,-106.0450216,7/23/1977,6089.99,1977-07-23
2898,17N.09E.25.21442,35.67947545,-105.93391,7/28/1977,7034.96,1977-07-28
2899,18N.10E.06.3424,35.81475015,-105.9211322,7/29/1977,6731.36,1977-07-29
2900,15N.08E.34.324,35.4830915,-106.0811329,8/1/1977,6057.14,1977-08-01
2901,NA04001002CCC,37.73583325,-105.8550206,8/2/1977,7542.5,1977-08-02
2902,17N.09E.33.23411,35.66197548,-105.9889109,8/3/1977,6515.22,1977-08-03
2903,16N.09E.03.1213 A,35.65169808,-105.9777995,8/4/1977,6688.57,1977-08-04
2904,16N.08E.11.1334,35.63142048,-106.069745,8/5/1977,6157.6,1977-08-05
2905,15N.08E.35.4331,35.48059157,-106.0619661,8/17/1977,6066.03,1977-08-17
2906,16N.08E.28.1414,35.58975498,-106.1016894,8/18/1977,6093.58,1977-08-18
2907,14N.08E.02.123,35.47614725,-106.0664106,8/25/1977,6044.54,1977-08-25
2908,15N.09E.31.313,35.50031325,-106.035577,8/26/1977,6041.29,1977-08-26
2909,03S.03W.23.413,34.03228719,-107.1228122,8/30/1977,6626.65,1977-08-30
2910,15N.08E.25.2412,35.50447979,-106.0386326,9/16/1977,6090.63,1977-09-16
2911,05S.12W.34.434A ED FARR,33.82319444,-108.0759444,9/23/1977,6759.07,1977-09-23
2912,05S.12W.34.434B,33.82505789,-108.0761647,9/23/1977,6759.04,1977-09-23
2913,05S.11W.19.113,33.86283591,-108.0350534,9/28/1977,6762.35,1977-09-28
2914,06S.13W.11.244,33.80533488,-108.1467213,9/28/1977,6753.41,1977-09-28
2915,06S.13W.11.243,33.80541667,-108.1467306,9/28/1977,6752.91,1977-09-28
2916,06S.12W.09.114,33.8083912,-108.0886647,9/28/1977,6744.94,1977-09-28
2917,05S.12W.05.14224,33.90450114,-108.1156112,9/29/1977,6763.46,1977-09-29
2918,05S.12W.04.13423,33.90291667,-108.10275,9/29/1977,6762.14,1977-09-29
2919,04S.12W.35.111,33.92311271,-108.0694995,9/29/1977,6759.23,1977-09-29
2920,05S.14W.13.13443,33.87311061,-108.2586689,10/3/1977,6805.21,1977-10-03
2921,02S.01W.02.100,34.16951091,-106.91864,10/3/1977,4621.35,1977-10-03
2922,07S.14W.03.14341,33.73005658,-108.2750561,10/5/1977,6741.96,1977-10-05
2923,JL-49-22-215,31.73372159,-106.29526,10/11/1977,3665.83,1977-10-11
2924,05S.14W.22.233,33.85949932,-108.2875579,10/21/1977,6775.03,1977-10-21
2925,15N.09E.23.234,35.51642428,-105.9525204,10/27/1977,6548.28,1977-10-27
2926,05S.09W.01.111,33.90839445,-107.7333786,10/28/1977,6800.28,1977-10-28
2927,05S.09W.03.221,33.90783872,-107.7539348,10/28/1977,6799.6,1977-10-28
2928,04S.10W.28.222,33.93700383,-107.8742167,10/28/1977,6735.97,1977-10-28
2929,02N.01E.04.444,34.42034223,-106.8347489,11/11/1977,4728.46,1977-11-11
2930,NA03801216DDB1  SNIPPY,37.53639354,-105.6386268,11/29/1977,7572.99,1977-11-29
2931,10S.03W.31.122,33.40479252,-107.1864214,12/1/1977,4405.41,1977-12-01
2932,28N.11E.31.431,36.6139091,-105.8108457,12/8/1977,6946.13,1977-12-08
2933,02S.06W.20.441,34.11506213,-107.4789282,12/14/1977,7086.37,1977-12-14
2934,01S.08W.35.441,34.17152778,-107.6324167,12/14/1977,6808.1,1977-12-14
2935,01S.07W.30.111,34.19811603,-107.6108775,12/14/1977,6803.04,1977-12-14
2936,02S.07W.17.133,34.13475,-107.5936667,12/14/1977,6802.85,1977-12-14
2937,01N.08W.19.14421,34.29755857,-107.7178265,12/15/1977,7195.1,1977-12-15
2938,01S.08W.02.442,34.24950437,-107.6389345,12/15/1977,6824.94,1977-12-15
2939,01N.08W.35.224111,34.25931389,-107.6500556,12/15/1977,6803.33,1977-12-15
2940,01S.08W.10.341,34.23144876,-107.6569905,12/15/1977,6801.99,1977-12-15
2941,01N.08W.36.323113,34.26311534,-107.6322676,12/15/1977,6801.56,1977-12-15
2942,01N.08W.35.123111,34.2685,-107.6426389,12/15/1977,6792.66,1977-12-15
2943,01N.08W.35.324221,34.26366667,-107.6320556,12/15/1977,6781.87,1977-12-15
2944,01S.08W.21.111,34.21194444,-107.68025,12/15/1977,6770.83,1977-12-15
2945,JL-49-13-833,31.77205294,-106.4538752,12/20/1977,3592.34,1977-12-20
2946,08S.07W.16.23214,33.61923225,-107.5625385,1/1/1978,6267.75,1978-01-01
2947,11N.04E.28.131 WKR 4,35.15504484,-106.5322459,1/1/1978,4925.51,1978-01-01
2948,JL-49-13-903,31.78149742,-106.401374,1/9/1978,3628.14,1978-01-09
2949,04N.02E.17.244,34.57458333,-106.6426111,1/14/1978,4783.51,1978-01-14
2950,17N.09E.24.414,35.68697523,-105.9344656,1/27/1978,6983.22,1978-01-27
2951,17N.09E.01.343,35.72697406,-105.9416882,1/27/1978,6838.08,1978-01-27
2952,23N.10E.26.430A,36.19252362,-105.8447402,2/1/1978,6268.2,1978-02-01
2953,02S.01W.35.222,34.09855556,-106.9056667,2/1/1978,4597.65,1978-02-01
2954,13S.04W.21.200,33.16868285,-107.2536418,3/1/1978,4275.39,1978-03-01
2955,16N.08E.26.140,35.58947728,-106.0650224,3/3/1978,6132.78,1978-03-03
2956,JL-49-22-126,31.7428877,-106.3505392,3/3/1978,3653.71,1978-03-03
2957,16N.08E.13.400,35.61308776,-106.0405779,3/14/1978,6163.38,1978-03-14
2958,15N.08E.04.143,35.55947812,-106.1016891,3/21/1978,6095.49,1978-03-21
2959,NA04100731DCC RG33A,37.74833548,-106.2500311,4/1/1978,7692.52,1978-04-01
2960,16N.08E.32.323,35.5703111,-106.1194671,4/7/1978,5980.31,1978-04-07
2961,08S.08W.09.211,33.63700932,-107.6678183,4/12/1978,6423.7,1978-04-12
2962,08S.08W.10.314,33.62784288,-107.6569847,4/12/1978,6399.65,1978-04-12
2963,08S.08W.10.341,33.62589848,-107.6555958,4/12/1978,6397.15,1978-04-12
2964,08S.08W.15.244,33.61673203,-107.6442067,4/12/1978,6371.4,1978-04-12
2965,08S.07W.30.313,33.5850661,-107.6072615,4/12/1978,6268.79,1978-04-12
2966,07S.08W.04.344B,33.72645191,-107.6700411,4/13/1978,6777.07,1978-04-13
2967,14N.08E.19.444,35.42142649,-106.1261334,4/27/1978,5558.21,1978-04-27
2968,15N.08E.04.330,35.55336719,-106.1050224,4/28/1978,6097.88,1978-04-28
2969,15N.09E.30.142,35.50364648,-106.0286326,4/29/1978,5981.23,1978-04-29
2970,07S.08W.21.314,33.68486111,-107.6746111,5/1/1978,6403.09,1978-05-01
2971,08S.08W.31.424,33.57117727,-107.6967073,5/2/1978,6490.66,1978-05-02
2972,08S.08W.32.443,33.56562187,-107.6808737,5/2/1978,6473.02,1978-05-02
2973,08S.08W.22.142,33.60451003,-107.6530957,5/3/1978,6328.46,1978-05-03
2974,08S.08W.18.23414,33.6172874,-107.7014299,5/4/1978,6438.36,1978-05-04
2975,09S.09W.13.313,33.52534484,-107.729763,5/10/1978,6897.47,1978-05-10
2976,09S.08W.19.221,33.52117832,-107.6986514,5/10/1978,6495.32,1978-05-10
2977,09S.08W.16.243,33.53062261,-107.6739289,5/10/1978,6494.95,1978-05-10
2978,09S.08W.08.223,33.54923332,-107.6800403,5/10/1978,6486.41,1978-05-10
2979,08S.08W.26.232,33.59034371,-107.630873,5/10/1978,6271.73,1978-05-10
2980,09S.08W.01.33131,33.55367779,-107.6258728,5/10/1978,6269.37,1978-05-10
2981,09S.08W.15.244,33.52951157,-107.6450396,5/11/1978,6441.82,1978-05-11
2982,09S.08W.13.123,33.53256711,-107.6205949,5/11/1978,6367.52,1978-05-11
2983,15N.08E.05.434A,35.5522561,-106.1125225,5/16/1978,6072.66,1978-05-16
2984,JL-49-13-726,31.755278,-106.473611,5/16/1978,3570.44,1978-05-16
2985,15N.08E.05.422,35.5578115,-106.1083558,5/18/1978,6079.88,1978-05-18
2986,15N.08E.24.430,35.51003519,-106.0427994,5/20/1978,6164.59,1978-05-20
2987,15N.08E.05.434,35.5522561,-106.1125225,5/21/1978,6074.66,1978-05-21
2988,16N.08E.32.343A,35.56614456,-106.1194671,5/23/1978,5955.54,1978-05-23
2989,05S.05W.26.200,33.84839659,-107.32698,5/30/1978,5908.23,1978-05-30
2990,24N.08E.12.423,36.32557622,-106.0400213,6/3/1978,6284.67,1978-06-03
2991,17N.09E.35.141,35.66336457,-105.9594659,6/22/1978,6643.03,1978-06-22
2992,15N.08E.26.323,35.49809109,-106.0655772,7/1/1978,6102.42,1978-07-01
2993,15N.09E.31.440,35.48114712,-106.020577,7/3/1978,6207.66,1978-07-03
2994,10N.02E.09.131,35.11198959,-106.7455833,7/6/1978,4961.0,1978-07-06
2995,15N.08E.24.211,35.52170152,-106.0439106,7/8/1978,6214.88,1978-07-08
2996,03S.04W.09.230,34.06534171,-107.2583696,7/12/1978,6887.14,1978-07-12
2997,03S.05W.31.223,34.00784109,-107.3958709,7/12/1978,6824.76,1978-07-12
2998,03S.05W.14.443,34.04145248,-107.3250369,7/12/1978,6505.17,1978-07-12
2999,03S.05W.27.311,34.01863889,-107.3549167,7/12/1978,6331.78,1978-07-12
3000,04S.07W.01.343,33.98089594,-107.5189281,7/13/1978,6803.14,1978-07-13
3001,04S.06W.13.224,33.96534104,-107.4086486,7/13/1978,6744.27,1978-07-13
3002,04S.05W.07.224,33.97923001,-107.3939263,7/13/1978,6629.85,1978-07-13
3003,03S.06W.21.111,34.03784044,-107.4722609,7/14/1978,6807.9,1978-07-14
3004,03S.06W.29.122,34.023396,-107.484761,7/14/1978,6807.64,1978-07-14
3005,04S.09W.15.333,33.9520049,-107.7692138,7/14/1978,6792.94,1978-07-14
3006,10N.02E.03.422+DUP,35.10921198,-106.7297496,7/23/1978,5035.42,1978-07-23
3007,16N.08E.11.222B,35.63808699,-106.0553005,7/26/1978,6113.63,1978-07-26
3008,16N.08E.20.411,35.60086572,-106.1153007,8/1/1978,6098.36,1978-08-01
3009,21N.08E.01.111,36.08807823,-106.0539117,8/1/1978,5603.36,1978-08-01
3010,13S.04W.15.100+DUP,33.16868289,-107.2455861,8/1/1978,4218.02,1978-08-01
3011,02S.01W.02.300,34.16228866,-106.9186399,8/5/1978,4604.41,1978-08-05
3012,NA04200701AAA1,37.93750035,-106.1464138,8/10/1978,7585.4,1978-08-10
3013,16N.09E.15.320,35.61531023,-105.975577,8/16/1978,6423.3,1978-08-16
3014,12N.02E.16.214,35.27361111,-106.7325,8/21/1978,4942.07,1978-08-21
3015,JL-49-05-913,31.910834,-106.397778,9/25/1978,3626.57,1978-09-25
3016,11N.02E.35.142 LA LUZ DEL SOL,35.14143332,-106.7016937,9/28/1978,4895.96,1978-09-28
3017,15S.05W.30.210,32.98118278,-107.3914154,10/1/1978,4481.68,1978-10-01
3018,JL-49-13-939,31.75288712,-106.4041517,10/6/1978,3658.58,1978-10-06
3019,14N.08E.12.110,35.46198098,-106.0519661,10/7/1978,6043.94,1978-10-07
3020,24N.08E.12.242,36.33057618,-106.0380768,10/13/1978,6281.94,1978-10-13
3021,JL-49-22-127,31.735556,-106.370833,10/19/1978,3632.17,1978-10-19
3022,10N.04E.21.344,35.07282532,-106.5083558,11/3/1978,4985.12,1978-11-03
3023,02S.08W.06.433,34.15422653,-107.7083806,11/15/1978,6805.95,1978-11-15
3024,08S.08W.01.243,33.64589823,-107.6119839,11/15/1978,6286.54,1978-11-15
3025,07S.08W.04.342A,33.72688889,-107.6690833,11/17/1978,6318.16,1978-11-17
3026,21S.03E.31.311,32.43870153,-106.6822241,11/20/1978,4082.47,1978-11-20
3027,27N.09E.24.433,36.5533523,-105.9361275,11/24/1978,6772.74,1978-11-24
3028,02S.01W.10.211,34.15669444,-106.9306389,11/28/1978,4670.2,1978-11-28
3029,10S.06W.29.400,33.40895808,-107.471703,11/29/1978,5280.28,1978-11-29
3030,10N.02E.09.232 COL 2,35.11310072,-106.7339164,12/1/1978,4910.99,1978-12-01
3031,JL-49-22-128,31.73,-106.346945,12/19/1978,3649.23,1978-12-19
3032,10N.04E.28.22,35.06949205,-106.5172448,12/23/1978,4888.77,1978-12-23
3033,14N.06E.18.422,35.44253634,-106.3389134,1/1/1979,5510.06,1979-01-01
3034,11S.06W.32.422,33.30951498,-107.4736462,1/1/1979,5320.68,1979-01-01
3035,10N.04E.21.433 LOM 5,35.07282525,-106.5239117,1/1/1979,4890.63,1979-01-01
3036,10N.04E.28.223 LOM 6,35.06893651,-106.5175226,1/1/1979,4887.92,1979-01-01
3037,JL-49-13-311,31.86982814,-106.4066525,1/8/1979,3629.41,1979-01-08
3038,JL-49-15-302,31.858334,-106.163612,1/15/1979,3695.46,1979-01-15
3039,17N.08E.35.444,35.6536421,-106.054745,1/16/1979,6074.14,1979-01-16
3040,13S.04W.35.133,33.13673834,-107.2303066,2/9/1979,4291.36,1979-02-09
3041,15N.08E.24.430A,35.51003519,-106.0427994,3/5/1979,6131.59,1979-03-05
3042,21N.08E.02.122,36.08780036,-106.0647453,3/7/1979,5640.23,1979-03-07
3043,24N.09E.07.111,36.33446504,-106.0358544,3/9/1979,6290.8,1979-03-09
3044,14N.08E.13.240,35.44475925,-106.0383549,3/9/1979,6064.13,1979-03-09
3045,02S.01W.24.110,34.12701083,-106.9039168,3/15/1979,4677.86,1979-03-15
3046,24N.08E.01.420,36.3408538,-106.0391878,3/19/1979,6316.41,1979-03-19
3047,16N.08E.32.140,35.57475541,-106.1186339,3/23/1979,6097.14,1979-03-23
3048,JL-49-04-170,31.988334,-106.606389,3/25/1979,3730.81,1979-03-25
3049,09S.08W.30.333,33.49256774,-107.7108735,3/29/1979,6524.38,1979-03-29
3050,09S.08W.28.121,33.50534535,-107.6733732,3/29/1979,6514.39,1979-03-29
3051,15N.08E.24.444,35.50920188,-106.0375215,3/30/1979,6171.24,1979-03-30
3052,21N.08E.02.110,36.08724476,-106.0703009,4/1/1979,5633.88,1979-04-01
3053,10S.08W.18.432,33.43673517,-107.7014279,4/4/1979,6534.32,1979-04-04
3054,10S.08W.20.113,33.42951306,-107.6936499,4/4/1979,6504.86,1979-04-04
3055,10S.08W.09.132,33.45756826,-107.6750391,4/4/1979,6488.44,1979-04-04
3056,10S.08W.20.313,33.42312425,-107.6936497,4/4/1979,6437.9,1979-04-04
3057,10S.09W.12.143,33.4564571,-107.7247618,4/5/1979,6701.5,1979-04-05
3058,09S.08W.26.241,33.5014566,-107.629206,4/6/1979,6795.3,1979-04-06
3059,10S.08W.21.224,33.43034642,-107.6611496,4/6/1979,6543.57,1979-04-06
3060,01N.08W.23.42331,34.29283705,-107.6419903,4/19/1979,6805.12,1979-04-19
3061,01N.08W.28.232,34.28450352,-107.6794917,4/19/1979,6797.99,1979-04-19
3062,02S.06W.20.441A,34.11506213,-107.4789282,4/20/1979,7074.07,1979-04-20
3063,02S.07W.12.444,34.14089507,-107.5089289,4/20/1979,7060.04,1979-04-20
3064,02S.07W.11.431,34.14256151,-107.5328187,4/20/1979,6896.12,1979-04-20
3065,02S.06W.08.232,34.15006189,-107.4817062,4/25/1979,7277.22,1979-04-25
3066,02S.06W.09.424,34.14478432,-107.4592059,4/25/1979,7237.34,1979-04-25
3067,03S.06W.02.113A,34.08145151,-107.4389274,4/25/1979,6873.82,1979-04-25
3068,02S.05W.20.444,34.11450734,-107.3739268,4/25/1979,6832.95,1979-04-25
3069,03S.07W.01.222,34.08089547,-107.5075396,4/25/1979,6803.61,1979-04-25
3070,02S.05W.32.113,34.09534066,-107.3905936,4/25/1979,6751.26,1979-04-25
3071,11N.04E.28.111 WKR 3,35.15921137,-106.5325237,4/28/1979,4928.03,1979-04-28
3072,NA04001108DCC,37.72194469,-105.7897415,5/3/1979,7530.36,1979-05-03
3073,03S.08W.14.323,34.04395001,-107.6403217,5/8/1979,6803.67,1979-05-08
3074,03S.08W.20.211,34.0375607,-107.6889344,5/8/1979,6792.81,1979-05-08
3075,02S.08W.35.222,34.09700534,-107.6308773,5/9/1979,6802.63,1979-05-09
3076,02S.07W.31.113,34.09533871,-107.6280995,5/10/1979,6812.22,1979-05-10
3077,03S.07W.05.443,34.0692282,-107.580042,5/10/1979,6805.15,1979-05-10
3078,03S.07W.08.231,34.06367263,-107.5855977,5/10/1979,6805.04,1979-05-10
3079,02S.07W.30.242,34.10756115,-107.596154,5/10/1979,6801.22,1979-05-10
3080,02S.09W.33.122,34.09644838,-107.7794936,5/23/1979,6800.77,1979-05-23
3081,02S.08W.13.330,34.12783853,-107.6272664,5/23/1979,6794.73,1979-05-23
3082,03S.09W.19.412,34.03144838,-107.8092161,5/24/1979,6783.2,1979-05-24
3083,JL-49-07-804,31.885278,-106.199445,6/10/1979,3693.34,1979-06-10
3084,02S.09W.22.443,34.11255967,-107.7547707,7/10/1979,6795.28,1979-07-10
3085,22S.02E.13.2222,32.40286912,-106.683057,7/16/1979,4070.44,1979-07-16
3086,03S.10W.31.212,34.00950282,-107.9150525,8/1/1979,6769.86,1979-08-01
3087,11S.06W.29.220,33.3306258,-107.4744798,8/3/1979,5289.9,1979-08-03
3088,04S.10W.05.333+DUP,33.98283642,-107.9078296,8/29/1979,6771.48,1979-08-29
3089,JL-49-13-935,31.75149829,-106.4019294,9/20/1979,3660.46,1979-09-20
3090,JL-49-14-418,31.805001,-106.360278,10/1/1979,3603.63,1979-10-01
3091,04S.01E.19.243,33.94812151,-106.8728035,10/6/1979,4539.25,1979-10-06
3092,11N.03E.13.242A,35.18393263,-106.5703025,10/10/1979,4946.88,1979-10-10
3093,03S.10W.19.222,34.03922222,-107.9097222,12/4/1979,6766.64,1979-12-04
3094,JL-49-14-419,31.811945,-106.351667,12/17/1979,3622.68,1979-12-17
3095,13N.05E.20.312  (RG 32040),35.34003901,-106.440025,12/31/1979,5448.36,1979-12-31
3096,10N.02E.25.112,35.07199111,-106.6908595,1/1/1980,4937.85,1980-01-01
3097,12S.05W.06.313,33.29340439,-107.4025347,1/1/1980,4885.21,1980-01-01
3098,14S.05W.23.4444,33.0706267,-107.3166944,1/1/1980,4316.41,1980-01-01
3099,07S.03W.08.121,33.72525,-107.1697222,1/11/1980,4875.85,1980-01-11
3100,JL-49-13-307,31.85899513,-106.4060969,1/18/1980,3627.21,1980-01-18
3101,06S.08W.24.411,33.77478493,-107.6161512,1/21/1980,6876.61,1980-01-21
3102,07S.08W.02.311,33.73089641,-107.6417071,1/21/1980,6313.08,1980-01-21
3103,04S.10W.01.224,33.9931151,-107.8225494,1/23/1980,6777.65,1980-01-23
3104,NA03801228DDD1,37.5038941,-105.6569607,1/30/1980,7567.76,1980-01-30
3105,JL-49-22-408,31.703889,-106.355834,2/4/1980,3650.61,1980-02-04
3106,NA04101016BBB2,37.80722178,-105.8916866,3/6/1980,7542.97,1980-03-06
3107,NA04201024DCB1,37.86861052,-105.8266837,3/6/1980,7533.45,1980-03-06
3108,NA04101001DCC1,37.82277729,-105.8266848,3/6/1980,7530.84,1980-03-06
3109,NA04001118BBB1,37.72138911,-105.818631,3/6/1980,7529.27,1980-03-06
3110,11N.02E.21.244 VCL 3,35.16726571,-106.7300279,3/6/1980,4951.75,1980-03-06
3111,JL-49-14-420,31.818611,-106.351667,3/13/1980,3625.23,1980-03-13
3112,JL-49-04-461,31.952778,-106.596389,3/21/1980,3732.38,1980-03-21
3113,11N.02E.03.221,35.21755556,-106.7126111,4/1/1980,4962.61,1980-04-01
3114,JL-49-15-522,31.812501,-106.205001,4/11/1980,3670.43,1980-04-11
3115,JL-49-14-421,31.825,-106.351945,4/24/1980,3642.96,1980-04-24
3116,02S.09W.13.444,34.12644884,-107.716714,5/1/1980,6805.14,1980-05-01
3117,02S.08W.06.314,34.15922646,-107.713103,5/1/1980,6800.06,1980-05-01
3118,02S.08W.07.344,34.14117104,-107.7092138,5/1/1980,6798.79,1980-05-01
3119,03S.07W.01.414,34.07256214,-107.5130953,5/2/1980,6823.12,1980-05-02
3120,-9999,,,5/2/1980,6804.5,1980-05-02
3121,03S.08W.01.310,34.07358333,-107.6246944,5/2/1980,6802.93,1980-05-02
3122,02S.09W.15.11111,34.14089271,-107.7681048,5/6/1980,6900.33,1980-05-06
3123,01S.09W.13.343,34.21422603,-107.7278263,5/6/1980,6801.17,1980-05-06
3124,03S.08W.36.222,34.00922827,-107.6117093,5/6/1980,6800.65,1980-05-06
3125,05S.09W.04.212,33.90756072,-107.7747688,5/6/1980,6788.79,1980-05-06
3126,04S.08W.25.321,33.92867301,-107.6230977,5/7/1980,7448.86,1980-05-07
3127,04S.08W.02.442,33.9822838,-107.6294874,5/7/1980,6866.43,1980-05-07
3128,03S.07W.16.433,34.04019444,-107.5669722,5/8/1980,6811.2,1980-05-08
3129,04S.06W.18.423,33.95728509,-107.4953162,5/9/1980,7466.27,1980-05-09
3130,03S.07W.12.423,34.05730556,-107.5105556,5/9/1980,6803.12,1980-05-09
3131,02S.09W.24.224A,34.12311552,-107.7167139,5/11/1980,6800.35,1980-05-11
3132,CC03107211DBD,37.36278822,-105.4002893,5/20/1980,7835.24,1980-05-20
3133,05N.01W.32.423,34.61394836,-106.960309,5/27/1980,4804.23,1980-05-27
3134,03N.01W.21.332,34.46647222,-106.9564167,5/28/1980,4774.74,1980-05-28
3135,01N.01W.15.443,34.30478805,-106.9244739,5/29/1980,4809.92,1980-05-29
3136,03N.01W.14.114,34.48966667,-106.9178333,5/29/1980,4786.67,1980-05-29
3137,03N.04E.28.244,34.45897222,-106.5258056,5/30/1980,5205.54,1980-05-30
3138,03N.02E.27.123,34.4611753,-106.7236352,5/30/1980,4828.48,1980-05-30
3139,03N.02E.33.222,34.44728667,-106.7180792,5/30/1980,4825.1,1980-05-30
3140,06N.01W.18.440,34.74116704,-106.9775325,6/5/1980,4845.91,1980-06-05
3141,07N.01W.19.124,34.82394196,-106.9844774,6/6/1980,4982.88,1980-06-06
3142,06N.01W.29.130,34.71950099,-106.9722544,6/6/1980,4790.47,1980-06-06
3143,03N.02E.31.431,34.43534228,-106.7725249,6/11/1980,4738.93,1980-06-11
3144,03N.04E.03.110,34.5181191,-106.5152973,6/12/1980,5355.31,1980-06-12
3145,03N.03E.32.310,34.44006469,-106.6455771,6/12/1980,4794.06,1980-06-12
3146,04N.03E.18.220,34.57867259,-106.6594681,6/12/1980,4767.59,1980-06-12
3147,04N.02E.32.100,34.53284027,-106.7586371,6/12/1980,4765.48,1980-06-12
3148,06N.03E.07.240,34.76338965,-106.6597469,6/13/1980,4836.49,1980-06-13
3149,02S.11W.29.244,34.10505713,-107.9958897,6/17/1980,7385.3,1980-06-17
3150,03S.11W.08.33132,34.05700155,-108.0117227,6/17/1980,7004.63,1980-06-17
3151,07N.03E.25.220,34.80894396,-106.5725227,6/18/1980,4813.21,1980-06-18
3152,13N.02E.17.331,35.35069444,-106.7611944,6/20/1980,4999.07,1980-06-20
3153,04S.06W.09.123,33.97895184,-107.4689271,6/23/1980,7109.09,1980-06-23
3154,04S.06W.10.244,33.97422977,-107.441149,6/23/1980,7028.51,1980-06-23
3155,03S.06W.36.312,34.00228541,-107.4205934,6/24/1980,6869.34,1980-06-24
3156,03S.11W.13.131,34.05005791,-107.9422761,6/25/1980,7104.22,1980-06-25
3157,03S.11W.09.424,34.05816667,-107.9784722,6/25/1980,7016.4,1980-06-25
3158,03S.11W.16.424,34.04477973,-107.980055,6/25/1980,7006.39,1980-06-25
3159,03S.11W.29.324,34.0153351,-108.0047775,6/25/1980,6810.2,1980-06-25
3160,02S.10W.29.123,34.10922478,-107.9022756,6/26/1980,7204.19,1980-06-26
3161,03S.10W.05.214,34.07922497,-107.8967194,6/26/1980,7159.9,1980-06-26
3162,03S.11W.27.342,34.01283552,-107.9694987,6/27/1980,6771.71,1980-06-27
3163,03S.11W.25.344,34.01144703,-107.9353309,6/27/1980,6768.19,1980-06-27
3164,03S.10W.07.312,34.06005809,-107.9228312,6/30/1980,7019.1,1980-06-30
3165,01S.03W.07.131,34.23852778,-107.2001111,7/1/1980,5697.71,1980-07-01
3166,05S.01E.30.133,33.84867703,-106.8850262,7/2/1980,4530.88,1980-07-02
3167,05S.01E.17.344+DUP,33.870066,-106.8622471,7/2/1980,4520.72,1980-07-02
3168,06S.01W.12.231,33.80423254,-106.8944711,7/2/1980,4508.97,1980-07-02
3169,06S.01E.05.233,33.81728825,-106.859469,7/2/1980,4507.65,1980-07-02
3170,04S.01E.19.242,33.95089929,-106.8714145,7/3/1980,4541.96,1980-07-03
3171,02S.09W.35.444,34.08422667,-107.7364365,7/4/1980,6804.76,1980-07-04
3172,03S.09W.03.221,34.08061539,-107.755326,7/4/1980,6801.75,1980-07-04
3173,03S.09W.01.212,34.08216667,-107.7214722,7/4/1980,6800.78,1980-07-04
3174,03S.10W.22.444,34.02505897,-107.8572731,7/4/1980,6745.27,1980-07-04
3175,02S.01W.11.420,34.1495109,-106.9075282,7/7/1980,4419.49,1980-07-07
3176,10N.02E.21.433,35.07504636,-106.7344716,7/10/1980,4976.46,1980-07-10
3177,01S.03W.17.124,34.22877778,-107.1767222,7/15/1980,5679.17,1980-07-15
3178,29N.09E.11.320,36.76196207,-105.9586263,7/16/1980,7569.47,1980-07-16
3179,27N.11E.35.311,36.53057662,-105.7477907,7/16/1980,6318.56,1980-07-16
3180,10S.06W.34.312,33.39701386,-107.4514249,7/16/1980,5182.25,1980-07-16
3181,JL-49-31-917,31.501667,-106.142778,7/16/1980,3579.81,1980-07-16
3182,11S.04W.32.413,33.30896026,-107.2719788,7/18/1980,4599.87,1980-07-18
3183,08S.04W.33.321,33.5725667,-107.2589237,7/23/1980,5210.25,1980-07-23
3184,08S.04W.35.113,33.57701124,-107.2272564,7/23/1980,4946.68,1980-07-23
3185,08S.03W.30.342,33.58255556,-107.1850278,7/23/1980,4842.26,1980-07-23
3186,09S.03W.20.232,33.51812416,-107.1639214,7/23/1980,4419.63,1980-07-23
3187,JL-49-40-110,31.492778,-106.123333,7/26/1980,3584.16,1980-07-26
3188,JL-49-40-111,31.493056,-106.123611,7/29/1980,3584.82,1980-07-29
3189,NA03801134DDA1 EW-4U,37.49139392,-105.7489076,7/31/1980,7518.02,1980-07-31
3190,26N.10E.14.322,36.48752022,-105.84696,8/5/1980,7343.41,1980-08-05
3191,25N.11E.28.343,36.36474444,-105.7775152,8/5/1980,6540.55,1980-08-05
3192,06S.05W.24.342,33.76728518,-107.3133682,8/6/1980,5668.85,1980-08-06
3193,10S.05W.21.241,33.43006921,-107.3539245,8/7/1980,5611.36,1980-08-07
3194,10S.05W.21.223,33.43145808,-107.3536467,8/7/1980,5573.74,1980-08-07
3195,07S.04W.28.142,33.67673103,-107.2572566,8/7/1980,5538.07,1980-08-07
3196,08S.04W.09.321,33.62922222,-107.2569722,8/7/1980,5428.08,1980-08-07
3197,07S.04W.27.432,33.6695,-107.2341944,8/7/1980,5212.11,1980-08-07
3198,11S.03W.18.123,33.35895988,-107.1894768,8/7/1980,4400.35,1980-08-07
3199,10S.04W.36.442,33.39340374,-107.1966995,8/9/1980,4390.42,1980-08-09
3200,12S.04W.29.421,33.2367389,-107.2672557,8/11/1980,4340.05,1980-08-11
3201,31N.02E.01.222,36.95779106,-106.1486355,8/13/1980,8213.18,1980-08-13
3202,26N.09E.08.122,36.51668506,-106.0105738,8/14/1980,7248.73,1980-08-14
3203,24N.08E.25.313,36.28140999,-106.0525221,8/16/1980,6168.76,1980-08-16
3204,13N.03E.36.132,35.31531703,-106.5814156,8/21/1980,4937.67,1980-08-21
3205,NA03701113AAA1 EW-2U,37.45972823,-105.7122399,9/3/1980,7554.35,1980-09-03
3206,NA03901201AAB1 EW-23U,37.66305781,-105.6058478,9/4/1980,7664.7,1980-09-04
3207,NA04001127AAD1,37.69027873,-105.7480739,9/11/1980,7528.31,1980-09-11
3208,NA04001115CCC1,37.70944497,-105.7625187,9/11/1980,7528.0,1980-09-11
3209,NA04001135BDB1,37.67361243,-105.7416849,9/11/1980,7527.24,1980-09-11
3210,NA03901207ADB1,37.64472438,-105.6947392,9/11/1980,7526.04,1980-09-11
3211,NA04001108ACC1,37.73027786,-105.7897414,9/12/1980,7529.45,1980-09-12
3212,16N.09E.13.100,35.62114366,-105.9425209,9/13/1980,6835.3,1980-09-13
3213,04S.11W.23.121,33.95172502,-107.954775,9/25/1980,6766.53,1980-09-25
3214,JL-49-14-422,31.831667,-106.352223,10/2/1980,3636.51,1980-10-02
3215,JL-49-22-618,31.68511197,-106.2644252,10/22/1980,3657.94,1980-10-22
3216,JL-49-22-619,31.69205618,-106.2713699,10/22/1980,3656.58,1980-10-22
3217,JL-49-22-616,31.696945,-106.277222,10/22/1980,3656.38,1980-10-22
3218,NA03400924DBB,37.17362222,-105.9352992,11/19/1980,7675.24,1980-11-19
3219,JL-49-13-627,31.794445,-106.401389,11/29/1980,3610.64,1980-11-29
3220,09N.02E.24.244,34.992827,-106.6764141,12/18/1980,4910.33,1980-12-18
3221,22S.02E.13.322A,32.39564708,-106.6913906,12/22/1980,4089.23,1980-12-22
3222,JL-49-13-626,31.82594054,-106.4052633,12/22/1980,3613.08,1980-12-22
3223,JL-49-14-713,31.75288732,-106.3683175,12/29/1980,3632.37,1980-12-29
3224,13S.06W.10.321,33.19308333,-107.4488611,1/1/1981,4824.35,1981-01-01
3225,14S.04W.19.334,33.07090441,-107.2947496,1/1/1981,4235.76,1981-01-01
3226,02N.01E.33.443,34.34564722,-106.8410861,1/20/1981,4687.23,1981-01-20
3227,11S.05W.36.1222,33.31729331,-107.3080901,2/10/1981,4711.73,1981-02-10
3228,13S.04W.01.321,33.20812789,-107.2078086,2/10/1981,4422.3,1981-02-10
3229,12S.03W.07.23344,33.28173888,-107.1844762,2/10/1981,4413.49,1981-02-10
3230,12S.03W.30.112,33.24312818,-107.1933649,2/10/1981,4402.79,1981-02-10
3231,11S.06W.11.442,33.36479219,-107.4211466,2/11/1981,5036.05,1981-02-11
3232,12S.05W.29.1411,33.24007176,-107.3803117,2/11/1981,4787.81,1981-02-11
3233,12S.05W.28.3222,33.23673851,-107.3603116,2/11/1981,4750.18,1981-02-11
3234,12S.05W.02.321,33.2945158,-107.3283678,2/11/1981,4701.67,1981-02-11
3235,14S.05W.09.1333,33.10633333,-107.3672778,2/12/1981,4494.12,1981-02-12
3236,14S.05W.16.2413,33.09368246,-107.3539179,2/12/1981,4434.16,1981-02-12
3237,14S.05W.23.3211,33.07673787,-107.3280836,2/12/1981,4349.97,1981-02-12
3238,12S.04W.03.2213,33.30229387,-107.2328114,2/13/1981,4408.79,1981-02-13
3239,15S.05W.01.4314,33.02868197,-107.3058593,2/13/1981,4198.43,1981-02-13
3240,13S.06W.10.413,33.19118261,-107.444755,2/17/1981,4803.46,1981-02-17
3241,13S.06W.13.4321,33.17423823,-107.4080876,2/17/1981,4710.76,1981-02-17
3242,NA03700821CBD1,37.43472695,-106.1094722,2/24/1981,7625.64,1981-02-24
3243,MBOWN-55 - 23S.02E.29.441 (NMSU-10),32.2742614,-106.7541694,3/1/1981,3838.6,1981-03-01
3244,JL-49-14-804,31.765278,-106.296945,3/16/1981,3664.76,1981-03-16
3245,07S.04W.02.200,33.73673002,-107.2161449,3/25/1981,4953.14,1981-03-25
3246,JL-49-14-513,31.801112,-106.301389,3/28/1981,3710.89,1981-03-28
3247,07S.03W.11.112A,33.7247868,-107.1205888,4/3/1981,4943.3,1981-04-03
3248,03N.01E.14.300,34.48339678,-106.813638,4/24/1981,4754.05,1981-04-24
3249,JL-49-05-614,31.95315904,-106.408042,4/29/1981,3647.76,1981-04-29
3250,CC03107209DAA,37.36639902,-105.4333452,5/13/1981,7820.8,1981-05-13
3251,NA03701201DAA EW-8U,37.47750615,-105.6033481,6/30/1981,7590.36,1981-06-30
3252,NA03801124CAA EW-12U,37.52542111,-105.7212679,7/1/1981,7513.6,1981-07-01
3253,JL-49-15-207,31.842222,-106.180555,9/18/1981,3705.17,1981-09-18
3254,NA03701203DCC EW-7U,37.475006,-105.6439048,9/22/1981,7583.63,1981-09-22
3255,NA03801113DAD  EW 13U,37.53639316,-105.7119621,9/22/1981,7510.86,1981-09-22
3256,JL-49-15-205,31.842222,-106.181111,10/1/1981,3696.95,1981-10-01
3257,JL-49-15-206,31.842222,-106.183055,10/7/1981,3695.39,1981-10-07
3258,JL-49-15-203,31.8375,-106.175,10/31/1981,3715.39,1981-10-31
3259,11N.02E.18.313,35.17958333,-106.7805278,11/25/1981,4952.03,1981-11-25
3260,JL-49-14-722,31.756112,-106.353612,11/30/1981,3629.77,1981-11-30
3261,NA03300928ADD,37.07223506,-105.9833544,12/3/1981,7690.83,1981-12-03
3262,NA03300921CCC,37.08056793,-106.0011327,12/3/1981,7690.31,1981-12-03
3263,03N.02E.17.332,34.48130556,-106.7653611,12/11/1981,4762.65,1981-12-11
3264,NA03300935DBB,37.0566803,-105.9555757,12/14/1981,7690.02,1981-12-14
3265,NA03200912ACC,37.02834796,-105.9369638,12/14/1981,7571.61,1981-12-14
3266,NA03400934BCC,37.14501119,-105.9825221,12/15/1981,7741.26,1981-12-15
3267,NA03301029CBD,37.07001409,-105.9064081,12/15/1981,7717.85,1981-12-15
3268,NA03301019CCD USGS 370447105553101,37.07973577,-105.9258532,12/15/1981,7707.93,1981-12-15
3269,NA03300936DBB,37.0566806,-105.937242,12/15/1981,7689.84,1981-12-15
3270,NA03300934CBB,37.05695763,-105.9827985,12/15/1981,7689.81,1981-12-15
3271,NA03301020CCB,37.08140263,-105.9100195,12/15/1981,7688.67,1981-12-15
3272,NA03300914CCC,37.09390151,-105.9641876,12/16/1981,7694.0,1981-12-16
3273,NA03200901CBB,37.04223636,-105.9461308,12/16/1981,7687.85,1981-12-16
3274,NA03400924CDB,37.16862226,-105.9414104,12/17/1981,7691.58,1981-12-17
3275,JL-49-22-129,31.742222,-106.341945,12/18/1981,3648.19,1981-12-18
3276,JL-49-23-709,31.638611,-106.224167,12/22/1981,3659.51,1981-12-22
3277,JL-49-13-216,31.86232818,-106.4322087,12/23/1981,3626.81,1981-12-23
3278,JL-49-13-727,31.770278,-106.460834,12/28/1981,3566.61,1981-12-28
3279,09N.03E.11.324,35.01858333,-106.5949444,1/6/1982,4893.24,1982-01-06
3280,25S.01E.20.440,32.11120851,-106.8530587,1/12/1982,3847.59,1982-01-12
3281,25S.01E.21.330,32.11120854,-106.8488918,1/12/1982,3823.94,1982-01-12
3282,28S.01E.31.330,31.82093763,-106.8813882,1/13/1982,3808.9,1982-01-13
3283,JL-49-04-802,31.88,-106.5775,1/13/1982,3754.58,1982-01-13
3284,29S.02E.06.120,31.81649444,-106.7752717,1/14/1982,3804.82,1982-01-14
3285,MBOWN-123 - 26S.02E.32.333,31.99843361,-106.7686079,1/15/1982,3790.67,1982-01-15
3286,21S.03E.19.343,32.46036765,-106.6786131,1/18/1982,4081.27,1982-01-18
3287,23S.01E.03.442B,32.33175932,-106.8202834,1/20/1982,3890.01,1982-01-20
3288,23S.01E.03.442A,32.33148156,-106.8200056,1/20/1982,3889.42,1982-01-20
3289,23S.02W.12.332,32.31842488,-107.0019558,1/21/1982,4272.3,1982-01-21
3290,23S.01E.03.442C,32.33203709,-106.8205612,1/21/1982,3890.82,1982-01-21
3291,22S.01E.03.442D,32.33231486,-106.820839,1/21/1982,3889.7,1982-01-21
3292,NA03201006BBB,37.04918093,-105.928075,1/22/1982,7694.73,1982-01-22
3293,23S.01E.03.442,32.33148156,-106.8200056,1/22/1982,3891.43,1982-01-22
3294,JL-49-15-410,31.810556,-106.236945,1/22/1982,3666.71,1982-01-22
3295,11N.02E.18.313C,35.17948728,-106.780307,1/25/1982,4948.45,1982-01-25
3296,11N.02E.18.313D,35.17948728,-106.780307,1/25/1982,4947.35,1982-01-25
3297,10N.01E.22.322,35.0803234,-106.825863,1/25/1982,4917.83,1982-01-25
3298,NA03400924DCC,37.16834456,-105.9358547,1/26/1982,7665.06,1982-01-26
3299,MBOWN-100 - 25S.01E.19.424A,32.11870822,-106.8716707,2/16/1982,3837.23,1982-02-16
3300,25S.02E.31.311,32.09009832,-106.7855553,2/16/1982,3832.74,1982-02-16
3301,MBOWN-108 - 25S.02E.31.312A,32.09120942,-106.7844442,2/16/1982,3831.5,1982-02-16
3302,MBOWN-113 - 26S.01W.04.412,32.07426413,-106.9486178,2/16/1982,3829.76,1982-02-16
3303,MBOWN-120 - 26S.01E.18.222B,32.05287623,-106.8719473,2/16/1982,3819.32,1982-02-16
3304,MBOWN-95 - 25S.02W.30.324,32.10204027,-107.0875115,2/17/1982,4032.35,1982-02-17
3305,26S.01W.25.311,32.01676564,-106.9033371,2/17/1982,3837.86,1982-02-17
3306,21S.03E.31.412,32.43842377,-106.6702792,2/19/1982,4084.81,1982-02-19
3307,21S.03E.19.333,32.4617565,-106.6825022,2/19/1982,4081.15,1982-02-19
3308,21S.03E.31.131,32.44203478,-106.6830575,2/19/1982,4078.12,1982-02-19
3309,21S.02E.25.344,32.44592356,-106.691669,2/19/1982,4075.55,1982-02-19
3310,22S.02E.13.411,32.39509153,-106.7061134,2/19/1982,4015.3,1982-02-19
3311,JL-49-04-179,31.968055,-106.602501,3/8/1982,3768.8,1982-03-08
3312,JL-49-15-204,31.839445,-106.178611,3/15/1982,3708.5,1982-03-15
3313,11N.03E.18.411A,35.18087671,-106.6653045,3/31/1982,4974.64,1982-03-31
3314,10N.03E.34.233,35.05133333,-106.6140556,4/16/1982,4900.89,1982-04-16
3315,10N.03E.33.431,35.04754774,-106.6303025,4/22/1982,4902.59,1982-04-22
3316,JL-49-22-131,31.711945,-106.366667,4/27/1982,3630.92,1982-04-27
3317,JL-49-14-604,31.804167,-106.274167,5/3/1982,3677.32,1982-05-03
3318,JL-49-13-941,31.76066478,-106.3852624,5/19/1982,3668.28,1982-05-19
3319,10N.03E.32.314 SAN JOSE NO. 9,35.04893647,-106.6530808,5/20/1982,4912.43,1982-05-20
3320,09N.03E.05.221,35.04393668,-106.6428027,5/20/1982,4907.39,1982-05-20
3321,13N.04E.34.422,35.31198427,-106.4964138,6/16/1982,5006.48,1982-06-16
3322,JL-49-15-511,31.810556,-106.181667,6/20/1982,3681.95,1982-06-20
3323,JL-49-22-132,31.728333,-106.371111,6/28/1982,3630.24,1982-06-28
3324,10N.03E.32.412,35.05032536,-106.6441917,6/30/1982,4895.32,1982-06-30
3325,16N.09E.12.414,35.62892129,-105.934743,7/23/1982,6963.21,1982-07-23
3326,01N.01W.36.334A,34.26117781,-106.9005837,8/6/1982,4670.14,1982-08-06
3327,01N.01W.36.334I,34.26117781,-106.9005837,8/6/1982,4664.58,1982-08-06
3328,01N.01W.36.334D,34.26117781,-106.9005837,8/6/1982,4664.17,1982-08-06
3329,01N.01W.36.334B,34.26117781,-106.9005837,8/6/1982,4664.02,1982-08-06
3330,01N.01W.36.334E,34.26117781,-106.9005837,8/6/1982,4663.9,1982-08-06
3331,01N.01W.36.334C,34.26117781,-106.9005837,8/6/1982,4663.87,1982-08-06
3332,01N.01W.36.334F,34.26117781,-106.9005837,8/6/1982,4663.85,1982-08-06
3333,01N.01W.36.334G,34.26117781,-106.9005837,8/6/1982,4663.85,1982-08-06
3334,01N.01W.36.334,34.26117781,-106.9005837,8/6/1982,4662.93,1982-08-06
3335,11N.04E.16.422,35.18087735,-106.5339128,8/18/1982,5104.29,1982-08-18
3336,JL-49-06-503,31.94343784,-106.3222063,8/18/1982,3712.37,1982-08-18
3337,22S.02E.11.420,32.40786898,-106.7025023,9/5/1982,4086.3,1982-09-05
3338,JL-49-15-513,31.812778,-106.171667,9/28/1982,3687.35,1982-09-28
3339,NA03200909BDD,37.02779144,-105.9941872,10/1/1982,7669.15,1982-10-01
3340,NA03200913BCC,37.01557034,-105.9458527,10/1/1982,7574.42,1982-10-01
3341,02N.03E.05.434,34.42091667,-106.7533611,10/2/1982,4723.78,1982-10-02
3342,11N.04E.20.241,35.1730998,-106.5378017,10/5/1982,4939.67,1982-10-05
3343,11N.04E.21.121,35.17393315,-106.5280793,10/5/1982,4936.57,1982-10-05
3344,JL-49-21-310,31.735,-106.3825,10/11/1982,3615.9,1982-10-11
3345,NA03301014DDD,37.09501446,-105.8380736,10/20/1982,7703.24,1982-10-20
3346,01N.01W.36.334K,34.26117781,-106.9005837,10/21/1982,4663.53,1982-10-21
3347,01N.01W.36.334J,34.26117781,-106.9005837,10/21/1982,4663.42,1982-10-21
3348,01N.01W.36.334H,34.26117781,-106.9005837,10/21/1982,4662.7,1982-10-21
3349,JL-49-15-608,31.826944,-106.165834,10/30/1982,3699.82,1982-10-30
3350,NA04101012ACC,37.81694397,-105.8269628,12/2/1982,7529.22,1982-12-02
3351,NA04001108CBB,37.72861121,-105.8002972,12/2/1982,7528.53,1982-12-02
3352,NA04101120CBB,37.78666627,-105.8002963,12/3/1982,7536.01,1982-12-03
3353,JL-49-04-484,31.945556,-106.601945,12/4/1982,3771.19,1982-12-04
3354,JL-49-22-130,31.709445,-106.359723,12/15/1982,3654.99,1982-12-15
3355,JL-49-04-748,31.903612,-106.594167,12/16/1982,3771.52,1982-12-16
3356,JL-49-22-946,31.649445,-106.285834,12/20/1982,3584.63,1982-12-20
3357,JL-49-14-303,31.83455229,-106.2772046,12/30/1982,3682.94,1982-12-30
3358,20N.10E.05.12211,36.00169129,-105.9036314,1/3/1983,6429.09,1983-01-03
3359,09S.03W.02.322,33.5570126,-107.1161427,1/15/1983,4419.72,1983-01-15
3360,11N.02E.24.223,35.17147222,-106.6791944,1/18/1983,4975.2,1983-01-18
3361,11N.03E.31.232,35.14115575,-106.662804,1/19/1983,4956.6,1983-01-19
3362,01S.73W.23.314,36.94168927,-105.5377866,1/25/1983,7636.96,1983-01-25
3363,02S.74W.02.244,36.90252184,-105.6277874,1/25/1983,7320.72,1983-01-25
3364,01S.73W.02.221,36.9955,-105.5228333,1/26/1983,7677.88,1983-01-26
3365,30N.13E.18.111,36.84307898,-105.6027856,1/26/1983,7517.09,1983-01-26
3366,30N.12E.02.444,36.85835605,-105.6222307,1/26/1983,7496.22,1983-01-26
3367,01S.74W.35.444,36.91029946,-105.6288988,1/26/1983,7329.6,1983-01-26
3368,30N.12E.16.241,36.84002212,-105.6622308,1/26/1983,7323.25,1983-01-26
3369,17N.09E.32.41234,35.65697551,-106.0064112,1/26/1983,6562.84,1983-01-26
3370,30N.13E.20.422,36.82085801,-105.568618,1/27/1983,7798.46,1983-01-27
3371,02S.73W.16.214,36.87780141,-105.5602857,1/27/1983,7558.53,1983-01-27
3372,17N.09E.29.43433,35.66864184,-106.0089113,1/27/1983,6593.82,1983-01-27
3373,10N.02E.25.213,35.07004678,-106.6819705,1/27/1983,4936.98,1983-01-27
3374,10N.01E.22.322B,35.0803234,-106.825863,1/27/1983,4915.83,1983-01-27
3375,17S.02W.16.242,32.8331324,-107.0430738,1/28/1983,4457.0,1983-01-28
3376,16S.02W.31.134,32.87277778,-107.08775,1/31/1983,4633.81,1983-01-31
3377,26N.12E.26.421,36.45841667,-105.6279444,2/1/1983,6948.78,1983-02-01
3378,25N.12E.21.434,36.36463889,-105.7991944,2/1/1983,6857.86,1983-02-01
3379,25N.11E.29.3334,36.36472222,-105.8005556,2/1/1983,6570.53,1983-02-01
3380,21N.08E.02.2221,36.09163889,-106.0549722,2/2/1983,5680.64,1983-02-02
3381,21N.08E.26.433,36.0144676,-106.0630787,2/2/1983,5599.94,1983-02-02
3382,17N.09E.28.32443,35.66975301,-105.9927999,2/8/1983,6440.48,1983-02-08
3383,16S.02W.25.131,32.89146526,-107.0066852,2/8/1983,4438.88,1983-02-08
3384,16S.02W.25.141,32.88955556,-107.0029167,2/8/1983,4422.31,1983-02-08
3385,JL-49-15-606,31.802778,-106.165278,2/9/1983,3682.07,1983-02-09
3386,JL-49-04-749,31.8875,-106.5975,2/10/1983,3751.01,1983-02-10
3387,11N.04E.10.444,35.19004389,-106.4986345,2/12/1983,5620.16,1983-02-12
3388,16S.02W.29.142,32.88952778,-107.0710556,2/17/1983,4628.56,1983-02-17
3389,MBOWN-17 - 23S.02W.12.341,32.31675824,-107.0036225,2/17/1983,4258.3,1983-02-17
3390,19S.01W.22.124,32.64725,-106.9303333,2/18/1983,4041.27,1983-02-18
3391,14N.08E.30.224,35.41753771,-106.1236334,2/22/1983,5695.13,1983-02-22
3392,13N.03E.36.234,35.31226164,-106.5719709,2/22/1983,4971.59,1983-02-22
3393,15N.07E.13.224,35.53447885,-106.1439114,2/23/1983,5935.23,1983-02-23
3394,06N.02E.30.412B,34.71616861,-106.7697495,2/23/1983,4815.59,1983-02-23
3395,06N.02E.30.412A,34.71616861,-106.7697495,2/23/1983,4815.41,1983-02-23
3396,13S.03W.36.343,33.12863889,-107.1058333,2/23/1983,4709.67,1983-02-23
3397,16S.01W.09.312,32.97285325,-106.9539073,2/23/1983,4543.45,1983-02-23
3398,01S.01W.01.213,34.25784459,-106.8930833,2/24/1983,4671.26,1983-02-24
3399,17N.09E.36.4332,35.6528095,-105.9361321,2/25/1983,6995.62,1983-02-25
3400,07S.03W.11.112B,33.72311111,-107.1200556,3/1/1983,4801.49,1983-03-01
3401,17N.10E.30.121,35.68141991,-105.9244654,3/2/1983,7008.66,1983-03-02
3402,17N.09E.24.343,35.68336416,-105.9414102,3/2/1983,6958.04,1983-03-02
3403,16N.09E.15.143,35.61558798,-105.9780771,3/2/1983,6615.92,1983-03-02
3404,17N.09E.35.2422,35.66194444,-105.9466667,3/3/1983,6787.55,1983-03-03
3405,16N.08E.26.44334,35.5803109,-106.0572445,3/3/1983,6142.94,1983-03-03
3406,16N.08E.26.4443,35.58031091,-106.0558556,3/3/1983,6141.73,1983-03-03
3407,16N.09E.06.4333 GONZALES,35.63947593,-106.0272446,3/4/1983,6130.28,1983-03-04
3408,14N.08E.01.333,35.46503645,-106.0525217,3/8/1983,6023.86,1983-03-08
3409,05N.01E.22.141,34.64811464,-106.8286394,3/18/1983,4810.57,1983-03-18
3410,05N.01E.35.143,34.61839363,-106.7069696,3/18/1983,4784.54,1983-03-18
3411,JL-49-14-611,31.809723,-106.251389,3/20/1983,3634.34,1983-03-20
3412,10N.01E.22.322C,35.0803234,-106.825863,3/25/1983,4918.83,1983-03-25
3413,NA04100832DDA   SAG 7,37.75138945,-106.0964153,3/28/1983,7630.43,1983-03-28
3414,13N.03E.25.241A,35.3300388,-106.5686378,3/29/1983,5041.69,1983-03-29
3415,13N.03E.25.241,35.33031656,-106.5691934,3/29/1983,5034.57,1983-03-29
3416,11N.03E.18.411B,35.18087671,-106.6653045,3/29/1983,4974.85,1983-03-29
3417,11N.03E.18.411C,35.18087671,-106.6653045,3/29/1983,4970.08,1983-03-29
3418,11N.03E.18.411D,35.18087671,-106.6653045,3/29/1983,4969.13,1983-03-29
3419,02N.01E.03.421,34.42700886,-106.8194707,3/30/1983,4732.35,1983-03-30
3420,10N.03E.09.442,35.1044904,-106.627803,3/31/1983,4944.71,1983-03-31
3421,03N.02E.28.311,34.454786,-106.8516942,4/1/1983,4723.44,1983-04-01
3422,JL-49-21-311,31.748611,-106.376111,4/13/1983,3615.54,1983-04-13
3423,10N.02E.27.413,35.06419444,-106.7175556,4/21/1983,4927.72,1983-04-21
3424,09N.02E.10.123,35.02719444,-106.7229167,4/21/1983,4924.19,1983-04-21
3425,JL-49-15-411,31.809723,-106.2375,4/26/1983,3723.9,1983-04-26
3426,NA0400104AAB,37.74805524,-105.873632,5/5/1983,7556.48,1983-05-05
3427,JL-49-15-514,31.817222,-106.171667,5/17/1983,3674.8,1983-05-17
3428,NA03501021CBA,37.25973168,-105.8886326,5/18/1983,7594.31,1983-05-18
3429,NA0350914DCB,37.27223078,-105.9550231,6/6/1983,7605.1,1983-06-06
3430,13N.05E.18.111,35.3633715,-106.4597476,6/21/1983,5077.84,1983-06-21
3431,NA04200723CDD   SAG 6,37.86500084,-106.1741938,7/13/1983,7626.38,1983-07-13
3432,NA03700826ABB  DAVIS,37.42278267,-106.0569707,7/13/1983,7619.63,1983-07-13
3433,JL-49-14-904,31.775833,-106.270278,7/20/1983,3671.77,1983-07-20
3434,JL-49-06-901,31.89121735,-106.2855383,7/23/1983,3689.1,1983-07-23
3435,01N.01E.04.342,34.33701027,-106.8447483,7/26/1983,4716.24,1983-07-26
3436,10N.03E.19.111,35.08699074,-106.6722482,7/28/1983,4939.7,1983-07-28
3437,25S.03E.06.2433,32.16204157,-106.6705528,8/10/1983,3818.29,1983-08-10
3438,25S.03E.06.4214,32.16065271,-106.6691638,8/11/1983,3820.14,1983-08-11
3439,25S.03E.06.4121,32.1617638,-106.6724973,8/11/1983,3819.71,1983-08-11
3440,09N.03E.19.243,34.9944937,-106.6600249,8/19/1983,4913.06,1983-08-19
3441,JL-49-04-750,31.911389,-106.603612,8/30/1983,3761.98,1983-08-30
3442,11N.04E.21.442,35.16171137,-106.5178012,9/11/1983,5315.13,1983-09-11
3443,16N.09E.17.143,35.61780992,-106.0127999,9/14/1983,6242.95,1983-09-14
3444,MBOWN-97 - 25S.01E.06.331,32.15731843,-106.8872275,9/22/1983,3843.36,1983-09-22
3445,JL-49-04-172,31.964723,-106.584722,9/26/1983,3744.84,1983-09-26
3446,07N.01E.33.334,34.78355556,-106.8470833,10/14/1983,4829.81,1983-10-14
3447,11N.04E.16.223,35.18671057,-106.5194682,10/23/1983,5187.46,1983-10-23
3448,JL-49-22-134,31.748056,-106.339722,10/24/1983,3637.52,1983-10-24
3449,JL-49-04-173,31.973611,-106.590834,11/1/1983,3744.69,1983-11-01
3450,15N.09E.03.4342,35.55197869,-105.972521,11/19/1983,6344.68,1983-11-19
3451,11N.04E.21.421,35.16575,-106.5195,11/27/1983,5294.65,1983-11-27
3452,MBOWN-83 - 24S.02E.19.214C (M-1C),32.2103738,-106.7727799,12/1/1983,3852.51,1983-12-01
3453,MBOWN-82 - 24S.02E.19.214B (M-1B),32.2103738,-106.7727799,12/1/1983,3848.73,1983-12-01
3454,MBOWN-81 - 24S.02E.19.214A (M-1A),32.2103738,-106.7727799,12/1/1983,3848.23,1983-12-01
3455,28S.03E.05.4321,31.89677046,-106.6555476,12/6/1983,3764.82,1983-12-06
3456,JL-49-04-488,31.929444,-106.623889,12/10/1983,3753.03,1983-12-10
3457,JL-49-14-423,31.805001,-106.345,12/14/1983,3611.64,1983-12-14
3458,JL-49-13-217,31.862501,-106.422222,12/22/1983,3625.22,1983-12-22
3459,JL-49-13-524,31.82149602,-106.4360974,12/26/1983,3617.44,1983-12-26
3460,JL-49-13-628,31.8298294,-106.3941519,12/26/1983,3598.52,1983-12-26
3461,17S.05W.13.3332,32.82613889,-107.3131944,1/23/1984,4128.75,1984-01-23
3462,14N.01E.02.314,35.46947699,-106.8019792,1/24/1984,5597.3,1984-01-24
3463,MBOWN-71 - 24S.02E.16.124B (M-4B),32.22565144,-106.7441681,1/26/1984,3843.57,1984-01-26
3464,MBOWN-70 - 24S.02E.16.124A (M-4A),32.22565144,-106.7441681,1/26/1984,3842.98,1984-01-26
3465,MBOWN-72 - 24S.02E.16.124C (M-4C),32.22565144,-106.7441681,1/30/1984,3845.81,1984-01-30
3466,MBOWN-103 - 25S.02E.04.114 (USBR-7),32.16731927,-106.7477779,2/1/1984,3846.74,1984-02-01
3467,MBOWN-104 - 25S.02E.23.212 (USBR-6),32.12593122,-106.7063866,2/1/1984,3817.77,1984-02-01
3468,MBOWN-158 - 27S.03E.09.444 (USBR-38),31.96649067,-106.6336036,2/1/1984,3778.74,1984-02-01
3469,MBOWN-246 - JL-49-04-701 (USBR-37),31.88565984,-106.6169355,2/1/1984,3753.45,1984-02-01
3470,MBOWN-212 - JL-49-03-916 (OLD USBR-36),31.87927111,-106.6261022,2/1/1984,3749.61,1984-02-01
3471,JL-49-14-424,31.812501,-106.345,2/6/1984,3623.86,1984-02-06
3472,25S.03E.06.2324,32.1637082,-106.6713862,2/7/1984,3821.64,1984-02-07
3473,11N.04E.22.431,35.16226696,-106.5064121,2/9/1984,5598.19,1984-02-09
3474,25S.03E.06.2221,32.16815255,-106.6683306,2/9/1984,3821.6,1984-02-09
3475,JL-49-15-516,31.818889,-106.177222,2/10/1984,3688.61,1984-02-10
3476,"Well C, 22S.02E.11.344",32.40311111,-106.7090278,2/14/1984,4074.76,1984-02-14
3477,24S.02E.23.413,32.20287407,-106.7083328,2/14/1984,3833.92,1984-02-14
3478,26S.03E.35.141,32.00621182,-106.6094369,2/14/1984,3768.98,1984-02-14
3479,26S.03E.34.243,32.00287854,-106.6180482,2/14/1984,3763.94,1984-02-14
3480,15S.05W.27.334,32.96888889,-107.3446944,2/15/1984,4304.94,1984-02-15
3481,21S.02E.12.222,32.50397763,-106.684725,2/15/1984,4072.42,1984-02-15
3482,04S.01E.32.200,33.92201045,-106.8566914,2/16/1984,4519.61,1984-02-16
3483,25S.03E.06.214,32.16593038,-106.6708306,2/16/1984,3833.75,1984-02-16
3484,25S.03E.08.214+DUP,32.15120847,-106.6538853,2/16/1984,3822.31,1984-02-16
3485,MBOWN-107 - 25S.02E.28.222B,32.11065374,-106.7352761,2/16/1984,3818.32,1984-02-16
3486,JL-49-06-405,31.95482595,-106.3749856,2/18/1984,3658.17,1984-02-18
3487,16S.02E.21.332,32.89924568,-106.7475108,2/20/1984,4959.48,1984-02-20
3488,16S.02E.21.313,32.89952341,-106.7516776,2/20/1984,4942.36,1984-02-20
3489,16S.02E.32.441,32.87063496,-106.755844,2/20/1984,4723.74,1984-02-20
3490,19S.05W.16.231,32.6614685,-107.3586345,2/20/1984,4401.54,1984-02-20
3491,19S.05W.26.224,32.63258013,-107.3164112,2/20/1984,4370.54,1984-02-20
3492,19S.05W.05.123,32.69118995,-107.3797462,2/20/1984,4321.0,1984-02-20
3493,19S.05W.12.112,32.67766667,-107.3123889,2/20/1984,4267.96,1984-02-20
3494,17S.01E.36.222,32.79424706,-106.7855658,2/20/1984,4205.02,1984-02-20
3495,18S.01E.02.221,32.77980266,-106.8058439,2/20/1984,4161.98,1984-02-20
3496,15S.01W.31.324,32.95683333,-106.98575,2/21/1984,4540.77,1984-02-21
3497,15S.01W.36.1131,32.96461111,-106.9034444,2/21/1984,4467.27,1984-02-21
3498,16S.01E.28.2113,32.89424473,-106.8452915,2/21/1984,4374.06,1984-02-21
3499,17S.02W.24.222,32.82063889,-106.9936667,2/21/1984,4332.26,1984-02-21
3500,18S.05W.10.214,32.76375,-107.3385,2/21/1984,4259.23,1984-02-21
3501,17S.05W.27.223+DUP,32.80725,-107.33625,2/21/1984,4146.0,1984-02-21
3502,25S.03E.06.4422,32.15787499,-106.6666636,2/21/1984,3826.4,1984-02-21
3503,25S.02E.10.343,32.14093091,-106.7299988,2/21/1984,3817.64,1984-02-21
3504,25S.02E.35.4224,32.08843201,-106.7005522,2/21/1984,3806.77,1984-02-21
3505,26S.03E.20.134,32.03176665,-106.660272,2/21/1984,3791.04,1984-02-21
3506,16S.02E.31.134,32.87452351,-106.7816781,2/22/1984,4679.91,1984-02-22
3507,18S.03W.05.124,32.77655556,-107.1749167,2/22/1984,4540.85,1984-02-22
3508,17S.02W.16.232,32.83396568,-107.0452961,2/22/1984,4456.58,1984-02-22
3509,17S.02W.29.311,32.80202132,-107.0750185,2/22/1984,4399.25,1984-02-22
3510,17S.02W.11.122,32.84983333,-107.0155833,2/22/1984,4396.1,1984-02-22
3511,17S.05W.05.132,32.86283333,-107.3800833,2/22/1984,4378.42,1984-02-22
3512,MBOWN-14 - 23S.01W.25.444,32.27087152,-106.8889516,2/22/1984,3872.17,1984-02-22
3513,25S.03E.06.4441,32.15565282,-106.6686081,2/22/1984,3817.1,1984-02-22
3514,MBOWN-179 - 28S.01W.07.113A,31.89065697,-106.9908393,2/22/1984,3803.9,1984-02-22
3515,MBOWN-180 - 28S.01W.07.113B,31.89065697,-106.9908393,2/22/1984,3803.42,1984-02-22
3516,15S.03W.26.313+DUP,32.97177778,-107.1263611,2/23/1984,5018.7,1984-02-23
3517,15S.06W.32.441,32.9564618,-107.4766946,2/23/1984,5010.57,1984-02-23
3518,14S.02W.33.423,33.04397222,-107.04425,2/23/1984,4737.08,1984-02-23
3519,15S.06W.28.433,32.96913889,-107.4602222,2/23/1984,4656.17,1984-02-23
3520,23S.03E.27.400+DUP,32.27231677,-106.6147192,2/23/1984,4648.35,1984-02-23
3521,15S.06W.25.423,32.97118314,-107.4089156,2/23/1984,4501.66,1984-02-23
3522,25S.03E.06.2442,32.16287489,-106.6669415,2/23/1984,3824.45,1984-02-23
3523,10S.01E.14.231,33.44229504,-106.8111299,2/28/1984,4628.96,1984-02-28
3524,10S.06W.34.341,33.39645832,-107.4486471,2/29/1984,5193.17,1984-02-29
3525,11S.05W.26.431,33.3239598,-107.325868,2/29/1984,4942.68,1984-02-29
3526,13S.06W.13.4331,33.17505556,-107.4083056,2/29/1984,4717.1,1984-02-29
3527,11S.04W.31.312,33.30922222,-107.2946389,2/29/1984,4676.08,1984-02-29
3528,14S.05W.16.123,33.09463889,-107.3597778,2/29/1984,4471.66,1984-02-29
3529,11S.05W.26.333,33.32062649,-107.3344791,3/1/1984,4788.48,1984-03-01
3530,11S.05W.35.141,33.31513889,-107.3293611,3/1/1984,4768.29,1984-03-01
3531,11S.04W.32.432,33.30923805,-107.2669788,3/1/1984,4593.18,1984-03-01
3532,13S.04W.01.133,33.20979454,-107.2130867,3/1/1984,4445.69,1984-03-01
3533,13S.04W.17.431,33.17452778,-107.2668056,3/1/1984,4322.59,1984-03-01
3534,MBOWN-205 - 29S.01E.06.111,31.82093758,-106.8863884,3/1/1984,3805.13,1984-03-01
3535,10S.04W.27.142,33.41756977,-107.2372565,3/2/1984,4446.35,1984-03-02
3536,10S.03W.18.241,33.44701413,-107.1800326,3/2/1984,4400.07,1984-03-02
3537,JL-49-04-174,31.992222,-106.610556,3/2/1984,3770.72,1984-03-02
3538,25S.01E.21.331,32.11454178,-106.8527809,3/4/1984,4016.98,1984-03-04
3539,MBOWN-184 - 28S.02E.23.222,31.86427126,-106.7024925,3/6/1984,3777.93,1984-03-06
3540,11N.04E.21.432,35.16226688,-106.5222458,3/26/1984,4921.8,1984-03-26
3541,22S.02E.18.111,32.40286882,-106.7838942,3/28/1984,3862.84,1984-03-28
3542,JL-49-15-607,31.810001,-106.165556,3/28/1984,3658.82,1984-03-28
3543,JL-49-14-905,31.78733142,-106.2644263,4/4/1984,3670.4,1984-04-04
3544,JL-49-15-515,31.815556,-106.168055,4/6/1984,3677.08,1984-04-06
3545,05N.02E.15.244,34.66113889,-106.7102778,5/14/1984,4804.53,1984-05-14
3546,JL-49-05-618,31.95427027,-106.3910971,5/21/1984,3640.89,1984-05-21
3547,JL-49-22-138,31.71844378,-106.3744283,6/1/1984,3668.17,1984-06-01
3548,JL-49-21-313,31.74455402,-106.4038738,6/1/1984,3667.15,1984-06-01
3549,JL-49-21-315,31.74483179,-106.403596,6/1/1984,3663.44,1984-06-01
3550,JL-49-22-136,31.71872154,-106.3752616,6/1/1984,3661.5,1984-06-01
3551,JL-49-22-844,31.64150178,-106.310259,6/1/1984,3654.83,1984-06-01
3552,JL-49-13-842,31.7537203,-106.42693,6/1/1984,3640.39,1984-06-01
3553,JL-49-13-945,31.76871994,-106.414152,6/1/1984,3638.88,1984-06-01
3554,JL-49-13-840,31.77010856,-106.4530418,6/1/1984,3629.11,1984-06-01
3555,JL-49-13-837,31.77094187,-106.4524863,6/1/1984,3627.41,1984-06-01
3556,JL-49-22-409,31.68650037,-106.3441494,6/7/1984,3667.04,1984-06-07
3557,JL-49-22-843,31.63816854,-106.3099812,6/7/1984,3651.04,1984-06-07
3558,JL-49-22-842,31.63816852,-106.3135924,6/7/1984,3650.53,1984-06-07
3559,JL-49-30-208,31.62039129,-106.302203,6/7/1984,3645.09,1984-06-07
3560,03N.01E.02.23,34.5175627,-106.8080826,7/3/1984,4750.16,1984-07-03
3561,05N.01E.22.230,34.64728135,-106.825306,8/3/1984,4813.6,1984-08-03
3562,JL-49-13-949,31.76983102,-106.4135964,8/20/1984,3585.17,1984-08-20
3563,NA04301035CAC1 EW-55U,37.92305487,-105.8486273,9/14/1984,7538.49,1984-09-14
3564,JL-49-14-202,31.856496,-106.2963718,9/26/1984,3663.05,1984-09-26
3565,JL-49-05-621,31.95010375,-106.3880415,10/4/1984,3644.2,1984-10-04
3566,JL-49-05-625,31.9501036,-106.4049864,10/4/1984,3643.52,1984-10-04
3567,JL-49-05-626,31.94927028,-106.4058197,10/4/1984,3642.76,1984-10-04
3568,MBOWN-27 - 23S.01E.22.232B (LC-1B),32.29592692,-106.824172,10/10/1984,3885.97,1984-10-10
3569,MBOWN-28 - 23S.01E.22.232C (LC-1C),32.29592692,-106.824172,10/12/1984,3886.57,1984-10-12
3570,MBOWN-30 - 23S.01E.22.241B (LC-2B),32.29592693,-106.8230608,10/20/1984,3881.77,1984-10-20
3571,MBOWN-31 - 23S.01E.22.241C (LC-2C),32.29592693,-106.8230608,10/22/1984,3885.64,1984-10-22
3572,JL-49-05-622,31.94871489,-106.388597,10/24/1984,3640.86,1984-10-24
3573,13N.01E.25.432,35.32305556,-106.7852778,10/31/1984,4973.68,1984-10-31
3574,MBOWN-26 - 23S.01E.22.232A (LC-1A),32.29592692,-106.824172,11/6/1984,3885.67,1984-11-06
3575,MBOWN-29 - 23S.01E.22.241A (LC-2A),32.29592693,-106.8230608,11/10/1984,3874.87,1984-11-10
3576,MBOWN-33 - 23S.01E.23.244A (LC-3A),32.29453824,-106.8033379,11/16/1984,3863.49,1984-11-16
3577,MBOWN-34 - 23S.01E.23.244B (LC-3B),32.29453824,-106.8033379,11/20/1984,3864.79,1984-11-20
3578,13N.06E.11.241  (RG 42651),35.37253865,-106.2700237,11/23/1984,5868.75,1984-11-23
3579,MBOWN-35 - 23S.01E.23.244C (LC-3C),32.29453824,-106.8033379,11/28/1984,3865.19,1984-11-28
3580,03S.01W.23.213,34.0345,-106.9173611,11/30/1984,4566.39,1984-11-30
3581,MBOWN-84 - 24S.02E.19.223A (M-2A),32.21148489,-106.7716688,12/1/1984,3849.96,1984-12-01
3582,JL-49-04-208,31.965001,-106.583055,12/1/1984,3757.68,1984-12-01
3583,MBOWN-85 - 24S.02E.19.223B (M-2B),32.21148489,-106.7716688,12/5/1984,3851.96,1984-12-05
3584,MBOWN-228 - JL-49-04-466 (CWF-4A),31.95343558,-106.6127696,12/5/1984,3771.5,1984-12-05
3585,MBOWN-229 - JL-49-04-467 (CWF-4B),31.95343558,-106.6127696,12/5/1984,3769.16,1984-12-05
3586,MBOWN-231 - JL-49-04-469 (CWF-4D),31.95343558,-106.6127696,12/5/1984,3738.25,1984-12-05
3587,MBOWN-230 - JL-49-04-468 (CWF-4C),31.95343558,-106.6127696,12/5/1984,3725.95,1984-12-05
3588,MBOWN-86 - 24S.02E.19.223C (M-2C),32.21148489,-106.7716688,12/6/1984,3855.26,1984-12-06
3589,16N.09E.16.213,35.62225434,-105.9933552,1/6/1985,6469.81,1985-01-06
3590,JL-49-14-514,31.800556,-106.303612,1/8/1985,3621.04,1985-01-08
3591,JL-49-22-216,31.720833,-106.319167,1/14/1985,3651.48,1985-01-14
3592,MBOWN-232 - JL-49-04-470 (CWF-3A),31.95371337,-106.6072139,1/16/1985,3772.29,1985-01-16
3593,MBOWN-233 - JL-49-04-471 (CWF-3B),31.95371337,-106.6072139,1/16/1985,3769.29,1985-01-16
3594,MBOWN-235 - JL-49-04-473 (CWF-3D),31.95399114,-106.6069361,1/16/1985,3744.75,1985-01-16
3595,MBOWN-234 - JL-49-04-472 (CWF-3C),31.95371337,-106.6072139,1/16/1985,3733.17,1985-01-16
3596,11N.04E.07.313,35.19365456,-106.5683581,1/19/1985,4997.57,1985-01-19
3597,05N.01W.14.233,34.65894733,-106.9125304,1/22/1985,4840.65,1985-01-22
3598,07N.02E.05.233,34.86227526,-106.7547492,1/23/1985,4861.38,1985-01-23
3599,04N.01W.12.341,34.58311611,-106.8989185,1/23/1985,4822.12,1985-01-23
3600,13N.05E.22.241,35.32726174,-106.4019691,1/25/1985,6085.54,1985-01-25
3601,07N.04E.23.122,34.82461111,-106.4936667,1/25/1985,5502.26,1985-01-25
3602,06N.01W.15.331,34.74200053,-106.9372537,1/25/1985,4835.98,1985-01-25
3603,04N.03E.10.423,34.58397222,-106.6096667,1/28/1985,4825.69,1985-01-28
3604,06N.02E.05.333,34.76922269,-106.756416,1/28/1985,4818.77,1985-01-28
3605,01S.01W.26.223,34.19816667,-106.90675,1/29/1985,4630.22,1985-01-29
3606,01S.01W.22.431,34.20569444,-106.9310833,1/29/1985,4619.88,1985-01-29
3607,07N.04E.28.121,34.81172173,-106.5286328,1/30/1985,5449.29,1985-01-30
3608,04N.02E.14.244,34.57355556,-106.6974722,1/30/1985,4787.79,1985-01-30
3609,03N.03E.10.413,34.49534164,-106.6164109,1/30/1985,4786.43,1985-01-30
3610,MBOWN-236 - JL-49-04-474 (CWF-2A),31.95371338,-106.605825,2/4/1985,3772.61,1985-02-04
3611,MBOWN-237 - JL-49-04-475 (CWF-2B),31.95371338,-106.605825,2/4/1985,3767.87,1985-02-04
3612,MBOWN-238 - JL-49-04-476 (CWF-2C),31.95371338,-106.605825,2/4/1985,3736.91,1985-02-04
3613,MBOWN-239 - JL-49-04-477 (CWF-2D),31.95371338,-106.605825,2/4/1985,3730.03,1985-02-04
3614,05S.01W.11.131,33.89172222,-106.9203056,2/5/1985,4969.53,1985-02-05
3615,03S.01W.23.312,34.03416667,-106.9191667,2/5/1985,4571.17,1985-02-05
3616,05S.01E.06.423,33.90105556,-106.8715,2/5/1985,4529.64,1985-02-05
3617,05S.01W.25.422,33.84367702,-106.8878041,2/5/1985,4525.88,1985-02-05
3618,05S.01E.28.212,33.85008333,-106.83675,2/5/1985,4513.44,1985-02-05
3619,07S.02W.34.123,33.66369444,-107.0328056,2/5/1985,4459.26,1985-02-05
3620,08S.03W.36.444,33.56575,-107.0898056,2/5/1985,4433.46,1985-02-05
3621,05S.02W.15.144,33.87697222,-107.0361944,2/6/1985,5466.35,1985-02-06
3622,06S.03W.10.111,33.81256412,-107.1386449,2/6/1985,5258.94,1985-02-06
3623,11N.01E.24.334,35.1605989,-106.7944739,2/6/1985,4949.24,1985-02-06
3624,02S.01W.36.433,34.08636111,-106.8957778,2/6/1985,4595.13,1985-02-06
3625,06S.02E.28.413,33.75478897,-106.7402952,2/6/1985,4536.24,1985-02-06
3626,13N.04E.35.144,35.2908739,-106.4958579,2/7/1985,5205.57,1985-02-07
3627,01N.01W.02.133,34.34256524,-106.9219739,2/7/1985,4788.25,1985-02-07
3628,01N.01W.03.144,34.33972222,-106.9215556,2/7/1985,4780.02,1985-02-07
3629,03N.01W.25.441,34.45200808,-106.8900286,2/7/1985,4759.41,1985-02-07
3630,14S.02W.21.342,33.07133333,-107.0520833,2/11/1985,4708.19,1985-02-11
3631,11N.04E.22.432,35.16166667,-106.5044444,2/13/1985,5596.01,1985-02-13
3632,13N.05E.19.200,35.3239284,-106.4514137,2/14/1985,5481.81,1985-02-14
3633,11N.04E.16.241,35.18476619,-106.5197459,2/14/1985,5265.65,1985-02-14
3634,13N.04E.34.142,35.31652778,-106.5124167,2/14/1985,5049.91,1985-02-14
3635,17S.01E.29.121,32.80730161,-106.8650129,2/14/1985,4129.01,1985-02-14
3636,17S.01E.19.434,32.80952368,-106.8758466,2/14/1985,4113.57,1985-02-14
3637,MBOWN-151 - 27S.02E.21.111,31.94926853,-106.7508284,2/15/1985,3794.85,1985-02-15
3638,MBOWN-240 - JL-49-04-478 (CWF-1A),31.95371338,-106.6044361,2/15/1985,3771.07,1985-02-15
3639,MBOWN-241 - JL-49-04-479 (CWF-1B),31.95371338,-106.6044361,2/15/1985,3763.7,1985-02-15
3640,MBOWN-242 - JL-49-04-480 (CWF-1C),31.95371338,-106.6044361,2/15/1985,3734.39,1985-02-15
3641,MBOWN-243 - JL-49-04-481 (CWF-1D),31.95371338,-106.6044361,2/15/1985,3729.93,1985-02-15
3642,MBOWN-109 - 25S.02E.31.312B,32.09120941,-106.7855554,2/19/1985,3822.13,1985-02-19
3643,19S.02E.33.123A,32.61647425,-106.7452844,2/21/1985,4080.77,1985-02-21
3644,MBOWN-359 25S.03E.17.433,32.12732011,-106.6572183,2/21/1985,3814.63,1985-02-21
3645,MBOWN-207 - 29S.02E.06.122B,31.82166667,-106.7791389,2/21/1985,3794.39,1985-02-21
3646,JL-49-13-629,31.818611,-106.405001,2/21/1985,3586.39,1985-02-21
3647,11N.03E.16.112,35.18865438,-106.6375262,2/27/1985,4986.73,1985-02-27
3648,MBOWN-115 - 26S.01W.16.334,32.04065369,-106.9527843,2/27/1985,3823.18,1985-02-27
3649,MBOWN-101 - 25S.01E.19.424B,32.11870822,-106.8716707,2/28/1985,3850.2,1985-02-28
3650,MBOWN-58 - 24S.02W.36.111,32.18398364,-107.0055657,3/6/1985,3989.66,1985-03-06
3651,JL-49-31-918,31.519722,-106.166944,3/20/1985,3605.6,1985-03-20
3652,JL-49-13-950,31.757223,-106.38,4/1/1985,3600.29,1985-04-01
3653,JL-49-04-482,31.95787998,-106.5899913,4/5/1985,3734.41,1985-04-05
3654,JL-49-15-521,31.798334,-106.185,4/23/1985,3652.22,1985-04-23
3655,JL-49-04-177,31.97149067,-106.5908248,4/29/1985,3763.28,1985-04-29
3656,JL-49-22-139,31.721667,-106.371111,5/22/1985,3613.85,1985-05-22
3657,11N.04E.18.124   SPANISH ASSEMBLY OF GOD CHURCH,35.18559929,-106.5605801,5/23/1985,4942.71,1985-05-23
3658,13N.03E.36.132A SAN MIGUEL,35.31448373,-106.58086,5/24/1985,5009.4,1985-05-24
3659,JL-49-04-176,31.985278,-106.606389,5/27/1985,3748.26,1985-05-27
3660,13N.03E.36.132B,35.3147615,-106.5805822,5/28/1985,5027.93,1985-05-28
3661,JL-49-06-603,31.92760524,-106.2869274,6/6/1985,3694.97,1985-06-06
3662,06N.02E.24.144,34.73188889,-106.6835556,8/31/1985,4824.05,1985-08-31
3663,09N.02E.03.42112,35.0369921,-106.714193,9/12/1985,4922.87,1985-09-12
3664,JL-49-15-512,31.816667,-106.178333,9/19/1985,3712.74,1985-09-19
3665,NA03901218CCD EW-19U,37.62000259,-105.7072396,10/1/1985,7518.46,1985-10-01
3666,JL-49-14-425,31.805278,-106.336667,10/14/1985,3607.81,1985-10-14
3667,JL-49-14-426,31.812778,-106.337222,12/2/1985,3620.71,1985-12-02
3668,11N.06E.08 SAN PEDRO GRANT S01065 S-4,35.19671275,-106.3161411,12/5/1985,6463.73,1985-12-05
3669,JL-49-15-611,31.818055,-106.148334,1/23/1986,3682.25,1986-01-23
3670,JL-48-42-101,31.37,-105.847778,1/26/1986,3549.95,1986-01-26
3671,JL-49-14-427,31.82,-106.337778,2/3/1986,3631.64,1986-02-03
3672,MBOWN-116 - 26S.01W.25.412B,32.01482129,-106.89417,3/26/1986,3820.44,1986-03-26
3673,16N.09E.15.412,35.61614358,-105.9702992,4/18/1986,6751.2,1986-04-18
3674,JL-48-35-701,31.403889,-105.726111,4/23/1986,3704.01,1986-04-23
3675,15N.08E.35.141,35.48836914,-106.0650217,6/2/1986,6095.91,1986-06-02
3676,MBOWN-147 - 27S.01E.04.121 (LANARK),31.99443317,-106.8500564,6/13/1986,3808.96,1986-06-13
3677,MBOWN-98 - 25S.01E.06.333 (AFTON TESTHOLE),32.15676289,-106.8872275,6/20/1986,3845.14,1986-06-20
3678,JL-49-04-178,31.958334,-106.588611,7/1/1986,3731.2,1986-07-01
3679,MBOWN-336 24S.02E.04.322,32.25037316,-106.7444465,7/28/1986,3840.34,1986-07-28
3680,19N.07E.36.3113 SF-2C,35.83335929,-106.1583583,7/29/1986,5404.14,1986-07-29
3681,19N.07E.36.3113 SF-2B,35.83335929,-106.1583583,7/29/1986,5385.88,1986-07-29
3682,09N.02E.15.413,35.00533333,-106.71675,8/8/1986,4903.67,1986-08-08
3683,MBOWN-150 - 27S.02E.13.331 (LA UNION TESTHOLE),31.95482411,-106.7002717,8/23/1986,3784.77,1986-08-23
3684,MBOWN-181 - 28S.01E.34.414,31.82593808,-106.8252743,9/4/1986,3802.7,1986-09-04
3685,JL-49-22-947,31.6325,-106.253889,9/4/1986,3648.49,1986-09-04
3686,17N.09E.35.1314A  Santa Fe 1  Deep Piezo.,35.66253123,-105.9630771,9/26/1986,6802.09,1986-09-26
3687,17N.09E.35.1314B  Santa Fe 1  Middle Piezo.,35.66253123,-105.9630771,9/26/1986,6702.79,1986-09-26
3688,17N.09E.35.1314C  Santa Fe 1  Shallow Piezo.,35.66253123,-105.9630771,9/26/1986,6632.39,1986-09-26
3689,14N.08E.11.2122,35.46448091,-106.0605773,10/3/1986,6038.18,1986-10-03
3690,JL-49-22-304,31.718889,-106.264445,10/23/1986,3611.82,1986-10-23
3691,JL-49-03-334,31.981389,-106.638611,12/3/1986,3774.38,1986-12-03
3692,JL-49-04-416,31.94149151,-106.6113805,12/4/1986,3745.07,1986-12-04
3693,JL-49-04-418,31.93176956,-106.6166583,1/3/1987,3747.46,1987-01-03
3694,10N.02E.23.223,35.07004677,-106.682526,2/12/1987,4929.65,1987-02-12
3695,JL-49-04-508,31.940556,-106.573333,3/4/1987,3742.48,1987-03-04
3696,JL-49-13-218,31.840834,-106.426667,3/9/1987,3620.99,1987-03-09
3697,19N.07E.36.3113 SF-2A,35.83335929,-106.1583583,3/11/1987,5650.95,1987-03-11
3698,JL-49-40-112,31.459723,-106.091111,3/14/1987,3571.95,1987-03-14
3699,JL-49-31-205,31.610001,-106.183889,3/16/1987,3613.27,1987-03-16
3700,22S.03E.09.3111,32.40842454,-106.6480557,4/24/1987,4071.52,1987-04-24
3701,JL-49-04-751,31.897778,-106.593889,4/24/1987,3740.67,1987-04-24
3702,23S.02E.14.431,32.30509388,-106.707779,5/5/1987,3871.28,1987-05-05
3703,23S.02E.06.2413,32.34064837,-106.7711152,8/5/1987,3845.3,1987-08-05
3704,JL-49-14-428,31.82,-106.345556,8/6/1987,3616.68,1987-08-06
3705,10N.03E.26.334,35.05966667,-106.70725,8/19/1987,4919.65,1987-08-19
3706,16N.06E.30.442,35.58336531,-106.3383592,10/13/1987,5220.12,1987-10-13
3707,16N.06E.31.423,35.57114347,-106.3408591,10/13/1987,5217.86,1987-10-13
3708,16N.06E.32.114,35.57725444,-106.3336368,10/13/1987,5213.63,1987-10-13
3709,16N.06E.31.322,35.57225448,-106.3480815,10/13/1987,5206.53,1987-10-13
3710,10N.01E.25.333,35.06004643,-106.7980843,10/31/1987,4892.83,1987-10-31
3711,MBOWN-339 22S.01E.36.314,32.34842572,-106.7983384,11/4/1987,3884.07,1987-11-04
3712,JL-49-13-952,31.77760871,-106.3891515,12/1/1987,3625.01,1987-12-01
3713,10N.02E.29.344,35.06419444,-106.7175556,12/9/1987,4318.68,1987-12-09
3714,10N.01E.36,35.05658333,-106.7841667,12/23/1987,4896.85,1987-12-23
3715,22S.02E.24.342,32.37620313,-106.6925015,1/13/1988,4113.03,1988-01-13
3716,19N.07E.35.4222B,35.83391482,-106.1608583,1/15/1988,5474.47,1988-01-15
3717,19N.07E.35.4212B,35.83419258,-106.162525,1/15/1988,5472.56,1988-01-15
3718,19N.07E.35.4122C,35.83502589,-106.1639139,1/15/1988,5468.43,1988-01-15
3719,19N.07E.35.4222C,35.83391482,-106.1608583,1/15/1988,5463.81,1988-01-15
3720,19N.07E.35.4212C,35.83419258,-106.162525,1/15/1988,5460.97,1988-01-15
3721,19N.07E.35.4122A,35.83502589,-106.1639139,1/15/1988,5455.0,1988-01-15
3722,19N.07E.35.4212A,35.83419258,-106.162525,1/15/1988,5445.42,1988-01-15
3723,19N.07E.35.4222A,35.83391482,-106.1608583,1/15/1988,5440.55,1988-01-15
3724,JL-49-04-491,31.939167,-106.601945,1/26/1988,3769.09,1988-01-26
3725,ELENA GALLEGOS LAND GRNT,35.14337788,-106.6661375,2/19/1988,4961.31,1988-02-19
3726,ELENA GALLEGOS LAND GRANT MONTANO 2 DEEP,35.14337788,-106.6661375,2/19/1988,4958.87,1988-02-19
3727,ELENA GALLEGOS LAND GRANT MONTANO 3 SHALLOW,35.14087802,-106.6541927,2/19/1988,4952.54,1988-02-19
3728,ELENA GALLEGOS LAND GRANT MONTANO 3 DEEP,35.14087802,-106.6541927,2/19/1988,4950.26,1988-02-19
3729,ELENA GALLEGOS LAND GRANT MONTANO 3 MID,35.14087802,-106.6541927,2/19/1988,4950.23,1988-02-19
3730,11N.03E.32.234B MONTANO 4 MID,35.13921145,-106.6441925,2/19/1988,4943.65,1988-02-19
3731,11N.03E.32.234C MONTANO 4 SHALLOW,35.13937811,-106.6445536,2/19/1988,4943.41,1988-02-19
3732,11N.03E.32.234A MONTANO 4 DEEP,35.13921145,-106.6441925,2/19/1988,4941.48,1988-02-19
3733,09N.03E.07.241B RIO BRAVO 3 MID,35.02727045,-106.6594696,2/19/1988,4925.42,1988-02-19
3734,09N.03E.07.241C RIO BRAVO 3 SHALLOW,35.02727045,-106.6594696,2/19/1988,4925.41,1988-02-19
3735,09N.03E.07.241A RIO BRAVO 3 DEEP,35.02727045,-106.6594696,2/19/1988,4925.36,1988-02-19
3736,09N.03E.07.131C RIO BRAVO 2 SHALLOW,35.02727042,-106.6658586,2/19/1988,4924.13,1988-02-19
3737,09N.03E.07.131B RIO BRAVO 2 MID,35.02727042,-106.6658586,2/19/1988,4923.98,1988-02-19
3738,09N.03E.07.131A RIO BRAVO 2 DEEP,35.02727042,-106.6658586,2/19/1988,4923.7,1988-02-19
3739,09N.02E.12.214C RIO BRAVO 1 SHALLOW,35.02699256,-106.6853035,2/19/1988,4922.72,1988-02-19
3740,09N.02E.12.214B RIO BRAVO 1 MID,35.02699256,-106.6853035,2/19/1988,4922.2,1988-02-19
3741,09N.02E.12.214A RIO BRAVO 1 DEEP,35.02699256,-106.6853035,2/19/1988,4922.17,1988-02-19
3742,JL-49-15-613,31.833334,-106.158889,3/7/1988,3663.14,1988-03-07
3743,JL-49-04-804,31.90760376,-106.580546,4/1/1988,3760.42,1988-04-01
3744,11N.01E.27.431,35.14615472,-106.8247525,4/27/1988,4941.23,1988-04-27
3745,16N.06E.32.113,35.57753218,-106.3369702,5/9/1988,5220.01,1988-05-09
3746,ELENA GALLEGOS LAND GRNT MONTANO 2 SHALLOW,35.14337788,-106.6661375,5/23/1988,4962.66,1988-05-23
3747,JL-49-13-953,31.7548316,-106.3880402,5/26/1988,3503.73,1988-05-26
3748,11N.04E.15.434A,35.17532212,-106.5025233,7/8/1988,5621.53,1988-07-08
3749,04N.03E.23.411,34.56055556,-106.5979722,7/16/1988,4901.54,1988-07-16
3750,11N.04E.15.434,35.17532212,-106.5025233,7/17/1988,5620.53,1988-07-17
3751,JL-49-14-431,31.827222,-106.345834,8/15/1988,3607.85,1988-08-15
3752,11N.03E.15.442,35.17726601,-106.604192,8/23/1988,4959.6,1988-08-23
3753,11N.03E.14.134,35.18226587,-106.6000253,8/23/1988,4959.44,1988-08-23
3754,11N.03E.14.131,35.18421023,-106.6041921,8/23/1988,4958.95,1988-08-23
3755,11N.03E.14.141,35.18448803,-106.5997476,8/23/1988,4958.17,1988-08-23
3756,11N.03E.14.312,35.18087703,-106.6003031,8/23/1988,4956.48,1988-08-23
3757,11N.03E.14.331,35.17726602,-106.6019698,8/23/1988,4956.39,1988-08-23
3758,11N.03E.14.314,35.1792104,-106.601692,8/23/1988,4955.27,1988-08-23
3759,JL-49-13-845,31.76649771,-106.4263745,9/8/1988,3633.81,1988-09-08
3760,27N.12E.11.1211,36.59557977,-105.636676,9/16/1988,7448.33,1988-09-16
3761,22S.02E.12.3333,32.40314688,-106.6994466,9/25/1988,4072.26,1988-09-25
3762,27N.13E.32.2123,36.53666667,-105.575,9/28/1988,7477.75,1988-09-28
3763,JL-49-05-321,31.985278,-106.410278,10/11/1988,3673.35,1988-10-11
3764,24N.11E.32.4214,36.26918987,-105.7900162,10/13/1988,5961.27,1988-10-13
3765,26N.13E.19.3433,36.46641436,-105.597233,10/14/1988,7152.25,1988-10-14
3766,JL-49-07-806,31.883055,-106.200278,10/15/1988,3683.44,1988-10-15
3767,JL-49-14-430,31.8275,-106.3375,10/20/1988,3617.64,1988-10-20
3768,09N.01E.18.333,35.00588077,-106.8869753,11/10/1988,4914.91,1988-11-10
3769,MBOWN-52 - 23S.02E.29.141 (NMSU-14),32.28092782,-106.7622253,11/11/1988,3851.27,1988-11-11
3770,JL-48-34-802,31.402778,-105.82,11/12/1988,3729.47,1988-11-12
3771,22S.03E.06.3333,32.41759096,-106.683335,11/15/1988,4072.25,1988-11-15
3772,JL-49-14-108,31.839722,-106.3375,11/21/1988,3628.65,1988-11-21
3773,31N.10E.11.1314,36.94013889,-105.8538056,12/1/1988,7340.73,1988-12-01
3774,31N.11E.14.311,36.92197222,-105.7454167,12/1/1988,7334.29,1988-12-01
3775,29N.10E.11.1143,36.76658333,-105.8528889,12/2/1988,7328.49,1988-12-02
3776,JL-49-14-433,31.832778,-106.337222,12/7/1988,3622.87,1988-12-07
3777,"CLC-40, LRG-430, S-26",32.41738889,-106.674,12/10/1988,4068.85,1988-12-10
3778,09N.01E.18.444,35.00472222,-106.8705556,12/19/1988,4912.3,1988-12-19
3779,JL-49-15-612,31.797222,-106.165001,12/19/1988,3658.76,1988-12-19
3780,JL-49-14-724,31.750556,-106.356945,12/20/1988,3593.2,1988-12-20
3781,NA03901031CCC1,37.57444689,-105.9289116,2/3/1989,7559.85,1989-02-03
3782,13N.06E.11  (RG 50339),35.36976093,-106.2755793,2/11/1989,5838.4,1989-02-11
3783,22S.03E.20.144,32.29426074,-106.6572212,3/17/1989,4055.64,1989-03-17
3784,JL-49-04-181,31.959167,-106.593889,3/19/1989,3716.9,1989-03-19
3785,JL-49-04-805,31.898056,-106.582222,3/30/1989,3755.23,1989-03-30
3786,JL-49-14-515,31.803889,-106.33,4/20/1989,3617.37,1989-04-20
3787,10N.04E.06.342 THS 7,35.12199019,-106.560024,4/21/1989,4901.83,1989-04-21
3788,MBOWN-91 - 24S.02E.23.342B (USBR-9),32.20148521,-106.7099995,4/25/1989,3841.05,1989-04-25
3789,MBOWN-106 - 25S.02E.25.322B (USBR-5),32.10426502,-106.6930523,4/28/1989,3812.26,1989-04-28
3790,MBOWN-253 - JL-49-12-117B (USBR-33),31.85427199,-106.5936012,5/3/1989,3748.31,1989-05-03
3791,MBOWN-250 - JL-49-12-101B (USBR-35),31.84510558,-106.6005457,5/3/1989,3744.43,1989-05-03
3792,JL-48-42-501,31.325,-105.818055,5/14/1989,3564.38,1989-05-14
3793,MBOWN-6 - 22S.01E.09.241A (USBR-26),32.41203478,-106.8405628,5/15/1989,3927.08,1989-05-15
3794,MBOWN-11 - 22S.01E.35.334B (USBR-18),32.34481457,-106.8152834,5/15/1989,3901.37,1989-05-15
3795,MBOWN-68 - 24S.02E.08.434A (USBR-13),32.22842912,-106.7566687,5/15/1989,3859.83,1989-05-15
3796,MBOWN-89 - 24S.02E.22.242B (USBR-10,32.20870729,-106.7186111,5/15/1989,3845.43,1989-05-15
3797,JL-49-14-516,31.809445,-106.330278,5/18/1989,3609.37,1989-05-18
3798,10N.03E.12.331,35.10504616,-106.584191,5/20/1989,4877.31,1989-05-20
3799,JL-49-14-517,31.815001,-106.330278,5/28/1989,3617.96,1989-05-28
3800,JL-49-14-518,31.820555,-106.330833,6/9/1989,3615.01,1989-06-09
3801,22N.12E.09.3144,36.15252576,-105.6730707,6/12/1989,7897.49,1989-06-12
3802,25N.13E.32.3221,36.35669295,-105.5802894,6/13/1989,6908.82,1989-06-13
3803,25N.12E.25.1422,36.37446993,-105.612512,6/13/1989,6858.24,1989-06-13
3804,26N.13E.19.3213,36.47224765,-105.5980663,6/14/1989,7202.76,1989-06-14
3805,25N.12E.36.2434,36.35752572,-105.6055676,6/14/1989,6926.48,1989-06-14
3806,27N.12E.33.1242,36.53557888,-105.6680668,6/14/1989,6793.31,1989-06-14
3807,27N.12E.32.2312,36.53446731,-105.684456,6/14/1989,6711.55,1989-06-14
3808,24N.12E.01.3224,36.34141453,-105.6125123,6/15/1989,6929.59,1989-06-15
3809,25N.12E.24.3123,36.38446984,-105.6144564,6/15/1989,6805.87,1989-06-15
3810,26N.12E.36.3213,36.44335839,-105.6166781,6/16/1989,6983.54,1989-06-16
3811,25N.12E.12.1334,36.41613623,-105.6194562,6/16/1989,6900.49,1989-06-16
3812,25N.12E.14.2431,36.4019695,-105.625012,6/16/1989,6781.35,1989-06-16
3813,10N.04E.18.311 EUB 8,35.09393552,-106.5589126,6/21/1989,4858.99,1989-06-21
3814,JL-49-14-519,31.826111,-106.330833,6/21/1989,3618.75,1989-06-21
3815,MBOWN-213 - JL-49-03-916B (USBR-36),31.87927111,-106.6261022,6/29/1989,3752.66,1989-06-29
3816,JL-49-14-520,31.831667,-106.330833,7/3/1989,3597.98,1989-07-03
3817,JL-49-14-203,31.837222,-106.330833,7/16/1989,3604.77,1989-07-16
3818,09N.02E.23.424,34.99047222,-106.6941111,8/15/1989,4908.75,1989-08-15
3819,22S.02E.13.422,32.39425822,-106.6838903,8/19/1989,4068.43,1989-08-19
3820,MBOWN-24 - 23S.01E.14.241 (USBR-45),32.3106489,-106.8058382,8/30/1989,3876.09,1989-08-30
3821,MBOWN-51 - 23S.02E.29.113 (USBR-47),32.28426102,-106.7683367,8/30/1989,3869.53,1989-08-30
3822,MBOWN-60 - 24S.01E.01.223 (USBR-46),32.25509497,-106.7886148,8/30/1989,3867.87,1989-08-30
3823,MBOWN-61 - 24S.01E.11.112 (USBR-48),32.24231726,-106.8155599,8/30/1989,3867.21,1989-08-30
3824,MBOWN-2 - 21S.01W.24.214 (USBR-42),32.47119944,-106.8927874,8/31/1989,3942.37,1989-08-31
3825,MBOWN-1 - 21S.01W.14.313 (USBR-41),32.47814346,-106.9216773,8/31/1989,3940.92,1989-08-31
3826,MBOWN-4 - 22S.01E.06.124 (USBR-43),32.42786736,-106.880842,8/31/1989,3926.04,1989-08-31
3827,MBOWN-20 - 23S.01E.01.413 (USBR-44),32.33425947,-106.7936159,8/31/1989,3884.59,1989-08-31
3828,MBOWN-172 - 27S.03E.22.221 (USBR-49),31.9503801,-106.6177697,8/31/1989,3773.07,1989-08-31
3829,MBOWN-176 - 27S.03E.35.113 (USBR-50),31.91982548,-106.615547,8/31/1989,3759.85,1989-08-31
3830,JL-49-13-954,31.77344207,-106.4055407,9/21/1989,3625.78,1989-09-21
3831,11N.04E.06.424,35.20727778,-106.5511389,9/25/1989,4947.35,1989-09-25
3832,30N.11E.28.4422,36.80286111,-105.7668056,10/20/1989,7323.18,1989-10-20
3833,26N.12E.25.3213,36.45780279,-105.6158446,10/27/1989,7098.35,1989-10-27
3834,16N.09E.14 110,35.624199,-105.9589101,11/6/1989,6653.93,1989-11-06
3835,16N.09E.14.342,35.61225491,-105.9569656,12/1/1989,6511.83,1989-12-01
3836,JL-49-14-612,31.80316437,-106.2577595,12/7/1989,3672.57,1989-12-07
3837,JL-48-34-903,31.399445,-105.759723,12/18/1989,3724.71,1989-12-18
3838,12N.01E.14.212,35.275,-106.8033333,12/20/1989,4951.22,1989-12-20
3839,JL-49-14-521,31.81066389,-106.3008162,12/20/1989,3643.03,1989-12-20
3840,09N.01E.18.211,35.01430556,-106.8756111,1/1/1990,4932.19,1990-01-01
3841,JL-49-04-753,31.909445,-106.619722,1/9/1990,3756.83,1990-01-09
3842,11N.06E.19.122,35.17091667,-106.3265556,2/22/1990,6618.35,1990-02-22
3843,10N.04E.26.331 FOUR HILLS WELL,35.06133611,-106.494825,3/6/1990,5512.05,1990-03-06
3844,JL-49-13-312,31.85927302,-106.3902631,4/10/1990,3595.36,1990-04-10
3845,07N.03E.10.142,34.85544444,-106.6198611,5/10/1990,4845.12,1990-05-10
3846,07N.04E.11.322,34.84877778,-106.4921944,5/16/1990,5523.73,1990-05-16
3847,07N.04E.08.122,34.85436111,-106.5449722,5/16/1990,5367.54,1990-05-16
3848,JL-49-15-523,31.798611,-106.1875,5/23/1990,3638.76,1990-05-23
3849,22S.02E.14.210,32.39953586,-106.704169,6/1/1990,4078.37,1990-06-01
3850,08N.03E.20.231,34.90969444,-106.6493333,6/26/1990,4880.67,1990-06-26
3851,22S.02E.32.134,32.3531481,-106.7630596,7/2/1990,3983.22,1990-07-02
3852,09N.05E.30.322,34.97505021,-106.4439115,7/13/1990,5836.18,1990-07-13
3853,08N.04E.12.334,34.92880556,-106.4773611,7/24/1990,5628.55,1990-07-24
3854,08N.04E.18.444,34.91775,-106.5535833,7/24/1990,5358.46,1990-07-24
3855,JL-49-03-335,31.975,-106.633889,7/25/1990,3780.62,1990-07-25
3856,JL-49-04-182,31.980278,-106.6225,8/1/1990,3782.99,1990-08-01
3857,JL-49-04-183,31.995834,-106.616389,8/4/1990,3787.2,1990-08-04
3858,13N.07E.09.213  (RG 52920),35.37448317,-106.2214122,8/5/1990,6246.34,1990-08-05
3859,JL-49-13-956,31.7634425,-106.3813734,8/15/1990,3580.36,1990-08-15
3860,08N.03E.08.423,34.93225,-106.64375,8/24/1990,4884.6,1990-08-24
3861,26S.02E.16.333,32.04009956,-106.7513859,9/26/1990,3801.68,1990-09-26
3862,26S.03E.34.323,31.99926748,-106.6263816,9/28/1990,3772.45,1990-09-28
3863,JL-48-34-902,31.399167,-105.759723,10/10/1990,3739.79,1990-10-10
3864,JL-49-04-490,31.955278,-106.593334,10/28/1990,3720.31,1990-10-28
3865,12N.02E.18.344,35.2625,-106.7727778,11/3/1990,4936.46,1990-11-03
3866,JL-49-14-615,31.812501,-106.255001,11/3/1990,3679.55,1990-11-03
3867,16N.09E.11.233,35.63225437,-105.9547434,11/7/1990,6662.49,1990-11-07
3868,JL-49-31-919,31.501945,-106.150834,11/10/1990,3593.13,1990-11-10
3869,JL-49-14-614,31.812501,-106.260278,11/15/1990,3689.73,1990-11-15
3870,MBOWN-46 - 23S.02E.20.322 (LC-35),32.29203863,-106.7625032,11/30/1990,3846.45,1990-11-30
3871,JL-49-14-613,31.812501,-106.266389,12/10/1990,3674.59,1990-12-10
3872,JL-49-13-630,31.81482969,-106.415819,12/19/1990,3594.0,1990-12-19
3873,04N.03E.21.31,34.55645103,-106.6411342,1/30/1991,4816.45,1991-01-30
3874,07N.04E.28.123,34.81172173,-106.5286328,2/5/1991,5453.54,1991-02-05
3875,MBOWN-144 - 27S.01W.26.433A,31.92593455,-106.9108359,2/21/1991,3815.77,1991-02-21
3876,07N.01E.22.431,34.81422089,-106.8250288,3/14/1991,4831.5,1991-03-14
3877,08N.01E.21.431,34.90583333,-106.9002222,3/15/1991,4907.52,1991-03-15
3878,13N.07E.09.221  (RG 53375),35.37642757,-106.2166899,3/25/1991,6314.49,1991-03-25
3879,17S.04W.31.223,32.79313006,-107.283634,3/29/1991,4107.48,1991-03-29
3880,25S.03E.06.222,32.16926364,-106.6666639,3/30/1991,3834.87,1991-03-30
3881,21N.08E.05.133,36.08279994,-106.1178017,4/27/1991,5676.8,1991-04-27
3882,50,37.70785036,-105.6810361,4/30/1991,7549.78,1991-04-30
3883,49,37.70694872,-105.6826501,4/30/1991,7548.61,1991-04-30
3884,52,37.68692746,-105.6815935,4/30/1991,7540.95,1991-04-30
3885,51,37.68673924,-105.6814103,4/30/1991,7539.07,1991-04-30
3886,53,37.68734168,-105.6832191,4/30/1991,7536.97,1991-04-30
3887,31,37.71045057,-105.7314553,4/30/1991,7529.66,1991-04-30
3888,48,37.67925371,-105.7006434,4/30/1991,7529.58,1991-04-30
3889,32,37.71048648,-105.7314784,4/30/1991,7529.55,1991-04-30
3890,62,37.67694314,-105.7011773,4/30/1991,7528.88,1991-04-30
3891,27,37.69968369,-105.7293758,4/30/1991,7527.86,1991-04-30
3892,2,37.70328179,-105.7305341,4/30/1991,7527.82,1991-04-30
3893,40,37.67702359,-105.7012915,4/30/1991,7527.57,1991-04-30
3894,28,37.69955807,-105.7292839,4/30/1991,7527.53,1991-04-30
3895,4,37.70255191,-105.7305043,4/30/1991,7527.36,1991-04-30
3896,46,37.67884672,-105.7008777,4/30/1991,7527.22,1991-04-30
3897,29,37.69945928,-105.7292262,4/30/1991,7527.13,1991-04-30
3898,45,37.67881833,-105.7011042,4/30/1991,7526.98,1991-04-30
3899,33,37.71048571,-105.7316032,4/30/1991,7526.9,1991-04-30
3900,3,37.70302092,-105.7304522,4/30/1991,7526.72,1991-04-30
3901,39,37.67697052,-105.7011209,4/30/1991,7526.7,1991-04-30
3902,43,37.6784215,-105.7011459,4/30/1991,7526.65,1991-04-30
3903,42,37.67845614,-105.7013843,4/30/1991,7526.61,1991-04-30
3904,30,37.6993519,-105.7291003,4/30/1991,7526.59,1991-04-30
3905,34,37.7105476,-105.7317966,4/30/1991,7526.44,1991-04-30
3906,44,37.67852118,-105.7010561,4/30/1991,7526.15,1991-04-30
3907,10,37.70209593,-105.7313619,4/30/1991,7525.58,1991-04-30
3908,47,37.67896395,-105.7008674,4/30/1991,7525.56,1991-04-30
3909,36,37.69030649,-105.7357377,4/30/1991,7525.53,1991-04-30
3910,61,37.70654499,-105.7362611,4/30/1991,7525.45,1991-04-30
3911,7,37.70197095,-105.7311679,4/30/1991,7525.36,1991-04-30
3912,19,37.7010561,-105.7318962,4/30/1991,7525.21,1991-04-30
3913,18,37.70110982,-105.7319535,4/30/1991,7525.12,1991-04-30
3914,21,37.70053766,-105.7311992,4/30/1991,7524.76,1991-04-30
3915,8,37.70193469,-105.7312016,4/30/1991,7524.7,1991-04-30
3916,5,37.70205396,-105.7308624,4/30/1991,7524.69,1991-04-30
3917,26,37.69982501,-105.7298423,4/30/1991,7524.63,1991-04-30
3918,6,37.70197137,-105.7310998,4/30/1991,7524.54,1991-04-30
3919,25,37.70002224,-105.7300144,4/30/1991,7524.49,1991-04-30
3920,9,37.70188054,-105.7312124,4/30/1991,7524.44,1991-04-30
3921,1,37.7036668,-105.7309463,4/30/1991,7524.44,1991-04-30
3922,11,37.70210459,-105.7314188,4/30/1991,7524.4,1991-04-30
3923,38,37.6908523,-105.733486,4/30/1991,7524.09,1991-04-30
3924,22,37.70039458,-105.7310163,4/30/1991,7524.02,1991-04-30
3925,35,37.69019848,-105.735714,4/30/1991,7523.91,1991-04-30
3926,17,37.70116305,-105.7320901,4/30/1991,7523.79,1991-04-30
3927,13,37.70217634,-105.7314762,4/30/1991,7523.32,1991-04-30
3928,16,37.7013326,-105.7323641,4/30/1991,7522.81,1991-04-30
3929,37,37.69040718,-105.7354892,4/30/1991,7522.8,1991-04-30
3930,15,37.70171902,-105.7325494,4/30/1991,7522.42,1991-04-30
3931,14,37.70220176,-105.7317373,4/30/1991,7522.21,1991-04-30
3932,54,37.68677386,-105.7327541,4/30/1991,7521.02,1991-04-30
3933,55,37.68684533,-105.7328568,4/30/1991,7520.28,1991-04-30
3934,57,37.69089055,-105.7374675,4/30/1991,7519.37,1991-04-30
3935,58,37.69089126,-105.7373541,4/30/1991,7519.13,1991-04-30
3936,60,37.69125297,-105.7371649,4/30/1991,7516.79,1991-04-30
3937,56,37.68715929,-105.7330981,4/30/1991,7516.18,1991-04-30
3938,59,37.68970628,-105.7380343,4/30/1991,7516.13,1991-04-30
3939,CC03007210CDC,37.44723035,-105.4250106,5/3/1991,8035.47,1991-05-03
3940,CC03007221ABA,37.43167509,-105.4386222,5/3/1991,7891.24,1991-05-03
3941,CC03107206DCC,37.3741763,-105.4789012,5/3/1991,7776.25,1991-05-03
3942,12,37.70213149,-105.7314417,5/9/1991,7524.74,1991-05-09
3943,24,37.70009371,-105.7301172,5/9/1991,7524.64,1991-05-09
3944,23,37.7002601,-105.7309015,5/9/1991,7524.19,1991-05-09
3945,20,37.70086831,-105.7316562,5/9/1991,7523.28,1991-05-09
3946,67,37.78124471,-105.6207141,5/17/1991,7701.39,1991-05-17
3947,41,37.67842903,-105.7013954,5/17/1991,7524.8,1991-05-17
3948,63,37.7166516,-105.6849516,5/24/1991,7551.73,1991-05-24
3949,64,37.716869,-105.6863151,5/24/1991,7550.1,1991-05-24
3950,65,37.71675278,-105.6876983,5/24/1991,7549.55,1991-05-24
3951,10N.04E.05.3244,35.12060143,-106.5425236,6/12/1991,4864.9,1991-06-12
3952,CC03007311ADD,37.45500728,-105.5058456,6/20/1991,7773.2,1991-06-20
3953,04N.02E.30.243,34.54395104,-106.7686374,6/24/1991,4764.44,1991-06-24
3954,66,37.71660765,-105.6847583,7/16/1991,7551.6,1991-07-16
3955,MBOWN-45 - 23S.02E.18.441 (LC-32),32.30148275,-106.7713925,7/16/1991,3840.45,1991-07-16
3956,23S.02E.05.342,32.33231534,-106.760837,7/16/1991,3815.31,1991-07-16
3957,12N.03E.33.121,35.20670933,-106.6444709,8/1/1991,4942.74,1991-08-01
3958,22S.01E.16.330,32.45842233,-106.8527859,10/3/1991,4199.97,1991-10-03
3959,JL-49-14-616,31.814445,-106.268333,10/17/1991,3659.85,1991-10-17
3960,09N.04E.04.341 KAFB 0310,35.03115987,-106.5278003,10/23/1991,5027.57,1991-10-23
3961,08N.02E.08.233,34.93713889,-106.7549444,11/7/1991,4875.94,1991-11-07
3962,09N.04E.04.141 KAFB 0309,35.03838186,-106.5297448,11/12/1991,4911.07,1991-11-12
3963,17S.04W.07.14,32.84618472,-107.2933568,11/20/1991,4132.32,1991-11-20
3964,16S.05W.23.243,32.90285053,-107.3191911,11/22/1991,4246.47,1991-11-22
3965,13N.03E.25.433,35.31961111,-106.5758333,12/1/1991,5040.39,1991-12-01
3966,25S.03E.17.111,32.14065315,-106.6658299,12/14/1991,3803.13,1991-12-14
3967,09N.03E.07.114 RIO BRAVO 5 MID,35.02781111,-106.6710333,1/9/1992,4923.36,1992-01-09
3968,09N.03E.07.114A RIO BRAVO 5 SHALLOW,35.02778611,-106.6710361,1/9/1992,4922.66,1992-01-09
3969,24S.02E.22.320,32.20537404,-106.7286115,1/14/1992,3835.42,1992-01-14
3970,13N.03E.24.331,35.33753845,-106.582666,1/23/1992,5026.58,1992-01-23
3971,26S.03E.08.124,32.06565479,-106.6594394,2/1/1992,3796.14,1992-02-01
3972,11N.03E.17.141 PASEO 1 MID,35.18309893,-106.6503042,2/14/1992,4972.22,1992-02-14
3973,14N.07E.32.440,35.39337158,-106.2155787,2/18/1992,6165.28,1992-02-18
3974,JL-49-13-943,31.764723,-106.386945,2/28/1992,3630.18,1992-02-28
3975,JL-49-13-220,31.83455119,-106.436653,2/28/1992,3601.4,1992-02-28
3976,13N.05E.22.242  (RG 54839),35.34396402,-106.3922886,3/2/1992,5927.71,1992-03-02
3977,24S.03E.28.232,32.19454083,-106.6377744,3/5/1992,3816.63,1992-03-05
3978,08N.03E.01.312 KAFB 1002,34.94727323,-106.5825232,3/27/1992,4908.3,1992-03-27
3979,29S.02E.13.113,31.79010682,-106.7002691,4/2/1992,3787.17,1992-04-02
3980,11N.03E.17.141A PASEO 1 SHALLOW,35.18309893,-106.6503042,4/6/1992,4986.93,1992-04-06
3981,09N.04E.07.234 KAFB 0215,35.02365997,-106.5558563,4/9/1992,4885.84,1992-04-09
3982,08N.03E.01.412 KAFB 1001,34.94727327,-106.5733564,4/13/1992,4914.52,1992-04-13
3983,16S.5N.24.131,32.90451712,-107.3147466,4/16/1992,4264.53,1992-04-16
3984,05S.01E.07.234,33.89062151,-106.8747479,5/6/1992,4535.18,1992-05-06
3985,21S.01W.15.210,32.47369908,-106.9286219,5/7/1992,4172.05,1992-05-07
3986,12S.04W.27.1,33.24201691,-107.2253105,5/12/1992,4490.51,1992-05-12
3987,6S.4E.13.322,33.78673592,-106.4833431,5/16/1992,4859.81,1992-05-16
3988,26S.03E.29.220,32.02371129,-106.6513828,5/23/1992,3792.0,1992-05-23
3989,16N.09E.14.224,35.6211436,-105.9502988,5/25/1992,6582.71,1992-05-25
3990,20S.02W.02.114,32.60313885,-107.0214038,6/1/1992,3999.68,1992-06-01
3991,09N.03E.02.131 KAFB 0417,35.03865926,-106.6030797,6/5/1992,4878.86,1992-06-05
3992,11N.03E.24.142 PINO YARD,35.16921082,-106.5803026,6/18/1992,4906.87,1992-06-18
3993,2S.1W.10.343,34.1450663,-106.9344741,6/21/1992,4645.32,1992-06-21
3994,JL-49-05-916,31.901112,-106.3875,6/30/1992,3614.64,1992-06-30
3995,JL-49-05-634,31.923333,-106.384722,7/11/1992,3618.79,1992-07-11
3996,25S.03E.05.34,32.15759722,-106.659719,7/17/1992,3815.11,1992-07-17
3997,JL-49-05-914,31.885834,-106.401389,7/20/1992,3601.13,1992-07-20
3998,03N.02E.09.11,34.50672992,-106.7425255,7/26/1992,4763.69,1992-07-26
3999,JL-49-15-524,31.796667,-106.184167,8/3/1992,3662.37,1992-08-03
4000,JL-49-05-915,31.893611,-106.3925,8/8/1992,3609.77,1992-08-08
4001,JL-49-15-525,31.794722,-106.184167,8/11/1992,3660.66,1992-08-11
4002,JL-49-05-633,31.94815921,-106.4055419,8/12/1992,3636.93,1992-08-12
4003,09N.03E.02.224 KAFB 0114,35.04143704,-106.5864127,8/13/1992,4871.47,1992-08-13
4004,JL-49-05-631,31.95038138,-106.404153,8/13/1992,3635.92,1992-08-13
4005,JL-49-05-629,31.94871476,-106.404153,8/14/1992,3637.69,1992-08-14
4006,JL-49-05-628,31.94871476,-106.404153,8/15/1992,3635.2,1992-08-15
4007,JL-49-05-632,31.94815921,-106.4055419,8/18/1992,3636.74,1992-08-18
4008,JL-49-05-635,31.928333,-106.375555,8/28/1992,3630.49,1992-08-28
4009,JL-49-05-630,31.95038138,-106.404153,9/3/1992,3638.49,1992-09-03
4010,11N.02E.27.232 ZAM 1,35.15504394,-106.715583,9/23/1992,4963.44,1992-09-23
4011,09N.03E.07.114B RIO BRAVO 5 DEEP,35.02780278,-106.6710694,9/29/1992,4918.27,1992-09-29
4012,JL-49-13-957,31.77705316,-106.3916515,10/5/1992,3570.25,1992-10-05
4013,16N.09E.14.322,35.61614369,-105.9569656,10/16/1992,6621.59,1992-10-16
4014,10N.02E.11.142 GON 1,35.111712,-106.7083603,11/1/1992,4945.48,1992-11-01
4015,28S.03E.35.4134,31.82593946,-106.6066567,11/12/1992,3738.17,1992-11-12
4016,JL-49-21-320,31.73955421,-106.3933179,11/16/1992,3666.61,1992-11-16
4017,JL-49-21-319,31.73955421,-106.3933179,11/16/1992,3656.1,1992-11-16
4018,JL-49-21-318,31.73955421,-106.3933179,11/16/1992,3599.2,1992-11-16
4019,JL-49-21-321,31.73955421,-106.3933179,11/16/1992,3589.21,1992-11-16
4020,JL-49-21-323,31.73955421,-106.3933179,11/16/1992,3579.79,1992-11-16
4021,JL-49-21-322,31.73955421,-106.3933179,11/16/1992,3578.62,1992-11-16
4022,JL-49-04-495,31.958056,-106.604445,11/20/1992,3720.07,1992-11-20
4023,19N.05E.10.213,35.89585657,-106.3947524,11/21/1992,8917.47,1992-11-21
4024,11N.03E.17.141B PASEO 1 DEEP,35.18309893,-106.6503042,12/3/1992,4954.07,1992-12-03
4025,11N.03E.17.233A PASEO 2 MID,35.18254342,-106.6455818,12/17/1992,4981.13,1992-12-17
4026,11N.03E.17.233B PASEO 2 MIDSHALLOW,35.18254342,-106.6455818,12/17/1992,4980.95,1992-12-17
4027,11N.03E.17.233 PASEO 2 DEEP,35.18254342,-106.6455818,12/17/1992,4976.34,1992-12-17
4028,24S.02E.07.114,32.23815094,-106.7830587,12/23/1992,3858.66,1992-12-23
4029,21S.01W.10.211,32.50286494,-106.9294556,1/9/1993,3997.83,1993-01-09
4030,20N.09E.02.2122,36.0003019,-105.9516879,1/15/1993,5995.61,1993-01-15
4031,MBOWN-208 - 29S.02E.13.113A,31.78927351,-106.6997135,2/19/1993,3777.45,1993-02-19
4032,"CLC-41, LRG-430, S-28",32.42466667,-106.6741944,3/15/1993,4065.25,1993-03-15
4033,14N.06E.07.341,35.45364705,-106.3494692,4/8/1993,5147.52,1993-04-08
4034,12N.03E.35.132,35.22726445,-106.6019702,5/7/1993,4973.77,1993-05-07
4035,08N.04E.26.144,34.89336111,-106.4920833,5/18/1993,5524.09,1993-05-18
4036,07N.03E.16.442,34.83122222,-106.6238889,5/18/1993,4838.75,1993-05-18
4037,13N.05E.22.443  (RG 57578),35.33476153,-106.3941913,5/24/1993,6036.17,1993-05-24
4038,21S.01W.09.224,32.50119858,-106.8986212,6/5/1993,4110.82,1993-06-05
4039,13N.07E.10  (RG 57653),35.3692056,-106.180023,6/15/1993,6583.26,1993-06-15
4040,25S.03E.09.21,32.15370842,-106.6388848,6/17/1993,3886.16,1993-06-17
4041,25S.02E.13.132,32.13287555,-106.6366621,6/24/1993,3945.76,1993-06-24
4042,12N.02E.35.112,35.23177778,-106.7073611,7/12/1993,4848.79,1993-07-12
4043,19S.03W.07.242,32.6736899,-107.1802974,7/20/1993,4052.32,1993-07-20
4044,JL-49-13-631,31.829722,-106.409445,7/20/1993,3608.92,1993-07-20
4045,11N.04E.22.423,35.16532244,-106.501412,7/24/1993,5601.33,1993-07-24
4046,10N.02E.01.2241,35.1330726,-106.6761376,7/30/1993,4955.86,1993-07-30
4047,16N.09E.15.434,35.61058818,-105.9702991,8/1/1993,6450.26,1993-08-01
4048,11N.03E.10.3442,35.19029333,-106.6139146,8/1/1993,4982.6,1993-08-01
4049,11N.03E.15.1234,35.18590457,-106.6165813,8/1/1993,4979.41,1993-08-01
4050,11N.03E.17.233D PASEO 2 SHALLOW,35.18265452,-106.6460541,8/2/1993,4981.18,1993-08-02
4051,10N.03E.08.3133,35.10590688,-106.6576647,8/3/1993,4929.01,1993-08-03
4052,10N.02E.12.4124,35.11060104,-106.6843598,8/4/1993,4947.95,1993-08-04
4053,10N.03E.19.2333,35.07840772,-106.6627201,8/4/1993,4941.96,1993-08-04
4054,08N.02E.01.3223,34.95285597,-106.6873032,8/5/1993,4900.5,1993-08-05
4055,24S.02E.11.32,32.23370677,-106.7113892,8/5/1993,3807.71,1993-08-05
4056,13N.02E.13.322,35.35472222,-106.6825,8/8/1993,5028.21,1993-08-08
4057,NA04101020AAA,37.79277736,-105.8922425,8/10/1993,7538.74,1993-08-10
4058,10N.02E.24.33221,35.07710207,-106.6889151,8/10/1993,4941.69,1993-08-10
4059,09N.02E.10.443,35.01502057,-106.7133039,8/10/1993,4916.03,1993-08-10
4060,10N.03E.29.3342,35.06246382,-106.6543031,8/11/1993,4931.54,1993-08-11
4061,"NA04000624ADD CR6 NEAR DEL NORTE, CO",37.69805815,-106.2594761,8/12/1993,7766.8,1993-08-12
4062,12N.03E.34.4413,35.21962576,-106.6088314,8/12/1993,5004.89,1993-08-12
4063,12N.03E.34.1141,35.22993095,-106.6185262,8/12/1993,4997.82,1993-08-12
4064,09N.02E.24.3311,34.98857706,-106.6922756,8/13/1993,4911.31,1993-08-13
4065,10N.03E.07.1232,35.11440655,-106.6694706,8/15/1993,4934.17,1993-08-15
4066,10N.03E.17.324,35.0925,-106.6926389,8/15/1993,4922.31,1993-08-15
4067,10N.03E.31.1314,35.05440842,-106.6733035,8/16/1993,4932.19,1993-08-16
4068,09N.02E.01.4122,35.03682561,-106.6786923,8/16/1993,4924.98,1993-08-16
4069,10N.02E.14.4244,35.09257379,-106.6931653,8/17/1993,4947.14,1993-08-17
4070,09N.02E.14.1344,35.00838192,-106.7070537,8/17/1993,4918.36,1993-08-17
4071,11N.03E.02.33142,35.20558333,-106.6024167,8/18/1993,5000.67,1993-08-18
4072,NA04001106ADD,37.74444424,-105.8008527,8/19/1993,7530.5,1993-08-19
4073,23S.01E.17.311,32.30731514,-106.8697291,8/20/1993,3904.77,1993-08-20
4074,NA03901016BDD,37.62555734,-105.8827993,8/24/1993,7550.35,1993-08-24
4075,"NA04001023BBB CR110 AND LANE 9 NEAR HOOPER, CO",37.70603889,-105.85475,8/24/1993,7541.58,1993-08-24
4076,11N.03E.15.344A PASEO 3 SHALLOW,35.17643266,-106.6136367,8/24/1993,4954.67,1993-08-24
4077,11N.03E.15.344B PASEO 3 MID,35.17643266,-106.6136367,8/24/1993,4952.76,1993-08-24
4078,11N.03E.15.344C PASEO 3 DEEP,35.17643266,-106.6136367,8/24/1993,4936.01,1993-08-24
4079,NA04001017DDA,37.70708056,-105.8928722,8/25/1993,7550.24,1993-08-25
4080,NA03800812ACA,37.55639152,-106.0478036,8/26/1993,7603.24,1993-08-26
4081,"NA03800917BAA CR 2S NEAR HOMELAKE, CO",37.5450026,-106.0130804,8/26/1993,7595.58,1993-08-26
4082,"NA03900930BAA DIAZ LANE NEAR HOMELAKE, CO",37.60305745,-106.0297473,8/27/1993,7596.68,1993-08-27
4083,NA03900925DDD,37.59083552,-105.9289116,8/27/1993,7554.28,1993-08-27
4084,NA03900906BCC,37.65444167,-106.0387806,8/29/1993,7608.41,1993-08-29
4085,NA04000934BAA,37.67583404,-105.9750234,8/29/1993,7576.0,1993-08-29
4086,NA04000802CBB,37.7397227,-106.0750259,8/30/1993,7622.37,1993-08-30
4087,NA04000814AAA,37.71926944,-106.0570139,8/30/1993,7618.69,1993-08-30
4088,NA04100907CCC,37.80707222,-106.0377194,8/31/1993,7581.29,1993-08-31
4089,NA04200824DDD,37.86499982,-106.0369666,8/31/1993,7568.47,1993-08-31
4090,NA04200931BAD,37.84918889,-106.0274444,8/31/1993,7567.89,1993-08-31
4091,NA04000905ADD,37.74194416,-106.0025237,9/1/1993,7585.84,1993-09-01
4092,NA04100929ADD,37.77066111,-106.0021056,9/1/1993,7579.57,1993-09-01
4093,NA04000826ACC,37.683575,-106.066225,9/2/1993,7621.85,1993-09-02
4094,NA03900914BBB,37.63187778,-105.9650139,9/2/1993,7574.68,1993-09-02
4095,"NA03900709ABB HWY160 NEAR DEL NORTE, CO",37.64694716,-106.213086,9/7/1993,7718.36,1993-09-07
4096,"NA03900808BBB CR5 NEAR MONTE VISTA, CO",37.64712222,-106.1292056,9/7/1993,7654.98,1993-09-07
4097,13N.05E.22.342  (RG 57957),35.33642812,-106.4005802,9/7/1993,5794.36,1993-09-07
4098,NA03700701DAA,37.48033611,-106.1516972,9/8/1993,7651.04,1993-09-08
4099,NA03600802DDD,37.38639448,-106.0575262,9/8/1993,7648.77,1993-09-08
4100,NA03700815BAA,37.45889316,-106.0850271,9/8/1993,7621.04,1993-09-08
4101,NA04200733ACC,37.84361233,-106.2100287,9/9/1993,7700.25,1993-09-09
4102,NA04100713ADD,37.79993979,-106.1487133,9/9/1993,7642.48,1993-09-09
4103,15N.08E.34.414,35.48392481,-106.0786329,9/9/1993,5885.65,1993-09-09
4104,NA04000818CDD,37.70472374,-106.1408613,9/10/1993,7661.97,1993-09-10
4105,23S.03E.28.413,32.27676134,-106.7422245,9/10/1993,3791.03,1993-09-10
4106,"NA03400929CBB  COUNTY RD 13, CO",37.16001047,-106.0186344,9/12/1993,7780.58,1993-09-12
4107,'NA03107306DCB ON TRINCHERA CRK ABV SMITH RES ALAM,37.37584223,-105.586959,9/12/1993,7644.02,1993-09-12
4108,NA04000717ABB,37.71861333,-106.2311418,9/13/1993,7729.94,1993-09-13
4109,NA04000712AAA,37.73345833,-106.1494972,9/13/1993,7663.88,1993-09-13
4110,NA03600835BCC,37.32056232,-106.0753043,9/16/1993,7707.08,1993-09-16
4111,NA03700936CDC,37.40028358,-105.9422453,9/16/1993,7557.21,1993-09-16
4112,19N.05E.10.213A,35.89585657,-106.3947524,9/21/1993,8837.47,1993-09-21
4113,12N.03E.27.4122,35.23951402,-106.6100538,9/23/1993,5002.09,1993-09-23
4114,13N.05E.22.211  (RG 57913),35.34726112,-106.3983581,9/25/1993,5794.54,1993-09-25
4115,10N.02E.35.3443,35.04474191,-106.7029429,9/28/1993,4931.78,1993-09-28
4116,13N.05E.16.443  (RG 58050),35.349761,-106.4116915,10/4/1993,5601.42,1993-10-04
4117,06N.03E.05.422,34.77477821,-106.6414132,11/5/1993,4831.51,1993-11-05
4118,13N.04E.33.422,35.31059534,-106.5150252,11/24/1993,5120.01,1993-11-24
4119,24S.02E.18.142,32.2228735,-106.7786137,12/16/1993,3841.22,1993-12-16
4120,13N.05E.34.11141,35.31781758,-106.4072468,12/20/1993,5924.37,1993-12-20
4121,13N.03E.26.433,35.32083333,-106.5913889,1/1/1994,5025.01,1994-01-01
4122,12N.03E.18.231,35.27305556,-106.6627778,1/1/1994,4942.61,1994-01-01
4123,12N.02E.02.444,35.29194444,-106.6933333,1/18/1994,5109.94,1994-01-18
4124,JL-49-04-184,31.999722,-106.610278,1/18/1994,3759.84,1994-01-18
4125,12N.03E.32.31321,35.22281988,-106.656138,2/5/1994,4959.88,1994-02-05
4126,23S.03E.21.342,32.28953879,-106.744447,2/9/1994,3845.17,1994-02-09
4127,13N.06E.12.233  (RG 59544),35.37087209,-106.2566903,2/16/1994,5998.37,1994-02-16
4128,25S.03E.08.214,32.15259733,-106.6552743,2/17/1994,3823.7,1994-02-17
4129,JL-49-13-525,31.81455182,-106.4305416,2/21/1994,3576.92,1994-02-21
4130,JL-49-14-906,31.751667,-106.250278,2/22/1994,3674.49,1994-02-22
4131,JL-49-24-419,31.695556,-106.112778,3/5/1994,3637.58,1994-03-05
4132,NA03701118CBC-ANWR-P14,37.44806115,-105.8202981,3/15/1994,7528.73,1994-03-15
4133,NA03701118ADB-ANWR-P15,37.45444998,-105.80752,3/15/1994,7527.61,1994-03-15
4134,NA03701116ACD ANWR-P1,37.4536169,-105.7733526,3/15/1994,7525.76,1994-03-15
4135,NA03701119ACC1-ANWR-P13,37.43861701,-105.8094645,3/15/1994,7525.76,1994-03-15
4136,NA03701117CCC1-ANWR-P12,37.44583911,-105.8016865,3/15/1994,7524.91,1994-03-15
4137,NA03701120ADD-ANWR-P11,37.43778387,-105.785575,3/15/1994,7523.43,1994-03-15
4138,NA03701115BAD-ANWR-P10,37.4575058,-105.7580744,3/15/1994,7521.47,1994-03-15
4139,NA03701122BAB-ANWR-P9,37.44417278,-105.76113,3/15/1994,7521.36,1994-03-15
4140,NA03701128DAB-ANWR-P2,37.42250658,-105.7694635,3/15/1994,7520.41,1994-03-15
4141,NA03701133CAA-ANWR-P3,37.40778467,-105.7761303,3/15/1994,7519.94,1994-03-15
4142,NA03601103BBD-ANWR-P4,37.3988961,-105.7619633,3/15/1994,7518.84,1994-03-15
4143,NA03601109ABA-ANWR-P5,37.38500747,-105.772519,3/15/1994,7516.11,1994-03-15
4144,NA03601110CAC-ANWR-P6,37.37500781,-105.7605743,3/15/1994,7514.27,1994-03-15
4145,NA03701122CCC-ANWR-P8,37.43056198,-105.7639078,3/15/1994,7513.4,1994-03-15
4146,NA03601122ADB01-ANWR-P7,37.35250845,-105.7502962,3/15/1994,7505.37,1994-03-15
4147,19S.03W.05.434,32.67843611,-107.1673056,3/15/1994,4047.14,1994-03-15
4148,17S.05W.01.4244,32.85658889,-107.299875,3/16/1994,4133.56,1994-03-16
4149,17S.04W.06.324,32.85587778,-107.2914167,3/16/1994,4131.77,1994-03-16
4150,17S.05W.24.314A,32.81558889,-107.3136028,3/16/1994,4127.95,1994-03-16
4151,17S.04W.29.3433,32.79451111,-107.282,3/16/1994,4112.92,1994-03-16
4152,19S.03W.07.131A,32.67305833,-107.1962056,3/16/1994,4059.88,1994-03-16
4153,19S.04W.01.214,32.69015833,-107.2029556,3/16/1994,4050.23,1994-03-16
4154,18S.04W.05.1233,32.77795833,-107.2777556,3/17/1994,4104.62,1994-03-17
4155,17S.05W.36.4221,32.78736944,-107.300725,3/17/1994,4103.96,1994-03-17
4156,18S.04W.05.314,32.76971667,-107.2778556,3/17/1994,4098.81,1994-03-17
4157,18S.04W.16.342,32.739175,-107.2570667,3/17/1994,4097.99,1994-03-17
4158,18S.04W.08.342,32.75279167,-107.2743806,3/17/1994,4094.55,1994-03-17
4159,18S.04W.17.4322,32.73897778,-107.2699,3/17/1994,4079.46,1994-03-17
4160,19S.03W.15.243,32.65734722,-107.1310417,3/17/1994,4035.61,1994-03-17
4161,19S.03W.14.2434,32.65614167,-107.1131861,3/17/1994,4029.72,1994-03-17
4162,17S.05W.13.24,32.83167778,-107.3033722,3/18/1994,4126.28,1994-03-18
4163,17S.05W.13.22 H-4,32.834425,-107.3033333,3/18/1994,4126.02,1994-03-18
4164,18S.04W.27.1441,32.71596944,-107.2409056,3/18/1994,4072.6,1994-03-18
4165,18S.04W.26.3323,32.71020833,-107.2273861,3/19/1994,4073.15,1994-03-19
4166,18S.04W.34.1344,32.70099444,-107.2433583,3/19/1994,4061.17,1994-03-19
4167,19S.04W.01.3234,32.68310556,-107.207125,3/19/1994,4053.33,1994-03-19
4168,19S.03W.10.4322,32.66686944,-107.1323972,3/19/1994,4043.44,1994-03-19
4169,19S.02W.16.3213 H-29,32.65434722,-107.0550972,3/20/1994,4021.38,1994-03-20
4170,19S.02W.17.1414,32.6582,-107.0710056,3/20/1994,4020.39,1994-03-20
4171,19S.02W.20.222A,32.64776944,-107.0609722,3/20/1994,4015.86,1994-03-20
4172,19S.02W.21.443 H-27,32.63456389,-107.0452583,3/20/1994,4013.07,1994-03-20
4173,19S.02W.26.4424,32.62209167,-107.0079306,3/20/1994,4000.84,1994-03-20
4174,19S.02W.26.321,32.62634167,-107.0190111,3/20/1994,4000.59,1994-03-20
4175,20S.02W.01.343,32.59142222,-107.0031444,3/20/1994,3997.94,1994-03-20
4176,20S.02W.02.1444,32.60024722,-107.0169556,3/20/1994,3994.85,1994-03-20
4177,23S.01E.35.444+DUP,32.25759478,-106.8033375,3/21/1994,3881.42,1994-03-21
4178,23S.03E.14.433,32.2850944,-106.7091677,3/22/1994,3850.23,1994-03-22
4179,JL-49-15-704,31.7517769,-106.2502592,3/23/1994,3674.24,1994-03-23
4180,NA03701117ABA-ANWR-P16,37.45889442,-105.7916863,3/30/1994,7525.66,1994-03-30
4181,JL-49-23-510,31.687222,-106.171389,4/4/1994,3665.7,1994-04-04
4182,14S.7W.25.44,33.05673842,-107.507808,4/6/1994,5084.5,1994-04-06
4183,MBOWN-349 23S.02E.33.43,32.25953958,-106.741391,4/18/1994,3847.58,1994-04-18
4184,26S.03E.28.244,32.01760037,-106.6336044,4/19/1994,3759.71,1994-04-19
4185,22S.03E.05.433,32.41759098,-106.6563895,5/15/1994,4065.69,1994-05-15
4186,16N.09E.13.111,35.62419911,-105.9458543,6/14/1994,6506.18,1994-06-14
4187,JL-49-39-352,31.495,-106.148334,6/20/1994,3595.87,1994-06-20
4188,JL-49-13-634,31.83094053,-106.3858184,7/5/1994,3601.92,1994-07-05
4189,JL-49-05-918,31.88482784,-106.3899855,7/5/1994,3595.8,1994-07-05
4190,05N.01E.34.33,34.60950457,-106.831417,7/27/1994,4770.45,1994-07-27
4191,JL-49-39-353,31.494445,-106.147778,8/10/1994,3566.7,1994-08-10
4192,04N.04E.32.24,34.52839651,-106.5427981,8/29/1994,4992.1,1994-08-29
4193,13N.03E.36.113,35.31698363,-106.5833601,9/2/1994,5017.2,1994-09-02
4194,11N.02E.04.344,35.2035,-106.7394722,9/30/1994,4928.83,1994-09-30
4195,NA03701101DCC EW-5U,37.47472781,-105.7205735,10/19/1994,7543.78,1994-10-19
4196,13N.05E.29.13  (RG 60230),35.32642834,-106.4419693,10/20/1994,5548.4,1994-10-20
4197,13N.06E.10.232  (RG 60153),35.37253857,-106.2900239,10/23/1994,5845.6,1994-10-23
4198,13N.06E.11.223  (RG 60781),35.37448305,-106.2700237,11/3/1994,5864.12,1994-11-03
4199,12N.03E.32.33124,35.21883333,-106.6613889,11/8/1994,4952.01,1994-11-08
4200,12N.07E.30 Ortiz Mine Grant  (RG  61217),35.23754223,-106.2311353,11/9/1994,6593.43,1994-11-09
4201,11N.03E.31.21311D  Montano 6 172-177 ft. screen,35.14337788,-106.6655819,11/10/1994,4954.16,1994-11-10
4202,11N.03E.31.21311C  Montano 6 558-603 ft. screen,35.14337788,-106.6655819,11/10/1994,4946.53,1994-11-10
4203,11N.03E.31.21311B  Montano 6 826-831 ft. screen,35.14337788,-106.6655819,11/10/1994,4944.77,1994-11-10
4204,11N.03E.31.21311A  Montano-6 973-978' screen,35.14337788,-106.6655819,11/10/1994,4943.78,1994-11-10
4205,NA03901235BDB2 EW-17U,37.58555924,-105.6330709,11/15/1994,7565.58,1994-11-15
4206,NA04200905AAA1 EW-65U,37.92138841,-106.0002973,11/25/1994,7548.12,1994-11-25
4207,12N.02E.35.232,35.22833333,-106.6988889,11/30/1994,4951.89,1994-11-30
4208,NA04001114DAD1   EW-30U,37.71083397,-105.7280733,12/1/1994,7527.72,1994-12-01
4209,JL-49-21-324,31.73955421,-106.3933179,12/2/1994,3680.08,1994-12-02
4210,JL-49-24-420,31.68762222,-106.1069861,12/3/1994,3626.66,1994-12-03
4211,13N.04E.35.122,35.31753965,-106.4886361,12/14/1994,5145.21,1994-12-14
4212,NA03801203DDD1 EW-15U,37.56194857,-105.6386267,12/23/1994,7559.48,1994-12-23
4213,10N.03E.04.1144,35.12782297,-106.6350256,12/27/1994,4913.46,1994-12-27
4214,13N.04E.26.244,35.32627778,-106.4798333,1/10/1995,5242.12,1995-01-10
4215,RG20A,37.83574706,-106.23859,1/12/1995,7686.3,1995-01-12
4216,12N.03E.32.13413,35.22670865,-106.6547491,1/12/1995,4928.38,1995-01-12
4217,13N.03E.21.3124,35.34247222,-106.6341667,1/17/1995,5163.38,1995-01-17
4218,03N.02E.16.130,34.48478593,-106.7441918,1/23/1995,4753.02,1995-01-23
4219,JL-49-04-419,31.9551022,-106.6116585,1/25/1995,3718.42,1995-01-25
4220,12N.02E.21.411,35.25166667,-106.7355556,2/1/1995,4903.75,1995-02-01
4221,06S.01W.12.233A,33.80463889,-106.893,2/14/1995,4516.28,1995-02-14
4222,JL-49-04-131,31.99454555,-106.5852694,2/14/1995,3863.96,1995-02-14
4223,MBOWN-142 - 26S.03E.33.221,32.00898944,-106.6372154,2/14/1995,3782.55,1995-02-14
4224,MBOWN-141 - 26S.03E.33.214,32.00871167,-106.6374932,2/14/1995,3764.21,1995-02-14
4225,MBOWN-222 - JL-49-04-210,31.97537947,-106.5822136,2/14/1995,3738.13,1995-02-14
4226,12N.03E.32.44344A,35.21805556,-106.6425,2/23/1995,4996.12,1995-02-23
4227,12N.03E.32.44344B,35.21805556,-106.6425,2/23/1995,4979.34,1995-02-23
4228,12N.03E.32.44344C,35.21805556,-106.6425,2/23/1995,4962.76,1995-02-23
4229,MBOWN-361 27S.03E.04.344,31.98121242,-106.6405484,2/27/1995,3768.24,1995-02-27
4230,13N.04E.28.131A,35.33003901,-106.5303036,3/3/1995,5055.98,1995-03-03
4231,12N.03E.32.32111D,35.22504205,-106.6528046,3/3/1995,4995.09,1995-03-03
4232,12N.03E.32.32111A,35.22531982,-106.6528046,3/3/1995,4982.79,1995-03-03
4233,12N.03E.32.32111E,35.22504205,-106.6528046,3/3/1995,4979.5,1995-03-03
4234,12N.03E.32.32111F,35.22504205,-106.6528046,3/3/1995,4973.35,1995-03-03
4235,12N.03E.32.32111B,35.22531982,-106.6528046,3/3/1995,4971.75,1995-03-03
4236,12N.03E.32.32111C,35.22531982,-106.6528046,3/3/1995,4965.1,1995-03-03
4237,15N.06E.06.411,35.5580883,-106.3450256,3/7/1995,5201.52,1995-03-07
4238,23S.01E.21.224,32.29814897,-106.8383391,3/15/1995,3880.97,1995-03-15
4239,MBOWN-335 25S.02E.04.421,32.1609305,-106.7386107,3/15/1995,3833.92,1995-03-15
4240,09N.02E.22.114,34.99847222,-106.7242778,3/21/1995,4901.63,1995-03-21
4241,MBOWN-331 26S.02E.02.223,32.07926553,-106.7033299,3/21/1995,3800.49,1995-03-21
4242,12N.03E.33.414a,35.22198671,-106.6269707,3/31/1995,5000.86,1995-03-31
4243,12N.03E.33.414c,35.22198671,-106.6269707,3/31/1995,4997.48,1995-03-31
4244,12N.03E.33.414b,35.22198671,-106.6269707,3/31/1995,4985.44,1995-03-31
4245,12N.03E.33.414d,35.22198671,-106.6269707,3/31/1995,4977.47,1995-03-31
4246,12N.03E.33.414e,35.22194444,-106.6269444,3/31/1995,4961.33,1995-03-31
4247,12N.03E.33.414f,35.22194444,-106.6269444,3/31/1995,4959.49,1995-03-31
4248,07N.03E.30.321,34.80458333,-106.6697222,4/3/1995,4834.48,1995-04-03
4249,06N.02E.10.341,34.7561676,-106.722804,4/6/1995,4822.63,1995-04-06
4250,07N.02E.23.414,34.81672128,-106.7000257,4/9/1995,4848.73,1995-04-09
4251,06N.02E.18.232,34.75002778,-106.7676944,4/9/1995,4823.83,1995-04-09
4252,03N.01E.23.331,34.46480556,-106.8156111,4/11/1995,4738.87,1995-04-11
4253,01N.01E.04.123,34.34397222,-106.8466944,4/11/1995,4704.03,1995-04-11
4254,07N.02E.22.231,34.82116555,-106.7183595,4/12/1995,4851.98,1995-04-12
4255,JL-49-22-306,31.70927793,-106.2719257,4/14/1995,3656.32,1995-04-14
4256,01S.01W.01.124,34.25534459,-106.8980836,4/17/1995,4663.86,1995-04-17
4257,19S.03W.11.323,32.66869091,-107.1230737,4/18/1995,4050.44,1995-04-18
4258,08S.02W.11.121,33.63525,-107.0156111,4/19/1995,4458.11,1995-04-19
4259,04S.01E.08.221,33.98423264,-106.8553026,4/20/1995,4562.31,1995-04-20
4260,09N.02E.36.222,34.96949439,-106.6766919,4/23/1995,4901.59,1995-04-23
4261,11N.O3E.16.111,35.18893214,-106.6383595,5/4/1995,4967.5,1995-05-04
4262,05N.04E.05.432,34.68422537,-106.5389101,5/17/1995,5228.14,1995-05-17
4263,19S.02W.03.211,32.69205556,-107.0342222,6/7/1995,4018.13,1995-06-07
4264,JL-49-04-187,31.960001,-106.5975,7/16/1995,3713.16,1995-07-16
4265,DeVito; Vereda Serena,,,9/13/1995,6678.25,1995-09-13
4266,JL-49-05-919,31.87788356,-106.3938745,10/20/1995,3603.12,1995-10-20
4267,05N.01E.28.41,34.63005953,-106.8397507,10/31/1995,4808.42,1995-10-31
4268,NSMW-3,37.95448836,-105.8229058,11/1/1995,7566.6,1995-11-01
4269,WELL_T,37.79240642,-105.6457914,11/3/1995,7681.86,1995-11-03
4270,08N.04E.04.413,34.94727347,-106.5233553,11/3/1995,5329.36,1995-11-03
4271,08N.04E.04.413A,34.94727347,-106.5233553,11/3/1995,5328.47,1995-11-03
4272,LSPW-2,37.98766102,-105.7435033,11/5/1995,7657.13,1995-11-05
4273,LSPW-5,37.97653125,-105.7872361,11/5/1995,7602.66,1995-11-05
4274,NSMW-1,37.97757236,-105.8014749,11/5/1995,7593.83,1995-11-05
4275,LSPW-3,37.95879478,-105.7865642,11/5/1995,7593.38,1995-11-05
4276,NSMW-2,37.96389282,-105.8027135,11/5/1995,7585.55,1995-11-05
4277,SHPW-1,37.94409339,-105.789067,11/5/1995,7574.11,1995-11-05
4278,EKPW-1,37.9271512,-105.7892302,11/6/1995,7564.27,1995-11-06
4279,ECTW-1,37.915073,-105.7892423,11/6/1995,7562.78,1995-11-06
4280,BPW-1,37.98520237,-105.7630924,11/7/1995,7630.21,1995-11-07
4281,WNSW-1,37.98443493,-105.826436,11/7/1995,7574.81,1995-11-07
4282,CMW-1,37.89447557,-105.7882025,11/7/1995,7557.14,1995-11-07
4283,NLPW-2,37.94633839,-105.7626051,11/8/1995,7603.89,1995-11-08
4284,NLPW-3,37.93923623,-105.7564842,11/9/1995,7605.71,1995-11-09
4285,NLPW-1,37.92811191,-105.7496748,11/9/1995,7603.36,1995-11-09
4286,SWCW-1,37.92029538,-105.7626314,11/9/1995,7585.11,1995-11-09
4287,16N.09E.15.241,35.61975461,-105.9683547,11/16/1995,6617.85,1995-11-16
4288,SW-11,37.88007804,-105.7808016,11/28/1995,7556.93,1995-11-28
4289,SW-9,37.89333223,-105.8225406,11/28/1995,7538.01,1995-11-28
4290,JL-49-13-846,31.77566397,-106.4488751,12/1/1995,3603.6,1995-12-01
4291,JL-49-14-109,31.839445,-106.346111,12/6/1995,3615.01,1995-12-06
4292,JL-49-14-432,31.833334,-106.345834,12/6/1995,3610.04,1995-12-06
4293,03N.02E.31.333,34.43562001,-106.7803029,12/7/1995,4735.86,1995-12-07
4294,NFMW-1,37.94534034,-105.8328745,12/12/1995,7560.03,1995-12-12
4295,NFMW-3,37.92763678,-105.843779,12/12/1995,7543.32,1995-12-12
4296,NFMW-2,37.91895854,-105.8493792,12/12/1995,7539.52,1995-12-12
4297,SLPW-1,37.89799884,-105.7322216,12/13/1995,7613.3,1995-12-13
4298,NWPW-1,37.93579592,-105.7780189,12/13/1995,7579.95,1995-12-13
4299,SLPW-2,37.90014029,-105.7626611,12/13/1995,7579.51,1995-12-13
4300,NAPW-2,37.84698901,-105.7509313,12/13/1995,7578.62,1995-12-13
4301,NAPW-1,37.87794474,-105.762635,12/13/1995,7572.49,1995-12-13
4302,SHPW-2,37.94409759,-105.8091248,12/13/1995,7561.81,1995-12-13
4303,EKPW-2,37.92497591,-105.8046287,12/13/1995,7555.36,1995-12-13
4304,WDMW-1,37.88087411,-105.7855341,12/13/1995,7554.09,1995-12-13
4305,SAPW-2,37.83655234,-105.7710981,12/13/1995,7552.2,1995-12-13
4306,WDMW-2,37.8804265,-105.8010028,12/13/1995,7545.02,1995-12-13
4307,WCPW-3,37.90412005,-105.8224174,12/13/1995,7541.46,1995-12-13
4308,WCPW-2,37.88349435,-105.8207447,12/13/1995,7539.51,1995-12-13
4309,SAPW-1,37.8440905,-105.7875614,12/13/1995,7538.44,1995-12-13
4310,DHPW-1,37.85478958,-105.7955897,12/13/1995,7538.24,1995-12-13
4311,BCPW-1,37.90235776,-105.850102,12/13/1995,7536.64,1995-12-13
4312,SDMW-1,37.86544085,-105.8048984,12/13/1995,7536.54,1995-12-13
4313,WCPW-1,37.86941338,-105.8086076,12/13/1995,7536.4,1995-12-13
4314,DHPW-2,37.85349021,-105.810703,12/13/1995,7533.21,1995-12-13
4315,SLBW-1,37.90646053,-105.7161481,12/14/1995,7642.02,1995-12-14
4316,APW-1,37.88454986,-105.713538,12/14/1995,7635.54,1995-12-14
4317,CMW-2,37.89551693,-105.7811507,12/14/1995,7561.76,1995-12-14
4318,JMW-1,37.82756691,-105.803577,12/14/1995,7532.1,1995-12-14
4319,JMW-3,37.84249104,-105.8179678,12/14/1995,7531.81,1995-12-14
4320,JMW-4,37.83360521,-105.8185012,12/14/1995,7530.58,1995-12-14
4321,JMW-2,37.82089799,-105.8164287,12/14/1995,7529.62,1995-12-14
4322,JL-49-15-705,31.75511026,-106.2316475,1/15/1996,3693.4,1996-01-15
4323,DW-7,37.84396192,-105.7862276,2/9/1996,7736.35,1996-02-09
4324,07N.03E.26.113,34.80894391,-106.605579,2/15/1996,4854.65,1996-02-15
4325,WELL_M,37.73722518,-105.525966,2/28/1996,8018.25,1996-02-28
4326,12N.02E.03.43,34.42117603,-106.7172452,3/12/1996,4759.28,1996-03-12
4327,LSPW-1,37.97707163,-105.724023,3/14/1996,7687.42,1996-03-14
4328,BMPW-1,37.91927727,-105.8880477,3/14/1996,7543.86,1996-03-14
4329,WELL_D1,37.73604195,-105.524505,3/19/1996,7933.89,1996-03-19
4330,WELL_MS,37.73419215,-105.5220296,3/21/1996,8019.58,1996-03-21
4331,11N.03E.25.322B SISTER CITIES,35.15226692,-106.5794691,4/9/1996,4909.35,1996-04-09
4332,11N.03E.25.322A SISTER CITIES,35.15226692,-106.5794691,4/9/1996,4895.18,1996-04-09
4333,11N.03E.25.322 SISTER CITIES,35.15226692,-106.5794691,4/9/1996,4894.63,1996-04-09
4334,WELL_U,37.73191243,-105.6072114,4/18/1996,7692.85,1996-04-18
4335,MBOWN-366 28S.03E.34.413  Sunland Park No.4,31.82666667,-106.6228889,4/26/1996,3713.12,1996-04-26
4336,WELL_D3,37.72833922,-105.5357307,5/2/1996,7872.23,1996-05-02
4337,10N.03E.08.331 BIA Windmill,35.10504581,-106.6555813,5/9/1996,4926.88,1996-05-09
4338,13N.05E.22.421  (RG 64551 EXP),35.34087245,-106.3947469,5/12/1996,5900.86,1996-05-12
4339,13N.07E.05.22  (RG 59684),35.39031611,-106.2153009,5/13/1996,5827.86,1996-05-13
4340,13N.07E.09.122  (RG 64215),35.37642756,-106.2233566,5/21/1996,6189.48,1996-05-21
4341,04N.02E.11.244,34.58977778,-106.6890278,6/8/1996,4653.22,1996-06-08
4342,10N.03E.14.324 DEL SOL DIVIDER,35.09302222,-106.5970278,6/17/1996,4866.76,1996-06-17
4343,10N.03E.14.324B DEL SOL DIVIDER,35.09302222,-106.5970278,6/17/1996,4863.9,1996-06-17
4344,10N.03E.14.324A DEL SOL DIVIDER,35.09302222,-106.5970278,6/17/1996,4855.93,1996-06-17
4345,13N.05E.29  (RG 64448),35.31809529,-106.4372469,7/16/1996,5689.17,1996-07-16
4346,11N.03E.07.141B HUNTERS RIDGE NO. 1,35.20032052,-106.668638,8/5/1996,4961.97,1996-08-05
4347,11N.03E.07.141E HUNTERS RIDGE NO. 2,35.20032052,-106.668638,8/5/1996,4960.55,1996-08-05
4348,11N.03E.07.141D HUNTERS RIDGE NO. 2,35.20032052,-106.668638,8/5/1996,4959.94,1996-08-05
4349,11N.03E.07.141C HUNTERS RIDGE NO. 2,35.20032052,-106.668638,8/5/1996,4957.03,1996-08-05
4350,11N.03E.07.141A HUNTERS RIDGE NO. 1,35.20032052,-106.668638,8/5/1996,4948.72,1996-08-05
4351,11N.03E.07.141 HUNTERS RIDGE NO. 1,35.20032052,-106.668638,8/5/1996,4944.34,1996-08-05
4352,10N.02E.11.244C WEST BLUFF NO. 2,35.110601,-106.6941933,8/22/1996,4947.52,1996-08-22
4353,10N.02E.11.244D WEST BLUFF NO. 2,35.110601,-106.6941933,8/22/1996,4946.63,1996-08-22
4354,10N.02E.11.244E WEST BLUFF NO. 2,35.110601,-106.6941933,8/22/1996,4946.59,1996-08-22
4355,10N.02E.11.244B WEST BLUFF NO. 1,35.110601,-106.6941933,8/22/1996,4945.65,1996-08-22
4356,10N.02E.11.244A WEST BLUFF NO. 1,35.110601,-106.6941933,8/22/1996,4931.05,1996-08-22
4357,10N.02E.11.244 WEST BLUFF NO. 1,35.110601,-106.6941933,8/22/1996,4923.67,1996-08-22
4358,JL-49-24-431,31.695556,-106.110834,8/27/1996,3926.71,1996-08-27
4359,13N.05E.21.134  (RG 63468),35.34170567,-106.4228027,9/7/1996,5421.38,1996-09-07
4360,10N.03E.05.341B GARFIELD PARK,35.11798611,-106.6512722,9/23/1996,4926.33,1996-09-23
4361,10N.03E.05.341A GARFIELD PARK,35.11798611,-106.6512722,9/23/1996,4919.24,1996-09-23
4362,10N.03E.05.341 GARFIELD PARK,35.11798611,-106.6512722,9/23/1996,4917.67,1996-09-23
4363,13N.05E.22.233  (RG 66261),35.34170574,-106.398358,9/25/1996,5802.43,1996-09-25
4364,13N.05E.22.214  (RG 66009),35.34531675,-106.3961358,9/30/1996,5815.01,1996-09-30
4365,17S.05W.15.222,32.83780556,-107.33575,10/22/1996,4143.39,1996-10-22
4366,DW-13,37.83282038,-105.5892636,10/29/1996,7831.78,1996-10-29
4367,DUNDW11,37.86094652,-105.6226255,10/29/1996,7761.29,1996-10-29
4368,DUNDW10,37.90116284,-105.6465672,10/30/1996,7758.4,1996-10-30
4369,10N.03E.36.24 KAFB-16,35.05138889,-106.5692778,10/31/1996,4867.83,1996-10-31
4370,10N.02E.21.412A WSM 3,35.07893514,-106.7322493,11/5/1996,4885.66,1996-11-05
4371,DUNSW13,38.02030122,-105.7285252,11/7/1996,7743.8,1996-11-07
4372,DUNDW12,38.02060345,-105.7284769,11/7/1996,7738.34,1996-11-07
4373,10N.02E.09.114 COL 1,35.11282291,-106.7430832,11/15/1996,4897.44,1996-11-15
4374,09N.03E.07.131,35.02643708,-106.673081,11/22/1996,4925.21,1996-11-22
4375,09N.03E.07.132B,35.02615932,-106.6716921,11/22/1996,4924.01,1996-11-22
4376,10N.02E.23.213 ATR 4,35.08587954,-106.6961376,12/4/1996,4943.14,1996-12-04
4377,10N.03E.26.422 BUR 5,35.06532517,-106.5880796,12/5/1996,4862.96,1996-12-05
4378,10N.03E.27.244 BUR 1,35.06643615,-106.6072467,12/5/1996,4857.62,1996-12-05
4379,09N.03E.07.141A,35.02588157,-106.6680809,12/10/1996,4924.15,1996-12-10
4380,09N.03E.07.141,35.02560379,-106.669192,12/10/1996,4923.9,1996-12-10
4381,09N.03E.07.142,35.0256038,-106.6669697,12/11/1996,4926.69,1996-12-11
4382,10N.02E.11.233 GON 2,35.10976767,-106.6978045,12/18/1996,4950.3,1996-12-18
4383,11N.03E.24.144 COR 2,35.1686553,-106.5778025,12/18/1996,4913.13,1996-12-18
4384,10N.04E.30.121 RID 5,35.07227222,-106.5629056,12/18/1996,4856.36,1996-12-18
4385,10N.03E.12.332 CHW 5,35.10421285,-106.5836354,12/19/1996,4860.6,1996-12-19
4386,10N.02E.27.444 LEA 2,35.04699171,-106.7289156,12/30/1996,4915.28,1996-12-30
4387,10N.02E.33.232 LEA 1,35.05254709,-106.729749,12/30/1996,4883.93,1996-12-30
4388,JL-49-14-617,31.82010834,-106.2608152,1/5/1997,3689.23,1997-01-05
4389,09N.03E.07.142A,35.02588156,-106.6694698,1/9/1997,4923.55,1997-01-09
4390,10N.03E.29.441 SJE 3,35.05032536,-106.6439139,1/23/1997,4912.11,1997-01-23
4391,10N.03E.32.144 SJE 1,35.05449188,-106.6472474,1/23/1997,4908.44,1997-01-23
4392,10N.03E.32.141 SJE 2,35.05421409,-106.6516919,1/23/1997,4844.4,1997-01-23
4393,JL-49-13-219,31.855834,-106.421944,2/6/1997,3596.17,1997-02-06
4394,JL-49-24-802,31.6345591,-106.0755306,2/6/1997,3590.35,1997-02-06
4395,10N.03E.33.233 MRD 1,35.05226981,-106.6300248,2/14/1997,4907.0,1997-02-14
4396,10N.04E.06.124 THS 5,35.12893441,-106.5603018,2/14/1997,4863.06,1997-02-14
4397,10N.04E.06.422 THS 6,35.122268,-106.5516905,2/14/1997,4861.25,1997-02-14
4398,10N.04E.05.342 THS 8,35.11976812,-106.5425236,2/14/1997,4861.18,1997-02-14
4399,10N.02E.12.313H,35.1061567,-106.691971,2/27/1997,4954.29,1997-02-27
4400,10N.02E.12.132A,35.11143433,-106.6889154,2/27/1997,4954.18,1997-02-27
4401,10N.02E.12.313G,35.1061567,-106.691971,2/27/1997,4954.11,1997-02-27
4402,10N.02E.12.132B,35.11143433,-106.6889154,2/27/1997,4954.11,1997-02-27
4403,10N.02E.12.313F,35.1061567,-106.691971,2/27/1997,4953.98,1997-02-27
4404,10N.02E.12.313E,35.1061567,-106.691971,2/27/1997,4953.69,1997-02-27
4405,10N.02E.12.313D,35.1061567,-106.691971,2/27/1997,4953.65,1997-02-27
4406,10N.02E.12.313B,35.10476786,-106.691971,2/27/1997,4953.4,1997-02-27
4407,10N.02E.12.313C,35.1061567,-106.691971,2/27/1997,4953.33,1997-02-27
4408,10N.02E.12.312B,35.10782333,-106.6900265,2/27/1997,4953.14,1997-02-27
4409,10N.02E.12.313,35.10476786,-106.691971,2/27/1997,4953.08,1997-02-27
4410,10N.02E.12.312A,35.10782333,-106.6900265,2/27/1997,4952.85,1997-02-27
4411,10N.02E.12.312C,35.10782333,-106.6900265,2/27/1997,4952.83,1997-02-27
4412,10N.02E.12.312E,35.10782333,-106.6900265,2/27/1997,4952.76,1997-02-27
4413,10N.02E.12.132,35.11143433,-106.6889154,2/27/1997,4952.75,1997-02-27
4414,10N.02E.12.313A,35.10476786,-106.691971,2/27/1997,4952.73,1997-02-27
4415,10N.02E.12.312D,35.10782333,-106.6900265,2/27/1997,4952.71,1997-02-27
4416,10N.02E.12.412B,35.11087882,-106.6839153,2/27/1997,4949.9,1997-02-27
4417,10N.02E.12.412A,35.11087882,-106.6839153,2/27/1997,4948.68,1997-02-27
4418,09N.04E.35.324,34.96116201,-106.4905773,3/1/1997,5638.37,1997-03-01
4419,13N.07E.10  (RG 67098),35.36865006,-106.180023,3/10/1997,6600.66,1997-03-10
4420,13N.05E.22.241  (RG 67204),35.34365014,-106.3941914,4/10/1997,5848.41,1997-04-10
4421,10N.02E.17.44C 98TH STREET,35.09004583,-106.7464164,4/21/1997,4908.31,1997-04-21
4422,10N.02E.17.44B 98TH STREET,35.09004583,-106.7464164,4/21/1997,4883.61,1997-04-21
4423,10N.02E.17.44 98TH STREET,35.09004583,-106.7464164,4/21/1997,4878.15,1997-04-21
4424,10N.02E.17.44A 98TH STREET,35.09004583,-106.7464164,4/21/1997,4876.92,1997-04-21
4425,10N.03E.36.132A,35.05266389,-106.582325,5/13/1997,4860.7,1997-05-13
4426,Alley BLM2,,,5/18/1997,6120.96,1997-05-18
4427,03N.03E.09.111,34.50552778,-106.6403611,5/19/1997,4673.52,1997-05-19
4428,Alley BLM1,,,5/21/1997,6127.6,1997-05-21
4429,09N.04E.30.132,34.98005013,-106.5664118,6/1/1997,4887.37,1997-06-01
4430,09N.03E.34.231A MESA DEL SOL,34.96625833,-106.6116861,6/4/1997,4890.12,1997-06-04
4431,11N.04E.18.222 NOR ESTE,35.1867104,-106.5547467,6/6/1997,4901.78,1997-06-06
4432,11N.04E.18.222A NOR ESTE,35.1867104,-106.5547467,6/6/1997,4900.04,1997-06-06
4433,11N.04E.18.222B NOR ESTE,35.1867104,-106.5547467,6/6/1997,4899.53,1997-06-06
4434,06N.02E.24.414,34.7353349,-106.6766917,6/16/1997,4823.5,1997-06-16
4435,12N.03E.29.422,35.23920833,-106.6400267,6/20/1997,5011.76,1997-06-20
4436,09N.03E.34.231 MESA DEL SOL,34.96625833,-106.6116861,6/20/1997,4902.04,1997-06-20
4437,09N.03E.34.231B MESA DEL SOL,34.96625833,-106.6116861,6/20/1997,4895.84,1997-06-20
4438,09N.04E.18.114,35.01166667,-106.5652778,7/7/1997,4879.57,1997-07-07
4439,09N.02E.26.322,34.97772222,-106.7019722,7/11/1997,4902.08,1997-07-11
4440,10N.04E.09.214B MATHESON MIDDLE SCHOOL,35.114775,-106.5218056,7/18/1997,4990.88,1997-07-18
4441,10N.04E.09.214A MATHESON MIDDLE SCHOOL,35.114775,-106.5218056,7/18/1997,4853.32,1997-07-18
4442,10N.04E.09.214 MATHESON MIDDLE SCHOOL,35.114775,-106.5218056,7/18/1997,4846.37,1997-07-18
4443,11N.03E.26.243B SIERRA VISTA,35.15282188,-106.6972493,7/25/1997,4964.69,1997-07-25
4444,11N.03E.26.243A SIERRA VISTA,35.15282188,-106.6972493,7/25/1997,4959.67,1997-07-25
4445,11N.03E.26.243 SIERRA VISTA,35.15282188,-106.6972493,7/25/1997,4933.51,1997-07-25
4446,"95-1, EUI #13",,,7/28/1997,6670.79,1997-07-28
4447,"EUI #6, W6",,,7/28/1997,6536.16,1997-07-28
4448,13N.05E.22.224  (RG 67542),35.34531676,-106.3916914,8/9/1997,5836.38,1997-08-09
4449,12N.02E.24.144B LINCOLN MIDDLE SCHOOL,35.25504091,-106.6858612,9/10/1997,4960.25,1997-09-10
4450,12N.02E.24.144A LINCOLN MIDDLE SCHOOL,35.25504091,-106.6858612,9/10/1997,4952.46,1997-09-10
4451,12N.02E.24.144 LINCOLN MIDDLE SCHOOL,35.25504091,-106.6858612,9/10/1997,4951.96,1997-09-10
4452,09N.03E.10.334B MONTESSA SITE,35.01586111,-106.6173167,9/17/1997,4886.44,1997-09-17
4453,09N.03E.10.334A MONTESSA SITE,35.01586111,-106.6173167,9/17/1997,4880.55,1997-09-17
4454,JL-49-24-422,31.694445,-106.116389,10/1/1997,3653.96,1997-10-01
4455,13N.05E.27  (RG 68825),35.3205952,-106.4383581,11/20/1997,5803.93,1997-11-20
4456,MBOWN-350 23S01E.22.232E (LC-1E),32.29592692,-106.824172,11/20/1997,3885.29,1997-11-20
4457,MBOWN-346 23S.01E.22.232D (LC-1D),32.29592692,-106.824172,11/20/1997,3885.22,1997-11-20
4458,MBOWN-347 23S.01E.22.241D (LC-2D),32.29592693,-106.8230608,11/20/1997,3884.84,1997-11-20
4459,MBOWN-352 24S.02E.19.214D (M-1D),32.2103738,-106.7727799,11/20/1997,3849.3,1997-11-20
4460,MBOWN-353 24S.02E.19.214E (M-1E),32.2103738,-106.7727799,11/20/1997,3849.23,1997-11-20
4461,08N.02E.02.413C ISLETA SITE,34.94727276,-106.7003035,12/18/1997,4904.14,1997-12-18
4462,08N.02E.02.413B ISLETA SITE,34.94727276,-106.7003035,12/18/1997,4904.03,1997-12-18
4463,08N.02E.02.413A ISLETA SITE,34.94727276,-106.7003035,12/18/1997,4903.3,1997-12-18
4464,08N.02E.02.413 ISLETA SITE,34.94727276,-106.7003035,12/18/1997,4892.67,1997-12-18
4465,MBOWN-355 24S.02E.19.223D (M-2D),32.21148489,-106.7716688,12/19/1997,3852.07,1997-12-19
4466,MBOWN-351 23S01E.22.241E (LC-2E),32.29592693,-106.8230608,1/17/1998,3884.77,1998-01-17
4467,USGS Espaola 3,,,2/3/1998,5627.8,1998-02-03
4468,11N.04E.18.434 WAW 1,35.17476632,-106.5561355,2/9/1998,4892.64,1998-02-09
4469,17N.10E.07.2243,35.72225221,-105.9130765,2/13/1998,7095.24,1998-02-13
4470,MBOWN-354 24S.02E.19.214F (M-1F),32.2103738,-106.7727799,2/19/1998,3848.97,1998-02-19
4471,12N.06E.24.42  (RG  69296),35.25754167,-106.2486353,4/14/1998,5946.73,1998-04-14
4472,NA04200931CCC   SAG 11,37.83583318,-106.0366895,4/15/1998,7615.86,1998-04-15
4473,NA04300801BBA   SAG 12,38.01305524,-106.0472417,4/17/1998,7602.74,1998-04-17
4474,17N.09E.18.223,35.70808511,-106.0214117,4/23/1998,6227.9,1998-04-23
4475,12N.03E.18.343 RR-21,35.26151111,-106.6691889,5/10/1998,4927.91,1998-05-10
4476,NA04200818CCB   SAG 9,37.88194501,-106.1461369,5/18/1998,7620.0,1998-05-18
4477,NA03900932BCC   ALA 10,37.58139103,-106.0214139,6/1/1998,7621.25,1998-06-01
4478,NA04101030ABC   SAG 16,37.77444404,-105.9180768,6/23/1998,7564.28,1998-06-23
4479,12N.04E.29.433B SANDIA SITE,35.23254235,-106.5422468,6/26/1998,4959.42,1998-06-26
4480,12N.04E.29.433A SANDIA SITE,35.23254235,-106.5422468,6/26/1998,4952.96,1998-06-26
4481,12N.04E.29.433 SANDIA SITE,35.23254235,-106.5422468,7/2/1998,4952.67,1998-07-02
4482,02S.08W.06.214,34.16625,-107.7034444,7/6/1998,6804.69,1998-07-06
4483,96t,37.80516101,-105.6233409,7/12/1998,7700.43,1998-07-12
4484,102t,37.8024095,-105.6455552,7/12/1998,7699.39,1998-07-12
4485,99t,37.80185038,-105.6281057,7/12/1998,7696.03,1998-07-12
4486,98t,37.80389278,-105.6270903,7/12/1998,7693.38,1998-07-12
4487,97t,37.80628204,-105.625678,7/12/1998,7689.84,1998-07-12
4488,95t,37.80201286,-105.6259442,7/12/1998,7689.66,1998-07-12
4489,86t,37.79191588,-105.6356039,7/12/1998,7686.51,1998-07-12
4490,2t,37.78195374,-105.6318782,7/12/1998,7684.31,1998-07-12
4491,42t,37.78100847,-105.6312484,7/12/1998,7683.43,1998-07-12
4492,103g,37.79484827,-105.6316781,7/12/1998,7683.42,1998-07-12
4493,3t,37.78198354,-105.6322042,7/12/1998,7683.0,1998-07-12
4494,93t,37.79605488,-105.6234379,7/12/1998,7682.02,1998-07-12
4495,1t,37.78267906,-105.6323439,7/12/1998,7681.57,1998-07-12
4496,81t,37.78333958,-105.6318694,7/12/1998,7681.57,1998-07-12
4497,85t,37.78466136,-105.6316187,7/12/1998,7681.27,1998-07-12
4498,94t,37.79597853,-105.6284772,7/12/1998,7681.24,1998-07-12
4499,41t,37.78117733,-105.6321143,7/12/1998,7680.75,1998-07-12
4500,100g,37.7985544,-105.6313627,7/12/1998,7680.67,1998-07-12
4501,82t,37.78443596,-105.631632,7/12/1998,7680.26,1998-07-12
4502,4t,37.78200933,-105.6324372,7/12/1998,7679.38,1998-07-12
4503,5t,37.782071,-105.6327014,7/12/1998,7679.26,1998-07-12
4504,40t,37.78121431,-105.6323627,7/12/1998,7678.49,1998-07-12
4505,91t,37.78911933,-105.6242618,7/12/1998,7677.74,1998-07-12
4506,37t,37.78157437,-105.6324492,7/12/1998,7677.33,1998-07-12
4507,106t,37.78768849,-105.6318669,7/12/1998,7677.08,1998-07-12
4508,105g,37.79310012,-105.6324402,7/12/1998,7676.83,1998-07-12
4509,101t,37.80077373,-105.6393347,7/12/1998,7676.49,1998-07-12
4510,36t,37.78157161,-105.6325432,7/12/1998,7676.41,1998-07-12
4511,6t,37.7819151,-105.6327793,7/12/1998,7675.23,1998-07-12
4512,39t,37.7812335,-105.6325641,7/12/1998,7675.17,1998-07-12
4513,8t,37.78206039,-105.6329984,7/12/1998,7675.11,1998-07-12
4514,35t,37.78157331,-105.6326479,7/12/1998,7675.03,1998-07-12
4515,7t,37.78187894,-105.6327992,7/12/1998,7675.0,1998-07-12
4516,9t,37.78200154,-105.6330483,7/12/1998,7674.85,1998-07-12
4517,30t,37.78130241,-105.6331602,7/12/1998,7674.59,1998-07-12
4518,104t,37.7919448,-105.6293784,7/12/1998,7674.37,1998-07-12
4519,29t,37.78129071,-105.6332399,7/12/1998,7674.26,1998-07-12
4520,10t,37.78208415,-105.6331902,7/12/1998,7674.2,1998-07-12
4521,89t,37.79168855,-105.6359747,7/12/1998,7673.89,1998-07-12
4522,34t,37.78160431,-105.6331684,7/12/1998,7673.66,1998-07-12
4523,32t,37.7816147,-105.633331,7/12/1998,7673.63,1998-07-12
4524,33t,37.78160191,-105.633195,7/12/1998,7673.53,1998-07-12
4525,31t,37.78129813,-105.6331186,7/12/1998,7673.46,1998-07-12
4526,44t,37.78105856,-105.6328327,7/12/1998,7673.36,1998-07-12
4527,38t,37.7812421,-105.6326412,7/12/1998,7673.15,1998-07-12
4528,27t,37.78135952,-105.6338534,7/12/1998,7672.82,1998-07-12
4529,11t,37.78250977,-105.6332379,7/12/1998,7672.71,1998-07-12
4530,28t,37.78164365,-105.6338139,7/12/1998,7672.24,1998-07-12
4531,92t,37.79575527,-105.6208617,7/12/1998,7668.6,1998-07-12
4532,87g_t,37.79223106,-105.6356552,7/12/1998,7667.84,1998-07-12
4533,88t,37.79211137,-105.6361217,7/12/1998,7667.03,1998-07-12
4534,A,37.78833817,-105.6442144,7/12/1998,7666.88,1998-07-12
4535,T,37.79239443,-105.6458055,7/12/1998,7666.55,1998-07-12
4536,"CLC-42, LRG-430, S-29",32.4325,-106.6603611,7/14/1998,4068.19,1998-07-14
4537,11N.04E.23.331,35.16393359,-106.4972454,7/28/1998,5602.31,1998-07-28
4538,EB-151,35.69613944,-105.9753463,7/29/1998,6680.26,1998-07-29
4539,13N.05E.28.42  (RG 70123),35.32365072,-106.4125246,8/10/1998,5796.75,1998-08-10
4540,13N.05E.28  (RG 67194),35.32476177,-106.423358,8/12/1998,5768.35,1998-08-12
4541,108t,37.81362304,-105.6214726,8/14/1998,7706.53,1998-08-14
4542,110t,37.80995547,-105.6225986,8/14/1998,7705.87,1998-08-14
4543,R,37.79616646,-105.6482689,8/14/1998,7705.8,1998-08-14
4544,107t,37.81189087,-105.6217809,8/14/1998,7705.34,1998-08-14
4545,S,37.79614837,-105.6482801,8/14/1998,7703.76,1998-08-14
4546,109t,37.81753995,-105.6192057,8/14/1998,7703.48,1998-08-14
4547,84t,37.78497213,-105.6312334,8/14/1998,7686.8,1998-08-14
4548,83t,37.78455449,-105.6313796,8/14/1998,7683.45,1998-08-14
4549,06N.03E.18.442B TOME SITE,34.74200139,-106.6600247,8/21/1998,4828.91,1998-08-21
4550,06N.03E.18.442A TOME SITE,34.74200139,-106.6600247,8/21/1998,4828.11,1998-08-21
4551,06N.03E.18.442 TOME SITE,34.74200139,-106.6600247,8/21/1998,4827.65,1998-08-21
4552,NA03801229ADB   ALA 11,37.513616,-105.6805724,8/24/1998,7562.9,1998-08-24
4553,EB-154,35.69105148,-105.9734829,8/24/1998,6675.27,1998-08-24
4554,NA03800934ADB   ALA 12,37.49722567,-105.9694684,9/16/1998,7583.05,1998-09-16
4555,05N.03E.28.411A NANCY LOPEZ2,34.63144881,-106.7189144,10/2/1998,4795.19,1998-10-02
4556,05N.03E.28.411 NANCY LOPEZ,34.63144881,-106.7189144,10/2/1998,4794.8,1998-10-02
4557,17N.05E.24.344 DOME ROAD CRN WELL,35.68141751,-106.3666945,10/9/1998,5204.56,1998-10-09
4558,"CLC-43, LRG-430, S-30",32.43247222,-106.6549167,10/10/1998,4066.21,1998-10-10
4559,Q,37.83157432,-105.5981223,10/23/1998,7863.2,1998-10-23
4560,112t,37.8310869,-105.6122911,10/23/1998,7822.29,1998-10-23
4561,113t,37.8024095,-105.6455552,10/23/1998,7695.16,1998-10-23
4562,NA03700929DCB   ALA 8,37.4183383,-106.0122471,10/29/1998,7607.22,1998-10-29
4563,09N.02E.12.433A RIO BRAVO PARK2,35.01671511,-106.6830811,11/5/1998,4923.68,1998-11-05
4564,09N.02E.12.433 Rio Bravo Park 1,35.01671511,-106.6830811,11/5/1998,4917.51,1998-11-05
4565,NA04300808ADC   SAG 18,37.98833333,-106.11,12/1/1998,7609.17,1998-12-01
4566,11N.03E.13.333,35.17483333,-106.5860833,12/22/1998,4932.52,1998-12-22
4567,NA03800813BDB   RIO 2,37.54083333,-106.0508333,1/6/1999,7621.48,1999-01-06
4568,12N.03E.32.212,35.23172222,-106.6459444,1/28/1999,4991.74,1999-01-28
4569,12N.03E.29.434,35.23309739,-106.6450267,1/28/1999,4965.21,1999-01-28
4570,New Hickox #2,,,2/18/1999,6849.21,1999-02-18
4571,Hacienda del Cerezo HDC2,,,2/24/1999,6165.01,1999-02-24
4572,NA03901014BBC   ALA 13,37.63000181,-105.8547431,3/25/1999,7567.51,1999-03-25
4573,Rancho de los Ninos Expl,,,4/14/1999,6169.74,1999-04-14
4574,13N.05E.29.13  (RG 71514),35.32948379,-106.4439138,5/5/1999,5485.29,1999-05-05
4575,XS_1,37.80505527,-105.6347033,5/9/1999,7804.12,1999-05-09
4576,XS_2,37.82620602,-105.6183734,5/9/1999,7750.92,1999-05-09
4577,115,37.80280324,-105.6386372,5/9/1999,7707.59,1999-05-09
4578,114,37.8024095,-105.6455552,5/9/1999,7688.63,1999-05-09
4579,117,37.80283014,-105.6465105,5/9/1999,7682.15,1999-05-09
4580,118,37.80338259,-105.6476694,5/9/1999,7678.63,1999-05-09
4581,116,37.79762971,-105.6406987,5/9/1999,7672.22,1999-05-09
4582,WELL_Z,37.78840552,-105.5999056,5/24/1999,7726.71,1999-05-24
4583,CM-108,31.59364963,-106.9441226,7/1/1999,3834.64,1999-07-01
4584,CM-125,31.66505076,-106.8577616,7/1/1999,3833.2,1999-07-01
4585,CM-100,31.53999489,-106.8408287,7/1/1999,3825.47,1999-07-01
4586,CM-109,31.59564399,-106.9184756,7/1/1999,3817.66,1999-07-01
4587,CM-073,31.72947196,-106.7593634,7/1/1999,3804.92,1999-07-01
4588,CM-053,31.71055901,-106.7565474,7/1/1999,3801.67,1999-07-01
4589,CM-042,31.73070569,-106.8198519,7/1/1999,3794.03,1999-07-01
4590,CM-041,31.7086251,-106.8178904,7/1/1999,3791.34,1999-07-01
4591,CM-124,31.69026871,-106.8166356,7/1/1999,3791.34,1999-07-01
4592,CM-038,31.69396858,-106.7852475,7/1/1999,3787.76,1999-07-01
4593,CM-040,31.71192619,-106.7828059,7/1/1999,3785.27,1999-07-01
4594,CM-123,31.72998618,-106.7801332,7/1/1999,3784.94,1999-07-01
4595,CM-039,31.74701582,-106.7775983,7/1/1999,3782.28,1999-07-01
4596,XS_5,37.81263994,-105.6338591,7/15/1999,7708.48,1999-07-15
4597,13N.04E.31.343A BERNALILLO SITE PIEZ 2,35.305,-106.5613889,9/2/1999,5018.22,1999-09-02
4598,13N.04E.31.343 BERNALILLO SITE,35.305,-106.5613889,9/2/1999,5009.21,1999-09-02
4599,13N.04E.36.322,35.31087324,-106.4705803,9/9/1999,5664.71,1999-09-09
4600,NA03801208DBD   ALA 16,37.55138889,-105.6811111,9/22/1999,7555.37,1999-09-22
4601,NA03801206BCC   ALA 14,37.56944444,-105.7102778,9/22/1999,7537.99,1999-09-22
4602,NA03601111DDC   ALA 17,37.37083333,-105.7336111,10/27/1999,7540.48,1999-10-27
4603,NA03801113DDB   ALA 15,37.53555556,-105.7155556,10/28/1999,7541.68,1999-10-28
4604,NA03900823CAB   RIO 3,37.60916667,-106.0691667,11/3/1999,7633.46,1999-11-03
4605,13N.01E.24.313 PHOENIX ROAD,35.33861111,-106.7966667,11/23/1999,4988.93,1999-11-23
4606,"EUI #2, W2",,,1/12/2000,6515.27,2000-01-12
4607,10N.02E.02.334,35.11805556,-106.7003889,1/25/2000,4945.9,2000-01-25
4608,10N.02E.24.312 ATR 2,35.07921312,-106.6880818,2/22/2000,4941.78,2000-02-22
4609,09N.02E.04.232 LEA 3,35.0397697,-106.732249,3/6/2000,4871.47,2000-03-06
4610,11N.04E.19.142 WAW 2,35.170322,-106.5603022,3/20/2000,4897.51,2000-03-20
4611,"EUI #7, W7",,,3/31/2000,6582.0,2000-03-31
4612,12N.06E.34 San Pedro Grant  (RG 73610),35.2222648,-106.2822466,4/3/2000,6292.31,2000-04-03
4613,12N.06E.34 SAN PEDRO GRANT (RG73610),35.22402309,-106.2827994,4/10/2000,6338.02,2000-04-10
4614,"EUI #1, W1",,,5/22/2000,6031.1,2000-05-22
4615,13N.07E.04.222  (RG 73831),35.39142721,-106.1966897,6/4/2000,6277.27,2000-06-04
4616,10N.02E.32.433 Westgate Heights Park 1,35.04555556,-106.7505556,6/12/2000,4882.37,2000-06-12
4617,10N.02E.32.433A Westgate Heights Park 2,35.04555556,-106.7505556,6/12/2000,4881.12,2000-06-12
4618,13N.05E.28  (RG 59216),35.32448401,-106.4180802,6/15/2000,5798.33,2000-06-15
4619,13N.05E.28  (RG 74080),35.32087303,-106.4108579,6/21/2000,5591.57,2000-06-21
4620,CM-062,31.65936038,-106.8169723,7/1/2000,3825.13,2000-07-01
4621,CM-095,31.63694549,-106.8785843,7/1/2000,3824.54,2000-07-01
4622,CM-112,31.59784433,-106.8655629,7/1/2000,3821.91,2000-07-01
4623,CM-057,31.68894967,-106.8362951,7/1/2000,3810.2,2000-07-01
4624,CM-054,31.74937761,-106.7621361,7/1/2000,3809.91,2000-07-01
4625,CM-059,31.65041178,-106.8657374,7/1/2000,3808.71,2000-07-01
4626,CM-113,31.59840347,-106.8388365,7/1/2000,3806.07,2000-07-01
4627,CM-058,31.67265912,-106.8425454,7/1/2000,3805.77,2000-07-01
4628,CM-061,31.67402379,-106.8165934,7/1/2000,3805.32,2000-07-01
4629,CM-063,31.66980084,-106.7873374,7/1/2000,3795.47,2000-07-01
4630,CM-064B,31.65187084,-106.7787687,7/1/2000,3792.13,2000-07-01
4631,CM-116,31.74663878,-106.8465535,7/1/2000,3791.99,2000-07-01
4632,CM-114,31.70766913,-106.8398717,7/1/2000,3787.34,2000-07-01
4633,CM-055,31.74882819,-106.8210509,7/1/2000,3781.46,2000-07-01
4634,CM-056,31.72723605,-106.842844,7/1/2000,3779.27,2000-07-01
4635,Alto MW-6,,,7/17/2000,6599.54,2000-07-17
4636,Alto MW-3,,,7/17/2000,6548.38,2000-07-17
4637,Alto MW-2,,,7/17/2000,6531.06,2000-07-17
4638,13N.05E.22.432  (RG 74471),35.33642814,-106.3961358,8/25/2000,5880.38,2000-08-25
4639,SC04101223DDD,37.78194477,-105.6169583,9/11/2000,7711.32,2000-09-11
4640,SC02707303ABB,37.73611232,-105.5247343,9/12/2000,8006.05,2000-09-12
4641,SC04101235ABB1,37.76611145,-105.6250145,9/13/2000,7665.34,2000-09-13
4642,SC02501236ADD,37.83166692,-105.5980678,9/14/2000,7864.18,2000-09-14
4643,SC04101235ABB2,37.76583367,-105.6252923,9/20/2000,7683.62,2000-09-20
4644,SC04101226DCD,37.7680559,-105.6236255,9/26/2000,7677.06,2000-09-26
4645,SC04001212AAA,37.7352786,-105.6016809,9/27/2000,7712.86,2000-09-27
4646,12N.06E.35 San Pedro Grant,35.2222648,-106.2794689,10/1/2000,6256.17,2000-10-01
4647,12N.06E.34 San Pedro Grant  (RG 74274),35.22837576,-106.2822466,10/10/2000,6363.94,2000-10-10
4648,10N.02E.32.433B Westgate Heights Park 3,35.04555556,-106.7505556,11/9/2000,4918.68,2000-11-09
4649,09N.02E.28.312B Niese Road3,34.97833333,-106.7419444,11/27/2000,4908.19,2000-11-27
4650,09N.02E.28.312A Niese Road2,34.97833333,-106.7419444,11/27/2000,4905.14,2000-11-27
4651,09N.02E.28.312 Niese Road1,34.97833333,-106.7419444,11/27/2000,4892.02,2000-11-27
4652,19S.03W.08.423 HD-1,32.66863889,-107.1653333,12/13/2000,4050.4,2000-12-13
4653,SFDowns #2,,,1/1/2001,6139.55,2001-01-01
4654,RGDSSP11,37.62996667,-105.8564333,1/12/2001,7526.9,2001-01-12
4655,03S.11W.27.411,34.01594444,-107.9663333,2/5/2001,6765.6,2001-02-05
4656,RGDSSP04,37.14778333,-105.6120833,2/14/2001,7571.82,2001-02-14
4657,RGDSSP12,37.0573,-105.9829167,2/22/2001,7693.63,2001-02-22
4658,RGDSSP08,37.40035,-106.00065,2/22/2001,7609.71,2001-02-22
4659,RGDSSP03,37.28511667,-105.85595,2/22/2001,7572.85,2001-02-22
4660,27S.01E.11.342,31.97065633,-106.8119429,3/13/2001,3801.27,2001-03-13
4661,MW-1,,,3/26/2001,6872.11,2001-03-26
4662,RGDSSP13,37.83746667,-106.0367333,3/29/2001,7600.44,2001-03-29
4663,Alto,,,3/31/2001,6495.99,2001-03-31
4664,MWB Well #9; Torreon #1,,,3/31/2001,6482.12,2001-03-31
4665,13N.05E.16.333  (RG 73287),35.34892765,-106.4247472,4/11/2001,5318.34,2001-04-11
4666,JL-49-15-520,31.808612,-106.181944,4/11/2001,3674.88,2001-04-11
4667,JL-49-15-506,31.82,-106.177222,4/11/2001,3673.79,2001-04-11
4668,JL-49-23-102,31.72,-106.241389,4/11/2001,3668.86,2001-04-11
4669,JL-49-23-101,31.746389,-106.249167,4/12/2001,3671.02,2001-04-12
4670,JL-49-22-623,31.685278,-106.263889,4/12/2001,3657.91,2001-04-12
4671,13N.05E.29  (RG 75753),35.32003968,-106.433358,5/7/2001,5407.92,2001-05-07
4672,13N.05E.16.343  (RG 73237),35.34837213,-106.421136,5/23/2001,5365.55,2001-05-23
4673,11N.01E.14.342 Paradise Road,35.17772222,-106.8076667,6/7/2001,4943.05,2001-06-07
4674,RGDSSP09,37.46596667,-106.1472667,6/19/2001,7629.05,2001-06-19
4675,RGDSSP10,37.5749,-106.15055,6/19/2001,7622.41,2001-06-19
4676,Alto MW-7,,,7/2/2001,6571.36,2001-07-02
4677,Alto MW-8,,,7/2/2001,6567.1,2001-07-02
4678,JL-49-15-304,31.8725,-106.166112,8/7/2001,3671.45,2001-08-07
4679,JL-49-15-614,31.833611,-106.157501,8/8/2001,3659.41,2001-08-08
4680,12N.07E.29 San Pedro Grant  (RG  69670),35.2419866,-106.2172462,9/10/2001,6723.63,2001-09-10
4681,"LCJV, Avanti, Santa Fe Metro",,,10/1/2001,6133.11,2001-10-01
4682,13N.05E.22.441  (RG 75169),35.33642814,-106.3941913,11/7/2001,5970.47,2001-11-07
4683,Heartstone Development Exp,,,12/5/2001,6373.32,2001-12-05
4684,Santa Fe Community College,,,1/19/2002,6355.96,2002-01-19
4685,Rancho Viejo El Rancho Well; MWB site,,,1/19/2002,6322.2,2002-01-19
4686,13N.05E.22.123  (RG 77297),35.34535284,-106.4020442,2/22/2002,5735.71,2002-02-22
4687,JL-49-04-191,31.967778,-106.608334,5/12/2002,3771.75,2002-05-12
4688,MW-2,,,6/3/2002,6958.13,2002-06-03
4689,12N.06E.27 San Pedro Grant  (RG  77621),35.23004238,-106.2850243,6/4/2002,6319.68,2002-06-04
4690,12N.06E.34 San Pedro Grant  (RG  77624),35.22698691,-106.284191,6/14/2002,6315.34,2002-06-14
4691,12N.06E.27 San Pedro Grant  (RG  77622),35.22948684,-106.2808577,6/18/2002,6206.39,2002-06-18
4692,Circle Drive,,,6/21/2002,7074.03,2002-06-21
4693,SDC3; SY-3; Gattis,,,6/21/2002,6898.71,2002-06-21
4694,"Knight, O-5, SY-2, SDC-2",,,6/21/2002,6858.29,2002-06-21
4695,MBOWN-32 - 23S.01E.22.241F (LC-2F),32.2962047,-106.8230608,6/21/2002,3865.91,2002-06-21
4696,JL-49-04-192,31.959167,-106.606667,6/24/2002,3705.74,2002-06-24
4697,Mountain Vista,,,6/29/2002,6335.85,2002-06-29
4698,NA04101013ABD2 EW-79U,37.80555511,-105.8250185,7/19/2002,7523.68,2002-07-19
4699,RGDSSP07,37.21016667,-105.9473167,7/31/2002,7626.96,2002-07-31
4700,Tesuque Ridge Tract C,,,8/20/2002,6934.11,2002-08-20
4701,Tesuque Ridge Well 2; Blatt,,,8/20/2002,6901.51,2002-08-20
4702,MBOWN-358 25S.02E.27.111,32.11166667,-106.7344444,9/10/2002,3826.91,2002-09-10
4703,NA04201036CCD3 EW-73U,37.83888837,-105.8350179,9/12/2002,7523.96,2002-09-12
4704,MBOWN-36 - 23S.01E.23.244D (LC-3D),32.29481601,-106.8033379,9/20/2002,3873.96,2002-09-20
4705,JL-49-06-706,31.8975,-106.3675,10/6/2002,3615.65,2002-10-06
4706,JL-49-05-920,31.898611,-106.384167,10/15/2002,3598.07,2002-10-15
4707,12N.06E.22 San Pedro Grant  (RG  74125),35.24920856,-106.2855797,10/25/2002,6244.4,2002-10-25
4708,JL-49-14-524,31.825278,-106.293056,11/4/2002,3647.04,2002-11-04
4709,JL-49-14-619,31.808612,-106.268889,11/19/2002,3658.97,2002-11-19
4710,JL-49-14-618,31.819167,-106.274167,11/23/2002,3662.73,2002-11-23
4711,CAT-6,,,12/3/2002,6871.13,2002-12-03
4712,JL-49-14-204,31.850001,-106.331667,12/7/2002,3614.34,2002-12-07
4713,13N.05E.29.112  (RG 50279),35.32976157,-106.4403026,12/9/2002,5465.08,2002-12-09
4714,JL-49-14-205,31.838611,-106.324167,12/17/2002,3612.25,2002-12-17
4715,Riley,,,1/7/2003,6792.5,2003-01-07
4716,EB-572,35.80089826,-105.9235916,1/8/2003,6686.19,2003-01-08
4717,Montoya 2,,,1/9/2003,6566.93,2003-01-09
4718,Montoya 1,,,1/9/2003,6566.13,2003-01-09
4719,17N.09E.32.312442B,35.65914208,-106.0142168,1/9/2003,6560.55,2003-01-09
4720,JL-49-14-110,31.864167,-106.339167,1/16/2003,3615.82,2003-01-16
4721,14N.09E.06.2233,35.47614726,-106.0222437,1/22/2003,6170.4,2003-01-22
4722,MWB#38 Fitter,,,1/22/2003,6036.41,2003-01-22
4723,NA04101001DCC2,37.82277778,-105.8265556,1/23/2003,7524.04,2003-01-23
4724,Ranney Ranch,,,1/23/2003,6270.8,2003-01-23
4725,NA04201006ADA3,37.91491667,-105.9105833,1/24/2003,7534.07,2003-01-24
4726,NA04101026BCC3,37.77175,-105.8550278,1/24/2003,7531.5,2003-01-24
4727,NA04101034DDD2,37.7505,-105.855,1/24/2003,7530.84,2003-01-24
4728,NA04201014BAB3,37.88961111,-105.8485556,1/24/2003,7529.29,2003-01-24
4729,NA04201014CCC3,37.87555556,-105.854,1/24/2003,7526.82,2003-01-24
4730,NA04201024DCB2,37.86866667,-105.8265833,1/24/2003,7526.8,2003-01-24
4731,NA04201034CDB3,37.83708333,-105.8670833,1/24/2003,7520.14,2003-01-24
4732,NA04201028CCC3,37.85136111,-105.8913333,1/24/2003,7514.43,2003-01-24
4733,16N.09E.15.4421,35.61353258,-105.9660491,1/28/2003,6586.73,2003-01-28
4734,15N.08E.15.3111,35.53003458,-106.0894665,1/28/2003,6118.09,2003-01-28
4735,JL-49-14-523,31.83,-106.308612,1/29/2003,3619.81,2003-01-29
4736,JL-49-06-708,31.876111,-106.346111,1/29/2003,3616.38,2003-01-29
4737,JL-49-06-707,31.893056,-106.355278,1/29/2003,3606.86,2003-01-29
4738,MBOWN-38 - 23S.01E.30.322 (CLC-37),32.2778714,-106.8800069,2/4/2003,3875.37,2003-02-04
4739,MBOWN-47 - 23S.02E.21.223 (CLC-34),32.29814966,-106.7377802,2/4/2003,3845.39,2003-02-04
4740,NA04200924DAD3 EW-80U,37.86999949,-105.9291859,2/21/2003,7524.62,2003-02-21
4741,MBOWN-152 - 27S.03E.03.211A (ISC-1A/ISC-1M),31.99444444,-106.6230556,3/12/2003,3784.62,2003-03-12
4742,MBOWN-153 - 27S.03E.03.211B (ISC-1B/ISC-1S),31.99444444,-106.6230556,3/12/2003,3776.35,2003-03-12
4743,MBOWN-168 - 27S.03E.22.134A (ISC-3A/ISC-3M),31.94573611,-106.6287472,3/12/2003,3769.14,2003-03-12
4744,MBOWN-160 - 27S.03E.15.213A (ISC-2A/ISC-2M),31.96508333,-106.6239,3/12/2003,3765.15,2003-03-12
4745,MBOWN-161 - 27S.03E.15.213B (ISC-2B/ISC-2S),31.96508333,-106.6239,3/12/2003,3765.15,2003-03-12
4746,MBOWN-169 - 27S.03E.22.134B (ISC-3B/ISC-3S),31.94573611,-106.6287472,3/12/2003,3759.73,2003-03-12
4747,MBOWN-154 - 27S.03E.03.211C (ISC-1C/ISC-1I),31.99444444,-106.6230556,3/12/2003,3753.14,2003-03-12
4748,MBOWN-155 - 27S.03E.03.211D (ISC-1D),31.99444444,-106.6230556,3/12/2003,3753.09,2003-03-12
4749,MBOWN-170 - 27S.03E.22.134C (ISC-3C/ISC-3I),31.94573611,-106.6287472,3/12/2003,3739.2,2003-03-12
4750,MBOWN-171 - 27S.03E.22.134D (ISC-3D),31.94573611,-106.6287472,3/12/2003,3738.57,2003-03-12
4751,MBOWN-163 - 27S.03E.15.213D (ISC-2D),31.96508333,-106.6239,3/12/2003,3722.48,2003-03-12
4752,MBOWN-162 - 27S.03E.15.213C (ISC-2C/ISC-2I),31.96508333,-106.6239,3/12/2003,3721.16,2003-03-12
4753,21N.08E.36.213,36.00825,-106.0411667,3/13/2003,5741.36,2003-03-13
4754,20N.08E.01.114,35.99891224,-106.0514119,3/13/2003,5592.69,2003-03-13
4755,21N.08E.32.422,36.00763889,-106.1093333,3/13/2003,5497.61,2003-03-13
4756,JL-49-14-304,31.848056,-106.253612,3/18/2003,3673.09,2003-03-18
4757,Pajarito well west of river,,,3/25/2003,5529.69,2003-03-25
4758,EB-148,35.66399912,-106.0584129,3/26/2003,6171.63,2003-03-26
4759,EB-149,35.6675419,-106.0564157,3/26/2003,6164.93,2003-03-26
4760,EB-152,35.69364814,-105.9779243,3/27/2003,6677.71,2003-03-27
4761,EB-153,35.69991181,-105.9715458,3/27/2003,6671.02,2003-03-27
4762,EB-150,35.6973678,-105.9661322,3/27/2003,6645.4,2003-03-27
4763,Clements,,,4/2/2003,6981.9,2003-04-02
4764,JL-49-14-305,31.842222,-106.252501,4/5/2003,3676.05,2003-04-05
4765,EB-156,35.68578674,-106.0971141,4/10/2003,6129.2,2003-04-10
4766,EB-155,35.68221342,-106.0895066,4/10/2003,6128.09,2003-04-10
4767,EB-189,35.77270012,-105.9160522,4/16/2003,6956.02,2003-04-16
4768,"Smoker, T-18",,,4/16/2003,6878.44,2003-04-16
4769,EB-185,35.74637268,-105.9244211,4/16/2003,6866.2,2003-04-16
4770,EB-200,35.77452146,-105.9195802,4/16/2003,6855.47,2003-04-16
4771,EB-199,35.7468156,-105.9266161,4/16/2003,6855.33,2003-04-16
4772,EB-191,35.76719198,-105.939353,4/16/2003,6673.63,2003-04-16
4773,EB-192,35.77318087,-105.9402089,4/16/2003,6633.27,2003-04-16
4774,EB-190,35.77488185,-105.9207903,4/23/2003,6841.67,2003-04-23
4775,EB-193,35.76460221,-105.9256829,4/23/2003,6776.47,2003-04-23
4776,EB-198,35.765977,-105.9297919,4/23/2003,6749.52,2003-04-23
4777,EB-194,35.75501759,-105.9362566,4/23/2003,6748.92,2003-04-23
4778,MBOWN-166 - 27S.03E.20.432D (LMV-3B),31.93954696,-106.6552704,4/29/2003,3748.87,2003-04-29
4779,"Factor, T-7",,,5/1/2003,6859.96,2003-05-01
4780,"Hotchkiss, T-47",,,5/1/2003,6826.7,2003-05-01
4781,"Lipsett, T-11",,,5/1/2003,6700.02,2003-05-01
4782,EB-195,35.76906238,-105.9225153,5/2/2003,6806.33,2003-05-02
4783,EB-197,35.75819581,-105.9286837,5/2/2003,6771.61,2003-05-02
4784,EB-169,35.6720554,-106.0771592,5/7/2003,6140.93,2003-05-07
4785,EB-080,35.73042176,-105.9351394,5/8/2003,6897.19,2003-05-08
4786,EB-168,35.70679328,-106.0382189,5/8/2003,6215.91,2003-05-08
4787,EB-167,35.70916453,-106.0371663,5/8/2003,6215.33,2003-05-08
4788,EB-058,35.71028758,-106.0376231,5/8/2003,6206.01,2003-05-08
4789,Old Hickox,,,5/14/2003,6834.55,2003-05-14
4790,EB-174,35.68013005,-105.9794169,5/14/2003,6655.53,2003-05-14
4791,EB-176,35.69560997,-106.064434,5/14/2003,6270.29,2003-05-14
4792,EB-175,35.6747093,-106.0717475,5/14/2003,6183.75,2003-05-14
4793,16N.08E.12.144,35.63169832,-106.0455781,5/14/2003,6157.5,2003-05-14
4794,16N.09E.07.1111,35.63836483,-106.0344669,5/14/2003,6156.42,2003-05-14
4795,EB-179,35.7587776,-105.9465766,5/15/2003,6708.69,2003-05-15
4796,EB-178,35.76633718,-105.9460357,5/15/2003,6635.18,2003-05-15
4797,EB-177,35.68406832,-106.0706791,5/15/2003,6210.77,2003-05-15
4798,EB-138,35.65753669,-106.058184,5/15/2003,6183.7,2003-05-15
4799,EB-081,35.78017546,-106.0348351,5/15/2003,6174.25,2003-05-15
4800,RGDSSP15,37.56958333,-105.7099,5/20/2003,7534.37,2003-05-20
4801,MW-5,,,5/27/2003,6879.0,2003-05-27
4802,EB-082,35.75553135,-105.9443481,5/29/2003,6782.6,2003-05-29
4803,EB-093,35.73884608,-105.9643992,5/29/2003,6679.25,2003-05-29
4804,EB-098,35.75340384,-105.9714877,5/29/2003,6672.87,2003-05-29
4805,EB-182,35.68499927,-106.0290625,5/29/2003,6245.46,2003-05-29
4806,RGDSSP02,37.75551667,-106.1213833,5/30/2003,7627.3,2003-05-30
4807,RGDSSP01,38.01475,-106.0511333,5/30/2003,7575.1,2003-05-30
4808,13N.05E.29  (RG 79790),35.32892827,-106.4353026,6/1/2003,5418.05,2003-06-01
4809,RGDSSP06,37.43003333,-105.4729667,6/2/2003,7762.53,2003-06-02
4810,RGDSSP05,37.35063333,-105.7240667,6/2/2003,7530.95,2003-06-02
4811,17N.08E.24.3222,35.68880556,-106.0438889,6/11/2003,6209.5,2003-06-11
4812,Santa Fe Ranch HQ,,,6/13/2003,6143.32,2003-06-13
4813,09N.03E.07.213B RBED,35.02685833,-106.664375,6/19/2003,4921.85,2003-06-19
4814,09N.03E.07.213A RBES,35.02685833,-106.664375,6/19/2003,4921.67,2003-06-19
4815,09N.03E.07.123A RBEDWS,35.02778333,-106.6691472,6/20/2003,4926.93,2003-06-20
4816,09N.03E.07.123B RBEDWD,35.02778611,-106.66915,6/20/2003,4926.91,2003-06-20
4817,09N.03E.07.113A RBERD,35.02793333,-106.6716417,6/20/2003,4922.43,2003-06-20
4818,EB-165,35.76123806,-105.9903545,6/23/2003,6362.8,2003-06-23
4819,Northwest Well,,,6/30/2003,6638.88,2003-06-30
4820,13N.04E.34.233,35.31369444,-106.5029722,6/30/2003,5064.31,2003-06-30
4821,CM-052,31.69261725,-106.753941,7/1/2003,3798.95,2003-07-01
4822,MBOWN-133 - 26S.03E.20.423A (LMV-2A),32.02815564,-106.6522162,7/2/2003,3785.29,2003-07-02
4823,MBOWN-134 - 26S.03E.20.423B (LMV-2B),32.02815564,-106.6522162,7/2/2003,3776.12,2003-07-02
4824,12N.06E.34 San Pedro Grant  (RG  80627),35.22309813,-106.2933577,7/10/2003,6186.4,2003-07-10
4825,09N.03E.07.114D RBEBD,35.02792778,-106.6709278,7/22/2003,4923.67,2003-07-22
4826,09N.02E.12.223B RBWD,35.02689722,-106.6767472,7/23/2003,4927.15,2003-07-23
4827,09N.02E.12.223A RBWS,35.02689722,-106.6767472,7/23/2003,4927.1,2003-07-23
4828,09N.03E.07.113D RBWBM,35.02800556,-106.6738222,7/23/2003,4925.95,2003-07-23
4829,09N.03E.07.113G RBWBD,35.02800556,-106.6738222,7/23/2003,4925.94,2003-07-23
4830,09N.03E.07.113C RBWDED,35.028,-106.6743917,7/23/2003,4925.34,2003-07-23
4831,09N.03E.07.113B RBWDES,35.028,-106.6743917,7/23/2003,4924.38,2003-07-23
4832,13N.05E.29.114  (RG 80733),35.33031712,-106.4344693,7/25/2003,5315.76,2003-07-25
4833,17N.09E.03.2411,35.73411253,-105.9683554,7/30/2003,6679.68,2003-07-30
4834,17N.09E.02.3231,35.72889052,-105.9597441,7/30/2003,6670.36,2003-07-30
4835,17N.09E.02.3244,35.72825168,-105.9564107,7/30/2003,6666.79,2003-07-30
4836,EB-275,35.75328223,-105.9764856,7/30/2003,6645.92,2003-07-30
4837,EB-085,35.76224931,-106.0214394,7/30/2003,6222.17,2003-07-30
4838,T17N.R09E.11.124A  Archery Range Deep Piezo.,35.7225,-105.9602778,9/11/2003,6738.39,2003-09-11
4839,T17N.R09E.11.124B  Archery Range Middle Piezo.,35.7225,-105.9602778,9/11/2003,6733.93,2003-09-11
4840,13N.05E.29  (RG 49199),35.32920605,-106.4311359,10/9/2003,5397.22,2003-10-09
4841,09N.03E.07.113F,35.02861111,-106.6730556,10/22/2003,4919.97,2003-10-22
4842,T18N.R08E.17.111A  Buckman Well Deep Piezo.,35.79194444,-106.1222222,10/24/2003,5904.45,2003-10-24
4843,T18N.R08E.17.111B  Buckman Well Middle Piezo.,35.79194444,-106.1222222,10/24/2003,5799.52,2003-10-24
4844,T18N.R08E.17.111C  Buckman Well Shallow Piezo.,35.79194444,-106.1222222,10/24/2003,5777.79,2003-10-24
4845,13N.05E.20  (RG 80078),35.32948382,-106.4294692,11/19/2003,5459.79,2003-11-19
4846,NA04001108DCC2,37.72155581,-105.7897415,11/20/2003,7521.1,2003-11-20
4847,NA04001118BBB2,37.72130578,-105.8194921,11/20/2003,7521.02,2003-11-20
4848,NA04001117DDD3,37.70813941,-105.7839358,11/20/2003,7519.37,2003-11-20
4849,EB-305,35.57358887,-106.0994445,1/9/2004,6104.65,2004-01-09
4850,EB-304,35.57429611,-106.1019703,1/9/2004,6086.96,2004-01-09
4851,EB-001,35.55534436,-106.1195845,1/9/2004,6017.48,2004-01-09
4852,EB-301,35.55988937,-106.1368272,1/9/2004,5868.03,2004-01-09
4853,MBOWN-56 - 23S.02E.30.123 (CLC-58),32.28426092,-106.7802815,1/13/2004,3853.32,2004-01-13
4854,EB-312,35.5678663,-106.0932089,2/10/2004,6120.17,2004-02-10
4855,EB-132,35.56985297,-106.0968333,2/10/2004,6112.0,2004-02-10
4856,EB-315,35.57264318,-106.103283,2/10/2004,6093.8,2004-02-10
4857,EB-316,35.5730969,-106.1059157,2/10/2004,6085.5,2004-02-10
4858,EB-306,35.57743446,-106.1087674,2/10/2004,6071.5,2004-02-10
4859,EB-314,35.57342907,-106.1129278,2/10/2004,6057.74,2004-02-10
4860,EB-313,35.5743142,-106.1117813,2/10/2004,6053.24,2004-02-10
4861,EB-310,35.5950361,-106.0807183,2/11/2004,6142.24,2004-02-11
4862,EB-309,35.59859271,-106.1050962,2/11/2004,6124.06,2004-02-11
4863,EB-311,35.58074093,-106.106087,2/11/2004,6100.95,2004-02-11
4864,EB-308,35.58074277,-106.1107886,2/11/2004,6095.92,2004-02-11
4865,EB-317,35.58336303,-106.0570306,2/20/2004,6141.05,2004-02-20
4866,EB-322,35.58432264,-106.0627384,2/20/2004,6135.02,2004-02-20
4867,EB-318,35.58338456,-106.05766,2/20/2004,6134.04,2004-02-20
4868,EB-319,35.58335975,-106.0584322,2/20/2004,6133.88,2004-02-20
4869,EB-321,35.58332116,-106.0597451,2/20/2004,6130.11,2004-02-20
4870,EB-320,35.58330915,-106.0590607,2/20/2004,6129.09,2004-02-20
4871,EB-323,35.57993908,-106.136073,2/21/2004,6010.69,2004-02-21
4872,EB-335,35.57946953,-106.073192,2/27/2004,6127.69,2004-02-27
4873,EB-334,35.57595174,-106.0824373,2/27/2004,6104.23,2004-02-27
4874,EB-333,35.5589362,-106.1055335,2/27/2004,6089.79,2004-02-27
4875,EB-332,35.55970267,-106.106504,2/27/2004,6088.05,2004-02-27
4876,EB-330,35.56037327,-106.11299,2/27/2004,6067.15,2004-02-27
4877,EB-331,35.56332439,-106.1146308,2/27/2004,6052.15,2004-02-27
4878,EB-002,35.56093479,-106.1136929,2/27/2004,6047.21,2004-02-27
4879,T17N.R09E.11.124C  Archery Range Shallow Piezo.,35.7225,-105.9602778,3/17/2004,6735.5,2004-03-17
4880,JL-49-04-188,31.96760184,-106.6083252,3/19/2004,3767.39,2004-03-19
4881,JL-49-04-433,31.94843576,-106.6066583,3/19/2004,3760.96,2004-03-19
4882,JL-49-04-190,31.96760184,-106.6088808,3/19/2004,3723.2,2004-03-19
4883,JL-49-04-189,31.95899099,-106.6066584,3/19/2004,3718.72,2004-03-19
4884,EB-022,35.62861137,-105.9399377,3/23/2004,6897.9,2004-03-23
4885,EB-407,35.61449147,-106.0481985,3/23/2004,6148.0,2004-03-23
4886,EB-020,35.62956314,-105.9392862,3/24/2004,6870.84,2004-03-24
4887,16N.09E.19.312 WILSON,35.60225476,-106.0330777,3/24/2004,6195.49,2004-03-24
4888,EB-114,35.59601114,-106.0489399,3/24/2004,6138.53,2004-03-24
4889,EB-329,35.60020891,-106.1126803,3/24/2004,6119.34,2004-03-24
4890,Rancho Viejo Bonanza,,,3/25/2004,6462.32,2004-03-25
4891,EB-286,35.74523632,-106.0182581,3/25/2004,6229.69,2004-03-25
4892,EB-326,35.61987408,-106.1144875,3/26/2004,6150.82,2004-03-26
4893,EB-327,35.61682957,-106.1200102,3/26/2004,6138.96,2004-03-26
4894,13N.07E.08.442  (RG 76343),35.36281683,-106.2083566,3/30/2004,6548.53,2004-03-30
4895,EB-009,35.66778576,-105.9457553,3/31/2004,6911.14,2004-03-31
4896,17N.09E.23.232,35.69186381,-105.9555494,3/31/2004,6664.97,2004-03-31
4897,EB-023,35.64681318,-106.00383,3/31/2004,6523.3,2004-03-31
4898,USFS 700 Ft Well,,,4/3/2004,5821.9,2004-04-03
4899,"CDEX #1C, shallow",,,4/15/2004,6324.18,2004-04-15
4900,La Tierra 32-T-2,,,4/29/2004,6322.84,2004-04-29
4901,Gold old,,,4/29/2004,6208.68,2004-04-29
4902,EB-339,35.58409387,-106.0702516,4/29/2004,6122.86,2004-04-29
4903,EB-340,35.56311588,-106.1069261,4/29/2004,6074.68,2004-04-29
4904,16N.09E.10.421,35.63042097,-105.9695492,4/30/2004,6605.06,2004-04-30
4905,Permit well,,,5/7/2004,5882.91,2004-05-07
4906,T16N.R08E.2.343C NMOSE County Well-Shallow Piez,35.64,-106.0691667,5/14/2004,6180.51,2004-05-14
4907,T16N.R08E.2.343B NMOSE County Well-Middle Piez,35.64,-106.0691667,5/14/2004,6162.11,2004-05-14
4908,T16N.R08E.2.343A NMOSE County Well-Deep Piez,35.64,-106.0691667,5/14/2004,6156.41,2004-05-14
4909,Sierra Vista Retirement Comm.,,,5/22/2004,6767.99,2004-05-22
4910,"Exon 1D, DBS-1D",,,5/25/2004,6604.95,2004-05-25
4911,17N.09E.02.31,35.73366815,-105.9622442,5/26/2004,6690.69,2004-05-26
4912,EB-060,35.75201498,-106.0055477,5/26/2004,6369.04,2004-05-26
4913,16N.09E.08.244,35.63230955,-106.0023276,5/27/2004,6510.64,2004-05-27
4914,EB-343,35.55026421,-105.9847081,5/28/2004,6365.41,2004-05-28
4915,EB-342,35.46258554,-106.0628537,5/28/2004,6020.68,2004-05-28
4916,Rancho Viejo LaCienega Well,,,6/3/2004,6561.13,2004-06-03
4917,EB-349,35.55721631,-105.9474999,6/3/2004,6525.23,2004-06-03
4918,EB-004,35.56453686,-105.9813848,6/3/2004,6362.08,2004-06-03
4919,EB-003,35.56773831,-105.9945002,6/3/2004,6338.97,2004-06-03
4920,Rancho ViejoTest Well,,,6/3/2004,6330.95,2004-06-03
4921,EB-346,35.52960931,-106.0192875,6/3/2004,6183.45,2004-06-03
4922,EB-350,35.56386922,-105.916141,6/10/2004,6883.49,2004-06-10
4923,EB-348,35.52733953,-105.9886853,6/10/2004,6332.87,2004-06-10
4924,EB-366,35.62612871,-106.0841292,6/10/2004,6158.9,2004-06-10
4925,EB-361,35.64244247,-106.047006,6/10/2004,6158.52,2004-06-10
4926,EB-364,35.63115651,-106.0764335,6/10/2004,6155.92,2004-06-10
4927,EB-365,35.63110267,-106.0894421,6/10/2004,6155.22,2004-06-10
4928,EB-363,35.62900485,-106.0841239,6/10/2004,6154.61,2004-06-10
4929,EB-362,35.62780865,-106.0897949,6/10/2004,6152.47,2004-06-10
4930,EB-369,35.60279121,-106.0416649,6/17/2004,6146.14,2004-06-17
4931,EB-372,35.66434224,-106.06245,6/18/2004,6171.45,2004-06-18
4932,EB-373,35.60996407,-106.0850151,6/18/2004,6148.04,2004-06-18
4933,EB-374,35.50152865,-106.0626168,6/18/2004,6114.67,2004-06-18
4934,EB-184,35.60385503,-106.0406299,6/24/2004,6155.42,2004-06-24
4935,EB-382,35.59776436,-106.0495037,6/24/2004,6148.2,2004-06-24
4936,EB-386,35.58622197,-106.0589887,6/24/2004,6147.25,2004-06-24
4937,EB-380,35.53055242,-106.0645766,6/24/2004,6137.99,2004-06-24
4938,EB-381,35.50541878,-106.0763848,6/24/2004,6124.79,2004-06-24
4939,EB-379,35.54934525,-106.0894491,6/24/2004,6103.93,2004-06-24
4940,EB-378,35.54304728,-106.0979243,6/24/2004,6098.88,2004-06-24
4941,EB-377,35.5383786,-106.1124985,6/24/2004,6034.34,2004-06-24
4942,EB-376,35.604277,-105.9525477,6/25/2004,6740.07,2004-06-25
4943,EB-375,35.60346323,-105.951699,6/25/2004,6736.87,2004-06-25
4944,EB-119,35.60808585,-105.9543151,6/25/2004,6715.83,2004-06-25
4945,17N.09E.32.41233,35.6593921,-106.0071334,6/28/2004,6557.59,2004-06-28
4946,EB-391,35.59450887,-106.0526844,7/1/2004,6147.7,2004-07-01
4947,EB-390,35.53705132,-106.0514147,7/1/2004,6145.32,2004-07-01
4948,Turquoise Trail #3,,,7/6/2004,6107.72,2004-07-06
4949,EB-347,35.49409669,-105.9675511,7/14/2004,6408.45,2004-07-14
4950,EB-344,35.5134425,-106.0236374,7/14/2004,6230.29,2004-07-14
4951,EB-352,35.54953544,-106.0372135,7/14/2004,6163.96,2004-07-14
4952,EB-112,35.58846584,-106.0456957,7/14/2004,6148.06,2004-07-14
4953,EB-084,35.62533617,-105.9930486,7/15/2004,6481.81,2004-07-15
4954,EB-392,35.58412612,-106.0501866,7/15/2004,6148.49,2004-07-15
4955,Peters Explor; Suerte del Sur,,,7/29/2004,6219.29,2004-07-29
4956,13N.05E.27  (RG 83044),35.32115081,-106.4089135,8/25/2004,5837.53,2004-08-25
4957,EB-433,35.52380912,-105.8637168,9/1/2004,6891.0,2004-09-01
4958,EB-448,35.52587667,-105.8783086,9/1/2004,6865.19,2004-09-01
4959,EB-440,35.50707521,-105.8761632,9/1/2004,6684.63,2004-09-01
4960,EB-139,35.50034774,-105.912817,9/1/2004,6599.6,2004-09-01
4961,EB-438,35.52152898,-105.9395697,9/1/2004,6529.52,2004-09-01
4962,EB-443,35.55194819,-105.9351363,9/1/2004,6522.97,2004-09-01
4963,EB-417,35.54694309,-105.9352768,9/1/2004,6515.87,2004-09-01
4964,EB-451,35.55210545,-105.946182,9/1/2004,6509.66,2004-09-01
4965,EB-436,35.54327184,-105.9493326,9/1/2004,6506.66,2004-09-01
4966,EB-426,35.54907823,-105.9561859,9/1/2004,6504.81,2004-09-01
4967,EB-446,35.51895157,-105.9417233,9/1/2004,6494.78,2004-09-01
4968,EB-418,35.54499254,-105.9608922,9/1/2004,6481.43,2004-09-01
4969,EB-431,35.54293414,-105.9646183,9/1/2004,6464.54,2004-09-01
4970,EB-442,35.5483749,-105.9708616,9/1/2004,6371.26,2004-09-01
4971,EB-430,35.55392251,-105.9671662,9/1/2004,6354.75,2004-09-01
4972,EB-423,35.53981248,-105.9626174,9/1/2004,6349.34,2004-09-01
4973,EB-450,35.49103993,-106.063967,9/1/2004,6083.34,2004-09-01
4974,EB-427,35.54985844,-105.9290441,9/4/2004,6535.92,2004-09-04
4975,EB-449,35.51690408,-105.9429786,9/4/2004,6497.74,2004-09-04
4976,EB-424,35.54818264,-105.9015653,9/6/2004,6842.17,2004-09-06
4977,EB-437,35.55355361,-105.9420175,9/6/2004,6514.88,2004-09-06
4978,EB-444,35.52753318,-105.8699442,9/7/2004,6900.43,2004-09-07
4979,EB-439,35.50763789,-105.8719239,9/7/2004,6671.03,2004-09-07
4980,EB-425,35.53905093,-105.9109278,9/7/2004,6619.92,2004-09-07
4981,EB-452,35.49817549,-105.9443584,9/7/2004,6498.41,2004-09-07
4982,EB-419,35.53566335,-105.9650828,9/7/2004,6456.27,2004-09-07
4983,EB-422,35.55499766,-105.9736115,9/7/2004,6385.86,2004-09-07
4984,EB-432,35.55690946,-105.9623363,9/9/2004,6434.59,2004-09-09
4985,JL-49-05-637,31.928055,-106.391389,10/30/2004,3599.36,2004-10-30
4986,16N.09E.04.334C NMOSE Fairgrounds Shallow Piez.,35.64027778,-105.9963889,11/9/2004,6488.94,2004-11-09
4987,16N.09E.04.334B NMOSE Fairgrounds Mid Piezometer,35.64027778,-105.9963889,11/9/2004,6456.74,2004-11-09
4988,16N.09E.04.334A NMOSE Fairgrounds Deep Piezometer,35.64027778,-105.9963889,11/9/2004,6444.54,2004-11-09
4989,JL-49-05-811,31.884722,-106.422778,11/17/2004,3582.02,2004-11-17
4990,Estancia Subdivision; Estrella Concepts,,,11/20/2004,6680.59,2004-11-20
4991,SF-1C,,,12/9/2004,6580.43,2004-12-09
4992,Buckman #7,,,12/31/2004,5279.31,2004-12-31
4993,Buckman #6,,,12/31/2004,5255.25,2004-12-31
4994,Buckman #8,,,12/31/2004,5185.29,2004-12-31
4995,NMOSE Archery Range Shallow Piezo,,,1/20/2005,6679.91,2005-01-20
4996,SF-4A,,,1/20/2005,5354.04,2005-01-20
4997,Santa Fe MW-7,,,1/25/2005,6657.04,2005-01-25
4998,09N.03E.07.113B RBERM-T2,35.02916667,-106.6717111,1/25/2005,4925.48,2005-01-25
4999,09N.03E.07.113A RBERS-T2,35.02916667,-106.6717111,1/25/2005,4925.27,2005-01-25
5000,Buckman #12,,,1/31/2005,5835.52,2005-01-31
5001,Buckman #11,,,1/31/2005,5777.1,2005-01-31
5002,Buckman #10,,,1/31/2005,5691.81,2005-01-31
5003,Skillet,,,1/31/2005,5618.49,2005-01-31
5004,Buckman #9,,,1/31/2005,5345.74,2005-01-31
5005,Weil PNM,,,1/31/2005,5332.65,2005-01-31
5006,Buckman #5,,,1/31/2005,5290.27,2005-01-31
5007,Buckman #2,,,1/31/2005,5207.13,2005-01-31
5008,Buckman #4,,,1/31/2005,5205.54,2005-01-31
5009,Buckman #3A,,,1/31/2005,5141.45,2005-01-31
5010,Buckman #1,,,1/31/2005,5127.82,2005-01-31
5011,La Tierra Lot 71; IV-1,,,2/6/2005,5982.41,2005-02-06
5012,09N.03E.07.113A RBEBS-T2,35.02915,-106.6709194,2/15/2005,4926.22,2005-02-15
5013,09N.03E.07.113B RBEBM-T2,35.02915,-106.6709194,2/16/2005,4926.23,2005-02-16
5014,09N.03E.07.113C RBEBD-T2,35.02915,-106.6709194,2/16/2005,4926.13,2005-02-16
5015,Longanecker,,,2/21/2005,6112.67,2005-02-21
5016,08N.02E.01.234C I-25 EBD,34.95018889,-106.6791694,2/22/2005,4899.26,2005-02-22
5017,Buckman #13,,,2/28/2005,6087.52,2005-02-28
5018,BACA LAND GRANT NO. 4   SW-2,37.97844444,-105.7933333,3/1/2005,7600.29,2005-03-01
5019,Santa Fe MW-6,,,3/10/2005,6656.87,2005-03-10
5020,Santa Fe Ortiz-1,,,3/10/2005,6643.57,2005-03-10
5021,Santa Fe MW-8,,,3/11/2005,6647.69,2005-03-11
5022,13N.05E.29.411,35.32513889,-106.4328056,3/28/2005,5549.77,2005-03-28
5023,Lujan WM,,,3/31/2005,7128.3,2005-03-31
5024,13N.05E.29.124,35.32897222,-106.45525,3/31/2005,5280.14,2005-03-31
5025,14N.09E.18.321,35.44159268,-106.030466,4/4/2005,6073.13,2005-04-04
5026,AS-030,36.51845938,-105.5374918,4/12/2005,8153.98,2005-04-12
5027,AS-035,36.52383902,-105.5439739,4/12/2005,8070.34,2005-04-12
5028,AS-034,36.52383963,-105.5438398,4/12/2005,8063.72,2005-04-12
5029,AS-023,36.52510739,-105.5425977,4/12/2005,8059.38,2005-04-12
5030,AS-036,36.51979397,-105.541399,4/12/2005,8051.34,2005-04-12
5031,AS-037,36.52962789,-105.5397361,4/12/2005,8051.13,2005-04-12
5032,AS-032,36.53066554,-105.5494059,4/12/2005,8043.71,2005-04-12
5033,AS-028,36.52872141,-105.5408357,4/12/2005,8038.96,2005-04-12
5034,AS-022,36.52553849,-105.5469011,4/12/2005,7952.85,2005-04-12
5035,AS-033,36.52815297,-105.5468748,4/12/2005,7921.97,2005-04-12
5036,AS-029,36.52285863,-105.5414985,4/13/2005,8117.27,2005-04-13
5037,AS-021,36.52442217,-105.5543769,4/13/2005,7819.11,2005-04-13
5038,AS-031,36.5291267,-105.5507689,4/13/2005,7745.94,2005-04-13
5039,AS-008,36.52608607,-105.601682,4/13/2005,7296.2,2005-04-13
5040,AS-007,36.52526917,-105.6027815,4/13/2005,7284.83,2005-04-13
5041,AH-018,36.52548756,-105.6217047,4/13/2005,6985.24,2005-04-13
5042,BACA LAND GRANT NO. 4   DW-2,37.82302778,-105.8053889,4/19/2005,7543.02,2005-04-19
5043,BACA LAND GRANT NO. 4   SW-12,37.82338889,-105.8050556,4/19/2005,7529.65,2005-04-19
5044,10N.03E.30.232F BWBS,35.06655,-106.66105,4/20/2005,4939.93,2005-04-20
5045,10N.03E.30.232G BWBM,35.06655,-106.66105,4/20/2005,4939.88,2005-04-20
5046,10N.03E.32.232H BWBD,35.06655,-106.66105,4/20/2005,4939.19,2005-04-20
5047,08N.02E.01.233E I-25 WDEM,34.95056111,-106.685075,4/20/2005,4901.26,2005-04-20
5048,08N.02E.01.233J I-25 WRM,34.95077222,-106.6827667,4/20/2005,4900.54,2005-04-20
5049,08N.02E.01.233I I-25 WRS,34.95077222,-106.6827667,4/20/2005,4900.51,2005-04-20
5050,08N.02E.01.233G I-25 WBM,34.95067222,-106.6835639,4/20/2005,4899.56,2005-04-20
5051,08N.02E.01.233F I-25 WBS,34.95067222,-106.6835639,4/20/2005,4899.38,2005-04-20
5052,08N.02E.01.234B I-25 EBM,34.95018889,-106.6791694,4/20/2005,4899.25,2005-04-20
5053,08N.02E.01.234A EBS,34.95018889,-106.6791694,4/20/2005,4898.67,2005-04-20
5054,BACA LAND GRANT NO. 4   DW-8,37.88525,-105.7158611,4/21/2005,7636.39,2005-04-21
5055,BACA LAND GRANT NO. 4   SW-5,37.93922222,-105.7564167,4/21/2005,7606.24,2005-04-21
5056,BACA LAND GRANT NO. 4   SW-7,37.89325,-105.76275,4/21/2005,7578.66,2005-04-21
5057,11N.03E.31.111C MEBS,35.14494167,-106.6753083,4/21/2005,4969.41,2005-04-21
5058,10N.03E.30.232J BWRM,35.06669444,-106.6600889,4/21/2005,4943.47,2005-04-21
5059,10N.03E.30.244B BERM,35.06721944,-106.6580611,4/21/2005,4942.5,2005-04-21
5060,10N.03E.30.244D BEBM,35.06730278,-106.6575083,4/21/2005,4940.63,2005-04-21
5061,10N.03E.30.244D BEBD,35.06730278,-106.6575083,4/21/2005,4940.24,2005-04-21
5062,10N.03E.30.244G BEDWM,35.06739167,-106.6566056,4/21/2005,4938.24,2005-04-21
5063,10N.03E.30.232E BWDEM,35.06639722,-106.6621417,4/21/2005,4937.57,2005-04-21
5064,08N.02E.01.234E I-25 ERM,34.95020278,-106.6802083,4/22/2005,4899.74,2005-04-22
5065,08N.02E.01.233H I-25 WBD,34.95067222,-106.6835639,4/22/2005,4899.45,2005-04-22
5066,AS-027,36.5233271,-105.5375813,4/27/2005,8209.3,2005-04-27
5067,AS-024,36.52463122,-105.5481569,4/27/2005,7962.54,2005-04-27
5068,AS-025,36.52620196,-105.559349,4/27/2005,7759.2,2005-04-27
5069,AS-039,36.52539409,-105.558606,4/27/2005,7751.04,2005-04-27
5070,AS-038,36.52930436,-105.5513399,4/27/2005,7750.95,2005-04-27
5071,AS-001,36.51656474,-105.5764233,4/27/2005,7553.54,2005-04-27
5072,AS-003,36.520024,-105.58802,4/27/2005,7457.39,2005-04-27
5073,AS-014,36.51801494,-105.5932206,4/27/2005,7366.75,2005-04-27
5074,AS-004,36.51865567,-105.5727978,4/28/2005,7604.86,2005-04-28
5075,AS-005,36.51793637,-105.5724016,4/28/2005,7602.37,2005-04-28
5076,AS-002,36.52941672,-105.584539,4/28/2005,7442.77,2005-04-28
5077,AS-015,36.52822625,-105.5883055,4/28/2005,7413.94,2005-04-28
5078,AS-016,36.52029617,-105.6056915,4/28/2005,7210.9,2005-04-28
5079,AS-011,36.52047584,-105.6058158,4/28/2005,7055.25,2005-04-28
5080,09N.03E.07.113L RBWRM-T2,35.02933889,-106.6734806,4/28/2005,4929.45,2005-04-28
5081,09N.03E.07.113I RBWBM-T2,35.02935,-106.6738083,4/28/2005,4928.56,2005-04-28
5082,09N.03E.07.113J RBWBD-T2,35.02935,-106.6738083,4/28/2005,4928.35,2005-04-28
5083,AS-043,36.54799062,-105.5652154,5/10/2005,7912.99,2005-05-10
5084,AS-026,36.52597551,-105.5498865,5/10/2005,7829.06,2005-05-10
5085,AS-006,36.52443086,-105.571634,5/10/2005,7622.82,2005-05-10
5086,AS-018,36.53737595,-105.6152087,5/10/2005,7136.26,2005-05-10
5087,AS-017,36.53256432,-105.6217055,5/10/2005,7105.94,2005-05-10
5088,AS-040,36.53041509,-105.5644284,5/11/2005,7733.88,2005-05-11
5089,AS-012,36.52743569,-105.5653674,5/11/2005,7716.72,2005-05-11
5090,AS-044,36.53071644,-105.5951607,5/11/2005,7407.48,2005-05-11
5091,AS-041,36.54567114,-105.5971971,5/11/2005,7391.06,2005-05-11
5092,AS-019,36.49420664,-105.5949483,5/11/2005,7317.64,2005-05-11
5093,AS-045,36.53803637,-105.5915861,5/11/2005,7290.98,2005-05-11
5094,AS-020,36.51283908,-105.6006748,5/11/2005,7223.09,2005-05-11
5095,AS-009,36.53727801,-105.5990317,5/12/2005,7279.29,2005-05-12
5096,08N.02E.01.233C I-25 WD,34.95083056,-106.6866694,5/17/2005,4902.15,2005-05-17
5097,08N.02E.01.233A I-25 WS,34.95083056,-106.6866694,5/17/2005,4902.13,2005-05-17
5098,08N.02E.01.233B I-25 WM,34.95083056,-106.6866694,5/17/2005,4901.87,2005-05-17
5099,08N.02E.01.243B I-25 EM,34.95136111,-106.6754306,5/19/2005,4896.63,2005-05-19
5100,08N.02E.01.243C I-25 ED,34.95136111,-106.6754306,5/19/2005,4896.6,2005-05-19
5101,08N.02E.01.243A I-25 ES,34.95136111,-106.6754306,5/19/2005,4896.59,2005-05-19
5102,EB-367,35.67559888,-106.0433506,5/24/2005,6318.56,2005-05-24
5103,EB-584,35.6886024,-106.0220358,5/24/2005,6232.62,2005-05-24
5104,EB-585,35.74210566,-106.0633164,5/24/2005,6041.53,2005-05-24
5105,Constant New,,,5/25/2005,6223.21,2005-05-25
5106,EB-593,35.6727485,-106.005359,5/26/2005,6489.82,2005-05-26
5107,EB-602,35.67483527,-105.9961919,6/1/2005,6492.42,2005-06-01
5108,EB-599,35.67714597,-106.0185084,6/1/2005,6310.03,2005-06-01
5109,EB-601,35.70613283,-106.0332471,6/1/2005,6208.94,2005-06-01
5110,08N.02E.01.243E I-25 EDEM,34.95105833,-106.6778639,6/1/2005,4899.48,2005-06-01
5111,08N.02E.01.243D I-25 EDES,34.95105833,-106.6778639,6/1/2005,4899.47,2005-06-01
5112,EB-109,35.67687269,-106.0241514,6/2/2005,6251.83,2005-06-02
5113,09N.03E.07.113A RBWBS,35.02800556,-106.6738222,6/2/2005,4928.47,2005-06-02
5114,09N.03E.07.114D RBEBM,35.02792778,-106.6709278,6/2/2005,4926.64,2005-06-02
5115,09N.03E.07.113C RBERS,35.02793333,-106.6716417,6/2/2005,4926.62,2005-06-02
5116,09N.03E.07.113B RBERM,35.02793333,-106.6716417,6/2/2005,4926.6,2005-06-02
5117,EB-619,35.73577586,-105.9683653,6/3/2005,6684.24,2005-06-03
5118,EB-583,35.67625431,-105.9946736,6/3/2005,6492.03,2005-06-03
5119,18N.08E.33.134 Dead Dog Well,35.74947235,-106.1022465,6/6/2005,5771.66,2005-06-06
5120,EB-603,35.6927443,-106.061213,6/7/2005,6174.17,2005-06-07
5121,11N.03E.31.111B MERM,35.14505,-106.6758806,6/13/2005,4971.34,2005-06-13
5122,11N.03E.31.111D MEBM,35.14494167,-106.6753083,6/13/2005,4969.64,2005-06-13
5123,11N.03E.31.111E MEBD,35.14494167,-106.6753083,6/13/2005,4969.22,2005-06-13
5124,MWA,,,6/14/2005,6858.08,2005-06-14
5125,10N.03E.30.232B BWM,35.06584444,-106.6642389,6/23/2005,4936.73,2005-06-23
5126,10N.03E.30.232C BWD,35.06584444,-106.6642389,6/23/2005,4936.71,2005-06-23
5127,10N.03E.30.232A BWS,35.06584444,-106.6642389,6/27/2005,4936.62,2005-06-27
5128,T10N.R02E.36.321A PROJECTED ARMIJO WELL 1,35.05194444,-106.685,6/29/2005,4889.27,2005-06-29
5129,T10N.R02E.36.321B PROJECTED ARMIJO WELL 2,35.05194444,-106.685,6/29/2005,4889.05,2005-06-29
5130,T17N.R08E.15.233A  Las Campanas Deep Piezo.,35.70777778,-106.0802778,7/6/2005,6170.73,2005-07-06
5131,T17N.R08E.15.233B  Las Campanas  Middle Piezo.,35.70777778,-106.0802778,7/6/2005,6124.66,2005-07-06
5132,T17N.R08E.15.233C  Las Campanas  Shallow Piezo.,35.70777778,-106.0802778,7/6/2005,6108.86,2005-07-06
5133,08N.02E.01.233D I-25 WDES,34.95056111,-106.685075,7/11/2005,4901.01,2005-07-11
5134,08N.02E.01.234D I-25 ERS,34.95020278,-106.6802028,7/11/2005,4897.43,2005-07-11
5135,09N.03E.07.113H RBWBS-T2,35.02935,-106.6738083,7/12/2005,4926.95,2005-07-12
5136,09N.03E.07.113H RBWRS,35.02800556,-106.6735139,7/12/2005,4926.75,2005-07-12
5137,10N.03E.30.232D BWDES,35.06639722,-106.6621417,7/13/2005,4938.04,2005-07-13
5138,13N.05E.30.141,35.32897222,-106.45525,8/2/2005,5254.06,2005-08-02
5139,09N.02E.PAJARITO GRANT 3,34.97694444,-106.704175,8/10/2005,4904.88,2005-08-10
5140,09N.02E.PAJARITO GRANT 4,34.95750833,-106.7075083,8/10/2005,4899.66,2005-08-10
5141,JL-49-06-714,31.885278,-106.351667,8/14/2005,3610.22,2005-08-14
5142,JL-49-06-713,31.889722,-106.353889,8/25/2005,3611.83,2005-08-25
5143,JL-49-06-712,31.894445,-106.356945,9/2/2005,3603.53,2005-09-02
5144,08N.02E.01.243F I-25 EDWS,34.95105833,-106.6780139,9/7/2005,4899.33,2005-09-07
5145,13N.05E.19.412,35.33894444,-106.4473889,9/8/2005,5423.01,2005-09-08
5146,13N.04E.35.314,35.30861111,-106.49175,9/8/2005,5165.53,2005-09-08
5147,13N.05E.28.312,35.32477778,-106.4229444,9/9/2005,5759.2,2005-09-09
5148,Vallecita de Gracia,,,9/10/2005,6121.86,2005-09-10
5149,09N.03E.07.113K RBWRS-T2,35.02933889,-106.6734806,9/14/2005,4925.77,2005-09-14
5150,10N.03E.30.244F BEDWS,35.06739167,-106.6566056,9/16/2005,4938.18,2005-09-16
5151,JL-49-06-710,31.898056,-106.368333,9/19/2005,3600.51,2005-09-19
5152,JL-49-06-709,31.898611,-106.372222,9/25/2005,3603.88,2005-09-25
5153,T09N.R03E.07.111A RBWDES-T2,35.02935,-106.6743111,10/5/2005,4927.22,2005-10-05
5154,T09N.R03E.07.111B RBWDEM-T2,35.02935556,-106.6743111,10/5/2005,4927.19,2005-10-05
5155,09N.03E.07.113I RBWRM,35.02800556,-106.6735139,10/5/2005,4926.45,2005-10-05
5156,10N.03E.30.232I BWRS,35.06669444,-106.6600889,10/7/2005,4940.96,2005-10-07
5157,10N.03E.30.244A BERS,35.06721944,-106.6580611,10/7/2005,4940.38,2005-10-07
5158,10N.03E.30.244C BEBS,35.06730278,-106.6575083,10/7/2005,4939.48,2005-10-07
5159,T11N.R02E.25.434D MWRM,35.14614722,-106.6782861,10/12/2005,4968.31,2005-10-12
5160,T11N.R02E.25.434C MWRS,35.14614722,-106.6782861,10/12/2005,4968.31,2005-10-12
5161,T11N.R02E.25.434A MWBS,35.14706111,-106.6802583,10/12/2005,4967.88,2005-10-12
5162,T11N.R02E.25.434B MWBM,35.14706111,-106.6802583,10/12/2005,4967.78,2005-10-12
5163,JL-49-05-923,31.898611,-106.3775,10/15/2005,3600.13,2005-10-15
5164,T11N.02E.36.222A MEDWS,35.14478889,-106.6744944,11/9/2005,4970.09,2005-11-09
5165,T11N.R02E.36.222B MEDWM,35.14478889,-106.6744944,11/9/2005,4969.99,2005-11-09
5166,JL-49-06-715,31.898611,-106.372222,11/9/2005,3583.88,2005-11-09
5167,JL-49-06-711,31.897778,-106.361945,11/18/2005,3601.88,2005-11-18
5168,JL-49-06-716,31.876389,-106.346389,11/28/2005,3617.47,2005-11-28
5169,NMOSE Jail Well shallow,,,11/30/2005,6146.59,2005-11-30
5170,13N.04E.26.221,35.33280556,-106.4824167,12/1/2005,5086.41,2005-12-01
5171,13N.04E.33.233,35.31866667,-106.5193333,12/3/2005,5037.89,2005-12-03
5172,11N.03E.111A MERS,35.14505,-106.6758806,12/5/2005,4967.65,2005-12-05
5173,11N.03E.TOWN OF ALAMEDA GRANT,35.19572222,-106.6418611,12/6/2005,4990.49,2005-12-06
5174,11N.03E.GALLEGOS GRANT 2,35.17077778,-106.6274444,12/6/2005,4951.93,2005-12-06
5175,11N.03E.03.333,35.20502778,-106.6209444,12/7/2005,4992.75,2005-12-07
5176,MBOWN-149 - 27S.01E.11.331 (UPRR),31.96972222,-106.8172222,12/8/2005,3805.37,2005-12-08
5177,MBOWN-94 - 25S.02W.26.421 (UPRR),32.10333333,-107.0094444,12/9/2005,3830.78,2005-12-09
5178,07N.02E.SAN CLEMENTE GRANT #2,34.79561111,-106.7376667,12/12/2005,4844.85,2005-12-12
5179,07N.02E.26.332,34.80572222,-106.7006389,12/12/2005,4844.49,2005-12-12
5180,13N.04E.31.142,35.31483333,-106.5515,12/13/2005,5043.68,2005-12-13
5181,11N.03E.GALLEGOS GRANT 3,35.158,-106.6550833,12/14/2005,4965.31,2005-12-14
5182,10N.03E.TOWN OF ABQ GRANT,35.12572222,-106.6709444,12/15/2005,4946.68,2005-12-15
5183,09N.02E.PAJARITO GRANT,34.99975,-106.7155833,12/15/2005,4917.43,2005-12-15
5184,"CLC-68, LRG-3290",32.42383333,-106.7085833,12/15/2005,4042.53,2005-12-15
5185,JL-49-14-111,31.871944,-106.343611,12/17/2005,3615.58,2005-12-17
5186,AH-022,36.52672526,-105.6331973,12/20/2005,6992.29,2005-12-20
5187,AH-021,36.48311368,-105.6942311,12/20/2005,6538.03,2005-12-20
5188,"CLC-69, LRG-3291",32.43116667,-106.7091667,12/21/2005,4037.83,2005-12-21
5189,EB-655,35.61892232,-105.9769254,12/22/2005,6599.5,2005-12-22
5190,JL-49-14-113,31.862778,-106.338056,12/22/2005,3612.7,2005-12-22
5191,Brooks/Lujan,,,1/1/2006,6830.35,2006-01-01
5192,09N.02E.TOWN OF ATRISCO GRANT,35.01833333,-106.6886667,1/4/2006,4921.94,2006-01-04
5193,11N.03E.GALLEGOS GRANT,35.17936111,-106.6303889,1/5/2006,4968.32,2006-01-05
5194,09N.02E.PAJARITO GRANT  #2,35.00352778,-106.7003889,1/6/2006,4912.84,2006-01-06
5195,JL-49-14-112,31.867222,-106.340834,1/6/2006,3611.9,2006-01-06
5196,T11N.R02E.25.444B MEBM-T2,35.14606944,-106.6744389,1/9/2006,4967.21,2006-01-09
5197,TIIN.R02E.25.444C MEBD-T2,35.14606944,-106.6744389,1/9/2006,4967.19,2006-01-09
5198,T11N.R03E.30.333A MEDWS-T2,35.14600833,-106.6738083,1/9/2006,4965.68,2006-01-09
5199,T11N.R03E.30.333B MEDWM-T2,35.14600833,-106.6738083,1/9/2006,4965.55,2006-01-09
5200,07N.02E.SAN CLEMENTE GRANT,34.80902778,-106.7260278,1/10/2006,4850.38,2006-01-10
5201,07N.02E.GUTIERREZ SEDILLO GRANT,34.85552778,-106.7058056,1/11/2006,4859.98,2006-01-11
5202,05N.02E.BELEN GRANT,34.6455,-106.778,1/11/2006,4790.56,2006-01-11
5203,T11N.R02E.25.444E MERM-T2,35.1461,-106.6749167,1/13/2006,4965.75,2006-01-13
5204,13N.05E.22.341,35.33708333,-106.40025,1/20/2006,5836.98,2006-01-20
5205,13N.05E.15.223,35.36031629,-106.3944693,1/20/2006,5609.35,2006-01-20
5206,T08N.R02E.01.241B I-25 EDEM-T2,34.95241944,-106.6783528,1/20/2006,4898.95,2006-01-20
5207,T08N.R02E.01.232E I-25 ERM-T2,34.95219722,-106.6806889,1/20/2006,4898.45,2006-01-20
5208,T08N.R02E.01.232B I-25 EBM-T2,34.9523,-106.6797472,1/20/2006,4897.75,2006-01-20
5209,T08N.R02E.01.232C I-25 EBD-T2,34.9523,-106.6797472,1/20/2006,4897.71,2006-01-20
5210,JL-49-14-114,31.858334,-106.335834,1/20/2006,3606.92,2006-01-20
5211,AH-010,36.53407373,-105.6464055,1/21/2006,6854.8,2006-01-21
5212,T08N.R02E.01.142B I-25 WDEM-T2,34.95162222,-106.68545,1/23/2006,4900.51,2006-01-23
5213,T08N.R02E.01.142A I-25 WDES-T2,34.95162222,-106.68545,1/23/2006,4900.48,2006-01-23
5214,T08N.R02E.01.231E I-25 WRM-T2,34.95205556,-106.6830417,1/23/2006,4898.15,2006-01-23
5215,T08N.R02E.01.231B I-25 WBM-T2,34.95185278,-106.6841806,1/23/2006,4896.28,2006-01-23
5216,T08N.R02E.01.231C I-25 WBD-T2,34.95185278,-106.6841806,1/23/2006,4896.2,2006-01-23
5217,19S.04W.01.214 H-13,32.69014167,-107.2029389,1/24/2006,4047.56,2006-01-24
5218,T10N.R03E.30.421A BWDES-T2,35.0654,-106.6618722,1/27/2006,4936.38,2006-01-27
5219,T10N.R03E.30.422B BWRM-T2,35.06564444,-106.6600028,1/30/2006,4940.1,2006-01-30
5220,T10N.R03E.30.422A BWRS-T2,35.06564444,-106.6600028,1/30/2006,4940.06,2006-01-30
5221,10N.03E.30.422C BERS-T2,35.065975,-106.6579417,1/30/2006,4938.84,2006-01-30
5222,10N.03E.30.422D BERM-T2,35.065975,-106.6579417,1/30/2006,4938.74,2006-01-30
5223,10N.03E.29.311C BEBS-T2,35.06608333,-106.657175,1/30/2006,4937.84,2006-01-30
5224,10N.03E.29.311D BEBM-T2,35.06608333,-106.657175,1/30/2006,4937.83,2006-01-30
5225,10N.03E.29.311E BEBD-T2,35.06608333,-106.657175,1/30/2006,4937.81,2006-01-30
5226,10N.03E.30.421C BWBS-T2,35.06556111,-106.6608306,1/30/2006,4936.86,2006-01-30
5227,10N.03E.30.421D BWBM-T2,35.06556111,-106.6608306,1/30/2006,4936.85,2006-01-30
5228,T10N.R03E.30.421B BWDEM-T2,35.0654,-106.6618722,1/30/2006,4936.39,2006-01-30
5229,10N.03E.30.421E BWBD-T2,35.06556111,-106.6608306,1/30/2006,4935.72,2006-01-30
5230,T10N.R03E.29.311B BEDWM-T2,35.06612222,-106.6562861,2/1/2006,4937.14,2006-02-01
5231,10N.03E.29.311A BEDWS-T2,35.06612222,-106.6562861,2/1/2006,4937.13,2006-02-01
5232,JL-49-14-116,31.848889,-106.330278,2/1/2006,3580.8,2006-02-01
5233,JL-49-14-115,31.853612,-106.333334,2/2/2006,3612.92,2006-02-02
5234,AH-041,36.52553776,-105.6478424,2/7/2006,6892.03,2006-02-07
5235,AH-033,36.51671594,-105.6619193,2/8/2006,6857.01,2006-02-08
5236,AH-004,36.54106895,-105.6836552,2/10/2006,6883.82,2006-02-10
5237,AH-003,36.53999195,-105.682819,2/10/2006,6577.99,2006-02-10
5238,AH-040,36.50360418,-105.7081377,2/20/2006,6499.97,2006-02-20
5239,JL-49-14-530,31.831389,-106.330833,2/25/2006,3557.96,2006-02-25
5240,AH-035,36.51978989,-105.6936763,3/3/2006,6625.29,2006-03-03
5241,AH-007,36.52897342,-105.6894801,3/3/2006,6554.02,2006-03-03
5242,AH-015,36.51964098,-105.6866944,3/8/2006,6755.8,2006-03-08
5243,AH-044,36.53254611,-105.6748111,3/10/2006,6735.27,2006-03-10
5244,AH-014,36.53763598,-105.6738499,3/10/2006,6585.03,2006-03-10
5245,AH-020,36.52681755,-105.6462446,3/13/2006,6889.58,2006-03-13
5246,AH-023,36.51962352,-105.6771337,3/13/2006,6847.59,2006-03-13
5247,AH-024,36.53954551,-105.6757322,3/13/2006,6582.04,2006-03-13
5248,AH-005,36.53790589,-105.6865878,3/13/2006,6542.83,2006-03-13
5249,13N.04.35.112,35.3175,-106.4921111,3/15/2006,5058.85,2006-03-15
5250,AH-012,36.52999976,-105.6495775,3/17/2006,6933.97,2006-03-17
5251,AH-009,36.52936985,-105.6689415,3/17/2006,6820.22,2006-03-17
5252,AH-049,36.53489262,-105.6695476,3/17/2006,6600.48,2006-03-17
5253,AH-006,36.54244574,-105.6714003,3/17/2006,6590.91,2006-03-17
5254,AH-050,36.54677276,-105.674622,3/17/2006,6586.76,2006-03-17
5255,AH-011,36.52708928,-105.6879219,3/17/2006,6566.63,2006-03-17
5256,AH-051,36.54618425,-105.6734772,3/17/2006,6566.04,2006-03-17
5257,MBOWN-59 - 24S.02W.36.111A,32.18398364,-107.0055657,3/22/2006,4005.43,2006-03-22
5258,AH-042,36.52517389,-105.6870896,3/23/2006,6552.35,2006-03-23
5259,AH-025,36.5158241,-105.7073556,3/24/2006,6499.13,2006-03-24
5260,JL-49-14-206,31.836945,-106.330833,3/25/2006,3599.2,2006-03-25
5261,AH-053,36.49914525,-105.7090686,3/27/2006,6515.91,2006-03-27
5262,AH-016,36.53300223,-105.6609745,4/6/2006,6843.84,2006-04-06
5263,AH-029,36.50992853,-105.6857041,4/6/2006,6760.7,2006-04-06
5264,AH-045,36.536499,-105.6708462,4/6/2006,6591.19,2006-04-06
5265,AH-039,36.52890144,-105.6082607,4/7/2006,7194.12,2006-04-07
5266,AH-013,36.52033291,-105.6517416,4/14/2006,6864.4,2006-04-14
5267,AH-048,36.52345532,-105.6770554,4/14/2006,6763.14,2006-04-14
5268,AH-001,36.53710075,-105.691753,4/14/2006,6589.55,2006-04-14
5269,AH-054,36.51109005,-105.7136111,4/14/2006,6486.47,2006-04-14
5270,JL-49-14-434,31.798334,-106.335,4/19/2006,3590.12,2006-04-19
5271,AH-027,36.50886599,-105.6870571,4/21/2006,6826.86,2006-04-21
5272,AH-002,36.5385599,-105.6698697,4/21/2006,6589.14,2006-04-21
5273,AH-032,36.52154694,-105.693826,4/21/2006,6555.84,2006-04-21
5274,JL-49-14-526,31.809445,-106.330278,4/25/2006,3590.7,2006-04-25
5275,AH-038,36.52076869,-105.6881117,4/26/2006,6609.42,2006-04-26
5276,T08N.R02E.01.241A I-25 EDES-T2,34.95241944,-106.6783528,5/1/2006,4899.65,2006-05-01
5277,T08N.R02E.01.232D I-25 ERS-T2,34.95219722,-106.6806889,5/1/2006,4898.7,2006-05-01
5278,T08N.R02E.01.232A I-25 EBS-T2,34.9523,-106.6797472,5/1/2006,4897.52,2006-05-01
5279,T08N.R02E.01.231A I-25 WBS-T2,34.95185278,-106.6841806,5/2/2006,4895.37,2006-05-02
5280,T09N.R03E.07.121A RBEDWS-T2,35.02911111,-106.6689556,5/3/2006,4924.81,2006-05-03
5281,T09N.R03E.07.121B RBEDWM-T2,35.02911111,-106.6689556,5/3/2006,4924.77,2006-05-03
5282,AH-037,36.50873317,-105.6675801,5/4/2006,6888.81,2006-05-04
5283,AH-030,36.51812864,-105.6815993,5/5/2006,6765.18,2006-05-05
5284,AH-031,36.51898629,-105.6907876,5/5/2006,6569.96,2006-05-05
5285,AH-046,36.51700046,-105.6927803,5/5/2006,6558.25,2006-05-05
5286,AH-034,36.51646033,-105.6895366,5/5/2006,6557.43,2006-05-05
5287,AH-017,36.51817827,-105.7071425,5/5/2006,6489.52,2006-05-05
5288,T11N.R02E.25.444A MEBS-T2,35.14606944,-106.6744389,5/18/2006,4967.56,2006-05-18
5289,T11N.R02E.25.444E MERS-T2,35.1461,-106.6749139,5/18/2006,4966.54,2006-05-18
5290,JL-49-14-437,31.819444,-106.338056,5/18/2006,3601.9,2006-05-18
5291,JL-49-14-525,31.803889,-106.330555,5/18/2006,3598.35,2006-05-18
5292,JL-49-14-435,31.812501,-106.345278,5/18/2006,3595.06,2006-05-18
5293,AH-052,36.52129972,-105.6913778,5/19/2006,6554.41,2006-05-19
5294,JL-49-14-117,31.833611,-106.3375,5/25/2006,3608.39,2006-05-25
5295,JL-49-14-528,31.825833,-106.330555,5/29/2006,3602.15,2006-05-29
5296,JL-49-14-436,31.812778,-106.337222,6/5/2006,3596.01,2006-06-05
5297,JL-49-14-529,31.820555,-106.330555,6/11/2006,3596.84,2006-06-11
5298,19N.09E.28.121 Cuyamungue Deep Piezometer,35.85555556,-105.9941667,6/14/2006,5991.75,2006-06-14
5299,19N.09E.28.121A Cuyamungue Shallow Piezometer,35.85555556,-105.9941667,6/14/2006,5978.0,2006-06-14
5300,JL-49-14-527,31.815001,-106.330555,6/19/2006,3595.83,2006-06-19
5301,AH-055,36.5199396,-105.6958332,7/12/2006,6553.79,2006-07-12
5302,CCD-OWB shallow,,,8/1/2006,6186.63,2006-08-01
5303,Lexus,,,8/1/2006,6149.4,2006-08-01
5304,T08N.R02E.01.231D I-25 WRS-T2,34.95205556,-106.6830417,8/15/2006,4898.25,2006-08-15
5305,CCD-I1 shallow,,,8/24/2006,6169.13,2006-08-24
5306,NA04001017DDA2,37.70707778,-105.8928083,11/1/2006,7539.33,2006-11-01
5307,NA04101020AAA2,37.79282222,-105.8921028,11/1/2006,7529.52,2006-11-01
5308,NA04200733ACC2,37.8437,-106.2098667,11/2/2006,7683.49,2006-11-02
5309,NA04100907CCC2,37.80703333,-106.0376806,11/2/2006,7566.49,2006-11-02
5310,NA04000934BAA2,37.67592778,-105.9750306,11/3/2006,7566.48,2006-11-03
5311,NA03400929CBB5,37.15991389,-106.0185889,11/4/2006,7753.19,2006-11-04
5312,NA03400929CBB4,37.15991389,-106.0185889,11/4/2006,7753.19,2006-11-04
5313,NA03400929CBB6,37.15991389,-106.0185889,11/4/2006,7753.19,2006-11-04
5314,NA03600835BCC2,37.32070556,-106.0748833,11/5/2006,7695.28,2006-11-05
5315,NA04000712AAA6,37.73345833,-106.1494556,11/6/2006,7638.8,2006-11-06
5316,NA04000712AAA4,37.73345833,-106.1494556,11/6/2006,7638.8,2006-11-06
5317,NA04000712AAA5,37.73345833,-106.1494556,11/6/2006,7638.8,2006-11-06
5318,NA04000814AAA5,37.71927222,-106.0570694,11/6/2006,7597.82,2006-11-06
5319,NA04000814AAA4,37.71927222,-106.0570694,11/6/2006,7597.82,2006-11-06
5320,NA04000814AAA6,37.71927222,-106.0570694,11/6/2006,7597.82,2006-11-06
5321,NA04000802CBB4,37.7386,-106.0749972,11/7/2006,7598.77,2006-11-07
5322,NA04000802CBB5,37.7386,-106.0749972,11/7/2006,7598.77,2006-11-07
5323,NA04000802CBB6,37.7386,-106.0749972,11/7/2006,7598.77,2006-11-07
5324,NA04100929ADD6,37.77063611,-106.0021472,11/7/2006,7560.96,2006-11-07
5325,NA04100929ADD4,37.77063611,-106.0021472,11/7/2006,7560.96,2006-11-07
5326,NA04100929ADD5,37.77063611,-106.0021472,11/7/2006,7560.96,2006-11-07
5327,NA04100929ADD3,37.77063611,-106.0021472,11/7/2006,7560.96,2006-11-07
5328,NA03900808BBB2,37.64712222,-106.1292556,11/8/2006,7641.85,2006-11-08
5329,NA04000905ADD5,37.74139167,-106.0020889,11/8/2006,7566.44,2006-11-08
5330,NA04000905ADD3,37.74139167,-106.0020889,11/8/2006,7566.44,2006-11-08
5331,NA04000905ADD4,37.74139167,-106.0020889,11/8/2006,7566.44,2006-11-08
5332,NA04000905ADD6,37.74139167,-106.0020889,11/8/2006,7566.44,2006-11-08
5333,NA03900925DDD2,37.59069444,-105.9288694,11/8/2006,7540.21,2006-11-08
5334,NA04100732CBC6,37.75383611,-106.2406111,11/9/2006,7672.59,2006-11-09
5335,NA04100732CBC7,37.75383611,-106.2406111,11/9/2006,7672.59,2006-11-09
5336,NA04000818CDD6,37.70479722,-106.1406861,11/9/2006,7637.51,2006-11-09
5337,NA04000818CDD5,37.70479722,-106.1406861,11/9/2006,7637.51,2006-11-09
5338,NA04000818CDD4,37.70479722,-106.1406861,11/9/2006,7637.51,2006-11-09
5339,NA04000826ACC5,37.68356111,-106.0662306,11/10/2006,7606.51,2006-11-10
5340,NA04000826ACC3,37.68356111,-106.0662306,11/10/2006,7606.51,2006-11-10
5341,NA04000826ACC6,37.68356111,-106.0662306,11/10/2006,7606.51,2006-11-10
5342,NA04000826ACC4,37.68356111,-106.0662306,11/10/2006,7606.51,2006-11-10
5343,NA04000826ACC2,37.68356111,-106.0662306,11/10/2006,7606.51,2006-11-10
5344,NA03900906BCC4,37.65449722,-106.0387583,11/10/2006,7589.16,2006-11-10
5345,NA03900906BCC5,37.65449722,-106.0387583,11/10/2006,7589.16,2006-11-10
5346,NA03900906BCC3,37.65449722,-106.0387583,11/10/2006,7589.16,2006-11-10
5347,NA03900906BCC6,37.65449722,-106.0387583,11/10/2006,7589.16,2006-11-10
5348,NA03900914BBB4,37.63184167,-105.9649944,11/11/2006,7557.2,2006-11-11
5349,NA03900914BBB5,37.63184167,-105.9649944,11/11/2006,7557.2,2006-11-11
5350,NA03900914BBB3,37.63184167,-105.9649944,11/11/2006,7557.2,2006-11-11
5351,NA03900914BBB6,37.63184167,-105.9649944,11/11/2006,7557.2,2006-11-11
5352,NA03901016BDD5,37.62548611,-105.8829583,11/11/2006,7544.28,2006-11-11
5353,NA03901016BDD2,37.62548611,-105.8829583,11/11/2006,7544.28,2006-11-11
5354,NA03901016BDD4,37.62548611,-105.8829583,11/11/2006,7544.28,2006-11-11
5355,NA03901016BDD6,37.62548611,-105.8829583,11/11/2006,7544.28,2006-11-11
5356,NA03901016BDD3,37.62548611,-105.8829583,11/11/2006,7544.28,2006-11-11
5357,10N.03E.21.123 MNW-4-D1,35.08458333,-106.6344444,2/18/2007,4900.29,2007-02-18
5358,10N.03E.21.111 SFMW-46,35.08563889,-106.6376944,2/18/2007,4897.93,2007-02-18
5359,10N.03E.28.223 RGT-FP3 DEEP,35.06934167,-106.6254667,3/19/2007,4887.19,2007-03-19
5360,10N.03E.28.223A RGT-FP3 MID,35.06934167,-106.6254667,3/19/2007,4883.58,2007-03-19
5361,10N.03E.28.223B RGT-FP3 SHALLOW,35.06934167,-106.6254667,3/19/2007,4880.5,2007-03-19
5362,Parker,,,5/1/2007,6168.66,2007-05-01
5363,NA03700701DAA2,37.48028056,-106.1517,5/4/2007,7644.12,2007-05-04
5364,10N.03E.28.144A RGT-FP2 MID,35.06560278,-106.6319361,5/23/2007,4885.81,2007-05-23
5365,10N.03E.28.243A RGT-FP1 DEEP,35.06603333,-106.62475,5/23/2007,4879.11,2007-05-23
5366,10N.03E.28.243B RGT-FP1 MID-DEEP,35.06603333,-106.62475,5/23/2007,4876.88,2007-05-23
5367,10N.03E.28.144 RGT-FP2 DEEP,35.06560278,-106.6319361,5/24/2007,4885.64,2007-05-24
5368,10N.03E.28.144B RGT-FP2 SHALLOW,35.06560278,-106.6319361,5/24/2007,4883.57,2007-05-24
5369,10N.03E.28.243C RGT-FP1 MID-SHALLOW,35.06603333,-106.62475,5/24/2007,4877.61,2007-05-24
5370,10N.03E.28.243D RGT-FP1 SHALLOW,35.06603333,-106.62475,5/24/2007,4875.55,2007-05-24
5371,JL-49-06-703,31.91454959,-106.3427622,6/12/2007,3634.46,2007-06-12
5372,NA04000905ADD2,37.74139167,-106.0020889,7/24/2007,7575.57,2007-07-24
5373,NA04000818CDD3,37.70479722,-106.1406861,7/25/2007,7645.62,2007-07-25
5374,NA03900906BCC2,37.65449722,-106.0387583,7/25/2007,7598.55,2007-07-25
5375,NA04100732CBC5,37.75383611,-106.2406111,7/27/2007,7680.81,2007-07-27
5376,NA03900914BBB2,37.63184167,-105.9649944,8/7/2007,7567.87,2007-08-07
5377,NA03400929CBB2,37.15991389,-106.0185889,8/27/2007,7776.19,2007-08-27
5378,Schubert,,,8/27/2007,6792.0,2007-08-27
5379,NA03400929CBB3,37.15991389,-106.0185889,9/13/2007,7772.91,2007-09-13
5380,MBOWN-209 - 29S.04E.08.224A (ISC-4A/ISC-4S),31.80480978,-106.5504887,9/24/2007,3728.77,2007-09-24
5381,MBOWN-210 - 29S.04E.08.224B (ISC-4B/ISC-4D),31.80480978,-106.5504887,9/24/2007,3728.03,2007-09-24
5382,MBOWN-190 - 28S.03E.16.221B (ISC-7B/ISC-7D),31.87927107,-106.6355469,9/25/2007,3750.46,2007-09-25
5383,MBOWN-189 - 28S.03E.16.221A (ISC-7A/ISC-7S),31.87927107,-106.6355469,9/25/2007,3747.3,2007-09-25
5384,MBOWN-197 - 28S.03E.22.432B (ISC-6B/ISC-6D),31.85288303,-106.6219351,9/26/2007,3747.0,2007-09-26
5385,MBOWN-196 - 28S.03E.22.432A (ISC-6A/ISC-6S),31.85288303,-106.6219351,9/26/2007,3743.66,2007-09-26
5386,MBOWN-198 - 28S.03E.26.344A (ISC-5A/ISC-5S),31.83705023,-106.607768,9/26/2007,3739.96,2007-09-26
5387,MBOWN-199 - 28S.03E.26.344B (ISC-5B/ISC-5D),31.83705023,-106.607768,9/26/2007,3739.78,2007-09-26
5388,T11N.R3E.17.132C PDN.WDES,35.18133611,-106.6548,11/7/2007,4986.09,2007-11-07
5389,T11N.R3E.17.141B PDN.WRM,35.18160278,-106.6529361,11/7/2007,4986.05,2007-11-07
5390,T11N.R3E.17.141A PDN.WRS,35.18160278,-106.6529361,11/7/2007,4986.04,2007-11-07
5391,T11N.R3E.17.141D PDN.ERM,35.18188611,-106.6511583,11/7/2007,4985.75,2007-11-07
5392,T11N.R3E.17.141C PDN.ERS,35.18188611,-106.6511583,11/7/2007,4985.72,2007-11-07
5393,T11N.R3E.17.144A PDN.EBS,35.18178611,-106.6503611,11/7/2007,4983.74,2007-11-07
5394,T11N.R3E.17.144B PDN.EBM,35.18178611,-106.6503611,11/7/2007,4983.7,2007-11-07
5395,T11.R3E.17.132E PDN.WBM,35.18156111,-106.6535833,11/7/2007,4983.65,2007-11-07
5396,T11.R3E.17.132D  PDN.WBS,35.18156111,-106.6535833,11/7/2007,4983.52,2007-11-07
5397,T11N.R2E.17.132B PDN.WDWM,35.18134444,-106.6548778,11/7/2007,4980.12,2007-11-07
5398,T11N.R3E.17.132A PDN.WDWS,35.18134444,-106.6548778,11/7/2007,4980.1,2007-11-07
5399,T11N.R3E.17.233A PDN.EDWS,35.18166667,-106.6483333,11/7/2007,4978.87,2007-11-07
5400,T11N.R3E.17.233C. PDN.EDEM,35.18187778,-106.6475806,11/7/2007,4976.11,2007-11-07
5401,T11N.R3E.17.113A PDN.WS,35.18055556,-106.6611111,11/13/2007,4981.6,2007-11-13
5402,T11N.R3E.17.113B PDN.WD,35.18055556,-106.6611111,11/13/2007,4981.35,2007-11-13
5403,10N.03E.33.312B P83-19U,35.04988889,-106.63525,1/29/2008,4896.02,2008-01-29
5404,10N.03E.33.312 P83-19LR,35.04977778,-106.63525,1/30/2008,4895.85,2008-01-30
5405,10N.03E.33.312A P83-19M,35.04986111,-106.63525,1/31/2008,4898.06,2008-01-31
5406,T11N.R3E.17.114C PDN.WDES-T2,35.18261667,-106.6542889,3/3/2008,4989.67,2008-03-03
5407,T11N.R3E.17.123D PDN.WRM-T2,35.18277222,-106.6525972,3/3/2008,4988.51,2008-03-03
5408,T11N.R3E.17.123C PDN.WRS-T2,35.18277222,-106.6525972,3/3/2008,4988.5,2008-03-03
5409,T11N.R3E.17.141E PDN.ERS-T2,35.18278056,-106.6509333,3/3/2008,4988.39,2008-03-03
5410,T11N.R3E.17.114B PDN.WDWM-T2,35.182625,-106.6544028,3/3/2008,4988.39,2008-03-03
5411,T11N.R3E.17.114A PDN.WDWS-T2,35.182625,-106.6544028,3/3/2008,4988.38,2008-03-03
5412,T11N.R3E.17.141F PDN.ERM-T2,35.18278056,-106.6509333,3/3/2008,4988.37,2008-03-03
5413,T11N.R3E.17.123B PDN.WBD-T2,35.18271667,-106.6531917,3/3/2008,4986.84,2008-03-03
5414,T11N.R3E.17.123A PDN.WBS-T2,35.18271667,-106.6531917,3/3/2008,4986.81,2008-03-03
5415,T11N.R3E.17.142C PDN.EBD-T2,35.18286667,-106.6497389,3/3/2008,4984.31,2008-03-03
5416,T11N.R3E.17.142A PDN.EBS-T2,35.18286667,-106.6497389,3/3/2008,4984.26,2008-03-03
5417,T11N.R3E.17.142B PDN.EBM-T2,35.18286667,-106.6497389,3/3/2008,4984.26,2008-03-03
5418,T11N.R3E.17.231A PDN.EDWS-T2,35.18325556,-106.6480278,3/3/2008,4981.84,2008-03-03
5419,T11N.R3E.17.231B PDN.EDES-T2,35.18325,-106.647825,3/3/2008,4981.41,2008-03-03
5420,T11N.R3E.17.231C PDN.EDEM-T2,35.18325,-106.647825,3/3/2008,4981.41,2008-03-03
5421,MBOWN-114 - 26S.01W.14.224 (UPRR),32.05055556,-106.9061111,3/11/2008,3826.42,2008-03-11
5422,13N.05E.15.223 A,35.36052778,-106.3936667,4/10/2008,5654.32,2008-04-10
5423,TC-201,36.72733953,-105.839018,5/12/2008,7323.38,2008-05-12
5424,TC-202,36.70495394,-105.7713997,5/12/2008,7309.2,2008-05-12
5425,TC-204,36.72746213,-105.7123156,5/12/2008,7186.99,2008-05-12
5426,TC-208,36.78815411,-105.711364,5/13/2008,7319.79,2008-05-13
5427,TC-209,36.82502584,-105.7390651,5/13/2008,7319.03,2008-05-13
5428,TC-215,36.83070348,-105.844844,5/14/2008,7325.0,2008-05-14
5429,TC-216,36.80027359,-105.854542,5/14/2008,7324.13,2008-05-14
5430,TC-212,36.84715603,-105.8030426,5/14/2008,7319.26,2008-05-14
5431,31N.09E.10.143,,,5/15/2008,7519.67,2008-05-15
5432,TC-220,36.97073974,-105.8487709,5/15/2008,7334.77,2008-05-15
5433,TC-223,36.98141401,-105.9564616,5/16/2008,7556.95,2008-05-16
5434,10N.03E.28.211 RGT-FP4 DEEP,35.07103611,-106.628425,9/22/2008,4870.76,2008-09-22
5435,10N.03E.28.211A RGT-FP4 MIDDLE,35.07103611,-106.628425,9/22/2008,4866.91,2008-09-22
5436,10N.03E.28.211B RGT-FP4 SHALLOW,35.07103611,-106.628425,9/22/2008,4866.34,2008-09-22
5437,"Well G, 21S.02E.11.143, LRG-00088",32.49813889,-106.7115833,10/16/2008,4052.63,2008-10-16
5438,T08N.R02E.01.241C I-25 EDWS-T2,34.95235278,-106.678525,10/21/2008,4899.11,2008-10-21
5439,T9N.R3E.7.121C rbedes-t2,35.02911111,-106.6688972,10/28/2008,4928.62,2008-10-28
5440,T9N.R3E.7.123C rbedes,35.02779722,-106.6689806,10/28/2008,4927.34,2008-10-28
5441,T9N.R3E.7.113E rbwdws,35.02798889,-106.6745,10/29/2008,4926.5,2008-10-29
5442,T9N.R3E.7.111C rbwdws-t2,35.02935556,-106.6743944,10/29/2008,4926.02,2008-10-29
5443,T10N.R3E.30.244H bedes,35.06739722,-106.6564944,10/30/2008,4938.76,2008-10-30
5444,T10N.R3E.29.311F bedes-t2,35.06613333,-106.6561694,10/31/2008,4938.71,2008-10-31
5445,BLM-10-517,32.50458333,-106.6485833,11/3/2008,4060.41,2008-11-03
5446,WW-1-452,32.51819444,-106.6655,11/5/2008,4059.39,2008-11-05
5447,PL-3-453,32.51088889,-106.6563611,11/6/2008,4059.19,2008-11-06
5448,JP-2-447,32.51080556,-106.6665556,11/25/2008,4061.06,2008-11-25
5449,BLM-7-509,32.50794444,-106.6486944,11/25/2008,4058.35,2008-11-25
5450,JP-1-424,32.50508333,-106.6666389,11/25/2008,4057.42,2008-11-25
5451,"Well E, 21S.02E.27.211, LRG-03884",32.45941667,-106.7245278,12/3/2008,4045.87,2008-12-03
5452,KAFB-0311,35.03644023,-106.5334671,12/11/2008,4926.67,2008-12-11
5453,"Well L, 21S.02E.25.43, LRG-04366/4367",32.44738889,-106.6915,12/24/2008,4098.46,2008-12-24
5454,"Well K, 22S.02E.24.113, LRG-00418",32.38627778,-106.6983611,12/24/2008,4083.35,2008-12-24
5455,"Well F, 21S.02E.14.34, LRG-13964",32.47741667,-106.7124444,1/9/2009,4068.22,2009-01-09
5456,"Well A, 22S.03E.17.142, LRG-01148",32.40361111,-106.6558333,1/16/2009,4021.83,2009-01-16
5457,La Tierra Lot 41,,,1/21/2009,6240.73,2009-01-21
5458,La Tierra Lot 47,,,1/21/2009,6206.65,2009-01-21
5459,La Tierra Lot 48,,,1/21/2009,6187.34,2009-01-21
5460,"Well I, 21S.03E.20.1",32.46958333,-106.6595278,2/10/2009,4048.58,2009-02-10
5461,T11N.R03E.08.212d (projected) awdws-t2,35.20166111,-106.6439306,2/13/2009,4998.14,2009-02-13
5462,T11N.R03E.05.443a (projected) awdws-t1,35.20296111,-106.6431639,2/13/2009,4996.65,2009-02-13
5463,T11N.R03E.08.222b (projected) awrs-t1,35.20223889,-106.6409111,2/13/2009,4996.65,2009-02-13
5464,T11N.R03E.08.222c (projected) awrm-t1,35.20223889,-106.6409111,2/13/2009,4996.65,2009-02-13
5465,T11N.R03E.08.223d (projected) awbd-t2,35.20116944,-106.6423167,2/13/2009,4996.08,2009-02-13
5466,T11N.R03E.08.223c (projected) awbs-t2,35.20116944,-106.6423167,2/13/2009,4996.06,2009-02-13
5467,T11N.R03E.08.223d (projected) awbm-t2,35.20116944,-106.6423167,2/13/2009,4996.05,2009-02-13
5468,T11N.R03E.08.221c (projected) awbd-t1,35.20255556,-106.6417778,2/13/2009,4995.85,2009-02-13
5469,T11N.R03E.08.221a (projected) awbs-t1,35.20255556,-106.6417778,2/13/2009,4995.78,2009-02-13
5470,T11N.R03E.08.221b (projected) awbm-t1,35.20255556,-106.6417778,2/13/2009,4995.78,2009-02-13
5471,T11N.R03E.08.223a (projected) awrs-t2,35.20095,-106.6416,2/13/2009,4995.68,2009-02-13
5472,T11N.R03E.08.223b (projected) awrm-t2,35.20095,-106.6416,2/13/2009,4995.67,2009-02-13
5473,T11N.R03E.08.221d (projected) awdes-t1,35.20291667,-106.6424722,2/13/2009,4995.29,2009-02-13
5474,T11N.R03E.08.212a (projected) awdes-t2,35.2015,-106.6434444,2/13/2009,4993.84,2009-02-13
5475,T11N.R03E.09.131b (projected) aedws-t2,35.20011944,-106.6381361,2/17/2009,4992.37,2009-02-17
5476,T11N.R03E.09.113i (projected) aerd-t1,35.20125,-106.6378889,2/17/2009,4991.23,2009-02-17
5477,T11N.R03E.09.113h (projected) aerm-t1,35.20125,-106.6378889,2/17/2009,4991.11,2009-02-17
5478,T11N.R03E.09.113c (projected) aedws-t1,35.20136667,-106.6367583,2/17/2009,4991.1,2009-02-17
5479,T11N.R03E.08.242d (projected) aers-t2,35.2,-106.6388889,2/17/2009,4990.78,2009-02-17
5480,T11N.R03E.08.242e (projected) aerm-t2,35.2,-106.6388889,2/17/2009,4990.75,2009-02-17
5481,T11N.R03E.09.113f (projected) aebd-t1,35.20122222,-106.6376389,2/17/2009,4990.18,2009-02-17
5482,T11N.R03E.09.113d (projected) aebs-t1,35.20122222,-106.6376389,2/17/2009,4990.06,2009-02-17
5483,T11N.R03E.09.113e (projected) aebm-t1,35.20122222,-106.6376389,2/17/2009,4990.03,2009-02-17
5484,T11N.R03E.09.131a (projected) aedes-t2,35.200025,-106.6378806,2/17/2009,4989.19,2009-02-17
5485,T11N.R03E.09.113a (projected) aedes-t1,35.20125278,-106.6366278,2/17/2009,4988.93,2009-02-17
5486,T11N.R03E.08.242b (projected) aebm-t2,35.19983333,-106.6386389,2/17/2009,4988.79,2009-02-17
5487,T11N.R03E.08.242c (projected) aebd-t2,35.19983333,-106.6386389,2/17/2009,4988.71,2009-02-17
5488,T11N.R03E.08.242a (projected) aebs-t2,35.19983333,-106.6386389,2/17/2009,4988.58,2009-02-17
5489,T11N.R03E.09.113g (projected) aers-t1,35.20125,-106.6378889,2/17/2009,4988.19,2009-02-17
5490,"Well B, 22S.02E.02.11, LRG-01683",32.41055556,-106.7051944,2/17/2009,4029.54,2009-02-17
5491,T10N.R02E.13.414f (projected) cebs-t2,35.09086667,-106.68065,2/18/2009,4948.81,2009-02-18
5492,T10N.R02E.13.414g (projected) cebm-t2,35.09086667,-106.68065,2/18/2009,4948.81,2009-02-18
5493,T10N.R02E.13.414h (projected) cebd-t2,35.09086667,-106.68065,2/18/2009,4948.79,2009-02-18
5494,T10N.R02E.13.413c (projected) cebs-t1,35.09193056,-106.6828361,2/18/2009,4947.58,2009-02-18
5495,T10N.R02E.13.414a (projected) cedws-t1,35.09268333,-106.6820278,2/18/2009,4947.57,2009-02-18
5496,T10N.R02E.13.413d (projected) cebm-t1,35.09193056,-106.6828361,2/18/2009,4947.56,2009-02-18
5497,T10N.R02E.13.413e (projected) cebd-t1,35.09193056,-106.6828361,2/18/2009,4947.53,2009-02-18
5498,T10N.R02E.13.414d (projected) cers-t2,35.09027778,-106.6811389,2/18/2009,4947.38,2009-02-18
5499,T10N.R02E.13.414e (projected) cerm-t2,35.09027778,-106.6811389,2/18/2009,4947.37,2009-02-18
5500,T10N.R02E.13.414j (projected) cedes-t2,35.09166944,-106.6799944,2/18/2009,4947.09,2009-02-18
5501,T10N.R02E.13.414i (projected) cedws-t2,35.09160278,-106.6800833,2/18/2009,4946.82,2009-02-18
5502,T10N.R02E.13.413b (projected) cerm-t1,35.09134167,-106.6834972,2/18/2009,4946.6,2009-02-18
5503,T10N.R02E.13.413a (projected) cers-t1,35.09134167,-106.6834972,2/18/2009,4946.6,2009-02-18
5504,T10N.R02E.13.414c (projected) cedes-t1,35.09279167,-106.6819639,2/18/2009,4945.93,2009-02-18
5505,09N.02E.25.122M PEDES,34.98451667,-106.6847944,2/18/2009,4912.84,2009-02-18
5506,T10N.R02E.13.342c (projected) cwbd-t1,35.08944722,-106.6847417,2/19/2009,4948.2,2009-02-19
5507,T10N.R02E.13.431d (projected) cwrs-t2,35.08926111,-106.682075,2/19/2009,4948.19,2009-02-19
5508,T10N.R02E.13.342a (projected) cwbs-t1,35.08944722,-106.6847417,2/19/2009,4948.19,2009-02-19
5509,T10N.R02E.13.342b (projected) cwbm-t1,35.08944722,-106.6847417,2/19/2009,4948.19,2009-02-19
5510,T10N.R02E.13.431e (projected) cwrm-t2,35.08926111,-106.682075,2/19/2009,4948.18,2009-02-19
5511,T10N.R02E.13.431a (projected) cwrs-t1,35.08999722,-106.6844111,2/19/2009,4947.15,2009-02-19
5512,T10N.R02E.13.431b (projected) cwrm-t1,35.08999722,-106.6844111,2/19/2009,4947.12,2009-02-19
5513,T10N.R02E.13.433c (projected) cwbm-t2,35.08843611,-106.6827167,2/19/2009,4946.29,2009-02-19
5514,T10N.R02E.13.433b (projected) cwbs-t2,35.08843611,-106.6827167,2/19/2009,4946.29,2009-02-19
5515,T10N.R02E.13.433d (projected) cwbd-t2,35.08843611,-106.6827167,2/19/2009,4946.25,2009-02-19
5516,T10N.R02E.13.433a (projected) cwdes-t2,35.08770278,-106.6833361,2/19/2009,4945.83,2009-02-19
5517,T10N.R02E.13.344a (projected) cwdws-t1,35.08868333,-106.685325,2/19/2009,4945.32,2009-02-19
5518,T10N.R02E.13.344c (projected) cwdes-t1,35.08875278,-106.6852389,2/19/2009,4945.28,2009-02-19
5519,T10N.R02E.13.344d (projected) cwdws-t2,35.08766111,-106.6833417,2/19/2009,4944.76,2009-02-19
5520,09N.02E.25.112H PWDES-T2,34.98441389,-106.6905889,2/19/2009,4910.82,2009-02-19
5521,09N.02E.25.112I PWDES,34.98542778,-106.6904083,2/19/2009,4910.77,2009-02-19
5522,09N.02E.25.122N PEDES-T2,34.98309167,-106.6849778,2/19/2009,4909.81,2009-02-19
5523,09N.02E.25.112J PWDWS,34.98551111,-106.6905917,2/19/2009,4907.38,2009-02-19
5524,09N.02E.25.112C PWRS-T2,34.98372222,-106.6882222,2/20/2009,4912.98,2009-02-20
5525,09N.02E.25.112D PWRM-T2,34.98372222,-106.6882222,2/20/2009,4912.96,2009-02-20
5526,09N.02E.25.112K PWBS-T2,34.98418611,-106.6887972,2/20/2009,4912.28,2009-02-20
5527,09N.02E.25.112L PWBM-T2,34.98418611,-106.6887972,2/20/2009,4912.26,2009-02-20
5528,09N.02E.25.112M PWBD-T2,34.98418611,-106.6887972,2/20/2009,4911.94,2009-02-20
5529,09N.02E.25.112F PWBS,34.98496944,-106.6889583,2/20/2009,4911.93,2009-02-20
5530,09N.02E.25.112E PWBD,34.98496944,-106.6889583,2/20/2009,4911.9,2009-02-20
5531,09N.02E.25.112G PWBM,34.98496944,-106.6889583,2/20/2009,4911.9,2009-02-20
5532,09N.02E.25.112A PWRS,34.98477778,-106.6874444,2/20/2009,4911.38,2009-02-20
5533,09N.02E.25.112B PWRM,34.98477778,-106.6874444,2/20/2009,4911.35,2009-02-20
5534,09N.02E.25.122L PEDWS,34.98444722,-106.6850139,2/20/2009,4910.5,2009-02-20
5535,09N.02E.25.122K PEDWS-T2,34.98305833,-106.6851472,2/20/2009,4908.31,2009-02-20
5536,09N.02E.25.122A PERS,34.98450556,-106.6861417,2/23/2009,4912.46,2009-02-23
5537,09N.02E.25.122B PERM,34.98450556,-106.6861417,2/23/2009,4912.44,2009-02-23
5538,09N.02E.25.122F PERS-T2,34.98321944,-106.6866056,2/23/2009,4912.37,2009-02-23
5539,09N.02E.25.122G PERM-T2,34.98321944,-106.6866056,2/23/2009,4912.35,2009-02-23
5540,09N.02E.25.122C PEBS,34.98445833,-106.6857111,2/23/2009,4911.31,2009-02-23
5541,09N.02E.25.122E PEBD,34.98445833,-106.6857111,2/23/2009,4911.09,2009-02-23
5542,09N.02E.25.122D PEBM,34.98445833,-106.6857111,2/23/2009,4911.08,2009-02-23
5543,09N.02E.25.122H PEBS-T2,34.98314722,-106.6860083,2/23/2009,4910.2,2009-02-23
5544,09N.02E.25.122I PEBM-T2,34.98314722,-106.6860083,2/23/2009,4910.2,2009-02-23
5545,09N.02E.25.122J PEBD-T2,34.98314722,-106.6860083,2/23/2009,4909.23,2009-02-23
5546,10N.03E.30.232K bwdws-t1,35.06638611,-106.6622333,2/24/2009,4936.48,2009-02-24
5547,10N.03E.30.421F bwdws-t2,35.06538333,-106.6619556,2/24/2009,4935.16,2009-02-24
5548,"Well J, 21S.03E.31.41, LRG-00567",32.43897222,-106.6703056,3/6/2009,4035.76,2009-03-06
5549,RGDSSP14,38.0071,-105.89185,5/21/2009,7596.64,2009-05-21
5550,TC-231,37.00975723,-105.8393133,6/3/2009,7414.67,2009-06-03
5551,TC-233,36.85168909,-105.9961542,6/4/2009,9234.44,2009-06-04
5552,TC-232,37.00699413,-105.7455213,6/4/2009,7325.43,2009-06-04
5553,TC-203,36.71103103,-105.7585846,6/5/2009,7159.17,2009-06-05
5554,CLC Shallow,32.427425,-106.6913083,7/16/2009,4034.34,2009-07-16
5555,CLC Deep,32.427425,-106.6913083,7/16/2009,4034.25,2009-07-16
5556,CLC Middle,32.427425,-106.6913083,7/16/2009,4034.22,2009-07-16
5557,NA04100732CBC4,37.75383611,-106.2406111,8/6/2009,7686.88,2009-08-06
5558,NA04100732CBC3,37.75383611,-106.2406111,8/6/2009,7686.83,2009-08-06
5559,NA04000712AAA2,37.73345833,-106.1494556,8/6/2009,7649.95,2009-08-06
5560,NA04000712AAA3,37.73345833,-106.1494556,8/6/2009,7649.93,2009-08-06
5561,NA04000818CDD2,37.70479722,-106.1406861,8/6/2009,7648.65,2009-08-06
5562,NA04000802CBB3,37.7386,-106.0749972,8/6/2009,7605.41,2009-08-06
5563,NA04000814AAA3,37.71927222,-106.0570694,8/6/2009,7603.9,2009-08-06
5564,NA04100929ADD2,37.77063611,-106.0021472,8/7/2009,7571.0,2009-08-07
5565,ATRISCO LAND GRANT ARROYO VISTA,35.09775,-106.7463333,8/25/2009,4916.89,2009-08-25
5566,MBOWN-299 MES43R,32.42798333,-106.8809333,8/25/2009,3926.36,2009-08-25
5567,MBOWN-279 MES16R,32.31663611,-106.8420111,8/25/2009,3882.59,2009-08-25
5568,MBOWN-260 ISC4WT,31.80466389,-106.5499444,8/25/2009,3729.3,2009-08-25
5569,MBOWN-271 MES8R,32.18497222,-106.7393528,8/26/2009,3836.63,2009-08-26
5570,MBOWN-286 MES23R,32.06782222,-106.6495,8/26/2009,3801.37,2009-08-26
5571,MBOWN-296 MES39R,31.99831944,-106.6516694,8/26/2009,3786.63,2009-08-26
5572,SA-0103,33.53205158,-107.620008,10/20/2009,6372.62,2009-10-20
5573,SA-0114,34.01749003,-107.7716064,10/29/2009,6806.06,2009-10-29
5574,SA-0117,34.08198048,-107.7696986,10/29/2009,6801.54,2009-10-29
5575,SA-0116,34.06955829,-107.7387347,10/29/2009,6801.49,2009-10-29
5576,SA-0115,34.06751899,-107.7388207,10/29/2009,6798.6,2009-10-29
5577,SA-0123,33.99497247,-107.8394711,11/4/2009,6774.21,2009-11-04
5578,SA-0119,33.9381582,-107.8956838,11/4/2009,6767.7,2009-11-04
5579,SA-0129,34.15576943,-107.7866919,11/17/2009,6799.7,2009-11-17
5580,SA-0128,33.64868533,-107.6091256,11/18/2009,6275.02,2009-11-18
5581,SA-0132,34.08062889,-107.8966388,12/9/2009,7270.93,2009-12-09
5582,SA-0133,34.04481884,-107.979734,12/9/2009,6993.94,2009-12-09
5583,SA-0140,33.42153705,-107.4750661,12/10/2009,5329.14,2009-12-10
5584,SA-0136,33.39720266,-107.4541454,12/10/2009,5218.21,2009-12-10
5585,SA-0135,33.39677413,-107.4516502,12/10/2009,5193.8,2009-12-10
5586,SA-0134,33.39883598,-107.4513427,12/10/2009,5181.01,2009-12-10
5587,SA-0139,33.37681953,-107.4320034,12/10/2009,5073.61,2009-12-10
5588,SA-0137,33.3200027,-107.3291659,12/10/2009,4769.2,2009-12-10
5589,SA-0138,33.32025661,-107.32957,12/10/2009,4768.5,2009-12-10
5590,SA-0109,33.54879577,-107.6826204,12/11/2009,6495.24,2009-12-11
5591,SA-0173,33.5104054,-107.6352516,12/11/2009,6481.73,2009-12-11
5592,SA-0172,33.52892649,-107.6448563,12/11/2009,6458.12,2009-12-11
5593,SA-0108,33.56220378,-107.6524402,12/11/2009,6397.67,2009-12-11
5594,SA-0151,33.48009327,-107.6318905,12/16/2009,7223.07,2009-12-16
5595,SA-0154,33.61679985,-107.6441773,12/17/2009,6384.48,2009-12-17
5596,SA-0163,33.61552092,-107.6521123,12/17/2009,6363.9,2009-12-17
5597,SA-0158,33.60999371,-107.6554987,12/17/2009,6347.27,2009-12-17
5598,SA-0157,33.60485394,-107.6567955,12/17/2009,6332.55,2009-12-17
5599,SA-0156,33.59981222,-107.6526868,12/17/2009,6314.16,2009-12-17
5600,SA-0155,33.58998914,-107.6330921,12/17/2009,6264.96,2009-12-17
5601,SA-0170,33.58502733,-107.6072821,12/21/2009,6270.55,2009-12-21
5602,SA-0171,33.57906217,-107.6096878,12/21/2009,6247.68,2009-12-21
5603,SA-0112,34.02120412,-107.874805,1/21/2010,6773.36,2010-01-21
5604,SA-0184,33.95670552,-107.4960897,5/4/2010,7481.74,2010-05-04
5605,SA-0178,33.7310477,-107.6415929,5/4/2010,6744.68,2010-05-04
5606,SA-0190,33.94915666,-107.8403705,5/6/2010,6869.11,2010-05-06
5607,SA-0191,33.95731578,-107.8014257,5/6/2010,6795.17,2010-05-06
5608,CM-130,31.76084163,-106.7349445,6/6/2010,3795.07,2010-06-06
5609,CM-128,31.73020964,-106.7135396,6/6/2010,3773.78,2010-06-06
5610,CM-051,31.6128242,-106.6797624,6/17/2010,3778.72,2010-06-17
5611,CM-110,31.59499956,-106.8920062,6/19/2010,3829.23,2010-06-19
5612,CM-009,31.64816685,-106.6339052,7/5/2010,3794.21,2010-07-05
5613,CM-126,31.69332364,-106.7243606,7/5/2010,3790.35,2010-07-05
5614,CM-007,31.65368336,-106.6447583,7/5/2010,3778.95,2010-07-05
5615,CM-127,31.71035079,-106.7185978,7/5/2010,3762.01,2010-07-05
5616,SA-0203,33.53098022,-107.5071956,7/6/2010,6037.43,2010-07-06
5617,SA-0199,33.45650238,-107.4858912,7/6/2010,5572.87,2010-07-06
5618,SA-0196,33.43106124,-107.4884342,7/6/2010,5378.85,2010-07-06
5619,CM-132,31.76683604,-106.7112476,7/6/2010,3788.02,2010-07-06
5620,CM-131,31.74799262,-106.709898,7/6/2010,3780.84,2010-07-06
5621,CM-158,31.7597024,-106.6929152,7/6/2010,3765.03,2010-07-06
5622,CM-118,31.62704314,-106.9093004,7/7/2010,3807.94,2010-07-07
5623,CM-159,31.65519315,-106.9605552,7/8/2010,3824.57,2010-07-08
5624,CM-119,31.67277291,-106.9214367,7/8/2010,3815.15,2010-07-08
5625,CM-160,31.72249379,-106.7410786,7/13/2010,3778.21,2010-07-13
5626,CM-144,31.74143942,-106.6933428,7/17/2010,3766.7,2010-07-17
5627,CM-066,31.59993602,-106.8875743,7/19/2010,3819.45,2010-07-19
5628,CM-129,31.73675651,-106.7290385,7/21/2010,3792.07,2010-07-21
5629,BC-0060,35.16696463,-106.3309624,8/10/2010,6627.24,2010-08-10
5630,SA-0214,33.65253511,-107.6627885,9/16/2010,6462.78,2010-09-16
5631,SA-0213,33.65260695,-107.6628015,9/16/2010,6461.79,2010-09-16
5632,SA-0215,33.6373617,-107.6678073,9/16/2010,6421.93,2010-09-16
5633,SA-0216,33.64129249,-107.6590252,9/16/2010,6354.77,2010-09-16
5634,SA-0212,33.65067116,-107.6551418,9/16/2010,6328.36,2010-09-16
5635,SA-0211,34.09720872,-107.5425066,11/9/2010,6804.72,2010-11-09
5636,TC-240,36.73979021,-105.6774834,11/12/2010,7157.03,2010-11-12
5637,QU-015,36.70702697,-105.6653952,11/12/2010,7145.5,2010-11-12
5638,BC-0068,35.16713636,-106.3317448,1/18/2011,6636.14,2011-01-18
5639,TV-100,36.30050274,-105.6785202,3/12/2011,7236.02,2011-03-12
5640,TV-105,36.35254479,-105.6347818,3/12/2011,6774.45,2011-03-12
5641,TV-102,36.33802423,-105.6459963,3/12/2011,6722.95,2011-03-12
5642,TV-120,36.3446548,-105.610881,3/13/2011,6930.77,2011-03-13
5643,TV-111,36.3571386,-105.6183458,3/13/2011,6855.47,2011-03-13
5644,TV-118,36.35075903,-105.624659,3/13/2011,6842.35,2011-03-13
5645,TV-114,36.34016809,-105.6379351,3/13/2011,6820.01,2011-03-13
5646,TV-117,36.34990704,-105.6272489,3/13/2011,6813.58,2011-03-13
5647,TV-122,36.35847571,-105.646756,3/13/2011,6788.37,2011-03-13
5648,TV-119,36.36639362,-105.6462865,3/13/2011,6787.88,2011-03-13
5649,TV-112,36.34538954,-105.6342445,3/13/2011,6761.77,2011-03-13
5650,TV-110,36.3664013,-105.6726602,3/13/2011,6621.44,2011-03-13
5651,TV-123,36.36533495,-105.6763072,3/13/2011,6616.76,2011-03-13
5652,TV-108,36.36664387,-105.6807661,3/13/2011,6614.71,2011-03-13
5653,TV-124,36.36525211,-105.6766074,3/13/2011,6611.85,2011-03-13
5654,TV-121,36.36563244,-105.6794866,3/13/2011,6611.81,2011-03-13
5655,TV-115,36.3432558,-105.6828024,3/13/2011,6426.91,2011-03-13
5656,TV-147,36.39012015,-105.6279732,3/14/2011,6879.02,2011-03-14
5657,TV-142,36.36504028,-105.6122553,3/14/2011,6859.33,2011-03-14
5658,TV-135,36.37879451,-105.611081,3/14/2011,6843.5,2011-03-14
5659,TV-150,36.39636244,-105.6098469,3/14/2011,6793.93,2011-03-14
5660,TV-144,36.4011459,-105.6262218,3/14/2011,6788.47,2011-03-14
5661,TV-137,36.38507346,-105.6241863,3/14/2011,6774.87,2011-03-14
5662,TV-136,36.38425152,-105.6498348,3/14/2011,6719.47,2011-03-14
5663,TV-138,36.38469228,-105.6500169,3/14/2011,6692.6,2011-03-14
5664,TV-139,36.34853062,-105.6842192,3/14/2011,6666.6,2011-03-14
5665,TV-152,36.34759766,-105.6527731,3/14/2011,6664.78,2011-03-14
5666,TV-140,36.33958942,-105.7010005,3/14/2011,6654.89,2011-03-14
5667,TV-143,36.37115796,-105.6732585,3/14/2011,6604.51,2011-03-14
5668,TV-160,36.34195427,-105.6118517,3/15/2011,6926.86,2011-03-15
5669,TV-161,36.36764911,-105.6357628,3/15/2011,6798.46,2011-03-15
5670,TV-162,36.36064555,-105.6389048,3/15/2011,6792.04,2011-03-15
5671,TV-163,36.38838634,-105.6302339,3/15/2011,6790.25,2011-03-15
5672,TV-169,36.39352974,-105.6259043,3/15/2011,6784.15,2011-03-15
5673,TV-157,36.35062605,-105.6344987,3/15/2011,6774.24,2011-03-15
5674,TV-156,36.34980066,-105.6354393,3/15/2011,6760.8,2011-03-15
5675,TV-167,36.3436396,-105.6361248,3/15/2011,6757.44,2011-03-15
5676,TV-154,36.38488371,-105.6396047,3/15/2011,6749.13,2011-03-15
5677,TV-168,36.39246803,-105.6289399,3/15/2011,6740.86,2011-03-15
5678,TV-155,36.3801131,-105.6581509,3/15/2011,6685.9,2011-03-15
5679,TV-177,36.37433832,-105.6606998,3/15/2011,6681.5,2011-03-15
5680,TV-165,36.37216073,-105.6664559,3/15/2011,6670.91,2011-03-15
5681,TV-178,36.37894187,-105.6645293,3/15/2011,6656.38,2011-03-15
5682,TV-174,36.38005087,-105.6645052,3/15/2011,6651.87,2011-03-15
5683,TV-173,36.36725792,-105.6774162,3/15/2011,6611.71,2011-03-15
5684,TV-166,36.34957755,-105.685588,3/15/2011,6605.63,2011-03-15
5685,TV-159,36.35568554,-105.6800354,3/15/2011,6599.51,2011-03-15
5686,TV-182,36.34878112,-105.6131644,3/16/2011,6911.72,2011-03-16
5687,TV-183,36.34277584,-105.6151343,3/16/2011,6910.71,2011-03-16
5688,TV-179,36.36907584,-105.6454168,3/16/2011,6790.89,2011-03-16
5689,TV-181,36.37138231,-105.6270645,3/16/2011,6787.8,2011-03-16
5690,TV-187,36.37770116,-105.6374388,3/16/2011,6776.25,2011-03-16
5691,TV-185,36.39191425,-105.6296714,3/16/2011,6739.01,2011-03-16
5692,TV-186,36.35348364,-105.6578821,3/16/2011,6737.24,2011-03-16
5693,TV-180,36.35235556,-105.6629881,3/16/2011,6627.86,2011-03-16
5694,TV-188,36.35091653,-105.6816099,3/16/2011,6461.41,2011-03-16
5695,SA-0219,33.49284529,-107.7111292,3/25/2011,6519.75,2011-03-25
5696,SA-0209,33.85894693,-107.7408164,3/31/2011,6800.42,2011-03-31
5697,TV-189,36.36540056,-105.6646147,4/9/2011,6691.65,2011-04-09
5698,TV-192,36.35753795,-105.6599782,4/20/2011,6681.89,2011-04-20
5699,TV-200,36.37018232,-105.6374667,4/21/2011,6782.64,2011-04-21
5700,TV-194,36.37755155,-105.6418078,4/21/2011,6776.77,2011-04-21
5701,TV-193,36.35342729,-105.6467365,4/21/2011,6758.64,2011-04-21
5702,TV-208,36.37723297,-105.6638124,4/21/2011,6660.75,2011-04-21
5703,TV-199,36.35994073,-105.6925894,4/21/2011,6570.36,2011-04-21
5704,TV-197,36.35493675,-105.7019517,4/21/2011,6445.0,2011-04-21
5705,TV-196,36.35457902,-105.7029961,4/21/2011,6440.18,2011-04-21
5706,TV-195,36.35117981,-105.7076575,4/21/2011,6411.6,2011-04-21
5707,BC-0049,35.16887051,-106.3298295,5/26/2011,6586.3,2011-05-26
5708,TV-226,36.37031807,-105.6254285,6/1/2011,6831.3,2011-06-01
5709,TV-223,36.37396783,-105.6476869,6/1/2011,6777.01,2011-06-01
5710,TV-224,36.37475209,-105.6543154,6/1/2011,6714.3,2011-06-01
5711,TV-228,36.37387018,-105.6523794,6/1/2011,6701.46,2011-06-01
5712,TV-227,36.36897231,-105.6755583,6/1/2011,6613.31,2011-06-01
5713,TV-218,36.3486105,-105.6455599,6/2/2011,6745.86,2011-06-02
5714,TV-219,36.34914351,-105.6453526,6/2/2011,6683.24,2011-06-02
5715,TV-217,36.3486105,-105.6455599,6/2/2011,6682.07,2011-06-02
5716,TV-164,36.3747049,-105.6693427,8/3/2011,6665.16,2011-08-03
5717,TV-149,36.34566078,-105.6925632,8/3/2011,6469.37,2011-08-03
5718,BC-0069,35.16966471,-106.3314017,9/21/2011,6637.02,2011-09-21
5719,LC-027,35.57837336,-106.0848537,10/4/2011,6122.13,2011-10-04
5720,LC-026,35.565482,-106.1035489,10/4/2011,6078.87,2011-10-04
5721,LC-025,35.56515797,-106.1034893,10/4/2011,6071.49,2011-10-04
5722,LC-029,35.56205002,-106.1002469,10/5/2011,6100.27,2011-10-05
5723,LC-010,35.57281055,-106.10568,10/5/2011,6088.09,2011-10-05
5724,LC-028,35.57088613,-106.106117,10/5/2011,6062.06,2011-10-05
5725,LC-009,35.57085027,-106.1060945,10/5/2011,6061.81,2011-10-05
5726,LC-011,35.57437782,-106.111727,10/5/2011,6043.56,2011-10-05
5727,EB-303,35.57827527,-106.1006453,10/6/2011,6097.82,2011-10-06
5728,TV-231,36.35436683,-105.6788871,10/14/2011,6664.43,2011-10-14
5729,QU-076,36.69966894,-105.6207089,1/5/2012,7282.83,2012-01-05
5730,QU-077,36.69985051,-105.620464,1/6/2012,7302.47,2012-01-06
5731,QU-075,36.69718202,-105.6204874,1/6/2012,7148.28,2012-01-06
5732,QU-095,36.70680301,-105.6042746,1/10/2012,7489.85,2012-01-10
5733,QU-094,36.70677585,-105.6042968,1/10/2012,7487.83,2012-01-10
5734,QU-099,36.69941696,-105.6101613,1/13/2012,7331.44,2012-01-13
5735,QU-098,36.69860886,-105.6130431,1/13/2012,7309.37,2012-01-13
5736,QU-073,36.6963847,-105.6195294,1/13/2012,7300.95,2012-01-13
5737,QU-091,36.70205525,-105.6072266,1/19/2012,7421.75,2012-01-19
5738,QU-068,36.69314917,-105.6228393,1/20/2012,7239.25,2012-01-20
5739,QU-069,36.69316726,-105.6228282,1/20/2012,7157.05,2012-01-20
5740,QU-096,36.71436922,-105.6054871,1/24/2012,7529.51,2012-01-24
5741,QU-071,36.69559012,-105.6215045,1/24/2012,7258.08,2012-01-24
5742,QU-070,36.69567184,-105.6213932,1/24/2012,7236.26,2012-01-24
5743,QU-082,36.69412957,-105.6232614,1/25/2012,7232.58,2012-01-25
5744,QU-084,36.69546391,-105.6351717,1/25/2012,7162.92,2012-01-25
5745,QU-083,36.69518008,-105.6326059,1/25/2012,7146.53,2012-01-25
5746,QU-081,36.69850545,-105.6225466,1/26/2012,7353.53,2012-01-26
5747,QU-078,36.69945026,-105.6211549,1/26/2012,7263.91,2012-01-26
5748,QU-090,36.70926615,-105.6091643,1/27/2012,7498.95,2012-01-27
5749,QU-072,36.69694677,-105.6206534,1/27/2012,7220.44,2012-01-27
5750,QU-089,36.70511677,-105.6061423,1/30/2012,7463.88,2012-01-30
5751,QU-086,36.70827121,-105.6322765,1/30/2012,7154.63,2012-01-30
5752,QU-085,36.70678213,-105.6291854,1/30/2012,7100.28,2012-01-30
5753,QU-087,36.72349024,-105.6040806,2/1/2012,7508.09,2012-02-01
5754,QU-097,36.69997509,-105.6085536,2/3/2012,7326.59,2012-02-03
5755,LC-030,35.55948343,-106.1146438,2/15/2012,6034.3,2012-02-15
5756,TV-235,36.33662668,-105.6028958,3/10/2012,6950.55,2012-03-10
5757,SA-0077,34.08084776,-107.755133,3/14/2012,6799.52,2012-03-14
5758,BC-0129,35.1664217,-106.471419,3/14/2012,6416.48,2012-03-14
5759,BC-0139,35.16050093,-106.4983974,3/14/2012,5607.97,2012-03-14
5760,BC-0137,35.18512352,-106.5408232,3/14/2012,4920.15,2012-03-14
5761,SA-0078,34.1296568,-107.6225418,3/15/2012,6801.34,2012-03-15
5762,TV-233,36.35354533,-105.6614045,4/10/2012,6642.37,2012-04-10
5763,EB-691,35.57813753,-106.1009193,5/24/2012,6093.12,2012-05-24
5764,TV-250,36.39728538,-105.6109469,6/12/2012,6789.37,2012-06-12
5765,TV-240,36.39426712,-105.6245386,6/12/2012,6772.15,2012-06-12
5766,TV-246,36.34121673,-105.6373977,6/19/2012,6758.78,2012-06-19
5767,QU-002,36.72424738,-105.582395,6/20/2012,7546.44,2012-06-20
5768,QU-011,36.72333601,-105.5807308,6/22/2012,7597.93,2012-06-22
5769,QU-004,36.7130036,-105.5810449,6/22/2012,7475.95,2012-06-22
5770,QU-005,36.73163792,-105.5696721,6/26/2012,7811.43,2012-06-26
5771,TV-254,36.35479901,-105.648141,6/28/2012,6758.07,2012-06-28
5772,TV-256,36.36148509,-105.6618841,6/28/2012,6626.36,2012-06-28
5773,QU-058,36.7449618,-105.6043608,7/6/2012,7504.6,2012-07-06
5774,QU-056,36.74236688,-105.6041053,7/6/2012,7500.63,2012-07-06
5775,QU-057,36.74232175,-105.6041161,7/7/2012,7500.55,2012-07-07
5776,RG35A,37.67984444,-106.2775278,7/9/2012,7764.55,2012-07-09
5777,RG29A,37.74810278,-106.0386056,7/9/2012,7583.68,2012-07-09
5778,TV-242,36.36478102,-105.7651414,7/9/2012,6524.52,2012-07-09
5779,TV-258,36.35447581,-105.6594285,7/11/2012,6631.87,2012-07-11
5780,QU-037,36.64765223,-105.6295767,7/19/2012,7519.86,2012-07-19
5781,QU-034,36.6937464,-105.6224075,7/24/2012,7234.19,2012-07-24
5782,QU-042,36.74850201,-105.5959311,7/30/2012,7503.13,2012-07-30
5783,QU-047,36.74403551,-105.6056977,7/31/2012,7504.94,2012-07-31
5784,QU-060,36.71316088,-105.5966321,8/2/2012,7538.65,2012-08-02
5785,QU-050,36.71184763,-105.5869816,8/2/2012,7485.65,2012-08-02
5786,QU-054,36.79027355,-105.5999755,8/3/2012,7562.55,2012-08-03
5787,QU-049,36.75248219,-105.5967908,8/3/2012,7505.57,2012-08-03
5788,QU-032,36.65433993,-105.6107788,8/11/2012,8045.11,2012-08-11
5789,QU-114,36.69046678,-105.6045721,8/11/2012,7321.58,2012-08-11
5790,QU-118,36.69394493,-105.6030993,8/11/2012,7295.05,2012-08-11
5791,QU-113,36.69291781,-105.5958264,8/13/2012,7329.25,2012-08-13
5792,QU-117,36.69157019,-105.612685,8/13/2012,7243.62,2012-08-13
5793,QU-115,36.70936214,-105.5955391,8/15/2012,7506.78,2012-08-15
5794,QU-110,36.69936894,-105.5874465,8/15/2012,7367.18,2012-08-15
5795,QU-116,36.69578104,-105.5892774,8/15/2012,7351.33,2012-08-15
5796,QU-112,36.68935643,-105.608414,8/15/2012,7295.6,2012-08-15
5797,QU-108,36.74572566,-105.5682528,8/17/2012,7934.15,2012-08-17
5798,QU-107,36.74875192,-105.5706948,8/17/2012,7729.78,2012-08-17
5799,QU-106,36.70485825,-105.5948438,8/18/2012,7451.97,2012-08-18
5800,QU-103,36.75856762,-105.5671935,8/25/2012,8164.99,2012-08-25
5801,QU-105,36.74909468,-105.5687705,8/25/2012,8089.43,2012-08-25
5802,TV-249,36.40707944,-105.6049342,10/13/2012,6815.48,2012-10-13
5803,HS-011,33.12894576,-107.2529017,10/19/2012,4248.55,2012-10-19
5804,HS-010,33.12884361,-107.2535635,10/19/2012,4247.24,2012-10-19
5805,HS-016,33.12865239,-107.2526691,10/19/2012,4241.46,2012-10-19
5806,HS-003,33.11871605,-107.2818516,10/19/2012,4224.35,2012-10-19
5807,HS-040,33.11534945,-107.2830075,10/19/2012,4220.17,2012-10-19
5808,HS-002,33.11402711,-107.2818482,10/19/2012,4219.6,2012-10-19
5809,HS-001,33.11535673,-107.2821183,10/19/2012,4218.14,2012-10-19
5810,HS-039,33.11425122,-107.283397,10/19/2012,4215.39,2012-10-19
5811,HS-035,33.12889839,-107.2575088,10/26/2012,4255.29,2012-10-26
5812,HS-034,33.1286421,-107.2587133,10/26/2012,4250.83,2012-10-26
5813,HS-026,33.12819307,-107.259109,10/26/2012,4248.84,2012-10-26
5814,HS-027,33.12849369,-107.2594382,10/26/2012,4248.52,2012-10-26
5815,HS-024,33.12834319,-107.2592843,10/26/2012,4247.44,2012-10-26
5816,HS-029,33.12859835,-107.2596338,10/26/2012,4247.42,2012-10-26
5817,HS-023,33.12833281,-107.2593591,10/26/2012,4246.26,2012-10-26
5818,HS-025,33.12810496,-107.2594926,10/26/2012,4245.41,2012-10-26
5819,HS-021,33.12741017,-107.2570313,10/26/2012,4245.36,2012-10-26
5820,HS-020,33.12790283,-107.2552221,10/26/2012,4244.69,2012-10-26
5821,HS-019,33.12804152,-107.2550327,10/26/2012,4244.51,2012-10-26
5822,HS-018,33.12739722,-107.254759,10/26/2012,4240.74,2012-10-26
5823,HS-022,33.12762421,-107.2531787,10/26/2012,4238.22,2012-10-26
5824,HS-036,33.12753365,-107.2502078,10/26/2012,4223.35,2012-10-26
5825,HS-037,33.12702445,-107.2504413,10/26/2012,4223.27,2012-10-26
5826,HS-041,33.1283317,-107.2529503,11/2/2012,4240.28,2012-11-02
5827,HS-043,33.12836852,-107.2529084,11/2/2012,4239.52,2012-11-02
5828,HS-042,33.12778577,-107.252722,11/2/2012,4238.3,2012-11-02
5829,QU-088,36.72341789,-105.6041248,11/6/2012,7510.24,2012-11-06
5830,QU-092,36.70241102,-105.6046321,11/6/2012,7426.84,2012-11-06
5831,QU-093,36.70253767,-105.6045435,11/6/2012,7425.34,2012-11-06
5832,QU-079,36.69945026,-105.6211549,11/6/2012,7260.11,2012-11-06
5833,QU-080,36.69945026,-105.6211549,11/6/2012,7196.16,2012-11-06
5834,QU-067,36.73303088,-105.6087808,11/6/2012,7155.25,2012-11-06
5835,QU-100,36.69654341,-105.607978,11/7/2012,7279.37,2012-11-07
5836,QU-039,36.72941795,-105.6410284,11/7/2012,7160.23,2012-11-07
5837,QU-101,36.69654341,-105.607978,11/7/2012,7160.02,2012-11-07
5838,HS-030,33.12854349,-107.2596753,11/9/2012,4248.58,2012-11-09
5839,HS-044,33.12878594,-107.2522653,11/9/2012,4242.33,2012-11-09
5840,HS-038,33.12732753,-107.2511349,11/16/2012,4226.79,2012-11-16
5841,HS-052,33.12986713,-107.2543078,11/29/2012,4253.43,2012-11-29
5842,HS-054,33.12530373,-107.2553378,11/29/2012,4236.56,2012-11-29
5843,HS-053,33.12572659,-107.2533981,11/29/2012,4230.0,2012-11-29
5844,HS-051,33.12782566,-107.2505153,11/29/2012,4226.08,2012-11-29
5845,HS-061,33.12710355,-107.2510542,11/29/2012,4225.38,2012-11-29
5846,JM-006,32.95802402,-106.844208,12/5/2012,4462.63,2012-12-05
5847,JM-001,32.93058396,-106.9328802,12/5/2012,4452.37,2012-12-05
5848,JM-002,32.92816504,-106.9423128,12/5/2012,4427.35,2012-12-05
5849,JM-005,32.89214233,-106.8418365,12/5/2012,4380.31,2012-12-05
5850,HS-047,33.12793453,-107.2519756,12/5/2012,4235.18,2012-12-05
5851,HS-046,33.12729013,-107.2522057,12/5/2012,4232.96,2012-12-05
5852,HS-048,33.12810432,-107.251562,12/5/2012,4232.52,2012-12-05
5853,HS-050,33.12740391,-107.2518978,12/5/2012,4232.32,2012-12-05
5854,HS-049,33.12782762,-107.2514049,12/5/2012,4229.72,2012-12-05
5855,JM-003,32.83306667,-106.9636436,12/5/2012,4076.9,2012-12-05
5856,JM-007,33.00503562,-106.803604,12/6/2012,4835.74,2012-12-06
5857,JM-008,32.9985989,-106.8750292,12/6/2012,4475.57,2012-12-06
5858,QU-007,36.73407903,-105.5681781,12/17/2012,7815.72,2012-12-17
5859,BC-0144,35.19323209,-106.5553864,12/17/2012,4922.85,2012-12-17
5860,BC-0141,35.1952491,-106.5527778,12/17/2012,4905.93,2012-12-17
5861,HS-058,33.13003868,-107.252801,12/18/2012,4253.97,2012-12-18
5862,HS-056,33.12718991,-107.2557504,12/18/2012,4246.71,2012-12-18
5863,HS-057,33.12780569,-107.2566021,12/18/2012,4245.74,2012-12-18
5864,HS-059,33.12815249,-107.2543818,12/18/2012,4244.95,2012-12-18
5865,HS-063,33.12560961,-107.2533844,1/8/2013,4229.18,2013-01-08
5866,HS-071,33.12731704,-107.2566967,1/9/2013,4244.25,2013-01-09
5867,HS-067,33.12802108,-107.2526744,1/9/2013,4238.51,2013-01-09
5868,TV-268,36.34636557,-105.5952257,1/11/2013,6933.5,2013-01-11
5869,TV-267,36.36092856,-105.5890947,1/11/2013,6906.28,2013-01-11
5870,HS-060,33.12927555,-107.2551071,1/23/2013,4255.0,2013-01-23
5871,JM-013,32.95279246,-106.9763317,1/24/2013,4502.0,2013-01-24
5872,JM-014,32.95203588,-106.9677042,1/24/2013,4472.96,2013-01-24
5873,QU-111,36.70053141,-105.6001841,2/9/2013,7353.69,2013-02-09
5874,HS-074,33.13431966,-107.2579049,2/19/2013,4274.42,2013-02-19
5875,HS-072,33.12713941,-107.2560492,2/19/2013,4246.42,2013-02-19
5876,HS-073,33.1275368,-107.2425346,2/19/2013,4218.09,2013-02-19
5877,QU-120,36.77990287,-105.6320575,2/25/2013,7472.97,2013-02-25
5878,QU-121,36.78975196,-105.6801534,2/25/2013,7280.55,2013-02-25
5879,HS-078,33.22905603,-107.3450655,3/22/2013,4698.16,2013-03-22
5880,HS-062,33.23726742,-107.2684462,3/22/2013,4389.86,2013-03-22
5881,HS-076,33.12805904,-107.2590413,3/22/2013,4253.93,2013-03-22
5882,HS-031,33.12884047,-107.2592114,3/22/2013,4249.8,2013-03-22
5883,HS-028,33.12853227,-107.2592999,3/22/2013,4249.4,2013-03-22
5884,HS-077,33.12762181,-107.2662318,3/22/2013,4249.28,2013-03-22
5885,HS-080,33.12021897,-107.2497961,3/22/2013,4229.28,2013-03-22
5886,HS-012,33.12963489,-107.2561773,3/23/2013,4252.29,2013-03-23
5887,HS-079,33.11957919,-107.2522659,3/23/2013,4229.18,2013-03-23
5888,QU-055,36.69494045,-105.6216224,4/7/2013,7256.59,2013-04-07
5889,LJ-002,34.09161761,-107.0237111,4/16/2013,5690.77,2013-04-16
5890,LJ-003,34.09095367,-107.0224164,4/16/2013,5689.14,2013-04-16
5891,LJ-004,34.08354188,-107.0207772,4/16/2013,5679.55,2013-04-16
5892,T10N.R04E.30.1243C TRUMBULL-NEST-1C,35.06909444,-106.5657528,4/22/2013,4882.77,2013-04-22
5893,T10N.R04E.30.1243B TRUMBULL-NEST-1B,35.06909444,-106.5657528,4/22/2013,4870.29,2013-04-22
5894,T10N.R04E.30.1243A TRUMBULL-NEST-1A,35.06909444,-106.5657528,4/22/2013,4861.98,2013-04-22
5895,JM-030,33.08436046,-107.0771272,5/13/2013,4763.69,2013-05-13
5896,JM-027,33.10698387,-107.0685948,5/13/2013,4705.33,2013-05-13
5897,JM-028,33.07516274,-107.0575239,5/13/2013,4702.09,2013-05-13
5898,JM-043,33.11699409,-107.0966164,5/16/2013,4764.35,2013-05-16
5899,JM-016,33.17353082,-107.0360472,5/16/2013,4660.93,2013-05-16
5900,JM-044,32.8309631,-107.0437534,5/22/2013,4451.45,2013-05-22
5901,JM-048,32.88944849,-107.0040614,5/22/2013,4431.46,2013-05-22
5902,JM-045,32.89001581,-107.0035505,5/22/2013,4431.36,2013-05-22
5903,JM-037,33.04398465,-107.045106,5/23/2013,4734.49,2013-05-23
5904,MG-039,34.11145691,-107.2661207,6/6/2013,6511.14,2013-06-06
5905,MG-037,34.13137067,-107.2089064,6/6/2013,6267.46,2013-06-06
5906,MG-038,34.13145202,-107.2093964,6/6/2013,6267.41,2013-06-06
5907,MG-030,34.10163383,-107.2702699,6/17/2013,6512.04,2013-06-17
5908,MG-003,34.08057358,-107.2158863,6/18/2013,7031.87,2013-06-18
5909,MG-004,34.07804434,-107.2276094,6/18/2013,6903.43,2013-06-18
5910,MG-022,34.10089085,-107.27193,6/18/2013,6528.47,2013-06-18
5911,MG-020,34.10621526,-107.2643442,6/18/2013,6505.84,2013-06-18
5912,QU-036,36.65068347,-105.6065545,6/19/2013,7677.04,2013-06-19
5913,QU-046,36.65409961,-105.6066484,6/19/2013,7434.93,2013-06-19
5914,MG-025,34.1060527,-107.27752,6/19/2013,6422.15,2013-06-19
5915,MG-010,34.11505621,-107.2325581,6/19/2013,6415.25,2013-06-19
5916,MG-029,34.13158922,-107.2102891,6/19/2013,6274.83,2013-06-19
5917,MG-033,34.13771789,-107.1918201,6/19/2013,6153.64,2013-06-19
5918,JL-49-22-141,31.709445,-106.359445,6/19/2013,3600.69,2013-06-19
5919,JL-49-21-325,31.735,-106.3825,6/19/2013,3566.9,2013-06-19
5920,QU-159,36.77301085,-105.6175346,6/20/2013,7501.02,2013-06-20
5921,QU-027,36.76653175,-105.617068,6/20/2013,7495.84,2013-06-20
5922,BC-0146,35.19685737,-106.5609254,6/20/2013,4871.06,2013-06-20
5923,QU-158,36.60418435,-105.6258354,6/24/2013,7578.98,2013-06-24
5924,QU-157,36.59694933,-105.6386899,6/24/2013,7412.67,2013-06-24
5925,MG-036,34.10785061,-107.2232095,6/25/2013,6608.96,2013-06-25
5926,QU-154,36.75254159,-105.6064367,6/26/2013,7543.83,2013-06-26
5927,QU-022,36.75360151,-105.6071845,6/28/2013,7561.4,2013-06-28
5928,QU-161,36.71308666,-105.6024203,7/1/2013,7539.24,2013-07-01
5929,QU-160,36.72092057,-105.6006114,7/1/2013,7511.56,2013-07-01
5930,QU-155,36.73705884,-105.5966378,7/2/2013,7508.85,2013-07-02
5931,QU-156,36.73501259,-105.5912012,7/2/2013,7502.95,2013-07-02
5932,JL-49-05-812,31.90055556,-106.4219444,7/3/2013,3578.85,2013-07-03
5933,MG-041,34.11133792,-107.2647518,7/16/2013,6476.83,2013-07-16
5934,LJ-005,34.06167074,-107.0655758,7/16/2013,5741.3,2013-07-16
5935,QU-164,36.75645914,-105.6159567,9/15/2013,7502.51,2013-09-15
5936,RIN10R,32.82024444,-107.3077667,9/16/2013,4117.16,2013-09-16
5937,RIN1R,32.76997222,-107.2816333,9/16/2013,4090.69,2013-09-16
5938,RIN11R,32.75536667,-107.2753444,9/16/2013,4083.54,2013-09-16
5939,RIN9R,32.74667778,-107.2647194,9/16/2013,4080.41,2013-09-16
5940,RIN7R,32.66484444,-107.1100139,9/16/2013,4022.08,2013-09-16
5941,RIN4R,32.65973611,-107.0777278,9/16/2013,4012.27,2013-09-16
5942,RIN5R,32.64358611,-107.0370639,9/16/2013,4002.38,2013-09-16
5943,BC-0142,35.19519932,-106.556654,9/17/2013,4925.01,2013-09-17
5944,BC-0138,35.19777021,-106.5600531,9/17/2013,4924.91,2013-09-17
5945,BC-0143,35.1961079,-106.5561112,9/17/2013,4865.19,2013-09-17
5946,MBOWN-304 MES48R,32.24861667,-106.8223056,9/18/2013,3863.63,2013-09-18
5947,MBOWN-303 MES47R,32.28443056,-106.7682306,9/18/2013,3853.45,2013-09-18
5948,MBOWN-276 MES13R,32.21361667,-106.7594472,9/19/2013,3834.61,2013-09-19
5949,MBOWN-273 MES10R,32.20895,-106.7105194,9/19/2013,3824.67,2013-09-19
5950,MBOWN-272 MES9R,32.20170833,-106.7070139,9/19/2013,3823.57,2013-09-19
5951,MBOWN-295 MES38R,31.96355556,-106.6388639,9/19/2013,3767.84,2013-09-19
5952,MBOWN-264 MES1R,31.927075,-106.6469861,9/19/2013,3762.12,2013-09-19
5953,MBOWN-298 MES42R,32.47385833,-106.8962972,9/20/2013,3945.16,2013-09-20
5954,MBOWN-297 MES41R,32.47810278,-106.92165,9/20/2013,3937.58,2013-09-20
5955,MBOWN-282 MES19R,32.38735556,-106.85365,9/20/2013,3924.0,2013-09-20
5956,MBOWN-283 MES20R,32.40280278,-106.8484944,9/20/2013,3917.5,2013-09-20
5957,MBOWN-270 MES7R,32.16881944,-106.7422417,9/20/2013,3828.71,2013-09-20
5958,MBOWN-290 MES27R,32.09693333,-106.6411972,9/20/2013,3801.14,2013-09-20
5959,MBOWN-284 MES21R,32.08274722,-106.64445,9/20/2013,3800.18,2013-09-20
5960,MBOWN-285 MES22R,32.06821667,-106.6330389,9/20/2013,3799.55,2013-09-20
5961,MBOWN-291 MES28R,32.05366944,-106.6293722,9/20/2013,3793.44,2013-09-20
5962,MBOWN-292 MES30R,32.03955278,-106.6225056,9/20/2013,3787.61,2013-09-20
5963,MBOWN-294 MES32R,32.02620833,-106.636175,9/20/2013,3781.97,2013-09-20
5964,MBOWN-293 MES31R,32.02458333,-106.6165111,9/20/2013,3779.78,2013-09-20
5965,MBOWN-281 MES18R,32.3422,-106.8252556,9/21/2013,3880.27,2013-09-21
5966,17S.05W.13.24 H3-2,32.83169444,-107.3033889,9/25/2013,4119.95,2013-09-25
5967,LC-034,35.57894121,-106.1017691,11/7/2013,6090.99,2013-11-07
5968,BC-0145,35.19682095,-106.5637475,12/23/2013,4927.22,2013-12-23
5969,15S.07W.01.412,33.03272222,-107.5103889,1/7/2014,4876.79,2014-01-07
5970,15S.05W.29.412,32.97472222,-107.3730278,1/7/2014,4396.84,2014-01-07
5971,15S.05W.28.4333,32.96891667,-107.3581389,1/7/2014,4355.08,2014-01-07
5972,15S.05W.27.33,32.96966667,-107.3496667,1/7/2014,4344.37,2014-01-07
5973,17S.02W.24.224,32.82055556,-106.9889444,1/15/2014,4349.38,2014-01-15
5974,26N.12E.26.3212,36.45722222,-105.6322222,5/6/2014,6830.62,2014-05-06
5975,Industrial Park Well 2,35.87597222,-106.0582,5/8/2014,5717.47,2014-05-08
5976,Industrial Park Well 1,35.87336111,-106.0576361,5/8/2014,5707.48,2014-05-08
5977,QU-003,36.71822706,-105.5930433,7/1/2014,7531.14,2014-07-01
5978,QU-168,36.82883699,-105.5594922,8/13/2014,7642.01,2014-08-13
5979,QU-109,36.73620496,-105.5760004,8/13/2014,7621.15,2014-08-13
5980,QU-051,36.73045548,-105.595758,9/5/2014,7505.46,2014-09-05
5981,Pow-Wow Well,35.87578056,-106.0459583,10/8/2014,5770.47,2014-10-08
5982,BH-4,35.86226667,-106.0429222,11/13/2014,6002.22,2014-11-13
5983,BH-3,35.86772778,-106.0441806,11/18/2014,5945.43,2014-11-18
5984,MW-4,35.86590556,-106.0433472,11/20/2014,5957.54,2014-11-20
5985,MW-3,35.86964722,-106.0451917,11/26/2014,5864.27,2014-11-26
5986,HS-114,33.12708038,-107.2508393,12/2/2014,4231.51,2014-12-02
5987,Windmill Well,35.87327222,-106.0453722,12/4/2014,5837.41,2014-12-04
5988,QU-174,36.74586702,-105.5892345,12/10/2014,7503.73,2014-12-10
5989,10N.04E.30.134D CESAR CHAVEZ SENTINEL WELL 1D,35.06646389,-106.5644083,2/6/2015,4881.38,2015-02-06
5990,10N.04E.30.134C CESAR CHAVEZ SENTINEL WELL 1C,35.06646389,-106.5644056,2/6/2015,4864.96,2015-02-06
5991,10N.04E.30.134B CESAR CHAVEZ SENTINEL WELL 1B,35.06646389,-106.5644083,2/6/2015,4861.88,2015-02-06
5992,10N.04E.30.134A CESAR CHAVEZ SENTINEL WELL 1A,35.06651389,-106.5643972,2/6/2015,4861.83,2015-02-06
5993,10N.04E.30.134G CESAR CHAVEZ MIDDLE OBS-1G,35.06649444,-106.5645694,2/6/2015,4861.42,2015-02-06
5994,10N.04E.30.134E CESAR CHAVEZ PUMPING WELL-1E,35.06654167,-106.5644861,2/13/2015,4881.21,2015-02-13
5995,EB-696,35.57973941,-106.0630861,2/15/2015,6131.82,2015-02-15
5996,MG-042,34.10754901,-107.2393087,2/18/2015,6352.04,2015-02-18
5997,SA-0230,33.8942972,-108.0409197,2/23/2015,6760.9,2015-02-23
5998,10N.04E.30.144E  SOUTHERN PUMPING WELL 1E,35.06649444,-106.5610028,2/25/2015,4875.96,2015-02-25
5999,SA-0229,33.75991545,-108.2520355,3/10/2015,6751.29,2015-03-10
6000,SA-0227,34.16244187,-107.6756986,3/11/2015,6804.67,2015-03-11
6001,QU-177,36.76832101,-105.5931711,3/20/2015,7622.6,2015-03-20
6002,SA-0232,34.25461504,-107.6427008,3/25/2015,6809.29,2015-03-25
6003,10N.04E.30.144H  SOUTHERN OBSERVATION WELL 1H,35.06635833,-106.5610167,3/27/2015,4870.84,2015-03-27
6004,10N.04E.30.144G  SOUTHERN OBSERVATION WELL 1G,35.06635833,-106.5610167,3/27/2015,4862.25,2015-03-27
6005,10N.04E.30.144F  SOUTHERN OBSERVATION WELL 1F,35.06635833,-106.5610167,3/27/2015,4862.12,2015-03-27
6006,10N.04E.30.144D  SOUTHERN SENTINEL WELL 1D,35.06651389,-106.5608361,4/1/2015,4884.43,2015-04-01
6007,10N.04E.30.144C  SOUTHERN SENTINEL WELL 1C,35.06651389,-106.5608361,4/1/2015,4870.25,2015-04-01
6008,10N.04E.30.144B SOUTHERN SENTINEL WELL 1B,35.06651389,-106.5608361,4/1/2015,4863.13,2015-04-01
6009,10N.04E.30.144A  SOUTHERN SENTINEL WELL 1A,35.066475,-106.560875,4/2/2015,4863.06,2015-04-02
6010,10N.04E.30.134H CESAR CHAVEZ DEEP OBS-1H,35.06649444,-106.5645694,4/12/2015,4870.6,2015-04-12
6011,10N.04E.30.134F CESAR CHAVEZ SHALLOW OBS-1F,35.06649167,-106.5645694,4/12/2015,4862.62,2015-04-12
6012,EB-663,35.59535525,-106.0181886,4/13/2015,6203.97,2015-04-13
6013,EB-662,35.59535525,-106.0181886,4/13/2015,6196.06,2015-04-13
6014,EB-661,35.59535525,-106.0181886,4/13/2015,6194.57,2015-04-13
6015,EB-666,35.59481849,-106.0251361,4/13/2015,6192.08,2015-04-13
6016,EB-667,35.59481849,-106.0251361,4/13/2015,6184.5,2015-04-13
6017,EB-387,35.57322262,-106.0628786,4/13/2015,6143.27,2015-04-13
6018,EB-695,35.57168529,-106.0633991,4/13/2015,6138.92,2015-04-13
6019,EB-388,35.57321649,-106.0656154,4/13/2015,6135.18,2015-04-13
6020,EB-389,35.57162239,-106.0654177,4/13/2015,6133.26,2015-04-13
6021,LC-036,35.58450952,-106.1031477,4/14/2015,6100.99,2015-04-14
6022,MG-043,34.10252517,-107.2718003,5/15/2015,6513.87,2015-05-15
6023,BC-0241,35.16904856,-106.4998279,6/10/2015,5591.2,2015-06-10
6024,19N.07E.35.4122B,35.83502589,-106.1639139,10/6/2015,5484.48,2015-10-06
6025,10N.03E.S33.343 SOUTH YALE LANDFILL MW-7,35.0445,-106.6282278,10/27/2015,4887.9,2015-10-27
6026,10N.03E.S34.422 SOUTH YALE LANDFILL MW-1,35.05091389,-106.6139389,10/27/2015,4884.38,2015-10-27
6027,MES14R,32.22831944,-106.7464278,1/19/2016,3823.65,2016-01-19
6028,MBOWN-275 MES12R,32.30084722,-106.8345528,1/20/2016,3879.29,2016-01-20
6029,MES11R,32.27098333,-106.8367917,1/20/2016,3871.38,2016-01-20
6030,MBOWN-301 MES45R,32.30903056,-106.8048111,1/21/2016,3855.71,2016-01-21
6031,MBOWN-302 MES46R,32.24868056,-106.78365,1/21/2016,3838.49,2016-01-21
6032,JL-49-40-508,31.430555,-106.058889,2/22/2016,3567.37,2016-02-22
6033,PB-0004,35.57457475,-106.341336,3/28/2016,5213.23,2016-03-28
6034,PB-0006,35.57485138,-106.3399722,3/28/2016,5209.69,2016-03-28
6035,PB-0001,35.58357313,-106.3331534,3/28/2016,5209.6,2016-03-28
6036,PB-0002,35.56745826,-106.3456532,3/28/2016,5190.98,2016-03-28
6037,PB-0012,35.57003275,-106.3763509,3/29/2016,5209.28,2016-03-29
6038,PB-0010,35.57115345,-106.3392927,3/29/2016,5202.8,2016-03-29
6039,PB-0008,35.56469936,-106.3513007,3/29/2016,5199.42,2016-03-29
6040,PB-0011,35.5644881,-106.3723942,3/29/2016,5196.06,2016-03-29
6041,PB-0009,35.56221597,-106.3564779,3/29/2016,5195.14,2016-03-29
6042,13N. 04E. 31. 224 C-30R,35.31672222,-106.5490278,3/30/2016,5044.1,2016-03-30
6043,18S.04W.05.314 H9-R,32.76975,-107.2778611,4/1/2016,4094.44,2016-04-01
6044,18S.04W.08.342 H-10R,32.75280556,-107.2743889,4/1/2016,4084.8,2016-04-01
6045,18S.04W.17.4322 H11-R,32.73894444,-107.2698889,4/1/2016,4071.7,2016-04-01
6046,18S.04W.26.3323 H15-R,32.71019444,-107.2274722,4/2/2016,4059.57,2016-04-02
6047,17S.05W.24.314 H2-R,32.81561111,-107.3134167,4/3/2016,4119.2,2016-04-03
6048,19S.03W.10.4322 H20-R,32.66686111,-107.1323889,4/3/2016,4036.21,2016-04-03
6049,SO-0139,34.00067032,-106.8731866,4/11/2016,4566.72,2016-04-11
6050,SO-0145,34.00074361,-106.8707414,4/11/2016,4565.83,2016-04-11
6051,SO-0144,34.00074361,-106.8707414,4/11/2016,4565.78,2016-04-11
6052,SO-0138,34.00014168,-106.877105,4/11/2016,4565.53,2016-04-11
6053,SO-0137,34.00013267,-106.8771048,4/11/2016,4565.51,2016-04-11
6054,SO-0143,34.00065145,-106.8714647,4/11/2016,4564.65,2016-04-11
6055,SO-0142,34.00065145,-106.8714647,4/11/2016,4564.3,2016-04-11
6056,SO-0141,34.00067009,-106.8720173,4/11/2016,4560.9,2016-04-11
6057,SO-0140,34.00067009,-106.8720173,4/11/2016,4560.78,2016-04-11
6058,PB-0016,35.57783443,-106.3327603,4/12/2016,5223.36,2016-04-12
6059,PB-0018,35.57961787,-106.333728,4/12/2016,5210.24,2016-04-12
6060,PB-0015,35.57366841,-106.3368958,4/12/2016,5209.46,2016-04-12
6061,PB-0017,35.56818432,-106.3363081,4/12/2016,5208.37,2016-04-12
6062,PB-0005,35.57003792,-106.3511917,4/12/2016,5204.26,2016-04-12
6063,PB-0013,35.57246006,-106.338542,4/12/2016,5204.21,2016-04-12
6064,PB-0019,35.57294392,-106.3469037,4/12/2016,5202.15,2016-04-12
6065,PB-0014,35.57395107,-106.3382357,4/12/2016,5202.03,2016-04-12
6066,PB-0020,35.57361333,-106.3345443,4/12/2016,5201.07,2016-04-12
6067,SO-0171,33.92495864,-106.8465724,4/12/2016,4547.14,2016-04-12
6068,SO-0170,33.92495864,-106.8465724,4/12/2016,4547.06,2016-04-12
6069,SO-0169,33.92492845,-106.8497844,4/12/2016,4545.86,2016-04-12
6070,SO-0173,33.92598291,-106.8576064,4/12/2016,4545.55,2016-04-12
6071,SO-0172,33.92598291,-106.8576064,4/12/2016,4545.36,2016-04-12
6072,SO-0174,33.92473338,-106.8537609,4/12/2016,4544.89,2016-04-12
6073,SO-0179,33.92479824,-106.8518477,4/12/2016,4544.63,2016-04-12
6074,SO-0180,33.92479824,-106.8518477,4/12/2016,4544.61,2016-04-12
6075,SO-0167,33.92485414,-106.8505292,4/12/2016,4544.26,2016-04-12
6076,SO-0168,33.92485414,-106.8505292,4/12/2016,4544.21,2016-04-12
6077,SO-0185,33.92478663,-106.8520205,4/12/2016,4543.53,2016-04-12
6078,SO-0184,33.92489464,-106.8520336,4/12/2016,4543.52,2016-04-12
6079,SO-0186,33.92478663,-106.8520205,4/12/2016,4543.51,2016-04-12
6080,SO-0188,33.9249579,-106.8520242,4/12/2016,4543.23,2016-04-12
6081,SO-0182,33.92480384,-106.8520749,4/12/2016,4542.61,2016-04-12
6082,SO-0183,33.92481286,-106.8520751,4/12/2016,4542.6,2016-04-12
6083,SO-0176,33.92462678,-106.8530554,4/12/2016,4542.37,2016-04-12
6084,SO-0187,33.92496708,-106.8520136,4/12/2016,4542.31,2016-04-12
6085,SO-0181,33.92480384,-106.8520749,4/12/2016,4542.3,2016-04-12
6086,SO-0177,33.92481715,-106.8523889,4/12/2016,4542.26,2016-04-12
6087,SO-0175,33.92462678,-106.8530554,4/12/2016,4541.87,2016-04-12
6088,SO-0178,33.92481715,-106.8523889,4/12/2016,4541.77,2016-04-12
6089,SO-0189,33.92477689,-106.8514686,4/12/2016,4541.22,2016-04-12
6090,SO-0190,33.92477689,-106.8514686,4/12/2016,4541.11,2016-04-12
6091,PB-0022,35.57083414,-106.3355686,4/13/2016,5211.51,2016-04-13
6092,PB-0021,35.57594826,-106.3337444,4/13/2016,5210.19,2016-04-13
6093,PB-0023,35.57485801,-106.3434265,4/13/2016,5208.2,2016-04-13
6094,SO-0131,34.00371397,-106.8609865,4/21/2016,4576.26,2016-04-21
6095,SO-0132,34.00369594,-106.8609861,4/21/2016,4574.89,2016-04-21
6096,SO-0136,33.99970624,-106.8588745,4/21/2016,4574.16,2016-04-21
6097,SO-0135,33.99970624,-106.8588745,4/21/2016,4574.05,2016-04-21
6098,SO-0130,34.00401334,-106.8662225,4/21/2016,4572.28,2016-04-21
6099,SO-0129,34.0040135,-106.8662116,4/21/2016,4572.22,2016-04-21
6100,SO-0133,33.99787968,-106.8645726,4/21/2016,4571.67,2016-04-21
6101,SO-0134,33.99787968,-106.8645726,4/21/2016,4571.67,2016-04-21
6102,SO-0128,34.00327734,-106.8689672,4/21/2016,4570.0,2016-04-21
6103,SO-0126,34.00303162,-106.8697089,4/21/2016,4568.97,2016-04-21
6104,SO-0125,34.00303162,-106.8697089,4/21/2016,4568.92,2016-04-21
6105,SO-0127,34.00301359,-106.8697085,4/21/2016,4568.59,2016-04-21
6106,PB-0027,35.57499784,-106.3446317,4/22/2016,5208.81,2016-04-22
6107,PB-0028,35.56112211,-106.3462865,4/22/2016,5199.88,2016-04-22
6108,SO-0262,34.00260202,-106.8569996,5/16/2016,4578.08,2016-05-16
6109,SO-0263,34.00262481,-106.8572816,5/16/2016,4577.96,2016-05-16
6110,SO-0264,34.00341469,-106.8599081,5/16/2016,4575.72,2016-05-16
6111,SO-0265,34.00341469,-106.8599081,5/16/2016,4575.69,2016-05-16
6112,SO-0266,34.00389409,-106.8627877,5/16/2016,4574.0,2016-05-16
6113,SO-0267,34.00405285,-106.865996,5/16/2016,4572.69,2016-05-16
6114,SO-0268,34.00405285,-106.865996,5/16/2016,4572.67,2016-05-16
6115,SO-0269,34.00398698,-106.8691452,5/16/2016,4570.45,2016-05-16
6116,BC-0265,35.18600007,-106.6187585,6/30/2016,4965.02,2016-06-30
6117,SO-0220,33.72554256,-106.9208211,7/29/2016,4484.32,2016-07-29
6118,SO-0219,33.72554256,-106.9208211,7/29/2016,4484.25,2016-07-29
6119,SO-0222,33.72389722,-106.917029,7/29/2016,4483.86,2016-07-29
6120,SO-0221,33.72389722,-106.917029,7/29/2016,4483.81,2016-07-29
6121,SO-0227,33.72401156,-106.917215,7/29/2016,4483.64,2016-07-29
6122,SO-0228,33.72401156,-106.917215,7/29/2016,4483.58,2016-07-29
6123,SO-0224,33.72339434,-106.9151509,7/29/2016,4481.4,2016-07-29
6124,SO-0223,33.72339434,-106.9151509,7/29/2016,4481.14,2016-07-29
6125,SO-0214,33.72136103,-106.9119439,7/29/2016,4480.93,2016-07-29
6126,SO-0213,33.72136103,-106.9119439,7/29/2016,4480.91,2016-07-29
6127,SO-0226,33.72200271,-106.912433,7/29/2016,4478.0,2016-07-29
6128,SO-0260,33.72332225,-106.9145666,7/29/2016,4476.71,2016-07-29
6129,SO-0218,33.71886124,-106.9103238,8/3/2016,4481.7,2016-08-03
6130,SO-0217,33.71886124,-106.9103238,8/3/2016,4480.7,2016-08-03
6131,SO-0216,33.72081667,-106.9115757,8/3/2016,4479.77,2016-08-03
6132,SO-0215,33.72081667,-106.9115757,8/3/2016,4479.73,2016-08-03
6133,SO-0254,33.67940692,-106.9977433,8/3/2016,4465.84,2016-08-03
6134,SO-0250,33.67947728,-106.9978528,8/3/2016,4465.58,2016-08-03
6135,SO-0251,33.67947728,-106.9978528,8/3/2016,4465.11,2016-08-03
6136,SO-0255,33.67940674,-106.9977541,8/3/2016,4461.8,2016-08-03
6137,30N.12E.01.141,36.86783056,-105.6153,8/5/2016,7510.13,2016-08-05
6138,T10N.R03E.S36.1433C DEEP VA SENTINEL WELL,35.05111111,-106.5816667,8/5/2016,4877.1,2016-08-05
6139,T10N.R03E.S36.1433B MIDDLE VA SENTINEL WELL,35.05111111,-106.5816667,8/5/2016,4875.24,2016-08-05
6140,T10N.R03E.S36.1433A SHALLOW VA SENTINEL WELL,35.05111111,-106.5816667,8/5/2016,4870.29,2016-08-05
6141,WL-0001,34.09370755,-106.8955562,8/24/2016,4600.0,2016-08-24
6142,SO-0271,34.00189588,-106.8553927,8/24/2016,4559.34,2016-08-24
6143,SO-0272,34.00189588,-106.8553927,9/21/2016,4578.11,2016-09-21
6144,SO-0274,34.00221781,-106.8561684,9/21/2016,4577.77,2016-09-21
6145,SO-0276,34.00221781,-106.8561684,9/21/2016,4577.69,2016-09-21
6146,SO-0230,33.72394129,-106.9170947,9/22/2016,4483.38,2016-09-22
6147,SO-0231,33.72392359,-106.9170728,9/22/2016,4483.26,2016-09-22
6148,SO-0229,33.72394129,-106.9170947,9/22/2016,4482.97,2016-09-22
6149,KAFB 106208,35.06791389,-106.5654333,10/21/2016,4868.58,2016-10-21
6150,KAFB 106201,35.06503056,-106.5636472,10/21/2016,4867.34,2016-10-21
6151,WL-0004,36.35213155,-106.1904976,11/8/2016,6897.7,2016-11-08
6152,TC-300,36.880218,-105.6075907,11/10/2016,7515.75,2016-11-10
6153,TC-308,36.90317962,-105.60014,11/10/2016,7513.1,2016-11-10
6154,TC-305,36.95094297,-105.6304804,11/10/2016,7321.8,2016-11-10
6155,TC-307,36.89818508,-105.6002468,11/11/2016,7511.31,2016-11-11
6156,TC-316,36.95275169,-105.6276761,11/11/2016,7326.16,2016-11-11
6157,TC-303,36.88715914,-105.6075896,11/16/2016,7526.86,2016-11-16
6158,TC-301,36.87642792,-105.6012883,11/16/2016,7520.32,2016-11-16
6159,TC-304,36.90752652,-105.6276758,11/16/2016,7337.75,2016-11-16
6160,TC-310,36.90881114,-105.628517,11/21/2016,7325.63,2016-11-21
6161,WL-0022,34.3457377,-106.8410527,1/26/2017,4693.36,2017-01-26
6162,WL-0024,34.05791404,-106.9185496,2/27/2017,4585.77,2017-02-27
6163,SO-0225,33.72332225,-106.9145666,5/2/2017,4480.2,2017-05-02
6164,SO-0275,34.00221781,-106.8561684,5/5/2017,4579.83,2017-05-05
6165,SO-0273,34.00189588,-106.8553927,5/5/2017,4579.71,2017-05-05
6166,SA-0234,34.08091437,-107.4386526,6/22/2017,6915.24,2017-06-22
